"November 22, 2018",50,Awesome Menu!,The menu was the staff who actually recommended everything! Service was fast and accurate. Food was very good. And it was a short walk from the Vatican right after our tour.
"November 20, 2018",50,Lunch before visiting Vatican,We had a quick lunch before visiting Vatican which is at 5 minutes walking. The owner proposed us a mix pizze plate. Delicious. Very friendly staff. It deserves a visit when you are in the neighborhood.
"November 16, 2018",50,Perfect pizza experience,We loved the place the service and pizza of course!! Very small traditional place where you go to eat the best pizza with a nice prosecco!! No wifi no modern details just food!!
"November 12, 2018",50,Great Pizza,"Had to wait for one of their very few tables, but was well worth it. Get the pizza sampler- six different variety slices and all are outstanding. Rice balls excellent too."
"November 11, 2018",50,Eatza Pizza Here!,"The food is incredible everywhere you go in this area but you've never had pizza until you eat it here. Wonderful people, wonderful food and great atmosphere."
"November 10, 2018",50,Go right after you finish the Vatican tour,"After 3-4 hours in Vatican museum and church, we were desperate for having a cold beer and some pizza. Bingo! The right place with great pizza pieces and very friendly staff. You might be queuing cause there is only few tables but it’s worth it."
"November 4, 2018",50,Best pizza,"We were 7 hungry persons and we waited like 15minutes because the place is small and it was full, but totally worth it! Fabulous pizza and perfect service! Very close to the Vatican."
"November 3, 2018",50,The best pizza,"The best pizza ever and service is just perfect! Place is very small, but with great vibe and an amazing food."
"October 31, 2018",40,"Amazing food, extremely popular","The pizza buffet lunch from here was magnificent and great value for money. Only problem was having to wait half an hour outside for a table, however we did have a snack whilst waiting."
"October 31, 2018",50,Best Pizza Ever,"Best pizza, what a find! Close to Vatican city a must try. Owner was very nice, rounded down the cost for us. Cheap and delicious!"
"October 31, 2018",50,Good,Very good. Fine pizza. Nice price. Good for vegetarians as well. :3B-):3O:-)(^_-):O:3:3:O:3:OO:-)(^_-):-\(^_-)B-)(-:B-)(-:B-)(-:B-)B-)B-)(^_-)B-)
"October 29, 2018",50,Lovely food,Would highly recommend. Near the Vatican. Tasting platter of pizzas was great. Really friendly staff.
"October 27, 2018",50,Just wow!,Great sampler dish and service just down from St Peter's Square. Left feeling so full and content! Worth the short wait!
"October 25, 2018",40,Nice try,One of nicest pizza restaurants in Rome. Friendly service! Cool beer! Highly recommend to friends and will come back next time. Many thanks !
"October 16, 2018",50,"Good food and coffee, nice service",The place is located only 100 m from St. Peter Basilica. You can be served a plate with a variaty of pizzas. Don't worry if you can't finish - you can take away.
"October 13, 2018",50,"Delicious, fast-food style pizxa","They suggested the mixed plate to sample different pizza types and it was delicious! Service was very good, staff were friendly"
"October 10, 2018",50,Premium Pizza on the Go,"This establishment is ideally suited outside the St. Peter’s basilica and Vatican City. Perfect to grab a quick bite of heavens foods, slices and slices of different pizzas waiting to satisfy you. Would highly recommend"
"October 8, 2018",40,Good service,"Popped in here for a quick bite. Plenty of seating outside, great in fine weather. Nice range of cuisine. Reasonable prices too."
"September 22, 2018",50,Dozens.,Dozens of pizzas on display and you pay by slice and seriously the pizzas are as good as the reviews.
"September 21, 2018",50,Amazing pizza,"The pizza sampler order was great plenty of different flavours, the staff was very friendly and funny. Please don’t leave without trying the homemade Tiramisu u will regret it 😉"
"September 20, 2018",50,Die happy,I’m writing this review with one hand because I don’t want to stop eating this pizza. Get the sharing platter. Eat all of it and even if your brain tells you to stop. Die happy
"September 19, 2018",40,Pizza! Pizza!,So many varieties to choose from by the slice & weight. Easy way to enjoy one of Italy's favorite foods.
"September 17, 2018",50,Amazing food. Took veg platter,Amazing food. Took veg platter . Reasonable place. Friendly staff. Beer is great . Near Vatican this is the best .
"September 17, 2018",50,Amazing!!!,Worth the visit! Best pizza we ate in Rome! The waiter is nice and very welcome! Just go.. don't miss it.
"September 15, 2018",50,Just great,"Where else would you get an amuse Bouche, waiting for your Pizza? And the Pizza were from another world. Very delicious, innovative flavors and an outstanding service, very untypical for Rome."
"September 13, 2018",50,Best in Taste n service,"This place was our first place after landing in Rome. We are vegetarian and went with the staffs recommendation on pizza platter, it was excellent. Great staff and service."
"September 12, 2018",30,Very expencive but tasty,"Very expencive, beer (red) 1 litre 12€, small 0.4l 6€, pizza (different tastes 2 of each) for 2 people 17,5€. Friendly service."
"September 11, 2018",50,Delicious Pizza 😍😍,It's a delicious pizza and various kinds for everyone to fall in love with 😍😍😍 Kind staff and cold beer 🍻🍻🍻
"September 8, 2018",50,Fabulous pizza and atmosphere,Had a super tea time meal of approximately 6-8 pizza squares each. Beautifully cooked and our waiter was multilingual and great chat. Highly recommended and so close to the Vatican after a long day... fabulous.
"September 2, 2018",50,Fantastic pizza!!!,fantastic pizza so many varieties of tastes to please everyone. we'll be back soon maybe next year !! Wendy and family
"September 2, 2018",50,Cheap and delicious!,The staff was friendly! Many flavors of pizza can choose. And you can ask them for the size you prefer...the price base on the weight....and really Not expensive in this area!
"September 2, 2018",50,the best pizza !!,if you are looking for the best pizza in the world then this is your place to go . amazing dought and very crispy !!
"August 23, 2018",50,Very good place to eat!,"If you're visiting Rome, you have to eat at Pizza Zizza! My boyfriend and I shared the plate of different pizza slices. It was delicious and not expensive. The service was great, people who work there create an awesome atmosphere."
"August 12, 2018",50,What a personality!,"small cafe however the food and waiter service/personality was huge! there was a short wait but worth it for sure. its thicker crust pizza. the shrimp one was my favorite. family of 6, 2 children."
"July 30, 2018",50,Excellent pizza in Rome,"Excellent pizza, fantastic service. Small pizzeria near Vatican with amazing pizza menu and very good service."
"July 27, 2018",50,"Incredible food and service, plus very cheap","We visited based on excellent reviews and we're certainly not disappointed. Incredible good, extremely friendly service and very reasonable (€28 for the shared pizza board pictured, a beer and an apperol spritz) Highly recommend"
"July 26, 2018",50,"Great pizza, so far the best in Rome!","What a great place for pizza, very small place but excellent service, did not require service fee but totally deserve one!"
"July 24, 2018",50,good food nice pizza,a nice place to take away pizza and many varieties of pizza .i have been to rome more than 10 times and each time i go a try something else .another favor of pizza..absolutely delicious.
"July 23, 2018",50,Magnificent pizza,"A nice and cozy small place next to the Vatican. The pizza is absolutely amazing, some og the best I’ve ever tasted. A place to be recommended for sure."
"July 11, 2018",50,Best pizza,"+ Really good Pizza + nice Dessert + good Service Could be that you have to wait a little bit, but it’s worth it"
"July 10, 2018",50,Hungry? Go to these guys..!,One of the best place to kill appetite...very very fresh and friendly atmosphere. Tastes just awesome and very very fresh. Do not forget to order tiramisu.
"July 9, 2018",50,Best pizza in Rome,We loved this place. We came here 3 times for our breakfast/lunch. Best Pizza in Rome. Get the sharing platter where you can get a bit of everything. You will not regret it!!
"July 7, 2018",50,Must-go Stop for Pizza,After a long day at the Vatican this was the perfect play to refuel with pizza and wine. Pizza was spectacular and the atmosphere was genuine. The pesto pizza had so much flavor! Simply delicious.
"July 5, 2018",30,Fair pizza,"Good, but Not the best pizza. There should be better places than here. But love the waiter’s personality and service! Worth visiting."
"July 3, 2018",50,"Great pizza, great value!","Wow what a find, great pizza with very good friendly service. Pizza Zizza is very, very good value. And even better food. One thing, it’s small so be prepared to que. Not a criticism just a fact, well worth the wait!"
"July 3, 2018",50,Awesome lunch after Vatican,We found this restaurant online and are glad we gave it a try. We got there right at 12 and were seated right away - fortunate since it’s a very small restaurant. Waiters/owners were great. We ordered the pizza sampler and loved it.
"June 27, 2018",50,Amazing 🍕 pizza,I love this pizza and this small place. The people is friendly and very cute.. I want another piece of pizza because it's a very good 😋
"June 27, 2018",50,Extremely Great Pizza!,Great service and great pizzas! We ordered almost everything on the menu and everything was amazing. They have anchovies pizza as well that wasn’t on display and it’s a must have if you love anchovies.
"June 26, 2018",40,Very nice experience !,"Very nice sample of Italian pizzas with different variety mozzarella, prochuto... at a nice terrace facing the Vatican . Price was reasonable and waiter friendly."
"June 24, 2018",50,Best Pizza Ever,I can’t rate this high enough! We had visited several pizza places across Italy and this was by far the best I have ever had and the service was excellent!
"June 21, 2018",50,Excellent food!,The food was amazing. Beautiful to look at and delicious to eat! The pizza and rice balls (not sure of their actual name) we’re so very good! Everything was fresh and tasty! Highly recommend!
"June 21, 2018",50,Best pizza & best service!,"Amazing drinks, amazing pizza, amazing dessert, amazing service! Just truly worth coming to. Cheap too!!"
"June 20, 2018",50,Perfect pizza place,This pizza place is really good and the pizza is amazing. We took plate for 2 with 6 different pizzas and each of them was just excellent.
"June 19, 2018",50,Top!,It is just a perfection!! Must visit. I had three meals in a row and I cant decide what is the best.
"June 16, 2018",50,Delicious! Worth the Wait! Pizza and Sangria!,"Pizza Zizza has an excellent selection of pizzas, but my family ordered the sampler which was suggested by the waiter. Great idea! Everything was wonderful, and I was"
"June 16, 2018",50,Best Pizza!,This place had the best pizza. We ordered the different variety of pizzas. The portion size was more than enough for the three of us. We even had left overs to take home. Highly recommend and also had great service!
"June 15, 2018",40,best I had in Rome.,Very good selection board. The pizza was the best I had in Rome. I recommend it to everyone you should try this place delicious pizza....
"June 8, 2018",50,Excellent,Very good selection board. The pizza was the best I had in Rome. Stumbled across by accident. Very friendly staff. Bit of a wait and no seats free outside. But still excellent.
"June 7, 2018",40,Good feed.,Long wait.. but friendly service.. majority of pizzas were tasty.. just the margherita was average.. worth a pit stop near the vatican.
"June 3, 2018",50,Bravo Zissa!!,"The legendarily sampler is enough to cross continents. Great service, small restaurant but pizza to die for. When in Rome, see the Pope then Pizza Zissa!!"
"June 3, 2018",50,Lunch,Exccellente! Try the pizza platter for the taste of everything! Service the best! Little place big soul
"May 27, 2018",50,Best!,"Very nice place, perfect and charismatics waiters. Pizza taste perfect and Spritz fammily coctail awesome."
"May 27, 2018",50,Really good food and warm staff!,Really tasty pizza. Welcoming and warm staff who is always happy to help and suggest something extra :)
"May 24, 2018",50,WOW,One of the best places I've been to in Rome for this kind of food. So good it inspired me to join trip advisor.
"May 23, 2018",50,Amazing pizza,Pizza to die for! The arancini balls were delicious and a nice surprise whilst waiting for a table. The waiter recommended we have the sampler. Every flavour pizza was amazing. Service was 5 star.
"May 14, 2018",50,The best,"Nice place near St.Peter's church. Very good service, tasty food, fresh stuff on pizzas. I would recommend comming!"
"May 14, 2018",50,Best Pizza in town,"Perfect service, very nice people. We got a little tasty food for free for waiting time. Pizza was very tasty!"
"May 13, 2018",50,Great!,It’s a small place but the food is amazing. It is usually full but it does worth to wait and they usually serve you some food while you are waiting. :)
"May 10, 2018",50,Awesome vibe,"I would suggest you sit inside on one of the small tables if your group size allows for it. The guys that work there are super friendly and very entertaining. I did not understand half of what they said, but it did not matter."
"May 8, 2018",50,Delicious variety!,Awesome! A mixed pizza platter - We went for the veggie option - Amaxing! Only downside is the very small place and therefore queues .. but well worth the wait!
"May 6, 2018",50,Pizza was great,Try it Pizza was great I got the sampler love the pesto pizza but all the samples were very good I would definitely go back
"April 29, 2018",50,Excellent food and staff!,Worth a visit...the food is simply amazing and the staff are very nice. It is also reasonably priced. Keep it up guys!
"April 29, 2018",50,Amazing,"This is how the fast food should looks like. Very fliendly staff, super delicious pizza, fast service. Highly recommend!"
"April 28, 2018",50,Amazing pizza not to expensive,Even though it’s steps from the Vatican it’s not a tourist trap. Good value for the mixed platter but get there early. They only have about 4 tables outside but it’s completely worth the wait. Get there at opening!
"April 28, 2018",50,Worth the wait,"Awesome pizza. The sampler is a great idea for the business, as well as for the customer. It’s a small place, so there may be a wait for a table. Don’t leave, it’s worth it!!"
"April 27, 2018",50,"Best Pizza, crispy & cheap!",Lovely concept and great staff! Don’t change anything guys! Tip: Always people queuing so be there 20 min before they open :)
"April 26, 2018",50,Very nice pizza place,Very nice little place with excelent service and great pizzas and beers 😁. The service is very good and food was delicius. Recomanded for quick snack or for lunch.
"April 23, 2018",50,Amazing pizza!!!,"Found that place through TripAdvisor. What a treat!! We didn't know which one to take , ordered a bunch and they were all amazing. The service was great. We would definitely go back and recommend it!"
"April 22, 2018",50,Amazing Italian pizza,"We went there to eat pizza, and we were kindly attended. The place is small and cozy, and we had a good coffee after the meal, but the coffee is machine made. Pizza is delicious there, I highly recommend to try."
"April 21, 2018",50,Best pizza in town,"People that say you shouldn’t eat pizza in Rome didn’t try pizza 🍕 at Pizza Zizza. Incredibly tasty, reasonable prices and charismatic staff; overall wonderful experience, definitely recommend! 👍🏻"
"April 19, 2018",50,Pizza,I would highly recommend Pizza Zizza! The staff were very friendly and the food was extremely tasty!
"April 15, 2018",50,A great idea well executed,This place is terribly small and there is often a long queue but it's worth the wait. Most people go for the platter of different pizza slices as did we. All were delicious. Great service too from the super efficient waiter
"April 13, 2018",50,Words can’t describe it!!!,"Absolutely the best pizza I’ve ever tried. Even if you have to wait, don’t hesitate. It’s worth it!!!"
"April 12, 2018",50,Fantastic Service and Food,Incredible all around. English friendly. Food was quick and incredible. We waited for maybe 5 minutes. They give you a little rice ball to tide you over. Would highly recommend.
"April 10, 2018",50,Delightful Pizza,"My family and I chose to do the pizza for four and were not disappointed! The pizza was absolutely delicious, some of the best I've ever had. Highly recommend Pizza Zizza to any (and every!) one visiting Roma or near Vatican City."
"April 9, 2018",50,Great value so close to the Vatican,"An excellent pre or post Vatican visit meal. We were in shoulder season and there was already a line starting to form. Highly recommend the sampler pizza option for groups as it offers a great variety. Good food, good service, good value."
"April 7, 2018",50,Lovely little place,"Fair price, nice pizza, great beer and the waiter could not have been more friendly. Proper little gem."
"April 7, 2018",50,Well deserved best pizzeria in Roma,"We loved the pizza sample dish! Fast service, simple but excellent pizzas. Friendly place as well. There’s always a line of people waiting to get a table😉"
"April 5, 2018",50,Just around the corner of the Vatican,Great spot near the Vatican. Joyful atmosphere and the pizzas are awesome! The waiter’s good mood is contagious :-)
"April 1, 2018",50,Perfect,"Absolutely amazing. Tasty food, best pizza ever. Honest, very kind and nice service. He recomended us very well, you can try all kind of pizza."
"March 31, 2018",40,Great choice,A must visit for anyone visiting st Peter's square. A fair wait (around 45 minutes) for a table but the wait is worth it. Pizza is superb along with the atmosphere.
"March 31, 2018",50,Pizza experience you can’t miss,We ate mixed plate of several italian pizzas. They were very good; crispy and delicious. The service was also excellent. Have to visit again.
"March 29, 2018",50,Must visit,"Amazing pizza! Staff is extremely friendly. Highly recommend the sampler. Don’t usually visit the same place twice when traveling, but will definitely come back here."
"March 28, 2018",50,Good pizza al taglio and friendly staff,"We went to grab some pizza, bought a plate with a sample of all of them. We were not disappointed. The pizza had a perfect crust and they tasted good. The staff was very kind and fun. I would recommend 😋"
"March 23, 2018",50,Rome,I suggest you to eat this pizza and meet perfect guys Enrico and Roberto. This pizza is the best in Roma and staff are really friendly.
"March 21, 2018",40,Enjoyable Pizzas,"We walked here after visiting the Vatican. The seats are outside by the street, only for about ten pax. We were recommended to select the selection platter for €9 each and it comes with six different varieties of pizza. Good experience."
"March 20, 2018",10,Take away,There is a takeaway counter next door. The pizza here is very ordinary and way over priced. Avoid it.
"March 20, 2018",50,Best service and pizza!,The best pizza and service! We came here today and we are also very pleased that we chose that pizzeria near Vatican. Top!!
"March 19, 2018",50,Delicioso!,"This place was worth the walk, my husband and I walked 3 miles to get to this place and I wouldn't have had it any other way. The service was outstanding, and the pizza was delicious! Recommend it 100%."
"March 16, 2018",50,Wonderful pizza,Small and cosy pizzeria. We went there after the visit to the vatican. We've had the pizza mix. It was awesome. The service is quick and friendly. The home made tirmisu was delicious. Enjoy.
"March 10, 2018",50,"Great pizza, good prices, worth a wait.",Enjoyed the pizza sampler after a busy morning at the Vatican museums. High quality pizza and great service - all at a reasonable price. Well worth the 10 minute wait for a table.
"March 3, 2018",50,Best pizza I ever tried,"The Best pizza I ever tried, good pizza good service ! no need to worry about the meal or chose of food, they will pick for you"
"February 27, 2018",50,Great pizza !,"The best pizza in Rome :) Great atmosphere and host. In addition to a delicious pizza, there is also a great tiramisu. Certainly being in Rome I will come back here!"
"February 13, 2018",50,Top Notch,"Great service, great food, good price. Got very lucky and managed to get a table straight away. Wish I could fit another visit in."
"February 6, 2018",50,Perfect,It's a little place with low number of tables. We had to wait for sometime. But it was alright after the pizza came. It was very delicious. It was nice to try 5 different types. Recommended for a delicious experience after visiting Vatican City.
"February 4, 2018",50,Amazing pizza!,Best pizza I ever had and the staff were so attentive and looked after us well! Loved a wee honk on the way out :)
"February 2, 2018",40,Good street food to try,The place is quite small and the que was long but you can have a takeaway. The staff was friendly and the food was good. If you want something quick after visiting the Vatican its a good lunch.
"January 28, 2018",50,Very delicious pizzas,We have tried 7 different pizzas and all of them were amazing and very delicious. I have not seen such amazing staff who were so happy and proud of their job. Everyone must go there and try these pizzas!!!
"January 27, 2018",50,Deserving of all the great reviews,"The reviews do this place justice!! Pizza was amazing, the best I had all weekend and staff were very attentive and pleasant!! Well worth a visit!!!"
"January 23, 2018",50,Recommended,Nice atmosphere. Suitable for vegetarians. Serve in plastic dishes so it is suitable also for people that eat kosher food. Pretty cheap as well. Very recommended!
"January 15, 2018",50,Best Pizza i've ever eaten.,"Brilliant pizza, as i've said, the best i've ever eaten. The staff were so friendly, as is everyone in Rome."
"January 11, 2018",50,Best pizza 🍕,Saw the reviews here and thought we should visit this place . Delicious pizza ever. 2 min from the Vatican
"January 5, 2018",50,Delicious!!!!,Went here for lunch after visiting the Vatican. The tasting platter of Pizzas was delicious and was well worth a bit of a wait. Highly recommend this pizzeria!
"December 28, 2017",10,Little restaurant. You have to wait 1 hour minimum,Little restaurant. You have to wait 1 hour minimum There are only 3 tables out and inside more less. Bye!!!
"December 28, 2017",50,Great roma style pizza,Very pleasant small place to eat close to st.pietro basilica. Pizza and tiramisu was great and servis as well. We enjoyed the lunch here. Highly recomended
"December 27, 2017",50,Best pizza we had in Rome!,"Best pizza we had in Rome! We tried different restaurants over 3 days and their pizzas were the best. Staff is very friendly as well. Must visit,really close to Vatican City."
"December 15, 2017",30,Okay Pizza,"It was good, not great! I was prepared to be blown away but it didn't happen sorry. It was good. Convenient! Dj"
"December 15, 2017",50,Amazing pizza place close to the Vatican,"If you spent the morning at the Vatican museums and St. Peter's Basilica and need some lunch. Walk to this place, just minutes away. Amazing pizza and friendly proprietors. Get the sample platter. The pesto is amazing!"
"December 13, 2017",50,Incredible pizza,"Very attractive prices, great atmosphere and delicious pizza! I recommend to order a mix of available tastes."
"December 11, 2017",50,BEST PIZZA PLACE IS ROME!,This is the place you go if you want to have the best pizza experience and if you want to be treated with warmth! These guys are the best!
"December 7, 2017",50,Best Pizza Ever,"A friend from Rome took me here and my family to show me real Italian pizza and it was awesome, the staff is very kind and easy to talk to. I recommend this place to be with friends or family."
"December 7, 2017",20,Very so so,The pizza was ok the price was high for what you get. They try to rush everything so you basically have 1 option of shared pizza with few types for 16 euro. Its way overrated. Not recommanded
"November 29, 2017",50,Excelent pizzas... best in word,"We were looking for a nice place to eat near Vatican, highly recommended... by far best pizzas ever. Also the servuce is very friendly and deserts are very tasty as well"
"November 28, 2017",50,Best pizza in Rome?!?!,Definitely a place to eat when you visit Vatican city.. Mixed pizza is a must and the stuff here is so friendly! Lots of congrats!👏👏
"November 25, 2017",50,Recommended,"Very good flavour and decent prices for the area. We had a mix of the pizzas available and beers, water and decent for 31 Euros per 2 people. Very good."
"November 17, 2017",50,Absolutely the best pizza I had in Rome,After 4 days I found this place and I'm sorry I didn't come here before ! The pizza is great and they have a mix of all the different types of pizza. I would like to have this at home
"November 15, 2017",50,"Great pizza, even better service",Came by for a quick dinner. Pizza was light and of great quality. Atmosphere is informal and the service was excellent. The prices are reasonable and location close to vatican.
