"January 16, 2020",50,"Classic steaks, classic ambiance",This is an true to the letter old school dry aged steak house. Substantial and diverse wine list to accompany. Visit once and you'll come back again and again.
"November 13, 2019",50,Old school steak house,"Start with a fantastic martini served in a small iced carafe. Next, a wedge. The main course a bone in ribeye. Then a baked potato with your choice of toppings. Too full for desert! It was all delicious."
"October 29, 2019",50,AMAZING dinner,"Crispy calamari, perfectly cooked steak, great sides and delicious desserts. Every aspect of our meal was perfect. The service was friendly and attentive and there was a lovely atmosphere. Would definitely come again."
"September 3, 2019",50,Birthday celebration,"Outstanding steak house. Brought my boyfriend here for his birthday celebration. Staff was very nice. Food was delicious. The lobster!!! Omg, loved it. Place was romantic, Nice and elegant. He really enjoyed it as well"
"August 13, 2019",50,Exactly what a steak house should be,"Yes, I enjoy the professional wait staff and the wood and the sight of the kitchen and the great big steaks! A fine bourbon paired with a perfectly cooked rib eye is a great joy in life and Harris' got it right."
"June 11, 2019",40,Steaks and chocolate raspberry mousse cake,"Service was a bit slower than what we are used to, but was great. Steaks were excellent as was the chocolate raspberry mousse cake. I’m a sucker for dessert and this was an excellent one! Recommended."
"May 21, 2019",50,Great Steaks,"Was recommended by our limo driver and it did not disappoint. great steak. we had made a reservation at another steak house and he recommended Harris, he made the reservations for us and we had a great meal."
"April 24, 2019",50,The TASTINESS!!!!,"Filet Mignon, Crab Cakes, and Oysters OH MY!!! I can[t wait to get my family in here to see what I am talking about."
"March 3, 2019",50,Elegant dining experience,Elegant restaurant with lots of wood decor. The staff was very professional without being stuffy. I will go there every chance I get. All members of my part loved it.
"January 16, 2019",50,Outstanding,Beautiful building. Really awesome place to dine. Our server was 1st class. Both fun and knowledgeable. The food and wine was outstanding. Impossible to critique anything about our night. Can’t wait to return.
"January 15, 2019",40,Worth the nostalgia,My meal was the best of all we ordered. Their creamy peppercorn sauce on any med rare steak is fab! I had my first baked Alaska which was beautifully presented. Love the bar leather club chairs. Classic stuff.
"December 12, 2018",40,Awesome,A cool place for grill. The food was excellent and we definitely enjoyed ourselves. We absolutely recommend that restaurant!
"December 11, 2018",50,Thanksgiving 2018,We had a fantastic time at this restaurant. Drinks before dinner at the bar. Excellent steak with wine. Service impeccable. More drinks at the bar afterwards. Even the two anti Trump supporters didn't spoil our time there ! A must for anybody with in SF.
"December 2, 2018",40,Steaks and salmon,We came here many times and enjoyed the food here every time. The steaks are always consistent. This time we took and ribeye bone-in and a salmon steak. All were cooked perfectly.
"November 5, 2018",50,Amazing!,"Great service, amazing service, comfortable and worth every penny, beautiful and comfortable! Meat is extraordinary but vegetables are the remarkable surprise!"
"November 3, 2018",50,Yet another great evening,"Was here together with several others. As always, exellent food, perfect steak, great service and nice environment. Separate rooms available."
"October 31, 2018",40,"perfect 12oz filet mignon, 20 oz steak and pepper steak",we invited our friend from UK to this amazing steakhouse as he never had a 20 oz steak. the 3 of us truly enjoyed every oz of our order. highly recommend.
"October 27, 2018",50,Great Food,we started the evening with a drink at the bar - then had a porterhouse steak I never head before. Just great. Dont miss to book your table.
"October 4, 2018",50,Old fashioned grand steakhouse,"Amazing steaks and service in this grand setting. Attentive waiters, live piano and delicious steaks and sides. The dessert was a great finish to a great meal."
"September 30, 2018",40,"Classic, vintage steakhouse",Enjoyed our dinner in the lounge with live light jazz music. Had the steak tartare for our appetizer before our petite filet mignon and “Kobe” Wagyu ribeye steak entrees. Both selections were favorable and tender. Attentive service. Great menu selections for this steakhouse.
"August 27, 2018",50,"Great service, terrific food, wonderful!!!","I love this place. It's quality food, service and atmosphere. It is on the expensive side but every time I dine here I love it. It's a great place for special occasions, dates, or an indulgent time out. Highly recommend while in SF."
"August 20, 2018",50,OMG. Awsome,Truly awsome place. The Martinis and oysters to the great steaks with foie gras and truffle oil. Yummm. So many choices in San Fran for Dinner. This is one of the top steakhouses You’ll love it.
"August 9, 2018",50,Great prime!,"Tried this place out tonight and glad I did! Good food, excellent service (thanks Adam!). Pleasant experience. Had prime late but it was still cooked right! Very positive experience. Thanks!"
"August 9, 2018",50,Vintage Steakhouse in San Francisco,We visited San Francisco for a week and this was my best meal by far. I had a 20oz Bone in Rib eye. Asked for Medium and received exactly that. Very tender and all others in my group were happy with their options.
"July 29, 2018",50,That‘s how a Steak House should be!,"Perfect beef, perfect drinks, perfect service, not cheap but as it ought to be! Wonderful traditional seating, but relaxed."
"July 18, 2018",50,Quality everytime!!,They could literally double the price and I’d still come. Best steaks. Best service. (Especially guys behind the bar as that is where I usually sit and eat) Best vibe. Highly recommend.
"July 15, 2018",50,Wonderful service and even better food,I really enjoyed a good dinner and the service was unbelievably good. Steak came out a little undercooked but they fixed it right away.
"July 13, 2018",40,Old school,"Good service, good cocktails, good wine list. Many great cuts of meat to choose from. Sides were very traditional and non a crowd pleaser, aka creamed spinach, and potatoes. Meat was good though. Good spot for taking clients."
"June 25, 2018",50,Marvelous Melting Pot,Harris' Steakhouse is quiet a landmark for SFO - so many different people in one place and on top a great bar and unbelievable delicious and tasty food. You absolutely need to visit :-)
"June 24, 2018",40,Fantastic Service...,"My wife and I came in late, the staff were very accommodating and served us a great dinner and fine wine."
"May 27, 2018",50,Harris' Steakhouse 2018,love it here in Harris' Steakhouse best steak s thay have i go ever time i go to harris love me some hot nice cut steaks
"May 13, 2018",40,Nice Food,"We ate here recently whilst staying in the area. The food was very nice, as was the wine and service is great too!"
"April 24, 2018",50,Perfect steak and service,"I'm one that always looks for reviews, but never takes the time to leave one-good or bad. The food and service was so outstanding that I had to say so. Definitely go here if you want a great steak and a friendly service team!"
"April 24, 2018",50,ralphciaio,"Hi my name is ralph ciaio at least try once in your life, Really i love this dish Harris' Steakhouse."
"March 3, 2018",50,Amazing Steak,Came here after an unforeseen but good Began lunch. Very very good. Great service great wine great steak. Very nice atmosphere though be forewarned there is a dress code which they kindly overlooked on our behalf. Large cuts too do bring an appetite.
"January 28, 2018",30,Good for gathering,"Very good price steak house in SF , $60 can get 20 oz steak I can say what you expect ? I can’t say the food taste is good, but I do hope they can improve their steak quality as well ."
"January 27, 2018",50,"Great steak, great service","Really great steak - nice fillet, prepared in a way not on the menu but advised by the waiter. Superb. Nice selection of wines. Highly recommended if you need a meat feast in SF."
"March 24, 2018",50,"Very expensive, but amazing","Uprfront: You will spend several hundred dollars for a party of four. Having said that, the place is old world beautiful, the service is impeccable, you can actually hear yourself and the other people in your party, and the food and drinks are amazing! You...More"
"March 21, 2018",50,Old school restaurant,"A terrific steakhouse. Service was over the top fantastic. Steaks, salads and appetizers were terrific. Only wished they had mash potato instead of baked. The drinks were awesome and they give a generous pour. We sat in the piano bar area. It was a great setting and a great evening. Valet parking immediately outside was added bonus. Classic old school feel. Good place for romantic dinner or business dinner."
"March 14, 2018",50,Dinner,We had a very nice experience. The small private room was very convenient. We could have conversations and privacy. At the same time we could listen to the live music which is a big plus to have. The food was great. I would recommend this restaurant. Enjoy!
"March 3, 2018",50,Amazing Steak,Came here after an unforeseen but good Began lunch. Very very good. Great service great wine great steak. Very nice atmosphere though be forewarned there is a dress code which they kindly overlooked on our behalf. Large cuts too do bring an appetite.
"February 15, 2018",50,Amazing Experience,"Went to The Steakhouse on 5/12 based on internet recommendations. Showed up early and were seated immdiately. Room was very classy in decor. Host asked what brought us to Vegas and we responded it was our anniversary. After a great meal (steaks were terrific as was salad and potatoes which are included in meal price) waiter brought us a delicious desert (on the house) with a candle and wished us a happy anniversary. Very nice touch to cap our great experience, which will be rewarded with our patronage in future (annual) visits."
"February 4, 2018",50,Great dinner,"Everything was wonderful. Service, drinks, food, and ambiance exceeded my expectations. Our waiter ( I forgot to ask his name) was old school good. We were in SF for a long weekend and dinner at Harris' was the best meal of the trip. If you like good steaks make a reservation at Harris'!"
"January 31, 2018",50,Amazing Old School Experience,"I have been coming to Harris for years and keep coming back because they get everything right. Steaks are aged in house, flavorful and they kitchen knows how to really pull out the flavor. I am not a fan of tartare but my friends have told me Harris tartare is as good as it gets, they just rave. Hanging out in the bar having drinks or eating in the main dining room feels like I have been transported back a few years to a place that just exudes a seldom used term these days, ""class"". Portions are generous and served flawlessly by an amazing and gracious staff. Perfect for business, outstanding for data night."
"January 28, 2018",30,Good for gathering,"Very good price steak house in SF , $60 can get 20 oz steak I can say what you expect ? I can’t say the food taste is good, but I do hope they can improve their steak quality as well ."
"January 27, 2018",50,"Great steak, great service","Really great steak - nice fillet, prepared in a way not on the menu but advised by the waiter. Superb. Nice selection of wines. Highly recommended if you need a meat feast in SF."
"January 27, 2018",50,Great buisnes dinner!,We went here for prime rib and boy we were not let down. The goodness started the moment went entered the restaurant. The staff was very nice and we had a great table. Our waitress was just great!! She took our drink order and gave us time to review the menu. When she came back she told us about the specials but we had our hearts set on prime rib. We both had the regular cut and it came out GREAT tender and full of flavor. It came with spinach and baked potato. We went to heaven. You can bet on my next trip to SF. I will make a bee line for this place.
"January 24, 2018",50,Great steak house,"Typical traditional classy steak house environment, excellent service and food. The steak was really memorable."
"December 14, 2017",50,Delicious Steak Dinners,The ribeye & filet were both cooked to perfection! The service was spot on! The dress code was business casual and prices medium
"November 18, 2017",50,Dry Aged Beef,"Harris' inhouse dry aged beef is the best. Potatoes and other vegetables very good as well. Decore is upscale, lots of wood and leather. Servers are knowledgeable and sommelier had some good recommendations. Overall a great steak!"
"October 22, 2017",50,Steak time,"We were looking for a good feed and this place did not disappoint. Fine dinning, good service and great steaks. A little music in the background was a nice touch"
"October 10, 2017",50,Great food,"Fun place, great service. Nice bar with a great Manhattan. We ate at the bar and it was really fun. Thank you."
"October 2, 2017",50,Awesome steaks!,"Our hotel recommended and booked Harris’ and we thoroughly enjoyed the steaks. Even though is a bit pricey, the food and steaks well worth it. This was probably our favorite meal of our holiday!"
"October 2, 2017",50,Awesome place to eat,This place is incredible. Will go back next time I am in SF. The service and food was excellent and it was not overpriced for the quality and quantity of food.
"September 30, 2017",40,Great Dinner for the Steak Lover,Harris' Steakhouse is one of the best steakhouses in San Francisco. The food and service are excellent. Upscale restaurant!
"September 26, 2017",50,Great Steak,"If you looking for a top quality steak look no further. I had the pepper steak, wife had the steak Diane, both were cooked perfect. Atmosphere was quiet and relaxing, service was spot on, would highly recommend, you won't be disappointed."
"September 18, 2017",50,Great dinner,"Steak at Harris is simply delicious! There is not much I may comment, just stop by and try it for yourself, you will not regret. Wine list is quite generous, seek recommendation from your server or just go with any Californian wine."
"September 10, 2017",50,Special occasion restaurant,We enjoyed our wedding anniversary dinner here. Our steaks were cooked exactly as requested and the dessert was fantastic. The menu had a better variety than other steakhouses in the area. We needed to book a few days ahead to ensure we got in.
"September 1, 2017",40,Valet parking ?,"We paid 13 dollars for valet parking when arriving, after dinner at 10:30 the valet had already left. Good thing our car was close by and the front desk had our keys. This is not acceptable."
"August 4, 2017",20,Not satisfied,"Nice place, friendly staff,.... but the ribeye was below standard. Some ordered well done, others rare, but everyone got medium (rare) with the excuse that all plates came from the same piece. There are far better places for a good steak with a personal touch."
"July 23, 2017",50,Best Steakhouse in bay arra,Great food and service. I would definitely recommend it and will come back many times. Crab cakes are delicious. Martinis are superb. Fresh bread is served. Desserts are very good too.
"July 19, 2017",50,Always great,"Best prime rib and steakhouse in San Fran. Consistent, delicious food, perfect service and wine list to match the menu. The steaks are perfectly aged, marbled, and melt in your mouth. Always recommend Harris for a great night out."
"July 9, 2017",40,GreAt Steak,One of the best tasting steaks I have had in years. I had the bone in rib steak. It was a little tough which surprised me but still very good. Service was great
"June 20, 2017",50,Delicious steak well served and cooked to perfectionn,We shared the Japanese WAGYU. Just right for 2 people with a lovely holondais sauce. Tender and tasty. The best we have had in the US so far. Expensive but worth it for our las night in US. Impeccable service with a nice bar.
"June 14, 2017",50,Classic steak house,"A lovely dinner for two - good wine, excellent petite filet mignon. The chef definitely knows how to grill to medium and medium well. Attentive but not overbearing service. Enjoyed our evening very much."
"June 3, 2017",40,Average,Love meat here. Also we use a private room just for our group that help reduce the popular noisy environments at us restaurants. Staff are kind and prices fair.
"June 1, 2017",50,From a Local's Perspective,Charming and excellent... service and food. Classic and wonderful. Can't go wrong with any steak... one of the best in the bay area I say. Wonderful salads... perfect potato and veggies.
"May 28, 2017",50,Must Visit this Restaurant,One of the best restaurants in the city. Bone in rib eye was outstanding. Service was incredible with our server so very helpful. Grilled scallops appetizer was excellent. Make sure you eat here when in SF
"April 23, 2017",50,New Years eve 2015,Absolutely good food and service! high wow factor! family of 8 had a blazt! Vaiters are super friendly and proffesional!
"April 20, 2017",30,Not bad,"Better ambience than food. I'd yippy had e been to multiple steak houses this will dissapoint. It does have a great feel, nice to have the piano BUT the for food it is weak."
"April 15, 2017",50,Simply great,We had a spotless dinner. Perfect prepared food and superior service. A real classic and tasteful restaurant. We were around in the menu being 5 persons. Had a porterhouse steak. Loved it. No room for dessert ;-)!
"April 15, 2017",50,High-class steakhouse,"Loved our visit from the Manhattan to the espresso. Perfect steaks, with great accompaniments and a terrific and wide wine list. A real SF establishment. Warmly recommended."
"March 28, 2017",50,Excellent,Excellent service and the special filet medallions were cooked perfectly. They accommodated our 4 year old.
"March 17, 2017",40,Great steaks in old world atmosphere,"Lovely old world feel in bay seating serving steaks of the quality you'd expect from the price point. Service was fantastic and my wife, who doesn't usually eat meat, said she'd definitely go back again. Compliment don't get much higher than that."
"March 5, 2017",50,Wonderful Evening,This steakhouse has it all. Beautifully maintained dining areas and bar. On Saturday great music- band. Service and attention was excellent and food met our expectations. Great steak- perfectly prepared and the best buttermilk mashed potatoes I have ever had..
"February 16, 2017",50,Amazing,"Ambiance was great, service was great, food amazing and drinks too. Best steakhouse in San Francisco?"
"February 6, 2017",40,Delicious Dinner,"Everything was wonderful! Our waiter was personable and professional,the extended wait staff were as well. The portions were more than expected. Our steaks were cooked perfectly and absolutely delicious. A bit overpriced, but worth it. Great ambience, great location, great experience."
"February 5, 2017",40,Best steak and piano bar in town,Great steaks and seafood -- fantastic service - great wine list and great music - knocked em down to four stars because of little slips -- cold creamed spinach and clams that had sat too long -- they used to be perfect
"February 1, 2017",50,Amazing food and service.,We love the atmosphere of Harris. The food is amazing. I think the best steak in San Francisco. The staff are attentive. The wine list is excellent. We always enjoy returning to this special place.
"January 30, 2017",50,Amazing!,"The food, service, ambiance are first class! We loved every minute! Dining many times, I always order the Harris' steak. Moist, juicy! Love the ahi tuna appetizer along with the Harris martini."
"January 21, 2017",40,Nice old fashioned steak house,"Harris' is a classic steak joint, reminded us a bit of Gibson's in Chicago. Portions are large, service is attentive. Lovely little jazz trio in the bar area."
"December 30, 2016",40,Good steakhouse,"This is another one of San Francisco's good Steakhouses. The steaks are tender (unless you ask for ""well done"") and flavorful."
"December 10, 2016",50,Classy,"Come here since 20 years, consistent food/meat quality, attentive staff sometimes live jazz. Mot cheap, so with good price/taste relation compared to other upper-level steakhouses. Just the interior gets into early aging. Will come and enjoy again"
"October 24, 2016",50,Excellent and accomadating,"They tucked our reservation in with a shoe horn for a party of seven booked with only a weeks notice....everything for our Chairman and family was excellent...food, service and atmosphere"
"October 22, 2016",50,"Super steak, good service, great atmosphere","I went here with my wife and we were so satisfied. The atmosphere was really great, the service was great and the food was fantastic."
"October 19, 2016",50,Awesome anniversary night!,"Great food, beautifully served. Most amazing steak we've ever had. We are looking forward to visiting again next month!"
"September 21, 2016",40,Classy Steakhouse,We had a nice dinner here. The service was really good and the interior was very classy. My date had the prime rib which was outstanding. I do recommend this restaurant.
"September 13, 2016",50,SF Great Steakhouse,"Great steaks from the best steakhouse in SF. Professional service, good wine list, large menu and comfortable surroundings round out the experience."
"September 7, 2016",40,Great dinner on our last night in San Fran!,"We had dinner at Harris' Steakhouse on our last night in the city. The filet topped with foie gras was excellent. The atmosphere is fabulous and the wine list is very good, had something for everyone. Our service was excellent. Will dine here again!"
"September 5, 2016",50,Great traditional steakhouse,"If you are a fan of traditional steakhouses with a good menu and a great bar, look no further. The ambiance is clubby, leather booths and fab martinis. Service was excellent; steaks to die for. Wonderful scalloped potatoes. I could go back tonight!"
"September 3, 2016",50,"Amazing steaks, great service",Food was super (if you like steak...!). Great wine list too. The restaurant catered for kids very well. Friendly and attentive waiter.
"August 16, 2016",40,Nice Steakhouse,Typical clubby steakhouse atmosphere in classic old updated space with a Victorian era nice bar. Steaks and prime rib were excellent; the creamed spinach a tad on the mushy side. Nice wine list. Excellent service.
"August 15, 2016",50,Perfect Steakhouse Experience,Great traditional steakhouse. Wonderful cuts of meat. Perfectly prepared. Great sides and vegetables. Good wine list. Service hits just the right note.
"August 15, 2016",50,Birthday Steak Dinner,"What a treat! Excellent service, exceptional focus on detail to ensure a dinning experience . The wine and food were extraordinary . The tab was on the high side, but was still a good value."
"August 10, 2016",40,Excellent place for dinner,"The Harris' Steakhouse offers a great menu, superb service and a special setting for a night out in San Francisco. Don't miss it."
"August 9, 2016",40,Good atrak,Expensive but worth it - good steak and wine. Service was good too. Great restaurant to enjoy a meal with friends. Recommend.
"July 7, 2016",50,GREAT STEAK HOUSE,Steaks are great!!! If you like crab cakes they are a must!! I was not crazy over the bisque but I am from the south.
"June 20, 2016",50,Fantastic meat place.,to me it looked like the perfect american steakhouse. fantastic filet and good wines. and it was too cold..
"May 25, 2016",10,Very dissatisfied with the food,"I was quite surprised at being disappointed. We expected a fine meal. While the service was very good, the meal was not. We ordered Steak Diane, and it was apparently their house take on it. Unimpressive."
"May 21, 2016",50,Delicious meal,"We had a wonderful dinner at Harris'. Started with the crab cakes, Caesar salad and shared the 12 oz. filet. Adam did a great job serving us!"
"April 25, 2016",50,Best Steak House in San Francisco,"After many visits to Harris', I can say without hesitation that this is the very best steakhouse in the City."
"March 30, 2016",40,Steak Diane Delicious,"Ample pour & piano player & cowboy cool lounge invite before dinner drinks. Oh so good oysters & vegetables. Steak Diane delicious medium well - though may take two try's; horseradish side zest. Polite, effective staff. Booths galore beneath high ceilings & stunning paintings."
"March 28, 2016",30,Good but not memorable,For such an expensive restaurant Harri's is nothing special to remember . A place you can just miss during your visit to San Francisco. Excellent meat and nothing else ( avoid by all means the no meat dishes )
"March 15, 2016",50,Delicious restaurant!,"Excellent food. Delicious! Expensive and the restaurant is not speedy but if you are there for a nice dinner and to visit with family, friends, coworkers highly recommend. Not much parking near but they do have Valet Parking."
"March 7, 2016",50,Marvelous meal!,"We had a fabulous experience here. Yes, the meals are pricey, But it was an excellent and delicious meal. The rib eye was out of this world!"
"March 2, 2016",40,Classic American steak restaurant,"Service, wines and food quality are great, always a great dinner, reservations on WE and during trade shows have to be made in advance since the place is especially popular among locals"
