"April 3, 2014",40,For those who are deeming of steaks,"Could be one of the best Steak House of Budapest. Kobe, Angus and high quality beef meat is provided in a nice and cosy atmosphere. Service is perfect!"
"March 25, 2014",40,Great experience,"Very reasonable prices. Good food, good wine. The meat was awesome, the sauces too. Service was average+. For sure we will come back if we get the opportunity."
"March 20, 2014",50,Great!,"Loved the food, we took Argentinian steaks, house wine was wonderful, the staff is indeed professional and friendly, even though we did not have a reservation we managed to have dinner since the place was fully booked on a Monday. Enjoyed the experience!"
"March 11, 2014",50,Good steaks,"The place is nice, the staff very professional, the foods are good. They know the secret of good steaks. The wine offer great as well. The prices a little bit high in Budapest, but same level in Europe. Recommended"
"February 26, 2014",50,Amazing steaks,The steaks at pampas steakhouse were very delicious. One of the best steaks we've eaten. The atmosphere was nice and the service was very knowing and kind. Their wine list was by far the best compared to all the other restaurants in Budapest we visited.
"February 20, 2014",50,A-M-A-Z-I-N-G-!,Ate a rib-eye stake. Best steak of my life. Great service and armosphere. I can't wait the next time i go to Budapest!
"February 15, 2014",50,Best one in Budapest,"This restaurant is perfect and 5 star, steak is also perfect. I prefer rib eye steak result is perfect. I suggest this area for everyone"
"February 2, 2014",50,Excellent!,"It was really a cool time there. Waiters was friendly, steak was perfect and price is OK. Highly recommend."
"December 12, 2013",50,great steaks and service,"Me and my friend both had Angus steaks (N.Y. trip and Rib-eye) and they were excellent: juicy, tasty and cooked perfectly. The service was perfect also; the staff was very helpful and knowledgeable. I can recommend the tomato and chili sauce as well."
"November 28, 2013",50,THE meat restaurant,"My fifth visit and still my favourite :) THE meat restaurant, excellent steaks with perfect service and decent vine selection."
"November 6, 2013",50,Polite service!,"It was my first visit, but not the last! There was a nice meals - N.Y.Strip steak and salad with tenderloin slices - and great service. It wasn't too chip, but this is the downtown! I can recommand this Restaurant!"
"October 18, 2013",20,Overrated,"Highly overrated steakhouse! Poor service, hard-cooked steak and sooooooooooooo pricey!!! Not recommended at all."
"October 15, 2013",50,Awsome,Tourists from norway) best service in budapest we've met so far. best meat we've eaten so far. Low price for beeing Kobe meat (exclusive) no teeth? Thats no problem... go for the Kobe.
"September 29, 2013",50,"Great place, wonderful steak!","Went here with my boyfriend, and we really wanted a good food experience. The steak was extremely tender and tasty. The wine selection was varied both in taste and prices. Food and drinks for every price class. Great service as well. Recommended!"
"September 10, 2013",30,Nice but the meat is quite average,"A steakhouse should have better meat, and the sidedishes are not any special either. The place is quit nice with large chairs and a little tacky interior"
"July 14, 2013",40,Good option,"The meat is wonderful, a parrila typically Argentine, but very little! Although time consuming, the service is not found wanting. Great option for those who want to eat good meat in Budapest! Is expensive for the amount of food"
"July 7, 2013",50,Good Steakhouse,"Great atmosphere, nice staff. The dishes were very good. I wuold come back in the future again. The prices are to the hungarian average a litle higher, but for those dishes are O.K."
"May 29, 2013",50,Fantastic Argentinian steakhouse!,We were recommended this place for a good steak by the barman at our hotel and we weren't disappointed. A wonderful rare fillet mignon followed by a chocolate fondant - heaven!!
"April 29, 2013",40,very nice steak restaurant in Budapest,good service and steak was cooked to order and the creme brulee was one of the best i'd tasted! worth a visit in budapest.
"April 1, 2013",50,best steak in town,If they have the USDA grain fed fillet then simply the best ever steak I have ever eaten cooked perfectly
"March 28, 2013",40,"Great steak, great service...",There is a good choice of steaks as you might expect! They were cooked just right and held plenty of flavour. The creme brulee for dessert was amazing!
"March 23, 2013",40,Steak cooked to perfection,Empenada excellent - better than the argentinian we eat in the UK does them. Steaks cooked to perfection exactly as ordered. Staff very helpful Bit dim inside Expensive but value for what you got.
"March 17, 2013",50,"good steak, terrific parking","Wonderful tenderloin steak and forgettable soup in a crowdy mainstreet restaurant, with polite, english speaking waiters and not-dirty toilets. Parking situation is awful. Price/value is ok"
"March 15, 2013",50,Very good steak!,"We tried the garlic soup, more kind of steaks (kobe, angus and hungarian), ribs, chicken wings, brownie... Everything was absolut perfect! The only problem, that its a bit expensive."
"March 14, 2013",50,Excellent Restaurant,The beef is great and the staff are friendly. But the menu can be a bit difficult to read because of dimmed lighting. Overall I recommend this restaurant to any one visiting Budapest.
"February 20, 2013",50,Best steak ever!,"Steak here was amazing, cooked exactly as requested. Most dishes required you to order separate sides but this meant that me and my friend could share several sides. Lovely atmosphere and polite waiters that speak good English."
"February 18, 2013",50,Does exactly what it says on the tin.,"This was by far our best meal of a 5 daybreak,the meat was outsdanding(huge pork fillet/tenderloin melted in mouth)great wine/great service(no attitude) a quality meal,"
"February 10, 2013",40,Wagyu to die for!,Had dinner here with family and ordered the Wagyu that they had recently received from Australia. It was amazing. Melted in your mouth. If you love steak you will love Pampas.
"January 23, 2013",50,Best Steak Ever,"Lovely place and great staff, we fell in love with our waiter he was wonderful.. food was fantastic and cooked to absolute perfection steak almost melted in my mouth.. a tad expensive but worth it in my opinion."
"January 3, 2013",50,top restaurant,"Great food, super service. if you like a good steak this is the place to be! Make sure to make a reservation and to eat the steak mix :)"
"November 26, 2012",50,Very good restaurant,All argentinian meat was awesome and prices OK. One diner with wine was between 25 and 30 Euros. We arrived there with no reservation but they managed to give us a table for 7 persons. Recommended!
"November 14, 2012",50,Enjoyable food!,"Nice place,great food and good service.Amazing steaks,especially Kobe beef...Prices were ok.............."
"November 7, 2012",50,Don't miss this!,"Great service, perfect steaks, nice atmosphere. We stayed in Budapest for a week and this was hands down the best dining experience we had over there."
"September 20, 2012",50,For stake lovers,"Really good, professional service, and fantastic food! Strongly reccommend if you like steak and want to eat sg special!"
"September 15, 2012",50,Perfect,"The best stake i have ever eaten. Perfect place for steak! If you want to drink a good wine, chose some tradicional hungarian wine! 😃"
"August 29, 2012",40,Best steak in town (at a price),"This one of a few places in Hungary where you can get a decent steak. Cozy atmosphere, just a tad heavy on the wallet for most folks"
"June 28, 2012",30,not for Budapest,"Steak is not for Budapest. somehow it just does not fit, although citchen trues hard, ingredients seems fair. Still, if looking for a steak in town go for it."
"June 22, 2012",50,Best steaks of Budapest,"Go to Pampas if you want to experience great steaks. Their steaks are from Hungarian, Angus and even the Japaneese Kobe cattle. The prices are a little bit above the normal in Budapest restaurants, but the steaks are worth it."
"May 11, 2012",30,"Good meat, the sideorders could have been better",Really well cooked meat. I ordered rareamd got a good rare.My gf ordered medium well and got it cooked perfect. Bit the side orders were a bit so so...
"May 6, 2012",40,Nice choice,Very good food at reasonable price and very friendly staff.I will go again.
"April 16, 2012",50,Best value,"All you need. Atmosphere, kind staff, exelent food for reasonable price."
"April 4, 2012",40,Great steak restaurant,"A bit unusual in Budapest but here you'll find great Argentian steaks. Try the surf and turf, yummi"
"March 18, 2012",50,Fantastic - one of the best steaks I have eaten,Great steak - had the Kobe Ribeye - my friend had the Kobe Fillet - both were fantastic and tasted amazing - so tender - so succulent - excellent service - beautiful wine
"March 15, 2012",50,Best steak in Budapest!,"My second visit to Pampas was no dissappointment. The meat is world class, and so are the staff! A bit pricy for Budapest, but well worth it."
"February 25, 2012",50,Beef of 1st class,"A perfect beef served by very nice and good English speaking waiters. The dinner was very,very good accompanied by a different type of lemon sorbet dessert. We enjoyed it. Go there. It is definitely worth a visit, Jorgen and Maria Knap, Hovik, Norway"
"February 23, 2012",50,Best steak I've ever had!,"If you like a good steak, and you're visiting Budapest, don't miss out on Pampas. Great service and atmosphere, and the food is truly outstanding. The waiters know their wine, so listen to them. Will definitely go back if ever in Budapest again."
"February 20, 2012",50,Delicious!,"Excellent steak, very tender and perfectly cooked. Order it as you would in England. I.e medium, comes medium! And not blue like it would be in France. Lots of choice and they also have Kobe steak should you desire it!"
"January 3, 2012",20,Not very good,Been there twice and felt cheated each time. Service is less than satisfactory and food leaves to be desired.
"December 22, 2011",40,good steaks :),ask for wine tips.. the waiter was very knowledgable..
"December 18, 2011",30,Very traditional Argentinian restaurant,But they didn't have Spanish speaking which is a shame.
"December 2, 2011",50,Best Steak in Eastern Europe!,"I was not expecting the mouth watering, perfectly grilled, incredibly tasty Rib Eye steak I received, I was so impressed I ordered another one, topped off with a bit of wine, a truly wonderful dinning experience!"
"November 28, 2011",30,Good steak,"The food was pretty good, but thought that it was way too overpriced. Was kind of sad that you only got steak with nothing else. The mashed potatoes were extra."
"November 17, 2011",50,The best...,"Great food, the best of all restaurants I've been in Budapest. Service is very good as well."
"November 10, 2011",50,Probably the best steak I have ever had.,"We found this restaurant on accident and thought why not? The service was excellent, the wine was superb and the steaks were melt in your mouth fantastic!!! I will never forget about that dinner."
"October 31, 2011",40,Great steak and good night out,"We enjoyed our nightout at Pampas and enjopyed the food on offer. It was very nice steak as you would expect but all the sides were good too, i would not say it was 5 star but a very good steak indeed."
"October 24, 2011",30,"Good food, lousy service","Seated us in the rear (non-smoking), we must have had a traineee as the poor service more than made up for the good (but overcooked) steaks."
"October 1, 2011",50,A Very Special Occasion,"The Pampas Steakhouse is certainly worth a visit. The food was cooked to perfection and the steaks were excellent. As for the service, this was very attentive without being intrusive. This is not a cheap night out but very good value for money."
"July 31, 2011",50,Best steak ever,Coming to Budapest I never miss the opportunity to have dinner at Pampas. Best steak and wide selection of wines. I strongly recommend it!
"May 15, 2011",40,Really nice meat,My husband and i walked around and looking for à restaurant and find Pampas. We order meat and it was really good. First course scimps with farlig and chili was also good. For à big steak this is a perfect restaurant.
"April 3, 2011",40,Good Food,Enjoyed the meal. we was in budapest for 4 days and went here for a meal on the last night and wasn't disapointed
"February 25, 2011",40,If you fancy a steak in Budapest then visit Pampas,"Opposit the Great Market Hall, Pampas serves great steaks. It's relatively expensive for Budapest but well worth a visit"
"January 9, 2011",50,Loved my T-bone steak!,"Excellent steaks with great service, what can I say more. Nothing to complain!"
"October 12, 2010",50,Great food and service,We ate at this restaurant twice as it was so good. I rarely eat steak in a restaurant but the food here was excellent. The service was also very good. A good choice of dishes and loads of wines.
"September 18, 2010",40,Great place for a meat-eater,"Excellent steaks, good food in general. For steak-lovers is a must."
"July 27, 2010",50,Best steak I have ever had,I tried the tender trio which was absolutely unique and faboules. Great wine selection as well. Try the YBS Argentinian Malbec which was fantastic. Great value for money.
"March 27, 2010",50,Excellent food and waiters,"The food was great, and the service too! Friendly and extremely professional waiters made the evening fantastic!The Tokaji wine for dessert was lovly! I definately recommend this place to anyone visiting this beautiful city! Absolutely the best restaurant i Budapest!"
"October 26, 2009",50,good steak,"good steak, excellent service, wine ok, prices ok arrived with small kids for lunch, attentive service food is good, could be presented nicer maybe i give a 5, recommended if you are in Budapest and had enough of Hungarian food"
"August 23, 2009",50,Worth a visit,"Good ambience, friendly and knowledgeable staff, excellent steaks and other meats. Reasonable prices."
"June 1, 2009",50,Absolutely the best steaks I ever had,"Besides the great variety of delicious steaks and wines, Pampas provides an unforgetable experience to its guests. I recommend it to all steak lovers!!!"
"May 17, 2009",40,Excellent steak and service in a central location of Budapest,Very good steak in Budapest (Pest side). Excellent decoration and atmosphere.Need reservation for week ends
"May 7, 2009",40,Great steak and BBQ wings,If you want steak then this is the mecca. You have to have NY strip and BBQ wings as a starter. Not necessarily the cheapest restaurant but you get what you pay for.
"March 24, 2009",50,The best steaks ever! Fantastic!,"Everything about Pampas Steakouse is fantastic! The steaks are the best ones I ever had, the atmosphere was great, the service was very professional and it is totally worth the price!!!"
"January 20, 2009",50,best of budapest,best of budapest
"January 4, 2009",50,Definitely my favourite:),Definitely my favourite:)
"November 18, 2008",50,crazy good steaks : ),crazy good steaks : )
"November 6, 2008",50,"Stylish decor, fab steaks. Not keen on the throwback to smoky restaurants tho","Stylish decor, fab steaks. Not keen on the throwback to smoky restaurants tho"
"July 14, 2008",40,Great for Steaks!,Great for Steaks!
"July 8, 2008",20,i didnt really like it because its relatively expensive for what you get. you basically get a tiny piece of steak for...,"i didnt really like it because its relatively expensive for what you get. you basically get a tiny piece of steak for about 20 to 30 dollars. and its not that good even though its ""super argentinean meat"""
"June 2, 2008",50,Best damn steakhouse in...,Best damn steakhouse in Budapest! One of the best anywhere.
"May 13, 2008",40,"Not exactly cheap, but sometimes worth the money. May be the best steak in Budapest.","Not exactly cheap, but sometimes worth the money. May be the best steak in Budapest."
"May 8, 2008",50,best succulent steak I have had outside the US,best succulent steak I have had outside the US
"May 2, 2008",40,A family favorite for steak.,A family favorite for steak.
"April 21, 2008",50,"The best Steakhouse I have found in the city, really yummy food, prices aren't bad and lovely interior","The best Steakhouse I have found in the city, really yummy food, prices aren't bad and lovely interior"
"January 12, 2008",50,excellent cuisine,excellent cuisine
"January 8, 2008",40,Real nice steak house. Can be compared to anywhere in the world. Steak and sides ordered separately. Wines are spot on...,Real nice steak house. Can be compared to anywhere in the world. Steak and sides ordered separately. Wines are spot on and sommeliers appreciate their work.
"December 18, 2007",30,"although food is great, service is lousy and the place is overpriced. If you wanna go for a less elegant, more alpine...","although food is great, service is lousy and the place is overpriced. If you wanna go for a less elegant, more alpine like diner to satisfy your meat-needs, I'd recommend you to check out the Branco Steakhouse in Erd."
"April 8, 2020",10,Terrible,"Overpriced, mediocre steaks with a ridiculous waiting time (the place was empty too) and pathetic portions. Wouldn't recommend this dump to anybody."
"February 20, 2020",50,Sensational dining experience,Lovely restaurant situated in a beautiful area of the city. Incredible food and wine and the brilliant customer service topped it off. Highly recommend.
"December 29, 2019",50,"Outstanding, I hadn’t been","Outstanding, I hadn’t been in Budapest for a few years and had to come here again. We were a big group of friends and everyone was extremely happy !! Amazing"
"December 15, 2019",50,Just simple perfect,"Always nice to be there! Quality food and service. Steaks are tender, juicy and very tasty. Side dishes and sweets also fantastic. Well done guys!"
"December 4, 2019",30,The waiter told us the bearnaise weren't glutenfree,"They didn't delivere. Wine was good, meat alright. Not all meat were cooked as preferred. The waiter told us that the bearnaise was not gluten free, then how do you make bearnaise?"
"October 20, 2019",50,Great welcome with children (7pm) super food and a bit of fun too!,"Reminded me of Courcheval, bit of show, great food, animated and chatty hosts. Great birthday treat, if it’s your birthday. Ribeye excellent, kids had fillets 180g again best steak ever apparently. Caviar a treat Good recommendation"
"October 8, 2019",50,A step up from a standard Steak Restaurant,"We ate here as a couple. We enjoyed great food, fabulous service, nothing was too much trouble. The steak was perfectly cooked."
"September 18, 2019",40,Good beef,Good beef nice location close to stephen’s cathedral the beef was good but not so high place is very nice so u should visit
"August 27, 2019",50,Great steak,"Came here with 5 other people because we were craving steak. The food we had was very tasty and the cuts of meat was perfect. If your after quality come here, if you want cheap, don't come here."
"July 21, 2019",50,Excellent steak,"Celebrated our 1st wedding anniversary here. Steaks are excellent. Had a combo of steaks - hungarian grey cattle, Argentine Angus and Uruguayan Angus. Cooked to perfection. Really nice interior and staff were great."
"June 14, 2019",10,Rude and incompetent,Rude and incompetent staff The worst is the management I would strongly recommend everybody to avoid it They poured the coffee all over me and did not even say sorry I have never encountered a worse attitude in my life Shame on you
"June 6, 2019",50,My favorite steak... and more,"I have been to this steak house many times over the years and it is surely on my list of mandatory places to have dinner. Lovely ambience, extravagant acoustic, delicious food. See you soon, for sure :-)"
"May 18, 2019",40,Very good,"Very nice place,with very nice food. Good atmosphere,polite stuff. I really cant say anything bad. Simple,worth trying :)"
"May 15, 2019",50,Reece thompson brown,"Came here last night on my second night to Budapest, steak was the BEST steak I’ve ever eaten! Staff were nicely and friendly, and the place itself was amazing! Perfect restaurant!"
"March 8, 2019",40,Good food but little up rated by price,The dessert very good. Steak maked not 5 stars but better quality than the middle class. The meat price higher more than normality.
"December 28, 2018",50,Gourmet fancy dining,"Just arrived to Budapest and decided to go for good steakhouse and we are in the right place to eat in, yes it is expensive so please check your budget. Every thing was perfect as it should be"
"December 28, 2018",50,Best Steaks Ever,Our party of four people all had different steaks all cooked differently from well done to rare. All came out perfectly cooked and so tender! Well done to the team with excellent service too. Best steak I have had at a restaurant.
"December 10, 2018",40,Fansy,"Nice place, good steaks, you can choose of many many varieties of meat. You need to book a table if you want to go there. Rather expensive."
"November 28, 2018",40,Nice restaurant.,"We were passing by and decided to give it a try. Very nice restaurant, decor and good food. Bit expensive but overall good experience."
"November 10, 2018",50,Absolutely superb!,"From the professional,yet friendly greeting at the door, through the excuisite service and deliciously stunning meals, to the plentiful and delightful desert offering, this restaurant is world class! One of the top highlights from our 4 day visit to Budapest! Strongly recommend!!!"
"November 7, 2018",50,Amazing,"One of the best place in Budapest, where you can find the bedt steakes, in a stunning bistro with delicious wines served by a great staff."
"October 27, 2018",40,Schic,Excellent beef and installation. Side dishes could be more refined. Carefull but slow and little confusing. Expensive but proportional to quality.
"October 21, 2018",50,Best steak ever,"Went to this restaurant with my family. Very good service in a comfortable place. We tried 3 kind of steaks and they where all out standing cooked, melted in your moth. Can highly recommend this place."
"September 22, 2018",50,Anniversary Dinner,"One of the best meals we’ve ever had. Attentive service, amazing food. Thankyou! Expect to pay about €200 per couple but it was worth every penny. The steak was cooked to perfection."
"September 9, 2018",50,Excellent food,It is fine dining! Very central you can eat our on the warm night. From the Hamburger to the stuffed chicken breast to the choice of three filets from different meats... The food is excellent. Pricy but worth it.
"September 4, 2018",40,Excellent steak and service,"If you are looking for an excellent steak in Budapest, look no further. The quality of the meat was outstanding and they serve a large portion of the meat as well. Service was also very good."
"August 19, 2018",50,Superb food and service,What a great restaurant - lovely ambiance and superb attentive service. The steaks and accompanying sides were also superb. The wine was very good and reasonably priced. An upmarket and high end dining experience all round - thanks.
"August 6, 2018",50,Top class restaurant,"If you want to feel really exclusive stuff in Budapest I strongly reccommend this place. Quality of food, choice of wines, service and overall ambient are exquisite. Enjoy ;)"
"July 27, 2018",40,good steaks - a bit expencive,"We ordered some steaks that were really nice, the side dishes were also really nice. Service was good and the wine was also really nice."
"July 20, 2018",50,"1051 Budapest, Sas utca 18.","Budapest's best restaurant, perfect food, drinks and excellent service, I can only recommend. The realm of steaks and the harmony of flavors. As we will have the opportunity to come again."
"July 1, 2018",50,"Steak, fois gras and wine selections to delight",Amazingly wide selection of steaks to choose from with a great selection of wines including Hungary’s finest. Do try a glass of Sepzy Tokaji Aszu while there.
"June 29, 2018",50,Great Menu,Great options of cuts on the menu. The multi country / cut plates are a fantastic idea. I had the Quality selection.
"June 29, 2018",50,No regrates,"The service, the display, the taste. Really cool interrior. And the service was excellent. The steak is soft enough to use youre gums."
"June 8, 2018",40,High end steak house,"Good service, good Meat, small side orders. Low value for money. (High Quality at High Price) Extremely good wines, good meats but at High prices."
"March 28, 2018",50,Worth the visit if you can afford it,A meal for 2 cost us €200 which is a good deal more than we would normally spend. However the meal was special and excellent so it was well worth the price.
"March 26, 2018",50,Wauw!!!,I loved this place! Perfect service and wonderful meat! Can’t wait to go back for the best steak ever! 😍
"March 20, 2018",20,Mini Steak,"We all know that 180g is a small Filet Mignon, but the served size was even smaller. Disappointing value-for-price"
"March 20, 2018",10,Would never go there again,Long waiting time. Smallest steaks with „300g“ I have ever seen. Service so and so. It is a business rip-off. Would never go there as a tourist
"March 2, 2018",50,Wow!,"Amazing food, amazing atmosphere, outstanding staff and customer service. Visit from the Chef, lots of advise on menu. Couldn’t recommend more!!"
