"February 13, 2016",40,Tasty pizza,Friendly stuff and nice relatively quite atmosphere close to the Vatican. Very tasty especially the pizza containing Mozzarella di Buffala.
"February 13, 2016",50,Excellent!!!,Let them make you a sampler...can't decide which kind was our favorite. And the servers were super friendly and accommodating to the kids.
"February 12, 2016",50,"Best pizza, best service","You have to love the guys there, Roberto and Enrico. We enjoyed a very good pizza in a very plesent enviorment"
"February 12, 2016",50,Eccellente!!,Unbelievable pizza and great experience. I know I often doubt the Trip Advisor reviews but you will not go wrong with this place.
"February 6, 2016",50,Very nice pizza,"Such a tasty pizza!The stuff was super friendly too! It is located near the Vatican,a perfect place to grab a slice of pizza and have a rest!"
"February 2, 2016",50,My 1st Foodgasm,"Hands down, best pizza I've ever had. If they have their bacon pizza, it was spectacular. Right next to the Vatican."
"February 2, 2016",50,"Delicious pizza, great service!","Delicious Pizza, close walk to the Vatican. Very friendly and accommodating service. Even offering my fiancé and I a few samples. Perfect end to an afternoon."
"February 1, 2016",50,Very very great pizza,Near to vatican. Best. Great. Amazing fresh. Good beer good pizza good music so this is the athmosphere what i want to find. Try Try to Salamon and potato and the spicy spinach.
"January 28, 2016",50,Delicious,Had a couple of slices of pizza after leaving the Vatican....lovely pizzas and friendly staff. They also served booze which compliment the experience nicely.
"January 27, 2016",50,AMAZING!!,"Myself and my brother visited Pizza Zizza today, the place was fantastic. The service was the best we experienced on the whole holiday. They were all so happy. The food was incredible!! I would highly recommend!!"
"January 20, 2016",50,"Amazing Pizza !! Nice price, nice people !!","If you visit the Vatican, you have to eat there! It's not a restaurant, more an Imbiss. The Pizza is amazing.. 😍"
"January 18, 2016",40,Very good option!!,"The service is excellent, the place is very small, pizza is very very very yummy, the only thing missing was meat on them :P Too many cheese and vegies!"
"January 18, 2016",10,Not really,Not good meal l didnt like very cold people you cant ordered any extra woth out money food is not my stile
"January 15, 2016",40,Fantastic pizza take-away,"Small, take-away establishment, but, despite the great reviews here, there was no queue! The range of toppings was great and makes you want to try everything, and as it is inexpensive, it is very tempting to do just that!"
"January 15, 2016",50,"Great experience, Nice staff, lovely food!","best pizzas I had in Rome with different flavors, the only bummer was the timing because it was raining heavily."
"January 8, 2016",50,A real roman experience,"Lovely warm and funny welcome from Roberto whose English is very good. The good is absolutely wonderful.delicious pizza and lovely cold beer, and cheap; €45 for 4 of us, including drinks. Ignore the neon lights, it's a wondrous place to eat :)"
"January 8, 2016",30,Roman pizza is not really the best,Very good atmosphere but the pizza is not really something. I am used to much better pizza even for a cheaper price. Take into account I dont like roman pizza which was too faty and with no distinct fresh flavours..
"January 7, 2016",50,Great spot!,"Great pizzas, excellent prices, and the staff are very fun to chat with. The location is a little hidden, and it's truly a small place, but their food is amazing."
"January 5, 2016",40,Very nice,"Cheap, very tasty and take away or either if you wanna sit . The cool part is you decide of how big of slice you wish of whichever pizzas you want. Cute,"
"January 5, 2016",50,Amazing pizza,Excellent food. We take mix pizza for two people 12 pieces 15€ and two drinks both 3€.the service was amazing bravo guys
"January 4, 2016",50,Excellent!,"Not too much space, but this taste of pizza you will never forget! For me and my family that was excellent choice!"
"January 2, 2016",50,Lovely pizza,Great pizza. Small little cafe on the side of a busy street. Easy to miss beside the bigger restaurants but well worth trying the pizza here.
"December 31, 2015",50,coool and tasty!,Very tasty and fresh! :) highly recommanded. it is a small caffetteria but a lovely one. we enjoyed our pizza under sunshine ;)
"December 30, 2015",40,Tasty and inexpensive pizza,"Close to the San pietro church, small place but fast and friendly staff. Very good food and inexpensive, ideal for lunch!!"
"December 30, 2015",50,Great,The best place to have pizza so far. They have really good choice. The staff is also nice and friendly. If we visit Rome again will definately go take some pizza.
"December 29, 2015",50,Love!,Sightseeing is so much better with a piece of great pizza in your hand❤️ Guys are amazingly positive which makes you want to come back everyday:)
"December 29, 2015",50,Great pizza,"Very much enjoyed the pizza. Selection is limited, but you can order as much as you want since you pay by weight. The staff is very friendly. Seating space is limited. Very close to St Peters Basilica."
"December 28, 2015",50,THE BEST PIZZA!,"Amazing pizza, incredible suppli, the staff are extremely helpful. opening hours are between 12 and 17 ( for enjoying all the best of the food assortment )"
"December 19, 2015",40,"Tasty, but a little bit fatty","Small pizzeria near Vatican. There are a few tables, so due high rating there can be no free table. Pizza was tasty, but a little bit fatty"
"December 17, 2015",40,Really testy pizza,One of the best pizzas ever all succulent soft toppings and very good food The staff are also very attentive always trying to make all the guests feel at home
"December 17, 2015",50,Best pizza in Rome,The owner is a fantastic host and they have the best pizza in Rome for sure! And also the price it's very good.
"December 13, 2015",50,Best Pizza......,Very delicious pizza with a very friendly service. The mix pizza was amazing. It might be a good option for the visitors or people around.
"December 10, 2015",50,Great pizza and beer!!,"Very friendly staff and lovely Pizza and beer, they did us a selection of pizza for 2 so we got to taste everything, would definitely recommend!"
"December 8, 2015",50,Absolutely the BEST,"Absolutely the best pizza we have ever had, hands down. Delicious crust and amazing cheese and toppings. Opened a little later than website said though, but service is quick and friendly. 5 min walk to the left of the Vatican. Go here!"
"December 4, 2015",50,Our best fast lunch in Rome,"Kind staff, very delicious tastes, good atmosphere. Me and my mother loved it. Congratulate Roberto and Enrico!! Thx for the little surprise :)"
"December 4, 2015",50,"Very friendly, good pizza.","We ate here with five, paid EUR 30 for plenty of pizza. Pizza was really good, even got some for free. Also people were very friendly"
"December 1, 2015",50,Great for lunch!,Visited here purely because of the great location and its rating on trip advisor! Small restaurant but great quality food served at reasonable price! Limited seating but take away offered too! Will definitely recommend!!!
"November 27, 2015",50,Friendly service & great pizza,We had some pizza and lasagne. The pizza is amazing. All of the pizza was really good. The owner was very friendly and talkative.
"November 26, 2015",50,Best pizza in Rome,Small place close to Vatican. Enrico and Roberto are extremely helpful and very friendly. The food is great- best pizza in Rome. The prices are very good.
"November 25, 2015",50,Awesome experience,My best dining experience in Rome so far. The pizza is really good but what makes this restaurant outstanding is the entertaining service. Definitely not my last visit!
"November 23, 2015",50,Top,"The pizza was really good. I tried the suppli. I really recommend. Staff very friendly. It is a small restaurant, but big in flavour"
"November 23, 2015",50,Very good Pizza,Very god Pizza with different flavours. We were 9 and all of us love the pizza. The staff is very friendly and they treated us very well. Definitely a place to stop if you visit the Vatican.
"November 22, 2015",50,Absolutely perfect slice,By far our favorite pizza place when we visited Rome. Tried several places but none could compare to Pizza Zizza. My favorite was the Zucchini slice and the marguerita was delicious also.
"November 22, 2015",50,Best pizza,After reading the reviews and as it was next to Vatican city we ve decided to try. Its true that the pizza is amazing and the guy - owner is very funny. Try a mix of pizzas. Excellent
"November 21, 2015",50,"Fantastic pizza, staff and drinks!","Right next to the Vatican, this very small pizza place has some indoor and outdoor seating and fantastic pizza and pasta. Really tasty and decently priced. Fab!"
"November 18, 2015",50,You MUST try it,"We were there yesterday and had a great time trying real Italian pizza. We tried 4 kinds and regretted not to try the others. The bill 13€ with 2 coffees. The prices are really reasonable. People are great, funny and very kind. 110% recommendable."
"November 18, 2015",50,"Really, really good, and friendly service","I'm from London, so arguably my pizza palette isn't up to Italian standards, however the pizza here was pretty amazing. The staff were very friendly and casual too."
"November 13, 2015",50,The best pizza in Roma,"You must visit this place. These guys are awesome, you're gonna like them after 1 minute. Pizza is delicious. All the best !!!"
"November 12, 2015",50,One of the best pizzas in rome,"Excellent place to enjoy good pizza and beer. Really friendly staff, good quality pizza and reasonable prices. If you are near Vaticane do not miss it."
"November 10, 2015",50,Loved the Pizza,We went to Pizza Zizza after visiting the Vatican. The restaurant served incredible pizza. The owners are great. Although the restaurant is small there are a number of tables so that you can relax and take a break from site seeing.
"November 10, 2015",40,Enjoyable lunchtime break after touring Vatican,Small but busy pizzeria a taglio with excellent fresh pizza choices! To the left outside the Vatican colonnade crossing the busy main road and on the left between two other restaurants.
"November 8, 2015",50,When in Rome,"Seriously good pizza!!! anytime, anywhere, let's have it!! love this place has everything going for it send me back one day please god!!!!"
"November 8, 2015",50,Best pizza I ever had,Read many great reviews on this place and it lived up to them all. Literally the best pizza I have ever had. Wish I had more days here to try everything. On top of great food the staff was incredibly friendly.
"November 6, 2015",50,Great choice!!!,"We went there because of tripadvisor.. It was excellent!! Nice pizza, polite young stuff, very helpfull and fiendly.. Pizza, beer and smiles!!! What more??"
"November 4, 2015",50,Best pizza in town.,"The staff is perfect, makes you happy. The taste of pizza is awesome. The price is normal. We ate 4 pieces of pizza, one cola and one beer for 20€."
"November 3, 2015",50,A Must!,"Totally awesome, the best pizza I've attempted in Rome! An unquestionable requirement go!! A truly pleasant vibe and inviting and inviting proprietors!"
"November 2, 2015",50,Really exhalent pizza,"Really I was very happy and satisfied with this pizzas and I never taste like this pizzas in my life , service and environment is very good"
"October 30, 2015",50,A must go!,"Absolutely fantastic, the best pizza I've tried in Rome! A must go!! A really nice vibe and very friendly and welcoming owners!"
"October 28, 2015",50,Best pizza ever !!,Such a lovely place with amazing pizza ! Perfect servise. Good price. Everything is perfect. Best place in Rome for quick lunch.
"October 27, 2015",50,best pizza near the Vatican,"staff was friendly, pizza was good. what more can you ask for? tripadvisor wants me to write more, but I feel like I've said enough. go to pizza zizza for a quick pizza stop near the Vatican! you won't be disappointed."
"October 27, 2015",50,Best pizza I have ever eaten!,...and I have eaten a lot of pizza. This little eatery is very close to the Vatican so it's perfect for lunch after you visit there. The pizza was perfect. This place is a MUST!
"October 27, 2015",50,Amazing,The best City... amazing restaurant... the best pizza I ever had. It was a joy to visit this place. we will come back for shore!
"October 25, 2015",50,As good a pizza as you are going to find,Totally friendly service. We had a sample platter of the various pizzas on offer and they were all great. Reasonable price. Go!
"October 25, 2015",50,Divine pizza!,"Best pizza ever! The owner is really nice, the atmosphere is great and the pizza is divine! A must when you go to Rome"
"October 23, 2015",50,Amazing Pizza,The best pizza we have ever eaten. Very friendly staff and really good prices for the food and drinks.
"October 23, 2015",50,Must try pizza in Rome,"Great pizza, excellent taste, friendly crew, these are the reason why one should try the pizza here! Must try the tomato cheese pizza, we all love it so"
"October 22, 2015",50,Best pizza rever,amazing place . The best pizza I ever tried. excellent customer service and good price . Is a must-go place in Rome!!!!!!
"October 21, 2015",40,Fantastic Italian Cuisine,"I have had a delicious pizza and great beer, I could't be any happier with the service. thank you guys"
"October 21, 2015",30,Average pizza but great service,The shop was easy to find. Shop owner was friendly. Price of pizza is determined by the weight. Lasagna was average too.
"October 19, 2015",50,Unbelievabely good!,"Go there! Now! You won't regret it. This place is magic. The food is amazing, service incredibly nice and friendly, location 2 min from St. Peters. Don't miss it. Best pizza we had in Rome - or like ever!"
"October 19, 2015",50,Fabulous pizza,Tiny place - someone was leaving table as we turned up - the pizza is tremendous. I have never set with my back to a rubbish bin at a restaurant but the food is great
"October 18, 2015",50,Very good!,A place well worth a visit to grab a pizza. Very tasty and nice service! We were a few friends and everybody were very satisfied!
"October 16, 2015",50,Best pizza,"Small place, close to Vatican. Enrico and Roberto are great guys and their pizza is amazing- the best in Italy."
"October 15, 2015",50,Best of the Best,Very delicious food. Best service. Highly recommend. Cozy place and I had never such a pizza ever. Wish a good luck for its owner.
"October 14, 2015",50,Probably one of the best pizza I have ever tried. Thank you...!,The meal was fantastic we had few many varieties of pizza and Gnocci. It was absolutely wonderful. The pizza bread is the best and is very unique. Highly recommended.
"October 14, 2015",40,Great service !!!,"Great service!!! Very helpful staff and nice pizza! It's not the best I've had as so many said in prior Trip Advisor's reviews , but is still good. What I can do say is that the service was very very good!"
"October 13, 2015",50,Very taste full pizza and great people !!,I was amazed by their pizza creations and how friendly the owners are ! Roberto Zizza congrats ! Just come by whenever you visit the Vatican ! Or just come for the pizza and forget about the Vatican hehe
"October 11, 2015",40,Great pizza!,"Came here after a visit to the Vatican. Excellent service, the owners are very friendly. Pizza tasted great!"
"October 7, 2015",30,Nice pizzeria for a quick lunch,"Very good service and tasty pizzas. Friendly and clean. English speaking. Cost is very low and they have a few tables to sit around, otherwise it is take away, small place."
"October 6, 2015",50,Walked for miles at Vatican and had an appetite,Great find close to the Vatican. My wife and I tried 3 different slices of pizza (3 x 1 Liter servings) and 2 big Birra Morretti Baffo D'Oro's. Multi buono! Best service we've had in Roma.
"October 3, 2015",40,Good pizza and friendly service,"Small, small place with very good slices of pizza and the staff friendly. Pizza price OK drinks a bit expensive for this type of place."
"September 7, 2015",50,"""Great post-Vatican Lunch""",My girlfriend and I were looking for a quick bite after touring the basilica and Zizza was perfect. Delicious pizza and I couldn't believe the price. Definitely worth a stop.
"July 29, 2015",50,"Excellent pizza , great tastes","Great and lovely service by the two gentlemen, great tastes with all kinds of toppings you have never dreamed of, good atmosphere and close to the Vatican"
"June 3, 2015",50,Great pizza in Rome:),Great place.. we spent there lovely afternoon eating pizza and having drinks. The owners are great and nice people. We really liked it..! Thanks guys:)
"May 29, 2015",50,Great Pizza at a reasonable price,Love the pizza. Owners are very friendly!!! Great snack or lunch. Better pizza than any other place around it.
"September 13, 2015",50,Great pizza close to the Vatican,"After climbing the dome this was just what I needed. Very friendly service and tasty pizza. Small appetizer, 2 nice slices and a coke for 8.30 €. Place can be a bit hard to find. If you come from the Vatican and cross a road...More"
"September 7, 2015",50,Absolutely The Best,"The pizza would have been enough to allocate all five stars, but the service went above and beyond. Everything was perfect in this quaint pizza shop just outside the Vatican. On a row of significantly larger restaurants, this seemingly small storefront offers you the best combinations of toppings paired with the perfect cheese and sauces. The man in the front (sorry, forgot his name) was so stinkin' friendly that j forgot I did not know the language of the city. He offered explanations and recommendations and brought our food to us perfectly sliced and heated so we could share in the joy of true Italian pizza. Loved it. If my boyfriend wouldn't look at me sideways I would go back there for lunch every day."
"September 7, 2015",50,"""Great post-Vatican Lunch""",My girlfriend and I were looking for a quick bite after touring the basilica and Zizza was perfect. Delicious pizza and I couldn't believe the price. Definitely worth a stop.
"July 29, 2015",50,"Excellent pizza , great tastes","Great and lovely service by the two gentlemen, great tastes with all kinds of toppings you have never dreamed of, good atmosphere and close to the Vatican"
"July 23, 2015",50,Lovely little place,"This is a lovely tiny place, can be easily missed if your not careful! This was about a ten minute walk from our hotel as me and my husband felt a bit peckish one evening.  It is run by two brothers and they're absolutely lovely. Service was quick and pizzas hit the spot! Lovely fresh and tasty.  Would highly recommend."
"July 12, 2015",40,Close to our B&B,"Close to our b&b. The owners are super nice and speak good English. The owners are young brothers. The restaurant is small, more a place for a quick snack. The pizza is great, especially the ones without tomato sauce, soooo crispy!  When we got there, it was a super hot day, the cook came and sprayed cold water on us :) and they gave us free dessert.  TIP:  If you are staying at the via bicolo b&b (great place), after a long day of walking, buy angels&Demons the dvd, take some pizza and cold soda from the pizza zizza brothers, go to your apartment, turn the ac on, turn the movie on and enjoy some great pizza while watching Robert Langdon racing threw Rome!"
"July 10, 2015",30,Nice food,"Think we picked a bad time. Sat down for an evening meal after a long day sight seeing. Orders a bottle of wine, bottle of water, a small starter between us and two meals. The meals were out of stock so we advised we would have another look whilst we they get the drinks and starter sorted.  Another couple sat next to us and ordered drinks about 5 minutes later. They had started their drinks before we managed to get hold of another waitress asking were our drinks and food were.  Unfortunately, we don't think she was having a good day as the wine was just dumped on the table with the starter, no side plates or water. Seemed like we really put the lady out when we asked for the plates and water.  Another waitress came up (the lady we placed the order with) and apologised, getting the plates and water.  Nice food, nice area just bad timing."
"June 3, 2015",50,Great pizza in Rome:),Great place.. we spent there lovely afternoon eating pizza and having drinks. The owners are great and nice people. We really liked it..! Thanks guys:)
"May 29, 2015",50,Great Pizza at a reasonable price,Love the pizza. Owners are very friendly!!! Great snack or lunch. Better pizza than any other place around it.
"September 13, 2015",50,Great pizza close to the Vatican,"After climbing the dome this was just what I needed. Very friendly service and tasty pizza. Small appetizer, 2 nice slices and a coke for 8.30 €. Place can be a bit hard to find. If you come from the Vatican and cross a road by a tunnel, after exiting the tunnel do a 180 and then it's 20 metres down the street. Says ""Pizza A Taglio"" outside..."
"September 7, 2015",50,Absolutely The Best,"The pizza would have been enough to allocate all five stars, but the service went above and beyond. Everything was perfect in this quaint pizza shop just outside the Vatican. On a row of significantly larger restaurants, this seemingly small storefront offers you the best combinations of toppings paired with the perfect cheese and sauces. The man in the front (sorry, forgot his name) was so stinkin' friendly that j forgot I did not know the language of the city. He offered explanations and recommendations and brought our food to us perfectly sliced and heated so we could share in the joy of true Italian pizza. Loved it. If my boyfriend wouldn't look at me sideways I would go back there for lunch every day."
"September 7, 2015",50,"""Great post-Vatican Lunch""",My girlfriend and I were looking for a quick bite after touring the basilica and Zizza was perfect. Delicious pizza and I couldn't believe the price. Definitely worth a stop.
"July 29, 2015",50,"Excellent pizza , great tastes","Great and lovely service by the two gentlemen, great tastes with all kinds of toppings you have never dreamed of, good atmosphere and close to the Vatican"
"July 23, 2015",50,Lovely little place,"This is a lovely tiny place, can be easily missed if your not careful! This was about a ten minute walk from our hotel as me and my husband felt a bit peckish one evening.  It is run by two brothers and they're absolutely lovely. Service was quick and pizzas hit the spot! Lovely fresh and tasty.  Would highly recommend."
"July 12, 2015",40,Close to our B&B,"Close to our b&b. The owners are super nice and speak good English. The owners are young brothers. The restaurant is small, more a place for a quick snack. The pizza is great, especially the ones without tomato sauce, soooo crispy!  When we got there, it was a super hot day, the cook came and sprayed cold water on us :) and they gave us free dessert.  TIP:  If you are staying at the via bicolo b&b (great place), after a long day of walking, buy angels&Demons the dvd, take some pizza and cold soda from the pizza zizza brothers, go to your apartment, turn the ac on, turn the movie on and enjoy some great pizza while watching Robert Langdon racing threw Rome!"
"July 10, 2015",30,Nice food,"Think we picked a bad time. Sat down for an evening meal after a long day sight seeing. Orders a bottle of wine, bottle of water, a small starter between us and two meals. The meals were out of stock so we advised we would have another look whilst we they get the drinks and starter sorted.  Another couple sat next to us and ordered drinks about 5 minutes later. They had started their drinks before we managed to get hold of another waitress asking were our drinks and food were.  Unfortunately, we don't think she was having a good day as the wine was just dumped on the table with the starter, no side plates or water. Seemed like we really put the lady out when we asked for the plates and water.  Another waitress came up (the lady we placed the order with) and apologised, getting the plates and water.  Nice food, nice area just bad timing."
"June 3, 2015",50,Great pizza in Rome:),Great place.. we spent there lovely afternoon eating pizza and having drinks. The owners are great and nice people. We really liked it..! Thanks guys:)
"May 29, 2015",50,Great Pizza at a reasonable price,Love the pizza. Owners are very friendly!!! Great snack or lunch. Better pizza than any other place around it.
"September 13, 2015",50,Great pizza close to the Vatican,"After climbing the dome this was just what I needed. Very friendly service and tasty pizza. Small appetizer, 2 nice slices and a coke for 8.30 €. Place can be a bit hard to find. If you come from the Vatican and cross a road...More"
