"January 30, 2020",40,Nice restaurant in a good location,Cooking on a hot stone is a bit gimmicky. I think I much prefer if I am going out for a meal to have it cooked for me.
"June 19, 2019",50,Best food in Euro,Hot Stone Steakhouse is the BEST food in my 15 days EURO trip!!! And the steak is very juicy and melt in my mouth
"June 14, 2019",50,Amazing place,"Amazing place, brilliant food and atmosphere. Good variation in menu if you don’t want steak. All staff very friendly and helpful. Definite place to go if in Budapest and want a great steak. Price reasonable for quality of food."
"April 12, 2019",50,Cook Your Own Steak,Steak was amazing - could have done with a slightly larger table but the food was great! Be warned - can get a wee bit hot with that lava stone right in front of you!
"November 29, 2018",30,Good food but...,The ambient and the food was good. We did not like that they are charging 5 euro for servicing desk. I can eat the whole meal for 5 euros. The prices are a bit high.
"November 15, 2018",50,So much choice,Had such an amazing evening here tonight- cooking it to your own standards. It’s a little pricey as they add service charges etc but food is a very quality!
"October 15, 2018",50,Interesting Experience & Wonderful Service!,"My wife and I found it an intriguing concept and were interested in trying it out! They certainly didn't disappoint. The service was terrific and the food was excellent. For those interested in this type of experience, we highly recommend!"
"October 19, 2018",50,High class steaks,"this is a very good steakhouse, and good serviceIt is special to make your ovn steak at the table, on the hot stones.But this is something you must try :)More"
"October 19, 2018",50,Returning to a Great Steakhouse,"We have visited this restaurant on many occasions when in Budapest, The food last night was amazing, the service was first class and Vivien was so nice and very pleasant that it made our night at the Hot Stone Grill a very special evening. We started by sharing a Chicken Caesar Salad which was very fresh and nicely presented then for main course the event of cooking our steaks! We both find it very interesting to cook on a hot stone and with the guidence of the staff you get your steak perfectly cooked to your liking, we decided to order a bottle of Pinot Noir Rose and it complemented the food perfectly. All in all the restaurant, the food and the staff, make this a great restaurant to visit when in Budapest."
"October 18, 2018",50,Great Steak experience,"Great Steak experience , steak come on hot lava stone you make it done as you love it. tasty Hungarian pork steak in unique experience great service friendly staff thanks alot"
"October 18, 2018",50,Great fun place with some mighty tasty mean,"The place is nice and the meat is good. They have a couple of Halal options as well, and the lamb was especially good. Just be prepared to give your full attention to the meat, as you have to prepare it on the stone yourself to your liking."
"October 17, 2018",50,Lovely meal,Had a lovely meal here and quite different having the hot stone in which to cook your steak to your liking - couldn’t fault the quality nor the service - would definitely eat here again
"October 15, 2018",50,Interesting Experience & Wonderful Service!,"My wife and I found it an intriguing concept and were interested in trying it out! They certainly didn't disappoint. The service was terrific and the food was excellent. For those interested in this type of experience, we highly recommend!"
"October 10, 2018",40,Nice experience,"Something different...  The staff were excellent and the concept of the restaurant was explained very well.  It is a nice experience that you should enjoy.  The Ribeye steak was nice.  I wouldn’t say you get a “cooked to perfection” steak as you cook it yourself along the way, but this is to be expected.  Nice selection of drinks too."
"October 7, 2018",50,Best Restaurant in Budapest,"Had a Dinner with my daughter - after 3 days spent in Budapest, we had a friendly Waiter and Waitress for the first time in this city. Food Quality was awesome too, we loved it here, would recommend 10/10"
"October 7, 2018",50,Lovely staff and food,"Came here after reading good reviews, didn’t book but luckily got a table although it was very busy. Sat outside which didn’t matter, blankets provided if needed and the rock keeps you warm anyway! The food was delicious, especially the caramelised onion soup for starter. Cooking the steak on the hot rock is great fun and quality of food was delicious on all 3 courses! Vivien our waitress was lovely, very friendly and polite! Would definitely recommend. (Rib eye steak in photo)"
"October 6, 2018",50,"Amazing food, friendly staff and overall great experience.","Cook your own steak on a hot stone at your table. Really nice atmosphere in the restaurant and the Manager recommended a delicious local wine. You can book online, which is definitely needed at the weekend."
"June 29, 2018",20,More expensive than London,More expensive than London!!!! Waiter had to keep going to ask someone else for information We only wanted a dark beer and to know what cut of steak would arrive We will not go here again
"April 14, 2018",10,What a pity.. I couldn't believe it,Not bad as restaurant but after we had a complete 8 people supper they simply refused to serve a side dish at the end of the supper. I was supposed to order a main course again!! NEVER AGAIN
"February 11, 2018",20,Don‘t,"Meat is good quality, but i did not really like the spices on it. Place is loud and not very cozy. Quite expensive and as often a 12% service charge was included. Staff was friendly."
"January 1, 2018",10,Rude staff,Rude staff. We asked if they had pancakes as childrens food and got a rude rude answer. Left immediately.
"October 26, 2017",50,Amazing food!,"We visited today and were blown away by the quality of steak! The grey cattle is amazing! The waitress was friendly, polite and advised us of the best options. We loved the novelty of cooking your own steak. Slightly pricey but well worth it!"
"October 16, 2017",50,Fantastic experience,"Great meat, friendly staff and great service. A must visit for any steak enthusiast - the hot stone principle means that you can grill your steak to your liking and that it remains hot (which makes all the difference)."
"September 18, 2017",40,Good Burger and service!,"A nice place for meat lovers. The meat is served on hot stone, therefore the name!Good and fast service. Good value for money."
"September 10, 2017",50,Amazing steak!,Quality of food and service is excellent! If you are visiting Budapest make sure you try their steak selections!
"August 28, 2017",50,Amazing meat,Best steak I had in Budapest. Seriously if you love meat as much as I do - come here. Service is awesome too.
"August 28, 2017",50,Wow!,"So tasty Argentina steak! The best dinner i have had in Budapest. Also i have to recommend caprese and carpaccio. Thank you, it was awesome^_^"
"August 25, 2017",50,Original and tasty,A nice place with an original way of preparing different kinds of meat. The result is impressive. It is worth trying. Little is tight and stuffy ... but there's too much hot stone though :)
"August 21, 2017",50,Amazing dinner,"Great service and great food here. We loved the hot stone concept and the staff were more than happy to help with anything we needed. Food was great, we both had the grey cattle and would highly recommend this!"
"August 3, 2017",50,Perfect Steak and excellent service,Pop in for a meal on my own. i had the perfect steak and i would like to say service is excellent. i will be back next year for sure but this time i will go with a group of friends. Thanks again
"July 27, 2017",20,Long wait,Minus - long wait for the food. Couldn't pay with card. Chicken should perhaps be taken away from they menu since the costomer has to streak the meat himself A little pricy
"July 23, 2017",50,The best in town by far!,"Came across this place by chance and it was incredible. Everything from the food, the explanation of the menu, and especially the service was perfect! Cheaper than anywhere in London!"
"July 22, 2017",40,quality,"it can be a little expensive, but the quality is there with a beautiful presentation and explanations. very good meat. the staff is at your service."
"July 12, 2017",40,Good restaurant,"Everything was good! We ate the grey cattle , it comes on a hot stone, very special and tasty! The service was great. Prices are a bit expensive."
"July 12, 2017",50,Delicious Food,We found this place by chance and we weren't disappointed. A lovely girl served us and we have the best burgers ever. Great place for a quick bite
"July 7, 2017",50,Great Hungarian Steak,"The ""Hungarian Beef Tenderloin"" was fantastic. This place has a great overall atmosphere, selection, and the staff was very pleasant and extremely helpful. Imi and Vivi are wonderful."
"June 21, 2017",50,Best meat quality in Budapest,"Fresh, delicious and unique meals. Serving was fast and the staff was very helpful. I will definitely visit it again."
"July 18, 2017",50,Fantastic Experience,Hot Stone blew me away with their service and food. The Grey Cattle tenderloin (recommended to us by our server) was excellent & unique in its preparation and the chocolate lave cake (also recommended by our waiter) was delicious. I was very pleased with the...More
"July 12, 2017",40,Good restaurant,"Everything was good! We ate the grey cattle , it comes on a hot stone, very special and tasty! The service was great. Prices are a bit expensive."
"July 12, 2017",50,Delightful,"Came here after a long day of tourist activity and it was just the tonic. Excellent service by a friendly waiter. Food was served promptly and was just right, we are plain eaters but it was delightful. The music and decor (some cool things scattered about) added to the restaurant. Another note is we have seen plenty of places with flies in Buda and this was a welcome change as it was fly free and clean."
"July 12, 2017",50,Delicious Food,We found this place by chance and we weren't disappointed. A lovely girl served us and we have the best burgers ever. Great place for a quick bite
"July 9, 2017",50,Best steak ever!,"Quite possibly the best steak I've had. I had the Grey Cattle tenderloin and my fiancee had the Hungarian Tenderloin. Both steaks were succulent and juicy. The peppercorn sauce I had was very creamy and complimented the steak (mines the more meatier tasting grey cattle). Prices were very reasonable for such high quality food. The waiter was attentive and informative. Honestly cannot fault this place, I will be going again before I go home. Would highly recommend to anyone wanting top class cuts of meat."
"July 7, 2017",50,Great Hungarian Steak,"The ""Hungarian Beef Tenderloin"" was fantastic. This place has a great overall atmosphere, selection, and the staff was very pleasant and extremely helpful. Imi and Vivi are wonderful."
"June 21, 2017",50,Best meat quality in Budapest,"Fresh, delicious and unique meals. Serving was fast and the staff was very helpful. I will definitely visit it again."
"June 14, 2017",50,Such a fun time!,"My boyfriend and I visited this restaurant last night. We had a unique experience, getting our steaks on the hot stone. The quality of the food in unbeleivably good and we were so pleased by how nice the whole staff was. I recommend this place to everybody who visits or lives in Budapest! It is a must!!!"
"June 13, 2017",50,Nice special restaurant,"We passed this place and stayed because it sounded exiting to cook your steak yourself directly on the table, we sat outside and ordered Hungarian Grey Cattle steak and we were served the meat a 400C hot stone and instructions. The meat was very good, along with side dishes of your preference."
"October 12, 2020",50,The place in Budapest to eat good steak,"Easy online table reservation, very helpful and professional staff, amazing food! Great variety in the menu. Prices are OK. I strongly recommend!"
"March 28, 2020",50,Amazing,This was amazing! Best steak we have ever tried! We really enjoyed this and recommend this! A must do when you visit Budapest! We will come back:)
"March 2, 2020",50,Great place to eat,"Was there with some friends, and we had a real good dinner, that tasted like heaven. The staff is super friendly and not that expensive."
"February 15, 2020",50,Amazing,"Had the pampas steak. Juicy, well seasoned and really tender. Went here once before. Same good service and pleasant staff. I will gladly go back."
"February 5, 2020",50,"Amazing food, great staff","Amazing food, great staff and a cosy place to dine when in Budapest. Would recommend it to everyone!"
"January 26, 2020",50,Good food,"Good food, quiet place. It's not cheap but you will pay what you will expect in a Steakhouse. We liked it."
"December 27, 2019",50,The best of Budapest,Absolutely delicious food and perfect service! Great prices also! Thank you for this experience! Wow!
"December 14, 2019",50,Awesome,"Excelent food excelent services, just those light fixtures I bumped my head loke 3 times when I got uo from table"
"December 2, 2019",50,birthday dinner,"this has to be up there with the best piece of stake I have ever had the honour to eat, cooked to perfection, and the staff are attentive without been in your face 10 out of 10. Very highly recommended."
"November 1, 2019",50,John Clamp,"Stunning plate of food, cooked exactly as we requested. The restaurant was really nice well decorated a d very friendly and attentive. Highly recommended"
"October 24, 2019",50,Perfect 👌,"Very good on all !! Perfectly done steak, fantastic desert, and good environment . Will for sure repeat next trip around"
"October 22, 2019",50,Wonderful place!,"What a restaurant! So good food, the best service, cosy place and very nice prices for that first class food! Highly recommend!!"
"October 20, 2019",50,Excellent dinner,The best steak ever and the service was fantastic. Thank you Lilla and Tamás for your recommendation. You know exactly what you are doing ❤ We had a wonderful evening and we will come back very soon.
"October 13, 2019",50,Dinner,"Booked this after seeing reviews on trip adviser. Excellent restaurant, beautiful intimate decor with excellent service. Steak cooked to absolute perfection and amazing wine selection!"
"October 9, 2019",40,Bill Owen,Steak was very good. Two needed further cooking as they were very much under done. The meal would have benefited from being warmer. The service was very good and the place was well appointed. Overall very good just needs a bit more attention to detail.
"October 8, 2019",50,Perfect restaurant,"I just love this place. They have amazing food,kind staff. This restaruant is our favorite one with my fiance."
"September 28, 2019",50,Outstanding steaks!!!,"Great argentinian steaks, excellent service, delicious meals, expensive for Hungary, but worth it without doubt"
"September 27, 2019",50,Steak Dinner,"We had not booked and we arrived after 10.00pm, the kitchen had closed but they seated us down and served us probably one of finest T Bone Steaks i have had the pleasure to eat."
"September 22, 2019",50,Amazing dining experience,Excellent friendly service. Wonderful menu and delicious food. A 'must' for those visiting Budapest.
"September 16, 2019",50,Always amazing,This was my third year coming here and fourth time visiting. It’s absolutely amazing tasting beef and the service is the best in Budapest. The mushroom sauce is delicious and they also serve my favourite beer San Miguel!
"September 3, 2019",30,A poor imitation,"We went here for my friend's birthday. I had been to Brazilian steakhouses in the US, Portugal and Czech Republic. This was hands down the worst but with the same prices. The chimichurri sauce is nothing you would recognize"
"August 18, 2019",50,Tasty,Meat very tasty. Real Argentina flavor. Everything was perfect. Space very nice. The price it’s at the level of the experience and service provided. A place to return again.
"August 7, 2019",50,good food drink combo,"Delicious food, good wine assortment, friendly staff. It is worth trying if you are in Budapest, not too expensive."
"August 7, 2019",50,Top drawer,"What’s not to like? Superb food, staff pleasant but unhelpful re selection. Our guy liked everything on the menu! Only joking here of course and I can’t say I blame him; it was outstanding! Reasonable price too. Definitely return..."
"August 3, 2019",50,Ribs,"Had awesome and cheap rips, very good, looked fantastic, great service and nice place. Recommend for everyone, you don't want to miss this."
"August 1, 2019",40,"Good steak, but expensive","I had the trio of wagyu, Argentinian and Hungarian 100gram steaks, a sort of back to back tasting! The Argentinian was the nicest."
"July 11, 2019",40,what a dinner!,"you have other option in the menu for a very reasonable price like burgers, ribs, etc. however if you go to a steak house the logical is to order a nice cut of meat."
"June 27, 2019",50,Amazing steak,Good service and the sirloin was cooked perfect. Would reccomend for a nice evening meal. Close to river aswell so not out of way
"June 17, 2019",50,Just great!,I really enjoyed my meal here and the service was very good. Steak was one of the best Ive ever had and was well worth the high price by hungarian food prices. Cooked exactly how I asked. Interior is nice also. Would return!
"June 12, 2019",50,Nice Place,We treked a mile or so to find it but was worth the visit. We didn't have starters but the steak was delicious. The staff were good and the place great. It's a little expensive but worth it for the steak.
"June 1, 2019",20,Do not eat the burger!,"Burger is not theirs speciality! The Angus burger was dry, totally overdone and not a good choice here. Choose the steak instead."
"May 9, 2019",50,Simply gorgeous,"Fabulous meal tonight,tenderloin steak absolutely delicious.......sauce and steak fries .Highly recommend."
"April 29, 2019",50,Perfect Steak Restaurant,Excellent Steak-Restaurant. Really nice flair and not too posh. The Steaks and the wine selection are really good. Also very nice and polite staff.
"April 29, 2019",50,Top Notch!,Service=Splendid! Food=Magnificent! Atmosphere=Brilliant! 5/5 in my book. And a full booksize winelist allways helps!
"March 25, 2019",50,We enjoyed so much!,"Food is incredible, we enjoyed so much. It was great. The quality and taste live up to the name! Highly recommended."
"March 19, 2019",50,Foodish!,If you ever go to visit Budapest its a must to go to the Pampas and eat their fantastis steaks. It is absolutely wonderful.
"January 28, 2019",40,Delicious Cut,"Good restaurant vibes and very nice and wormy place , i ordered an Argentinian steak 320G and it was perfect ,defiantly your place for epic cuts of meat."
"January 24, 2019",30,Ok restaurant,We went here for my friends birthday. It was nothing special and a bit overpriced. The interior could use a little freshening up as well
"January 6, 2019",50,Best Value for Monet,"Craving for steaks? Forget the Prime or the KNRDY Steak Restaurants. They are expensive! Try Pampas or La Pampa in Budapest for the same high quality steaks with LESS prices! Believe me, I've been living in Budapest for 3 years already."
"January 4, 2019",50,Most Delicious Restaurant in Budapest!,We found Pampas from previous online reviews looking for a delicious steakhouse. Words cannot do justice to how amazing our meal was! ENJOY!!
"January 3, 2019",50,New year eve dinner,Thank you of very good service and good steak with awesome taste. We really enjoyed of dinner just before new year. Location was brilliant near a hotel and bridge. We recommened this fir good steak in Budapest.
"December 29, 2018",50,Perfecto,"A perfect evening. Excellent meat. Quality wine. A professional services. Really recommended. The pampas steak is recommended, very juicy and quality meat. Apple pie desert is a perfect complementary."
"December 14, 2018",50,Fantastic steak. Great price value,Must try if looking for a steak. Good price value. Kind service. Wide offer of different steaks. Best if you reserve a table well in advance.
"December 8, 2018",50,Great Steakhouse,"Just had supper here before leaving Budapest in the morning. Delicious meal, very good service and a great last night. Not traditional but a lasting memory"
"November 23, 2018",40,Impressed,Good experience but I think regarding to the spread in the reviews it can be a bit random because of the management.food was excellent and the vine also ut the creembrulee was cold as a mf only downer at this visit
"November 16, 2018",40,Very good!,"Great service. Super fresh food. Beer good and cold. pleasant environment. Rustic potatoes, file mignon and chimichurri sauce. The meat came at the right spot."
"November 13, 2018",50,Beautiful,We visited here around 4:30pm on a Saturday with no reservation and got seated quickly. The restaurant has lovely decor and the food and wine was even better. Best meal of the holiday and very reasonable and big portions! Must go!!
"October 28, 2018",50,Argentina & prime steak,"Great stuff,really nice place and delicius dishes,they speak english perfectlly,we wonted to go to reast for sale but at the end this was perfect"
"October 19, 2018",50,Very Nice!,"Super great food, very good service and a Lively atmosphere. Value for money! Would recommend it anytime"
"October 14, 2018",50,Excellent food ans service,Food was excellent. Went with group of people and everybody's steak was superb. Service was excellent and very professional.
"October 13, 2018",50,What a tasteful dinner!!!,"The flavore, the atmosphere, nice personal and good service. Tasted the creamy soup - just lovely pompcan soup. The chicken was tasty. And the steaks melted in the mouth. Worth the trip."
"September 29, 2018",50,Excellent,"Service was exceptional, waiters very helpful, quick service. Food was delicious, 3 steaks and 1 chicken dish, all 10/10. Would definitely return."
"September 18, 2018",50,Pampas,Great place. The angus burger was very good . The people are friendly and the atmosphere is relaxed.
"September 18, 2018",40,Perfect place,The price is a little bit higher than usual but it seems to be nice. The steak itself is fine and the place is fine too.
"September 16, 2018",50,"Expensive, but worth that money",I was there few times and liked the services as well as the unique taste of steaks. I hope they will open several restaurants and develop a chain.
"August 5, 2018",50,Too much beef to choose from,Great service. Perfect food and big selection of beef to choose from. The mushroom sauce is the one!
"July 14, 2018",50,I ate a cow by myself!,Delicious Argentina beef! Very reasonable priced for the amount of meat you get. Called the restaurant in the afternoon and they were able to fit us in for for dinner that evening.
"July 10, 2018",40,Quality and reasonably priced,The restaurant is easy to find as it’s just a block away From Central Market. They offer more then 200 different kinds of wine. The steak although is expensive but it’s still reasonably priced for a good quality cut.
"July 9, 2018",40,craving for good meat and tasty food,These guys know what they are doing. very good meat! Tasty as could be. Staff extremely nice and friendly. We had a superb evening among friends. Starting on a high nite and finishing on a even higher note. I would go back any given day!
"July 4, 2018",50,Really good steak,"It is a really good place to have a family dinner, also a really good place to have a good Argentinian style steak, my favourite is the T-bone, it was really good here too."
"June 28, 2018",50,Excellent food,Slightly more expensive than the other restaurants we’d visited but decided to give it a go as we’d heard good things and we were not disappointed. Food was amazing and service was excellent. Can’t fault it really.
"June 22, 2018",50,This is the place to eat beef,"The place for beef lovers. Ordered the kobe beef and it is with no doubt the best beef experience I have ever had. All around excellent service, nice staff and world class beef."
"May 31, 2018",50,Excellent Steaks,"We visited here to celebrate a birthday. Staff were attentive and helpful. Food was excellent, steaks and chicken. Good selection of wine. Overall not cheap, just less than UK prices but worth a visit."
"May 19, 2018",40,Great restaurant for carnivores !,Large selection of very good multiple types of meat. Very good service Convenient location We shall certaily be back !
"May 11, 2018",50,Amazing,"Food, drinks,staff,- everything was on point as usual. Great steaks. Eaten here many times and will come back!"
"April 13, 2018",40,Very good Steaks,"Superb Steaks and very god side orders. We also ordered a good Hungarian Read wine, burgundy style. Super wine for the money. The service was quick and friendly but not very talkative. Absolutely a place to recommend for the money. The locality was nice."
"April 9, 2018",50,Best steakhous in town,Best argentinian steak with a very good hungarian red wine. A nice and elegant place whit gentle weitres
"April 3, 2018",40,Worth a visit,"Delicious steak and good service. Good selection of food, and the restaurant really cares about quality. It is high priced, but worth it."
"February 14, 2018",50,Valentines meal,"Absolutely fantastic meal & service. Steaks were cooked to perfection and extremely succulent, I’d put this in the top 10 steakhouses I’ve visited on the planet and I’ve been to quite a few. If I’m ever back in Budapest I’ll visit again."
