"June 2, 2018",10,Terrible management,"My husband and I love steak. This was worse thsn Charlie Browns and the manager was the hostess. He argued that the food was correct. We ordered filet mignon and delmonico steaks, it was garbage"
"May 4, 2018",50,Great Lunch,"Repeat visit after 2 years since our last visit. The double cheeseburgers are unbelievable value, the service and ambience faultless."
"March 29, 2018",50,My fair lady,What a great restaurant and reservation. They were attentive and efficient We had no stress about time and everything was plated beautifully Recommend
"March 12, 2018",50,Great Meal,"We finally visited after years of talking about it. An institution that held up to the hype. Delicious food with great service. We are Dallasites, so we are picky about steakhouses. Delmonico’s was a great experience."
"March 8, 2018",50,Iconic and gorgeous restaurant,"great foods, very friendly staff. nice setting and a beautifull interior. This is an iconic restaurant in NYC, very well worth a visit."
"March 5, 2018",50,Fantastic,This restaurant is everything I thought it would be. Very pricy but the food is amazing. The history behind it makes it a must do in NYC.
"February 20, 2018",50,Great classic dining,We celebrated a birthday there and the food and service were superb. Steak similar to Peter Luger but the menu offers much more variety (eg seafood) and thus a great option if not everyone is into steak.
"February 11, 2018",40,"good place, classic one","We were very tired going around NYC while visit it. Delmonico's was a very pleasant surprise. It is very comfortable place, very relaxing and with good service. Huge selection of wine and nice food. We did like it all."
"December 28, 2017",50,Old School Steak House,My daughter and I dined here during Restaurant Week this past summer. It was a treat to eat here as it is a grand old place. the service was excellent and the food exceptional.
"December 22, 2017",50,My favorite restaurant,The food is excellent and served by the most professional staff that are efficient and welcoming. The inside of the restaurant is old school beautiful and rich in history.
"December 11, 2017",50,Best dinner? Best lunch too,"We think this is the best steak dinner in the city since years. Now we think it is also the best seafood lunch in the city too. Hats off to Billy Oliva and his team, top man."
"November 27, 2017",50,Exquisite Steak House.,This place is old-school Trad. Don't let that put you off. The food is incredible. Highly recommended.
"November 5, 2017",50,What a place !!,We visited Delmonico’s for lunch as this is where Eggs Benedict was invented... Also Baked Alaska which I had both. The ambiance was just excellent and the food delicious. If you are in Manhattan book a table and visit!!
"November 1, 2017",50,The Best Filet Mignon I have ever eaten!,"Cooked to perfection!!!!!! My wife and I had to try this NY Icon on a visit. I had the Filet and she had the Delmonico steak. Both were amazing! The atmosphere was perfect for any special occasion, business or pleasure."
"September 15, 2017",50,Excellent!!,The food is amazing! My filet mignon was cooked to perfection and the side dishes (meant to be shared) were excellent. The ambience is wonderful and the service is top-notch. Love this place!
"September 6, 2017",40,Great steak at the price,"One of the truly great steak houses. You will have food for another meal unless you eat big. Tradional NY Steak, Cowboy or Filet will leave over Plenty. I enjoy mashed and spinach,. But finish with the New Orleans Benets"
"August 13, 2017",50,Perfect as predicted,I was aware of its reputation as a great restaurant and it did not disappoint. The Rib Eye was perfect as was the service. If you have not eaten here then you should when in NY
"August 9, 2017",50,Delmonico's Burger Delivers,"Been to Delmonico's before for steaks which are great but went back for lunch and a burger after seeing a piece about it on Travel Channel, well they nailed it. Great meat, cooked perfect and awesome fries to match, enjoy."
"August 9, 2017",50,Wonderful,"We had a great time. This week is ""Restaurant Week "" in NYC. The food and service was outstanding We had lunch. A little pricey, but well worth the price"
"July 10, 2017",50,Iconic steakhouse not to be missed!,Delmonico's has been a favorite of mine for many years....Visited there in July 2017 to celebrate my girlfriends birthday...very special she loved it!
"June 29, 2017",50,Elegant bit of history,I recently had a family dinner at the legendary restaurant. The food and service were exceptional. It was like a trip back in time and we thoroughly enjoyed the experience. Had a Delmonico steak and Baked Alaska. My daughter and her fiancée were very impressed!
"June 10, 2017",50,Delicious!,"Couldn't fault this place at all! 4 of us as filet mignon and ny strips, all of which were excellent. Great wine and wonderful service. I'm a complete steak snob and this is high on my list of places to go back to."
"May 23, 2017",30,Just OK,"As commented by others, I found the Delmonico steak too salty. It was a large portion and excellent quality but overpowered with the saltiness. Seafood Newburgh appetizer was very old school, deep fried and lacking in presentation. Wine list was excellent."
"May 10, 2017",50,Fine dining at its best,"Historic location, fine dining and the greatest service. Memories for a lifetime. Simply one of the greatest restaurant I have ever been to!"
"April 25, 2017",50,The best and original Eggs Benedict,"The grand interiors are dwarfed and muted by the delectable breakfast staple, Eggs Benedict. Velvety and sublime, truly a cut above the rest."
"April 23, 2017",50,Sensational Steaks,Wonderful charm of yesteryear since this was the first restaurant in the country. Eager to please staff and delicious food. Steak was perfectly cooked and really too much per serving to eat! Great appetizers.
"April 22, 2017",50,Steak,Best steak I have ever had by a million miles. Quite pricey but well worth it. I would definitely recommend it.
"April 20, 2017",50,Great Food Good service,High quality service and high quality food. I had no regrets with anything that I order and service was not excellent.
"April 15, 2017",50,Delicious Steak and appetizers,"This traditional restaurant is well located walking distance from Memorial. Miniature eggs Benedict and Oysters Diamond, lobster Newberg carbonara make this a great experience. Delmonico Steak is one of the best I had."
"April 9, 2017",40,Great steaks,One of the best steaks I had in NY. Desserts looks tasty too. Portion are huge so you will certainly come home with some leftovers.
