"August 24, 2018",50,Great experience,"We enjoyed everything - the bar, the large warm room, the huge picture windows, the excellent service from our waiter, and very good steaks. The bacon appetizer was also a big hit. We will be back."
"August 11, 2018",50,Never disappointed,3rd time visit from UK and as good as ever. Turned up on spec and got a seat outside. Prime 16oz Rib Eye cooked to perfection and exquisite taste.
"August 8, 2018",50,Fantastic food and service,"Was a table of 6, the starters and main courses were amazing, particularly the boned rib eye. All steaks cooked exactly as we requested. Staff were excellent, will definitely be returning."
"July 31, 2018",50,Tomahawk,My girlfriend and I had dinner her. What an experience! The service and the food was phenomenal! We shared the Tomahawk Steak with creamed spinach and corn. It was delicious! We will definitely be back!!!
"July 14, 2018",50,ny steakhouse,"excellent food and service....but you pay for it. apps are large and fantastic. morew steak choices than a normal cow can offer. sides are huge and costly. great quality overall , not sure about the value"
"July 12, 2018",40,$$$$$$$,Great food. Outrageously priced. Ambience really nice. Can’t say I will ever go back. Can get good steaks other places without having to mortgage the house.
"June 26, 2018",50,Celebrate at this restraunt if you want your meal to match your celebration!,"The filet mignon was among the best I have ever had. The roasted cauliflower with Brie Saussure was over the top as well as outhepotatoes augratin! Excellent choice for that special occasion dinner! Great staff very attentive,."
"June 24, 2018",50,Amazing food,This place is fantastic! Everything we had was wonderful.. very friendly people great service and very clean. Would definitely go back!
"June 23, 2018",50,Before or after theatre!,Wonderful service and food. Try to sit in mezzanine by railing for them best view. The veal was great. Steaks served on a very hot plate --side dishes are great.
"June 23, 2018",30,Noisy. Good steaks,Went to this place Friday night. Restaurant nearly full. Extremely noisy. If you don’t mind to yell in order to be heard on the other side of the table then this may still be your place. Great & good steaks. Slow service.
"June 23, 2018",50,Birthday,It was my first time here the food was amazing staff was very friendly everything was perfect i will be back.tracey
"June 20, 2018",50,Still the best,"My wife and I stop here for lunch and on occasion for dinner. The quality of food and service remains excellent after 10 years. Crab cakes are great, cheesecake remains best ever."
"June 20, 2018",50,Appetizers to die for!,"I frequent the restaurant with my colleagues, and while steak is great, it is the appetizers I (personally) keep coming for! The bacon is so delicious, I have never ever thought it can be cooked this way! The shellfish plateau...."
"June 20, 2018",50,Del Frisco's Double Eagle Steak House NYC,"This is a fine dining experience. The food is outstanding, done to perfection. The waitstaff are attentive. The hostess seats you promptly with reservations. If you are thinking of a celebratory dinner make this your experience."
"June 6, 2018",50,best steakhouse chain,"great experience. sit upstairs on the mezzanine level overlooking the entire restaurant. Our server, Chris B., was fantastic. by far the best side dishes of any steakhouse."
"June 3, 2018",50,Great Steaks,"We all ordered steaks at our table, although different ones. They were all fabulous. Side orders were delicious and plentiful for sharing."
"May 31, 2018",40,Limited menu but top quality,Great choice to impress a business colleague. Sit upstairs not in the bar area. Off the menu best choice is the 24 ounce lobster tail. They have like 2 or 3 each day. Steak salad is good choice. Pricey but a memorial meal.
"May 28, 2018",40,Great Wine Room,Had a private dinner at the wine room downstairs. Loved the room! The food was very good and prices accordingly (but it is NYC!) And the service was impeccable.
"May 21, 2018",50,Fine steaks,"We had three fine steaks, prime ribeyes bone-in. Done to perfection, med.rare, mediums. Our waitress was attentive & brought us a birthday/anniversary dessert trio that was scrumptious!"
"May 16, 2018",40,Busy with good reason,"Somewhat noisy because it’s so busy, but busy for a reason. Obviously, people go for the huge steaks, but seafood is excellent as well. Reliable and straightforward. Portions can be substantial, so try and leave extra time between courses."
"May 4, 2018",50,Giant steaks and perfect setting,"A table situated at the first floor may give you a perfect view over the restaurant and also looking out the large windows, where there is a lot of traffic. The service is excellent and will accomodate all wishes. Steaks Are to die for🙏"
"May 1, 2018",50,Always a great experience!,"I already know that when I come here to eat, I will have great service, food and drinks. Atmosphere is very nice also. Their crab cake appetizer is AMAZING! I usually have the VIP drink which is also good."
"April 27, 2018",10,Overrated!,We waited 1.5 hours for waiter to bring food. The taste was good but didn't worth the wait. The rest of the service was slow too. The bathrooms were dirtier than at a gas station.
"April 9, 2018",50,Best Steak House in the City,Del Frisco's is delicious! You HAVE to try the crab cakes. This place never disappoints. The wine selection is untouchable- ask for a tour of their wine cellar - WOW
"April 4, 2018",50,Great restaurant,"Had a great server, Erin, that knew the wine and menu well. I had the wedge salad, ribeye with bernaise sauce, Brussel sprouts and chocolate mousse. Everything was well made."
"April 3, 2018",50,Perfection,"Amazing Evening ❤️ Perfect location, awesome views, food was DEVINE and was very family friendly!!! The chilled Alaskan King Crab and Gulf Shrimp was perfection!!!"
"April 2, 2018",50,WOW,"If you like steak... and you’re in NYC... you can’t miss this place. Absolutely delicious, best steak we have had and that still stands to date. Great sides and plentiful portions. If we return to NYC, the Hungry Moles will be back to Del Frisco’s."
"April 1, 2018",50,Birthday steak with family,"Crowded but very clean and attractive. Service was excellent with Crystal Food choices were for a steak house Food hooded perfectly to the customer's specifications Onion rings, Mac and cheese were great"
"March 29, 2018",50,outstanding,"Rae was our server and she was absolutely amazing, she was so nice and helpful in every aspect and i can’t say enough good things about her. The food was also very very good, i would recommend Del Frisco’s to anyone."
"March 17, 2018",50,Very classy and great quality.,"It’s all about the crab cakes and the steak - world class. Everything else is also good - this is a high end restaurant, not cheap, but a great experience with good atmosphere. Extensive wine list. Sit here and watch the Fox News ticker."
"March 11, 2018",40,Reservation Problens,"Got there at 6:03 for my 6pm Rez. Was seated 33 minutes later. Absolutely unacceptable. Steaks were very good, lemon cake too. Waiter Jose was fantastic. But don't make me wait that long to spend that much money."
"March 5, 2018",50,Phenomenal food flavor,The sides were awesome! Lobster Mac and cheese was as awesome to my taste buds as the steak! Also great wine list!
"March 4, 2018",40,Restaurant week,"Restaurant week menu has a good variety and includes wine, first course, entree and dessert. I had the brick chicken which was very good. Staff were attentive and pleasant."
"February 26, 2018",40,Great lunch,Came here for a quick lunch. Had the lamb it was great. Won’t lie maybe the best cake I’ve ever had for dessert. The lemon cake was amazing a must.
"February 20, 2018",50,Good!,Very good service and great food. We had a porterhouse and it was really delicious! Portion size is too big though and we do not have room for desert!
"February 16, 2018",50,Great food and Great service,We have been here many times when in NYC and the food is always consistent. The service is usually right on. Our most recent visit our waiter made sure we were not rushed but planned our dinner timing perfectly to leave and watch a show.
"February 4, 2018",50,Business Lunch Excellence!,"Want to impress a potential client? This is the place to be. Excellent staff, steak and other food options. Coffee and dessert takes the cake, literally! Can’t wait to return!"
"January 28, 2018",50,Magnificent,This restaurant was amazing. We love steakhouses and we are totally foodies. The service was everything you would expect and want and more. The food was delicious! Down to the salad. My shrimp cocktail was so fresh you could taste the ocean. Loved it all!
"January 22, 2018",40,Busy Place,"This place was packed , Food was good and service but a little noisy and very busy for me. But cant complain about anything"
"January 22, 2018",50,Celebrating,A great place to come for a special dinner.we had an awesome time! Excellent service and food. Had a window seat which had great views !
"January 15, 2018",40,Nice,"Really enjoyed this place. Awesome waiter, good prices, great food. Great place to celebrate a birthday."
"January 8, 2018",50,"Wonderful dinner before theatre. Great cocktails, too!","We went early (5pm) in order to have a relaxing dinner before seeing a show and it was perfect. Wonderful drinks, fabulous, fresh appetizers and steaks and wonderful birthday cheesecake made the meal memorable. Looking forward to next trip already!"
"January 5, 2018",50,Great meal!!,"We had great steaks, great desert and great service!! Would definitely go back the next time we are in town!!"
"January 3, 2018",50,Best Steak in Manhattan,Location and atmosphere can not be beat. Many cuts of steak choose from and all are great. I have eaten here many times and have always had a great experience.
"December 3, 2017",10,Thanksgiving day,"Wait was too long. They obviously overbooked. Food was terrible and they ran out of stuffing. Our meal consisted of turkey mashed potatoes and sweer potatoes, really? Not worth the 400 dollars we spent. What a rip off, I want a refund!!"
"December 2, 2017",50,Busy but worth the steaks,Gets busy most nights with Wall street workers. But totally worth the wait. I had the rib-eye with lobster and mushroom sides. One of the best steak restaurants in the US.
"November 29, 2017",50,"Super, Classy, Restaurant Great food, service, and atmospheres","Ate a great bone in filet steak, it had a great taste and favor, service was outstanding. Very impressive. Will definitely go back to this restaurant when I am in New York City"
"November 27, 2017",50,Fabulous business lunch,Great food and service. Very good location for a business lunch or dinner. Short walk from the subway so easy to access. Recommend the cream corn.
"November 17, 2017",50,Awesome Streakhouse,Went here with my wife on our anniversary and had a fantastic time. Go an hour early and sit at the bar for a drink and appetizer. Filet is fantastic and the au gratin potatoes are simply the best.
"November 10, 2017",50,To die for,"Yes it is! World renowned and you will know why. Excellent food. If it’s not right, they make it right. Service is impeccable!! Ambiance is perfect. Excellent location. Please make reservations well ahead of time."
"November 9, 2017",50,Wonderful crab,If you love seafood and steak you’ll love this place. Went on a Monday night but the atmosphere was terrific and the food sensational. Thoroughly recommend.
"November 2, 2017",50,Fine Dining,"Great service and a very good meal.Chris, our waiter made certain that we finished our meal in time to get to our 8pm show.I forgot the excellent wines and great martinis. waiter made certain that we did not miss out 8pm show time Bo boo"
"October 23, 2017",50,6th Avenue Meat Paradise,Great steakhouse - Outstanding service - wines to match with a selection that is without parallel in Gotham. Highly recommended.
"October 19, 2017",50,"What an amazing experience!!!! SUPER DELICIOUS FOOD, AMAZING AMBIANCE AND AWESOME STAFF!!!","The whole experience was just amazing, from beginning to end. We enjoyed every moment of it. Every one was super nice and friendly. Special mention to Manny, Felix and Christoper. Thank you ALL for the wonderful night."
"October 11, 2017",50,Great meal,"Restaurant was packed at 5 pm on Wednesday night. I can understand why. Appetizers, steak, sides, dessert were all very good. Nothing was jusk ok. Pretty pricey, but worth it"
"October 10, 2017",50,Big American Steak!!!!,A great restaurant with a great service and great steaks! Thanks & Greetings from Spain / Germany - Andi- Nicole Cheyenne & Ernst
"October 8, 2017",50,Always excellent,I have been coming to Del Frisco's for over 12 years when visiting NY and it never disappoints. I love their ribeye. Service is always excellent. For a great New York steak experience you cant go past Del Frisco's.
"October 7, 2017",10,Unpleasant host,They are very busy but it is no excuse for the host to be rude. I used yo eat there often. Not anymore.
"October 1, 2017",10,Didn't like it,"Too expensive, didn't like the food at all. The pork steak wasn't good and the food took long time to come. Wouldn't recommened it. I Only liked the view of the rockfeller center"
"September 26, 2017",50,One of the best steak in NYC,"Even though it was not easy to get a table, I love the steak here. The meat is good and the steak is one of the best"
"September 18, 2017",30,Too noisy,"Great location great steak but too noisy, you can't have any conversation without screaming. I have been more than one time but for my opinion is still the limit of this steakhouses."
"September 14, 2017",50,Still the best,"Had dinner with my Wife and a friend of over 20 years. I have been going to this restaurant since it opened 17 years ago. The most consistent restaurant I have ever dined at. Food quality EXCELLENT, Service OUTSTANDING"
"September 8, 2017",50,Wonderful!,"Great menu, food, drinks and service. Everything here is top notch. The crab appetizer is amazing and the crème brulee is wonderful!"
"September 6, 2017",50,Birthday dinner,"My husband and I dined here for his birthday dinner. The service was impeccable, with our server Chris being both friendly and extremely knowledgeable. The food was amazing and I would highly recommend the crab cake. We will definitely return."
"August 31, 2017",50,As good as always,"I have been going for years, every time I come to New York. It is less crowded and quieter for lunch. Food excellent and service very good. I will be back"
"August 29, 2017",50,Best steak I've ever eaten,"Oh my, this was an incredibly good restaurant experience. Fantastic flavor to my filet! Great service from my server. Grab your wallet, breathe deep, and go here. You won't be sorry."
"August 28, 2017",50,Fantastic cocktails & steaks,"A shout out to Bartender Mike for making a fabulous Cosmopolitan! (Most don't do it well!) He knows his stuff! We had excellent / friendly service at the bar and at our table. Delicious food, great location. Highly recommend."
"August 26, 2017",50,Quality,No wonder this place is amongst the best in both service and food. A definite dining experience for a visitor to the Big Apple
"August 13, 2017",50,Incredible place,"Best experience ever!!! The manager him self treat us like kings and queens, food was amazing, and the place was out of league."
"August 10, 2017",50,Night out,"Excellent food and service. Pricy, but you get what you pay for. Highly recommend to all steak and seafood lovers!"
"August 6, 2017",40,"Great steak, busy noisy and lively place","Great food, with really nice steak. The side dishes were fantastic. The place is nice but absolutely huge and very busy. Good for a group but I wouldn't go as a couple."
"August 4, 2017",50,VIP Bacon,The VIP cocktail is wonderful and the bacon amazing too. Who eats bacon like this? Doesn't verbally happen but it is so good one must try it. Medallions of beer were outstanding. Vibrant spot in NY.
"August 2, 2017",40,Overpriced,Not the type of restaurant to deserve the price of foods that they have. Food was good but not excellent and the restaurant itself it's average looking regarding the view and it's class image.
"June 30, 2020",50,Wow,Such a cool historic restaurant. I had their eggs Benedict and they were fabulous. Such a great experience eating here. I highly recommend it.
"February 20, 2020",50,Wow,"After a perfect, juicy, flavorful Delmonico’s rib eye signature steak and mashed potatoes with wedge salad starter, it’s no wonder Lincoln and JFK dined here. They don’t ride on the laurels of their wreath. They strive for perfection and attain it!"
"February 15, 2020",50,Fantastic meal at Delmonicos.,"Fantastic meal at Delmonicos. Mindy was our server and service was excellent! Steaks were perfect, calamari was great and dessert was outstanding! Old NYC charm. Relaxed atmosphere."
"January 15, 2020",50,Great food and atmosphere,"Its a must for all visitors to NYC, food is great, atmosphere is great as well. Having being the oldest upscale restaurant in the history of USA makes it even sweeter! Will definitely come back to it when I am back to the USA."
"December 27, 2019",50,Elegant Dining,"Beautiful and elegant, Delmonico's is now one of my favorite restaurants and one I will always make time for a dining experience each time I visit NYC! From the appetizers to the steaks, the sides, and the best Baked Alaska; the best I ever had!"
"December 11, 2019",20,Early closing!,Any restaurant worth its salt should be open till a decent hour especially one like this which is out of the way and despite arriving before 10pm was unceremoniously informed that the kitchen was long closed !
"November 27, 2019",50,Exquisite!,"Outstanding food, superb service, beautiful restaurant and good facilities. Thoroughly recommend this restaurant for that special occasion. Fine dining at it's very best."
"November 25, 2019",50,Delmonico’s - Delicious wine and tomahawk steak,Very nice experience. Historic restaurant. Delicious wine and food. The staff was great. Worth a visit!
"November 16, 2019",50,Top Notch Traditional Steakhouse,This is a NY classic - 180 year old steakhouse. Food (all al la carte as you’d expect in this category restaurant) was excellent - had filet with Blue Cheese topping. Service was excellent too.
"October 29, 2019",50,Always Awesome,"I had my first meal at Delmonico's at age 8 with my grandparents, continued going here every time I am in NYC. Great steaks and service served in a beautiful dining room."
"October 19, 2019",50,Was on my Bucket List,Lived up to it's Reputation. Was Great to dine where Abraham Linclon and JFK and many other Great People. I had the Delmonico steak and it is the best steak I ever had.
"October 9, 2019",50,The best steak ever!,My husband and I went to Delmonico's for my birthday/wedding anniversary. This was by far the best steak I've had in a long time. We are coming back to NYC in a months' time and we definitely intend on returning. See you soon!
"October 8, 2019",50,Truly the First Class Dining Experience!!,"If you are looking for outstanding service, fabulous food and ambiance, this is the place to celebrate an special occasion."
"September 20, 2019",50,Delmonico's,"The best steak i ever ate, the delmonico potatoes are amazing. The staff are world class. If you are lucky enough to dine here you will agree with this review."
"August 19, 2019",40,Good food!,"We enjoyed having our lunch there, the market lobster was amazing, but it was a big dish that needed to be shared. The bread basket and burrata dish were delicious! Friendly staff."
"August 15, 2019",40,Good!,"Good atmosphere, decor and service. If you love steak this is the place for you. I went during restaurant week and got a 3 course meal for $42. That can’t be beat."
"August 13, 2019",40,Nice bar,Had already eaten so went to the bar. Great selection of drinks and we could smell (and see!) the food in the restaurant which looked lovely but was untested.
"August 6, 2019",50,Fabulous meal,This old world steakhouse did not disappoint. Steaks were excellent - cooked perfectly to our respective likings.It was food week so the three course meal was a real bargain. Baked Alaska dessert was amazing. Thanks for a memorable visit!
"July 25, 2019",50,Old school elegance,We had a fabulous dinner at Delmonico. Our server was professional and pleasant. The food was delicious and we ordered from the Restaurant Week menu which was terrific.
"June 20, 2019",50,Perfect Steak and Staff,"This is the best steakhouse I have ever been. The steak was cooked to perfection and the staff was so kind, friendly and professional. Visiting Delmonico's was a great experience for me. I give my highest recommendations."
"June 4, 2019",50,Wow,The second best dinner I have ever had. The service was awesome. Very well taken care of. Big Al was great.
"May 28, 2019",50,Massive steaks!,"I visited here on a business trip with a large group. The service was very attentive, the food came quickly and the steaks were just massive"
"May 17, 2019",50,Steak signed up and sealed,"I do confirm: their signature steak makes it worth coming. I like the classic and a bit uppish atmosphere of this restaurant in the Financial District where you can find families, friends’ reunions, couples of all ages."
"May 15, 2019",50,Out of this world food and ambiance,"Loved the chandeliers, cloth tableclothes andnapkins and wonderful service The food was really special!!!"
"May 7, 2019",50,Perfect steak,"Nice food.you get huge steaks. Price is not cheap but the quality and the service , aswell as the old atmosphere in the restaurant is perfect"
"April 24, 2019",50,Best steak of my life,"This was the best steak I have had in my life, and I’ve enjoyed a lot of steaks! The setting is classical and the wine list sensational. The New York bakes cheesecake topped it off as a truly memorable birthday dinner."
"March 31, 2019",40,Steak Perfection,"Authentic High End Steak House. Attention to details. Staff great. Had the Porterhouse for two, with mushrooms and potatoes on the side."
"January 23, 2019",50,Amazing!!!,In the city from Tennessee on a girls trip and this was our favorite place! We were treated so great! The food was amazing and the service was even better!!
"January 21, 2019",50,Amazing!!,Girls trip!! We were treated incredible! Food was amazing... service and management was exceptional. One of my favorites while in New York.
"January 21, 2019",30,Just Okay,"Met some friends there for dinner, 5 total. Drinks were great, food was okay for the price. All in all just feels like an overpriced steakhouse."
"January 19, 2019",50,Dine in style,What an amazing place I hear it one of the oldest and most best steak houses in NYC. I want to say this is the best steak house I have been to in years. The service was great but the food was even better.
"December 22, 2018",50,First class experience,"I visited New York and met a friend there for dinner, wow wow wow. Cannot thank the friendly staff and the food was amazing."
"December 21, 2018",50,Very nice place,"Very nice place, ambient is perfect, stylish with all the little touches and details. Food was also (not healthy as that's not such place), but tasty."
"December 11, 2018",50,Best steak!,"Delmonico's is an old school, classic NYC steakhouse. Their food is top quality and the prices reflect this. Be sure to dress business casual."
"December 3, 2018",40,Great serbixe,I am very impressed with the excellent service. The steaks were amazing and the atmosphere was food as well.
"October 28, 2018",40,great business dinner,"I went to this restaurant on a business dinner, and I would definitely go back. This is where the Delmonico steak was named. The restaurant is well appointed and has the proper steak house ambiance. The food was wonderful, and a great experience."
"October 22, 2018",50,Historic Restaurant,"We were with a group of about 2 dozen people. Following a visit to the Ellis Island National Museum of Immigration, we had lunch at Delmonico's. Excellent lunch of squash lobster soup, rock cod and pumpkin pie ala mode."
"October 21, 2018",50,A Timeless Original,"Excellent service. Excellent food (a number dishes were developed there, e.g. Eggs Benedict, Baked Alaska). Excellent room and connected bar (both classic scenes). Excellent location (classic Wall Street location; be sure to walk to the Bull and the Girl)."
"October 1, 2018",50,Final Night's Dinner,Went to Delmonico's for our last night in NYC. Great old-world style restaurant with outstanding service and a fabulous menu.
"October 1, 2018",50,Great steak.,Had the 45 day aged special and wow was it good. Unbelievable actually. Would recommend the steak here for sure. Wine selection was well done and really enjoyed that as well.
"September 19, 2018",40,Great steak and sides,We had great steak and sides. The waiter wasn’t too pleasant but the food was well prepared and delicious.
"September 16, 2018",10,Upmarket,"Had a meal there. I asked for pink lamb had to send it back twice as it was bloody, but still left it. After all the good revues I was looking forward to eating there but ended up disappointed .would I recommend definitely NO"
"August 16, 2018",50,Beyond Excellence,"My filet was cooked to perfection, the mushrooms were succulent and the asparagus medley was delicious. The dinner was beyond my expectations and I would highly recommend for a special occasion. A bit pricey to recommend for an every day meal."
