"March 16, 2017",40,"Nice meal, decent steak","Business meal at this mid-priced restaurant close to Ann Frank House. Enjoyed the meal, nice setting, good staff, decent wine... would definitely return"
"March 15, 2017",50,Nice quaint restaurant with good food,Good food and services ! A 5-10 min from main shopping stretch. Will love to be back! Spent estimated Euro30/pax.
"March 12, 2017",50,Amazing food!,"The food was lovely, so tasty! We had the sharing steak and it was cooked perfectly for both of us. The staff were lovely and attentive and I would definitely go back again!"
"March 5, 2017",40,black and blue,great flavours and friendly staff who gave us a splendid evening with good quality food fish and meat both are very good price / quality a lovly restarant at the lelie canal great we will come back.for the death chocolate WHoow..
"February 20, 2017",50,Nice cozy restaurant with great food,"Nice cozy restaurant with great food. We enjoyed the nice decor, helpful hosts and great food (try the hamburger...). Reasonable prices, nice merlot, good deserts (especially the roasted pineapple). Definitely worth a try."
"February 16, 2017",50,Very Nice Dinner,Enjoyed an evening meal here. Very comfortable and close to our hotel. Good service and enjoyed a very nice meal.
"February 15, 2017",50,Excellent food and great ambiance.,We were tempted in by the advert for gluhwein and we're not disappointed. The food was well presented and extremely good. Service was great and it was a relaxing environment to pass away time and have a few glasses of gluhwein! Good value for money.
"February 12, 2017",50,"Delicious, inviting, great service",A lovely venue - really liked the decor. The food was excellent and a welcome respite from snowy Amsterdam! Would definitely recommend and go back if we get the opportunity.
"February 11, 2017",40,Light bite at lunch time,Great find in Amsterdam. Fennel soup and soda bread were delicious. They also serve bread with a warm cheese dip. The staff were friendly and the jar of boiled sweets with the bill was a lovely touch.
"February 11, 2017",50,Perfect Ribeye steak,"Everything perfect! The ribeye steak 600gr was perfect! Alias, more then perfect!! The stuff are very friendly, the ambient is nice and much nicer than the people here posted the photos. I really recommend this restaurant."
"February 11, 2017",40,Meat by the water,Delicious steak in a cosy original restaurant. Very friendly personnel. Be sure to reserve a table beforehand though.
"February 7, 2017",30,Worth it only for the dessert,"I had the bruschetta and the lady steak and I was not at all impressed. The petit gateau however was good. Service was awful, waitresses were slow. Choose another place if you can"
"February 6, 2017",40,Good Place to Eat,Stayed at a nearby hotel and decided to stop in for dinner. Atmosphere was nice. Prices were not expensive. Food was pretty good.
"February 4, 2017",40,Great steak and relaxing setting,"Relaxing atmosphere, great steak, lots of fries and some other interesting choices. The place to come for a good steak dinner."
"February 2, 2017",50,Good food,The food was served by friendly staff and to a very high standard. It was clean and the food was presented well and delicious
"January 29, 2017",50,Good afternoon meal,"We came here in the afternoon, since the placed seemed to be really charming. We ate something little and drunk an afternoon coffee. Everything was delicious and the staff was lovely. I would recommend it to everyone."
"January 23, 2017",50,Great,"visited here for mid-afternoon drinks, however had we been staying in the City longer would definitely have returned for dinner. Really nice setting, friendly staff and the food looked fabulous. Best value place we visited too, and a good location."
"January 22, 2017",50,Amazing!,"This place was awesome! Great atmosphere, extremely friendly and attentive staff, best service in Amsterdam. Food was amazing as well, would come back here in a second."
"January 18, 2017",40,Great steak and friendly service,A good value steak house with very friendly staff. We both ate the tenderloin and it was beautifully cooked.
"January 3, 2017",50,Best Steak in town,We had the best meal last night. Steak was cooked to perfection and the relish complimented it perfectly. The service was very friendly and very helpful. We would recommend Black and Blue to any visitor or local to Amsterdam. Anne & Evert Melbourne.
"December 31, 2016",30,Not bad,"Really enjoyed the service here, the steak was tasty but portion size very small and they undercooked it more than we asked but in return we didn't pay for drinks on the bill so customer service was great."
"December 29, 2016",40,One of the better places we ate at in Amsterdam,This place is located a couple of streets down from Anne Frank's house. It was really good food with wonderful presentation. We got hamburgers and they were pretty good.
"December 26, 2016",50,Exzellent food,"We visited on Xmas day and the food and service was excellent, the steaks were fantastic well worth a visit"
"December 16, 2016",40,Popped in for some Gluevein,"We popped in here for some gluevein during our walk. Quick service, loved the décor. I wanted to stay for some food, but we had to press on."
"December 6, 2016",50,Best steak I have ever eaten!,"What can I say, great atmosphere, friendly staff and the food was amazing. The waiter took me to the kitchen so I could thank the chef! ""What a meal"" We will be back! Thank you"
"December 2, 2016",50,Excellent Burgers,"Great Angus burgers and excellent service. Burgers come with chips and salad, just ask if you want more."
"November 27, 2016",50,Amazing Food!!,"We ate here twice during our stay, both times amazing .. chicken and peanut sour dough for lunch and steak for dinner. Highly recommend reasonably price!"
"November 27, 2016",50,"Friendly, tasty restaurant we stumbled upon","The staff were friendly, accommodating for us English folk. Great steak burger, bruschetta and wine. Perfect for couples and groups of friends."
"November 27, 2016",30,Suitable for lunch,"I have had lunch here a number of times and it is perfect with a menu that suits any mood, Good service and in a quite cross street between two of the canals"
"November 26, 2016",50,Steak dinner,We got in late evening and were going to get pizza recommended by our house host but they closed so nearby was Black and Blue. We were pleased with our dinner. Excellent steaks and service.
"November 23, 2016",50,Excellent,"Was there with a few colleagues and we were all impressed. Cozy restaurant with great staff and amazing food, especially the steak. Highly recommended!"
"November 23, 2016",40,Excellent dinner,Nice atmosphere and the best meat. We chose steak with fries and it was a magnificent solution. One of the best steaks I've tasted. Service also very kind
"November 13, 2016",50,Bright,"Great place with a friendly atmosphere, deliciously cooked food and simply nice interior Steaks, burgers, soups and salads are all tasty)"
"November 13, 2016",30,Not bad,"Very good service, and extremely nice staff. Food is normal, we didn't try many things, but it was ok. The quality of the meat was also good."
"November 7, 2016",50,Enjoyable.,"Great restaurant, friendly staff and great food. We visited twice and both times were excellent, we had the Black and Blue Steak and all you can eat chips and salad. Highly recommended."
"October 31, 2016",40,Nice steak!,"Busy but good atmosphere in this steak restaurant. Lovely meal, if you want a good steak and chips. Around the corner to the Toren hotel."
"October 30, 2016",50,"Amazing steak, great service","Came here with a group of friends after reading reviews on Trip Advisor. Would highly recommend, delicious steak and complimentary chips as well which was a nice bonus. Best to book though as it got very busy when we were there."
"October 26, 2016",40,Good steaks & service,Restaurant had especially good stakes with fries and salad & nice atmosphere. The service was also good.
"October 25, 2016",50,Superb,Had a superb meal celebrating a close friends birthday. All food was prepared as it should be and steak was exceptional. Service was excellent too - restaurant was pretty busy - would definitely go again. Staff were very friendly definitely recommend 😊
"October 21, 2016",50,Excellent,"Dinner was wonderful, salad very fresh and steak outstanding. Our server who had been to our city was terrific and personable."
"October 17, 2016",40,Very good steak restaurant,The Angos was delight. Hospitality was very good. The right place for the one who wants the best steak. Reservation needed in order not to be disapointed.
"October 17, 2016",50,Excellent food,"A restaurant with a great ambiance, excellent food and prices similar to the UK (a relief in Amsterdam). Really good – would recommend."
"October 14, 2016",40,Good meat,"Good restaurant, quite busy but cosy atmosphere and good food. I would recommend a table on de ground floor."
"October 11, 2016",50,Excellent steak restaurant in quiet area of town - great!,Fantastic little restaurant that does gorgeous food. Great interiors and local atmosphere. What's not to like? We shared a chateaubriand steak - AMAZING. Ask for the table at the top of the stairs.
"October 8, 2016",50,Lovely lunch,"This restaurant was just a few doors away from our BnB and we had a lunch there. Very good tasty, fresh food and the most delicious macaroons served with the coffee! Service was great too."
"October 7, 2016",50,Fire grilled lobster,"This is a very classy place with outstanding food, drink, and atmosphere. Fully intend on visiting again."
"October 3, 2016",50,Top recommendation,Staff at hotel recommended this restaurant and it was definitely a top tip! I had steak - REALLY good and husband had burger which seemed to hit the spot then shared very nice lemon cheesecake with raspberry ice cream
"September 29, 2016",40,Nice place,"Good food, nice place, great menù. I suggest wine because there is just one kind of beer which is not the best in the world."
"September 23, 2016",40,Steaks to die for.,Top steaks served up here - well worth a visit if you are near by. Will be back if nearby in future.
"September 20, 2016",40,"Very pleasant, tasty and friendly place",The restaurant was five minutes away from our hotel. Great food! Especially the steaks. Good service. We thought our order includes meat. When the waiter found out that we were disappointed she brought us an extra portion of Fillet without charging.
"September 19, 2016",30,skip this for breakfast/brunch,"very mediocre breakfast/brunch however we heard they cooked a good steak. After brunch though, we weren't willing to give it another crack...."
"September 15, 2016",50,Good food and great service,"Dined here twice for diner and once for lunch. Good food, particularly the bruschetta👌. Service excellent with the most pleasant and friendly staff. Premises well appointed and ambience spot on. Great place to dine and watch the world go by."
"September 12, 2016",50,Great steaks,"A restaurant with great steaks and a very friendly ambience. AND proper double-fried chips with, of course, mayonnaise galore!!"
"September 4, 2016",50,Food was Absolutely Amazing,The Bruschetta was to die for! The bread was so amazing i want to learn how to.. Also the meat was a dream. Perfectly cooked. Exquisite.
"August 30, 2016",40,Good food poor service,"Great steak, and lovely starter. Decor is Lovely and all would have been fab but our waitress was totally disinterested and didn't bother if we needed more drinks when our food arrived. Shame as Could be great."
"August 23, 2016",40,Really good steak,A really good location and a perfect rib eye. The steak was cooked over charcoal so a really good crust and additional flavour. The service was excellent. Only down side being it was a little pricey for what it was.
"August 8, 2016",50,"Excellent food, friendly staff & wonderful atmosphere",Visited with my husband on our first night in Amsterdam. Oysters to start (lovely) followed by steak frites with salad. Staff very friendly and attentive. All in all a wonderful experience - we will be back!
"August 4, 2016",40,Yummy Burger,"Food, atmosphere was great. As the place is crowded, the personnel is busy with lot's of work, and sometimes it takes some time until your request is filled."
"July 30, 2016",50,"Waitresses, food and ambiance are awesome",We bumped into this beautiful restaurant after we finished the Anne Frank museum. It's awesome and they served a very tasty onion and Fennel soup... wow
"July 13, 2016",40,Great evening,Spent a very nice evening here recently. The staff was very helpful and always available if we had any queries. The menu is good and I highly recommend a medium cooked black and blue steak with the chocolate cake for dessert.
"July 12, 2016",40,Coffee and macaroon,"Lovely aesthetic and atmosphere, they have a fabulous deal on a coffee and macaroon. My latte was beautifully made and the macaroons are truly delicious, however the staff were not particularly friendly although not altogether unpleasant."
"July 10, 2016",40,Nice quiet restaurant,Ate here on a Saturday lunch time. Food was nice comfy seats and nice and quiet away from the bustle of the city. Staff were friendly
"July 9, 2016",40,Great find during our one night stay in Amsterdam,Great little restaurant that was near our hotel. Our family enjoyed the meal although the noise level was quite high. Service was only so-so as waitstaff got busy with several large tables. Food was great!
"July 2, 2016",40,"Chips, chips and more chips","Just around the corner from our hotel and obviously very popular. The staff were great and the food matched. Particularly enjoyed chips which the staff replenished, gratis, when we finished the first serving."
"July 2, 2016",50,Fantastic,"If you're looking for a fantastic meal look no further, this place ticks all the boxes, oysters, Steak tartare, ribeye for two, 2 bottles of wine €140 great value, not to be missed"
"June 30, 2016",40,Lovely lunch,"We dined here for lunch after a morning walking tour. The food was simple, wholesome, & freshly prepared & the atmosphere is really hip. My boys loved their burgers, & I wouldn't hesitate to dine here again."
"June 26, 2016",50,Something for everyone,"Great food, reasonable prices. The burgers were terrific. The seafood was grilled, including the mussels, which gave them a great flavor. Meals came with fries and salad, which they gladly refilled. A great find!"
"June 25, 2016",50,Hidden jewel,We passed by this place along the canals and decided to check it out. We are so glad we did. The food is great and the service staff are very pleasant! I loved the burgers especially and went back for it twice!
"June 25, 2016",40,"Good ambience, Food mixed quality","Business dinner for 6 - 2 courses on 20-June 2016. Steak pretty good all round but mine was overdone. Starters just a little better. 4* for service and venue, 3.5* for food."
"June 14, 2016",50,Precious moments,"Wonderful lunch in picturesque location. Service was fantastic, overlooking a lovely canal, I thoroughly enjoyed my steak and fries, with a delicious glass of red wine."
"June 13, 2016",50,Yummy and fun dinner,"We went to the Anne frank museum and we're looking for someplace close Thru tripadvisor I found this restaurant. We had the beef tournedos, pork loin and the eggplant All were so amazing and the service was terrific"
"June 7, 2016",50,Cappuccino time with a sweet surprise!,"We just visited the Black and Blue to have a break and a coffee in a relaxing atmosphere. I ordered a Cappucino and surprisingly it came with a ""macaron"". Excellent location, comfortable place and kind service. What else?"
"June 6, 2016",40,Great Vibe,"Very relaxed vibe. Right of the canal from the Anne frank house. Although the seating is very close to others in the restaurant, it has a very private vibe. Great food and even better service"
"June 6, 2016",50,Atmospheric steak,Beautifully tender and delicious steaks. Served on wooden platters so food went cold quickly but otherwise faultless. Delicious desserts too.
"June 1, 2016",40,Good service with some unique food options,"We had good service from our server, offering some great options for dinner. We decided on the soup of the day, a roasted vegetable purée which was very tasty. We also had the roasted eggplant and steak, both hit the spot."
"May 26, 2016",40,Charming restaurant with nice food,I went to this restaurant one night as it was near my hotel in Amsterdam. The food was surprisingly good and the staff were friendly.
"May 16, 2016",50,Amazing!!!,"We enjoyed the restaurant! Every thing was delicious and service is great We had the angus steak and the hamburger. Next time in Amsterdam, we will come:)"
"May 16, 2016",50,Great food and service!,"We were a group of 9 people here for a birthday meal, great service, food and wine. Would definitely recommend this restaurant. High quality food for good value."
"May 15, 2016",50,Wonderful restaurant,"Great food, juicy, perfectly cooked steaks. You can have half lobster with the steaks! Very good service, friendly, attentive."
"May 7, 2016",50,Wow what a steak,Had a lovely meal and great staff. I like the way the steaks were so tender and endless chips and salad. The house wines were nice so didn't need to go mad. I would go back again
"May 4, 2016",50,Great place to eat,We had one of the best steaks ever at this restaurant- great quality meat cooked to perfection. Attentive staff who were also able to advise on wine choice.
"April 30, 2016",50,Fantastic,Turned up without a reservation and the staff couldn't do more to get us a table on a busy Saturday night. When seated staff couldn't be more friendly and helpful. Food was absolutely fantastic! Would recommend this to anyone!
"April 28, 2016",50,Tour day meal! Spot on!,"Tired of walking around the 9 canals on your way to the cheese and tulip museums, we found this wonderful cozy restaurant, with delicious food! Totally worth and great rest!"
"April 26, 2016",50,Amazing Steak,"Great wine, good service and lovely surroundings. Steak was perfectly cooked and as rare as we asked for (blue - which is rare!). Will definitely visit again."
"April 24, 2016",40,Great steak,"Loved the steak here, which was cooked extremely well. The restaurant was slightly cramped but well presented and the service very friendly. Highly recommended!"
"April 21, 2016",40,Very nice place,"We visited the restaurant during the National Restaurant Week. We had a 3 course meal The steak was amazing, the dessert was really really good as well. I ordered carpaccio as a started.. it was just ok. but the rest was really great."
"April 19, 2016",40,Delicious food and great service,It was amazing evening for my and my family. Food was really great and service was at the very good level. I DO recommend this restaurant. Enjoy!
"April 12, 2016",50,Excellent service and steak,"We had a great experience at Black and Blue. Unsure of where to go to get a good meal, the friendly wait staff greeted us and made recommendations. The steak was amazing. Thank you for our awesome first meal in Amsterdam!"
"April 11, 2016",40,Clean machine,"Very fluent place. Did not knew much about Dutch local beers and where bitter balls got the name. American style place. Service was good though. Bitter balls were good. I wonder, why call bitter? Not much bitter in taste. But... that is another subject."
"April 9, 2016",50,Great st ak,We found ourselves unexpectedly in Amsterdam when our flight was cancelled. We were so hungary and they were totally full but they graciously fit us in at the bar Great steak and hamburgers and the most efficient staff ever
"April 6, 2016",50,Good place for steaks in a nice and warm atmosphere,"The Steak placet Black and Blue is the place for anyone who loves good, pure food and a relaxed atmosphere. The service was very friendly and volontarily spoke German which is always the case in Amsterdam. Meeat was very good and the wines too."
"April 5, 2016",50,Nice food and atmosphere,"This is a really nicely decorated restaurant with very comfortable seats, nice food and good choices, staff were also nice!"
"April 3, 2016",50,Very tasty,"We went here on restaurant week, so we had a small menu to choose from. It was SO tasty! Very nice place."
"April 3, 2016",20,No worth it,"The food is over priced, the staff was rude and snobby and the whole thing was a huge disappointment. Go to literally any other place."
"March 31, 2016",40,Very nice lunch,Beautiful little restaurant with good food and good service just two minutes walk from Anna Frank House.
"March 28, 2016",50,Great food great staff,"Nice simple menu with very good food. The staff are great, the food is fresh and well cooked and plentiful. Well recommended"
"March 28, 2016",50,Great food and service,I picked this restaurant based upon review and I was very happy I did. One of the best steaks I have. Service was great. Definitely a must.
"March 27, 2016",40,Good quality and service,"I had a dinner here with my family in march. It's a Good steakhouse, nice location and atmosphere and the Waiter was a nice smiling girl. Great steaks, the price was Good compared to what we ate. Reccommended"
"March 26, 2016",40,One of the best steaks I've eaten,"Had the black and blue steak at medium rare, which was really tender. Service was abit slow though, and the Chocolate fondant was slightly disappointing since there were very favorable reviews."
"March 24, 2016",50,Best Restaurante in Amsterdam,"The ambiance is great, next to the Anne Frank museum. The food was absolutely great. Good stake, tasty salads. Very recommendable and NOT expensive. Service was really good. A must in Amsterdam."
"March 15, 2016",40,great ambiance,"Cozy place with delicious food and nice beers. Close to the Anne Frank House and city center. Reserve at night, seems to be very busy and popular"
"March 13, 2016",40,"Cool place for lunch, and I expect dinner is good too","Excellent steak in a very cool (in a hipster way) setting. Nice staff, good food, although I hate getting food served to me on a wooden board - didn't detract from the taste!!!"
"March 13, 2016",40,Fantastic Angus meat!,"Perfect place to eat an excellent Angus meat. We asked for the Black Angus Tournedos. People very nice and good service. Try it, you will enjoy it!"
"March 12, 2016",50,Fine meat.,"Nice décor, good service, really good steaks. Reserved through the TripAdvisor's app, very easy. Came with friends to celebrate a birthday."
"March 10, 2016",50,Fabulous restaurant,Dined here with my partner in early March 2015. Food was superb. We both had steak which was cooked to perfection and the unlimited chips was a treat! This place is a must try if visiting Amsterdam!!
"March 3, 2016",40,Very nice and fresh atmosphere,"Impressive amount of seats but still cosy and the service works fine. The food was excellent and also the recommended ""house wine""."
"February 27, 2016",50,Dub landing,"Excellent food, service and price. great atmosphere and will defo visit again next time we're in Amsterdam. Had Angus steak with lobster and both were cooked to perfection,"
"February 24, 2016",40,Superb food,"The restaurant was very busy so advise to book otherwise you will not get a table until very late. The food was excellent, the Service was very friendly and accommodating. The steaks were superb and the French toast dessert - OMG!! Definitely recommend."
"February 15, 2016",10,Disaster,I have been in bed ever since being sick. This place should be shut down I asked for a well done burger and it was red raw! Bad
"February 12, 2016",40,Good food at reasonable prices,Enjoyed a quiet late lunch after a morning of sightseeing. I had the romain salad topped with goat cheese. The amount of cheese was so generous that I couldn't eat it all. (It was delicious though). Their burgers are also quite tasty as well.
"January 27, 2016",50,Fab Food,"Fab Place, lovely setting, Staff so helpful and couldnt do too much to help. The Food was lovely. Will be recommending it to the rest of my family when they visit Amsterdam at the beginning of February"
"January 11, 2016",50,Lovely Christmas evening,"We had Christmas dinner over there and was amazing he staff was so nice and the food lovely, highly recommended."
"January 6, 2016",50,Great place!!!!,"Best service of all time and the prices are so fair! Use the bathroom, it is fantastic. And I suggest you have a hot chocolate with their macaron, because it is delicious!!"
"January 5, 2016",40,good food,"The atmosphere is nice and quiet, the food is good. I had the half lobster with the salad, really tasty! It is a bit expensive though."
"December 30, 2015",40,Great family meal,"We turned up on spec and helpful staff found us a table. Good service, very good food and very good atmosphere. Success all round."
"December 26, 2015",50,"Great setting, light inventive food",The place is well decorated with nice paintings. The food was inventive and the tastes were clear of heavy sauces. Service was great.
"December 7, 2015",50,Great salmon and steak,Had salmon for starters. Great. Angus tournedos for main course. Great. Only small problem is the horrible Pepsi Light instead of a Coke Zero - also known as 'Black Champagne' :) Just go there...
"December 4, 2015",50,Great atmosphere,"Great friendly service, served timely and catered to our needs. Excellent food, and great vegetarian dish for a predominantly steak restaurant."
