"November 14, 2017",50,lovely food .,"These pizzas were lovely , we really enjoyed out time in this little gem of a place we found by chance . We tried so many different mix pizzas and we were really looked after by wonderful staff ."
"November 8, 2017",50,The best pizza,This is the best pizza i have ever eatan. I will definetely come back. Pizza mozzarella and pizza pesto are the best!
"November 6, 2017",50,PERFECTO!!!!!,"What else I could say . Go for it guys! Food is amazing, service is 100% profesional and friendly. Oh one more thing - Eng language is not a problem ;)"
"November 4, 2017",50,Best. Pizza. Ever.,"The pizza is just amazing, nice variations, perfect crust, super delicious. And to top it of try the homemade tiramisu, it is to die for! If that all wouldn‘t be enough already: the staff is super nice and funny!"
"November 4, 2017",50,Yummie!!!!!,"Great Pizza, great Tiramisú and fantastic entertainment!!!! Looooooovvvvvvvveeeeee it! It is a tiny but perfect place to have a fun evening with good food in Rome 😋😋😋"
"November 4, 2017",50,Róma,A hely kicsi de a pizza isteni. Jó kiszolgàlàs. Small place but the pizza is perfect also the reservations.
"November 3, 2017",50,Very good pizza.,"Very good pizza, 7 types in one serving, great experience. The waiter was very entertaining. Good location."
"November 3, 2017",50,Excellent choice!,The atmosphere was great and the pizza was extremely tasty. There was a plate with many kinds of pizza. Excellent!!
"October 31, 2017",40,Best pizza in Rome,Great food at a reasonable price .Great atmosphere and a great waiter . Will go back before we go home . Go for the mix you can't go wrong
"October 28, 2017",50,Best pizza experience,"Just go there, let them bring you their mix, and perhaps two glasses of bear and then you will have the best pizza experience in your whole life. Great staff, magnificent pizza. Can’t wait to go back."
"October 25, 2017",50,Awesome Pizza with great service,We went to this place after reading great reviews. Ordered a pizza platter and Tiramisu.. loved both. The service was exceptional too.. Would surely give it a go the next time we visit..
"October 17, 2017",30,"okay pizza, nothing unusual","Great service from waitress, really really friendly, however the pizza is okay, not outstanding, tiramisu was very tasty! Wouldn't go back."
"October 16, 2017",50,Amazing pizza!,Tiny little cafe with 7 tables. Amazing pizza boards... I think we had 7! Food for two and 2 drinks each came to 25 EUR and we were so full after!! Definitely go!
"October 13, 2017",40,Mix of pizzas,"Perfect mix of pizzas (I think 9 types). When we were there, It was full. We had to wait (about 15 minutes). And beer for 5€ is too expensive."
"October 13, 2017",50,Pizzas - Mixxx,A good pizzeria with combinations of pizzas suited to the taste. A little place just in front of the Vatican entrance . Highly recommended for taste of couple of pizzas in one
"October 12, 2017",20,i don't get the reviews - average/below average pizza,"no one was there when i arrived. i was shocked. how does a place with 1800 reviews be empty? just due to these amazing reviews i went ahead and tried the tired looking few slices, and it was not good. makes ya wonder..."
"October 8, 2017",50,Best place to eat in Rome,"We still didn’t decide, but probably it is the best pizza we had ever eaten. You can taste every single pizza they have if you take “The Mix”. It's perfect for two."
"October 7, 2017",50,Awesome place!,"Ten stars: 5 for the food, 5 for the service!! Waiter was snappy, attentive, and very nice. The pizza and tiramisu was fantastic."
"October 7, 2017",50,"Hungary, Budapest","This place is amazing. The guys are the nicest dudes we met in Rome. The pizza is fantastic. We got a little from every flavour. Get a dessert too, won't regret it."
"October 5, 2017",50,Great...❤🇭🇷,"The best pizza in Rome. The staff is amazing and food is amazing. Must try. Thank you guys. Hello from Zagreb, Croatia. 😉"
"October 5, 2017",40,food and service,the restaurant serve good food and its platted so amazing so i like to come one more time with my family
"September 29, 2017",50,Best pizza on our trip in Italy,"Good friendly service in a small sinple pizzeria. We had the mixed pizza. All varieties were excellent but our favourites were the pesto, bacon and cheese slices. We've had pizza in Naples, Sienna, Italian Riviera and Tuscany. This was the best easily."
"September 28, 2017",50,Vacation in Roma,The best pizza I ever had!!!! You must try it!!! Best service! The waiter was very accommodating with us because was very busy and no table to seat.
"September 25, 2017",30,Pricy for the amount of pizza you get,"The pizza is average quality, easy to find the same or better quality in Rome and, of course, at a better price. True though that its location (100 m away from the Vatican) may set the price"
"September 25, 2017",50,Great street food,"Fantastic place, waiter had great personality and recommended the 7 pizza mix dish for lunch which was perfect for my daughter and I. Delicious every one of them! And rice ball for a small aperitif was great too."
"September 24, 2017",50,Amazing,Very close to the vatican is this Amazing place with one of the best pizza and excellent staff. Keep up the good work guys!!
"September 22, 2017",50,Amazing!!!,Stopped here after visiting the Vatican museums. There was a bit of a queue but the pizza was well worth the wait. The mixed selection was amazing as was the tiramisu. Great service too!!
"September 18, 2017",50,Amazing pizza,"The most delicious pizza, which we have ever eaten! Everyone should try it! Service is gr8!!! They have their own beer which is nice too!"
"September 18, 2017",50,Best pizza ever!,"We were expecting good pizza, as we came here based on reccomendations, but it was even better than we expected! Buffalo and bacon pizza was smth unbeleavable! Must visit spot in Rome!"
"September 14, 2017",50,Great Pizza next to Vatican,I would recommend getting the mixed board to enjoy a taste of all the flavours. Sit outside and soak up the afternoon sun with a beer and some great pizza. The staff are real nice aswell.
"September 14, 2017",30,"Delicious, extraordinary","Come here, this is really a fabulous decision. Beautiful, fresh pizza, and offers great, sincere and thoughtful service. This little restaurant is like a gem. We ordered a comprehensive pizza, we feel very good to eat."
"September 13, 2017",50,Tasty. Quickly served,"Excellent idea of suggesting a plate of mixed pizzas. 15,5 € for two. The dough is at the same time crispy and soft, very pleasant to eat. A rice ball fritter offered as a starter. Loved it."
"September 12, 2017",50,Best Pizza in Rome!,Amazing pizzas and we had it on our first and it was amazing we love it and when we come back to Rome will go here again!!! Staff was great and nice and happy and their pizzas were alll soooooooooo gooood!!! 😃😃😃😃
"September 12, 2017",50,Must try!,"Absolutely amazing...and I'm saying this after having a great pizza and an awful one somewhere else in Rome. Flavourful pizza...I mean tomato sos tastes sooooo fresh! Great staff as well, chearful and helpful what else could you want?"
"September 11, 2017",50,great spot,"no menu needed, took their recommendation, fast service, tasty food, cheapest bill in Italy so far! Would recommend to anyone who is hungry and just wants a casual few slices to share when on the run or after the basilica."
"September 10, 2017",50,Amazing pizza!,"This place had wonderful service. Great location, walking distance from the Vatican. The pizza was so delicious! As were the free appetizers we were given!"
"September 2, 2017",50,The Reviews are Right - Brilliant,Went here upon recommendation and it was fantastic. Best pizza we have ever had without question. The service was great and the small touch of providing some small appetizers for free was really nice. Highly recommended place to visit.
"August 4, 2017",50,Fantastic and quaint,"We visited here after a trip to the Vatican and it was a fabulous decision. Beautiful, fresh, original pizza with a wonderful, honest and attentive service. This small restaurant is an absolute gem. We had the mixed selection of pizza which we thoroughly enjoyed."
"August 2, 2017",50,Amazing.,Amazing food and very kind waiters. It's a small restaurant with only few tables outside. We got different pizza slices and loved every bite.
"July 28, 2017",50,Name has changed to Pizza Zizza,"Great pizza on the spot, lot of pizzeria round, one full terrasse is this one! No need to look at the menu go for the mix pizza and enjoy..."
"July 22, 2017",40,Great service and fine pizza bianca,Any other pizza we ordered was just average. On the other hand service was pretty good. The place is quite tiny but nice for a date.
"July 20, 2017",50,Delicious Pizza !,"Simply a heaven after a long day of vatican visit ! We were a family of 5 with 3 kids, the service was perfect and kids enjoyed jokes and mimics :)"
"July 19, 2017",50,Simply amazing,"BEST. PIZZA. EVER. Go after the Vatican. If they have a ""mixed"" pizza platter, get that. If you have dietary restrictions, then maybe not. Every single one was good. The owner is so extremely accommodating and the service was the best."
"July 18, 2017",50,A pleasant surprise,The best pizza in this part of Rome. Stumbled upon this tiny place quite by chance and would totally recommend it.
"July 18, 2017",50,Must visit,Had dinner here following trip adviser recommendations and it was the best pizza I've tasted. Staff were extremely friendly. Would definitely head here again
"July 17, 2017",50,Must experience,Best pizza in Rome! The friendly staff/ owners will accommodate you! Just minutes from Vatican City!
"July 17, 2017",50,Best pizza I have ever had,Hands down best pizza I have ever had. Topped on with great friendly service (got given a free arancini ball).
"July 16, 2017",50,Best Pizza in Italy,"Do yourself a favour and try the Pizzas at this place. They are sensational, much better than pizza in Naples and all other regions we have visited! Also, the guys who work there are super friendly and speak good English!"
"July 15, 2017",50,Sensational Pizza,"The pizza was so good we ate here twice. They served many different types of pizza from pesto, ham, bacon, potato and fish, to cheese and sauce. All on foccacia bread pizza crust to die for."
"July 15, 2017",50,Best Pizza in Rome,"We had the best pizza here. Service was super friendly, food was fast and delicious! Highly recommend."
"July 14, 2017",50,Definitely best pizza in Italy!,We tried a mixed vegetarian platter. Every slice was just divine! Lovely staff as well. Definitely recommend the detour!
"July 10, 2017",50,Pizza Must,"A must stop for incredible pizza while in Rome, espicially after a trip to the Vatican. Try the sampler and you will not be disappointed."
"July 8, 2017",50,Delicious pizza!,Best pizza in Rome. We had mix of different kinds of pizza. This was just perfect! It's small local near Vatican but you have to visit it :)
"July 5, 2017",40,Excellente!,"The pizza is very nice and it is very cheap. We played about 34 euros for 2 beers, å tiramisu and 16 pieces og different pizza. Recomended!"
"July 1, 2017",50,Soooo good,Big queue. There was a 20 minute wait but it was well worth it. He knew we wanted vegetarian option bought out a platter off 4 different options. I'd say it was an excellent price as pizza was sooo good
"June 30, 2017",50,Amazing pizza and great service,"Takeaway pizza was very tasty, served as squares of different toppings, giving a taste of the varieties Pizza Zizza has. The service was great and very friendly, and the complementary rice balls were a great addition during a short wait for the food."
"June 29, 2017",50,Tasty Pizza,Only a block away from St. Peter Basilica. They gave great advice and the pizza was wonderful and affordable. I tried Tiramisu for desert. It was quite good.
"June 28, 2017",50,Best pizza I've had...ever!!,I work for a gourmet pizza place in the states and Pizza Zizza is the best pizza my husband and I have ever had. Don't think about it...just go! Their dessert was fabulous as well.
"June 27, 2017",50,Delicious,We have stopped by Pizza Zizza for a lunch! It was the best pizza that I've eaten in Rome! 😊 We have tasted vegetarian pizzas and ıt was really good! Go and taste!
"June 27, 2017",50,Great pizza and service!,"This is legit delicious pizza. Honestly, maybe the best I've ever tasted. Service was great and very friendly. And the value was also good. Eggplant and pesto was the standout."
"June 27, 2017",40,Small but tasty,It's a very small place. Only few tables but good taste of pizza. Variety of selections. Not wood oven.
"June 26, 2017",50,The best pizza,"We just came from Vatican and found this place by TripAdvisor. Great pizza, a lot of genuing flavours. Friendly and very funny staff. Highly recommended, you want regret. We will try tiramisu next time."
"June 25, 2017",50,Best Pizza We've tasted,Quite simply Pizza Zizza's make the best Pizza you could ever wish to taste. If you are going to the Vatican then I'd strongly recommend going. The Margarita Pizza was truly delicious.
"June 21, 2017",50,The best pizza in Rome!,Came here for lunch after the Vatican and was blown away by the food!! Would highly recommend to any and everyone going to Rome.
"June 19, 2017",50,Soooooo good!,"We were hungry, hot, and grumpy when we found this place. The food was wonderful and the service was great. It cost our group of four $22 for the sample platter. It was well worth it!"
"June 18, 2017",50,We loved it!,"Friendly place, very good pizza and tiramisu and the best service in Rome. We loved it and can't wait to visit you again."
"June 15, 2017",50,Perfecto!!,Pizza was very delicious and the service was great as well. We ordered a mix of different pizzas and pay 7 euro pro person for the pizzas.
"June 15, 2017",50,Best pizza in Rome! Next to Vatican,Hands down the best service and Pizza in Rome. Have to visit if near the Vatican. Get the mix platter at around €7 per person and be amazed!
"June 15, 2017",50,Great low key lunch,"Fantastic pizza, great staff very friendly and the desserts look amazing. Would really recommend this for lunch after a visit to the Vatican, it is walking distance"
"June 14, 2017",50,Great pizza,"Tiny place, great selection of pizza... Eggplant pesto is by far the best of all the slices. Rice balls were great as well. Well worth the visit"
"June 11, 2017",50,Excellent!!!!,"Best pizza in town, best beer, the service is excellent, Enrico & Roberto are charismatic, original and nice. They make a unique show! If you go there you'll not regret it!"
"June 7, 2017",30,Normal,"Quality to Price ratio is good. Prices per slice are between 2-4 euro but, nothing special considering the taste."
"June 5, 2017",50,Best filling station near Vaticano,When your dogs are barking and you're thirsty and hungry Pizza zeza is the place to go after the Vatican. Excellent service wonderful food. Very small but worth the wait.
"May 31, 2017",40,best pizza,"a variety of pizzas to choose from,reasonable prises and friendly staff, if you visit rome you should try ."
"May 26, 2017",50,Delicious!,"Absolutely delicious pizza! And very good-natured staff! They offered us a platter of various kinds of pizza, all amazing."
"May 26, 2017",50,Very tasty pizza for a good price,"After we read the good reviews, we decided to visit this place. We didn't regret. The pizza selection was delicious, and a portion was adequate. The staff was very friendly. Highly recommended."
"May 25, 2017",50,Best pizza,Best pizza in Rome. We had selection of pizzas and it was very tasty. It's small local pizzeria and you should visit it :)
"May 25, 2017",50,Great Pizza,Close to the Vatican and offering a great selection of freshly made pizzas. Staff were really friendly and helpful. Recommend you have the sampler platter. Good value.
"May 19, 2017",50,You !!must!! go there after Vatican visit,"I've visited the vatican and went there afterwards. Well, prices are very good, pizza is very good and the staff was extremely friendly!! They have special pizzas.. not only the default stuff you know from the menu of other pizzerias.. You must go there!!! ☺️"
"May 15, 2017",40,Lunch,"Best pizza ever, its really delicious. Very friendly staff. I waited like 15 minutes. Try the dessert. Ur gonna love it"
"May 15, 2017",50,I love it and recommande it 5/5,what a great restaurant and awesome pizza... the guys over there are just awesome... but you have to wait for 15min between 12h and 14h cause it is so small
"May 13, 2017",50,Best Pizza in Rome!,Amazing pizza and service. They went out of their way to provide us with the most comfortable experience. If the seats are all taken just wait and they will make every effort to accommodate you. The friendliest experience we had in Rome!
"May 8, 2017",50,Great pizza with a view,Pesto pizza is so good but the bacon pizza is to write home about. Plus there is a great view of the Vatican.
"May 6, 2017",50,The best place to have a pizza,"Brilliant. Literally, brilliant. The best pizza in town, the best atmosphere. If you get in Rome you should really have a pizza here. I highly recommend to all of you. 10+"
"April 29, 2017",50,Amazing place for quick food break,Just near the exit from the Vatican to the right nice pizza place. Don't compromise on nearby locations the pizza is excellent and the service is wonderful.
"April 23, 2017",50,Lunch Break,An ideal location for lunch when visiting The Pantheon. Polite friendly staff who made you feel welcome.
"April 22, 2017",30,Overrated,"We had vegetarian mix pizza. It tastes good but nowhere near special. You can easily find pizza like it every corner of Rome. Also, I wouldn't bother to wait for tables to sit."
"April 19, 2017",50,"Amazing pizza, great service!","These guys are awesome, serving fresh pizza that is super delicious. It is also very cheap and great for people who are on the go and want to visit as many places as possible in Rome."
"April 19, 2017",40,Great spot near the Vatican,Was having a though time choosing what I wanted when they recommended a tasting plate and I would highly recommend people to do the same. Tasty pizza and a very reasonable price in a great location for lunch near the Vatican.
"April 18, 2017",50,Great!,"Very nice place. Pizza is wonderfull! Beer is cold! And it's cheap! Lugar muito bacana, pizza muito saborosa, cerveja bem gelada e bem barato!"
"April 16, 2017",50,Tasty&Friendly,"Tasty&Friendly Pizza Pasta and Espresso!!! Stay there twice with my girlfriend, just near Vatican! Great"
"April 12, 2017",50,"Friendly, tasty and cozy","Try assorted square pizza slices, awesome stuff! An average check for 2 should be around 20 euros :)"
"April 11, 2017",50,Great pizza and service!,"We enjoyed a delicious lunch at this cafe; try the sampler if you have enough people or big appetites. Service was amazing and fast, and the prices were surprisingly low. Highly recommended!"
"April 6, 2017",40,Good pizza and service! Really liked it,"This is a friendly staffed restaurant, good variety of pizza at good prices, I liked it and would stop by again if I'm near"
"April 5, 2017",50,Best Pizza in Rome!,"This was most definitely the best pizza I had in Rome! It is very close to the Vatican, I recommend to go there when visiting Rome! The staff is also super friendly and lovely."
"March 14, 2017",50,Best pizza I ate in Rome,Don't get discouraged by the small place. It is worth to wait for a table in the street. We had a mixed pizza menu for four. All delicious! Very friendly and helpful service. Don't miss this place if you are close to Vatican!
"March 13, 2017",50,Perfect,"Wonderful, wonderful pizza. The owner was very happy and explained everything in English as soon as we came in. My daughter and I both decided it was probably the best pizza we have had."
"March 3, 2017",50,Pizza was unreal!,Got a selection of different pizzas and they were all incredible - probs best we've ever had. Also they gave us some free arancini which was nice! Really friendly staff too.
"March 1, 2017",50,The best pizza ever!,"Absolutely loved it! We tried 4 different pizzas and loves all of them, more so pizza with beef and arugula and pizza with pesto eggplant. Staff is super friendly :)"
"February 27, 2017",50,Fantastic pizza!,A real little gem! Recommend the mix pizza. Amazing base with simple but flavoursome toppings! Possibly the best pizza we have tasted!
"February 27, 2017",50,Delicious pizza,"We found this place on Trip Advisor and decided to give it a shot. Was not disappointed! Lots of varieties and friendly service. They give you the option of small pieces, so you can try a little bit of everything."
"February 24, 2017",50,Wonderful!,Really lovely staff. Very helpful and friendly. They explained all the flavours in English without us asking. They also suggested a really nice (and cheap!) wine. Perfect pit stop.
"February 15, 2017",50,So tasty pizza,"Nice service, it was fun to meet them. Delicious pizza, you can taste many different kinds. There is also delicious craft beer. Located just next to Vatican"
"February 14, 2017",50,excelent food,"A small restaurant like many others in Rome but pizza is exceptional, and with very friendly attitude of those who served have made a break between sightseeing make us feel very good that we can continue."
"February 9, 2017",40,Great quick pizza,Really good diversity of pizza with great taste. They offer a variety for a fix price per each person. All were good and warm. Attentive service.
"February 7, 2017",50,The best pizza in Rome !,"A small place with great atmosphere. Pizza is delicious, in my opinion it's the best pizza in Rome. Yummy !"
"February 4, 2017",50,Awesome pizza,Find this place! It's awesome! Great pizza! Very close to the Vatican! We spent the day at the Vatican and walked about 10 minutes to this place.
"February 2, 2017",50,AMAZING,"Best pizza i had in Rome, reasonably priced and friendly staff. Only negative comment is my boyfriend and i went back for the second day in a row it was so amazing but it was closed."
"January 30, 2017",50,Super Pizza,"Amazing Pizza close to vatican, easy to find and with excellent friendly service. Would definitely recommend it."
"January 28, 2017",50,Amazing pizza and service,Such a friendly bunch and pizza was delicious🍕a little hard to find because the name was slightly hidden. Small inside and I think they need a few more tables outside. But overall it was great!
"January 27, 2017",50,Best pizza in Rome,"I LOVE pizza and after many visits to pizzerias in Rome, this one has been the stand out favourite. The pizza was amazing. The service is also brilliant, very friendly and welcoming"
"January 24, 2017",50,Fabulous pizza and great lively service,"Pizza is amazing, service is friendly, fun and gives the place a great buzz. Definitely worth a visit if you're in Rome"
"January 21, 2017",50,Hmmmmmm!,wow! This place is awesome. The pizza is sooooo good. A little bit tricky to find. We just happened upon it & so glad we did!
"January 21, 2017",50,Best place in town,Excellent service and quality of food. Totally reasonable price. It was very tasty and variaty was huge.
"January 20, 2017",50,Pizza near Vatican,Lovely selection of pizza suggested by the owners. Friendly staff and fast efficient service. Reasonable price. Good beer and good tirimasu!
"January 13, 2017",40,Quick family lunch,"Enjoy the variaty of pizza, they are delicious. Good taste and good choice. Nice service and really cheap"
"January 13, 2017",40,Great Pizza!,The pizza was excellent... The atmosphere and the people were great despite it is a small place with a couple of tables. I would definitely visit again.
"December 29, 2016",50,"Great food, great people",The outstanding pizza will make you smile. The service will make you smile. The people will make you smile.
"December 28, 2016",40,Very friendly and good food,Had 4 different pizza's and they were all good. The owner is a very friendly guy with a good talk and makes the wait a fly by
"December 26, 2016",50,Amazing pizza,Truly lovely staff and amazing pizza! Would definitely recommend! First pizza in Rome and I have a feeling it will be hard to top!
"December 22, 2016",50,famlly vacation,they treated you like family robert was the best the pizza was outstanding being from the united states i felt like i was at home we would go back to rome just to eat at zizza's
"December 22, 2016",50,Fantastic experience,"We saw this place on TripAdvisor and figured that we have to try the pizza joint rated 5 stars. Phenomenal service, great pizza, and a good location gives this place 5 stars in my books."
"December 22, 2016",40,Cheap. Good. Friendly,"Staffs are friendly, pizzas are good. Price is reasonably cheap. The only hassle is the very limited seats. Only 10 seats with tables outside the place with heater on the wall. Nonetheless. I would recommend."
"December 11, 2016",50,Great little pizza place right outside the Vatican,"We were looking for a place to have lunch after the Vatican tour, found this place thanks to TripAdvisor and it was just great. Small family Pizzeria with great variety, good draft beer and very friendly service."
"December 7, 2016",50,the best,"It is the best place for have a pizza. Kind staff, cheap prices and the best pizza at Rome, located near to the Vatican."
"December 6, 2016",50,Excellent pizza friendly staff,"In this place you can eat the best pizza near the Vatican city. Reasonable prices, fresh pizza, excellent tiramisu. A highlight of eating in Rome!"
