"July 27, 2016",50,One of the best restaurant - classic cuisine,Great fish and great meat. Great portions of food and famous because Real Madrid Players usually go there to eat. Fantastic food
"July 4, 2016",50,Perfect,"It was so delicious. Great atmosphere and quick service. If you want to eat special meal, you should go ;) Thank you for everything."
"March 22, 2016",50,"Fantastic food, great location","Asador Donistiarra was the perfect setting for our business dinner. Service was impeccable, staff was very friendly and professional. The food was somewhat price but certainly worth it. We will be back"
"February 17, 2016",40,Great atmosphere and excellent food,This is a must go restaurant in Madrid. Really nice place and very good food and wine. Basque taste.
"December 26, 2015",50,Best restaurant in Madrid!!!,"Food, atmosphere, service! All perfect absolutely the best in Madrid! Don't go before 10pm it is authentic Madrid and you won't get the experience. They treat everyone like royalty! Simply the best!"
"July 10, 2015",50,Delightful,Probably one f the best eateries in Madrid. The appetizers were amazing and the entrees were very good portion sizes. Perhaps the best steak in Madrid.
"October 21, 2014",50,One of the best restaurants in the world,best lamb with potatos in the world. frecuently visited by soccer players and famous people. I go there every time I am in Madrid.
"September 4, 2014",50,Great fun to cook your own steak!,"Very good food & great fun to cook your own steak at the table with friends. Always a good friendly and relaxed atmosphere (so long as you go after 9pm),"
"April 16, 2014",50,second time was even better,Enjoyed dinner more than the first time . The wine was great . We always go earlier and it's never any have issues. The servers are polite and friendly. Would like to go make soon.
"March 14, 2014",40,Excellent steaks!,"This was a great find! Unbeknownst to us, it is obviously something of an ""institution"" as the walls bedecked with photos of the great and famous testify. And the food was certainly a testament to its popularity. Recommended for a special night out."
"February 15, 2014",50,"Great meat, great wine, great atmosphere","Really a must do in terms of restaurants in Madrid. Close to the soccer stadium so a good location after a soccer match - remember tobook in advance. Order the meat to be grilled at your table and my favourite wine, Hacienda Monasterio.Recommended!"
"December 22, 2013",50,Extreme friendliness and top service,"Apart from the top quality fish and meat and professional service, the rating is based on the detail that we arrived at 00:30 from the airport but still were welcomed with extreme friendliness because of the fact that it was a birthday."
"December 16, 2013",40,Always at an excellent level,"Excellent service, great food. It is not cheap but you get excellent quality. Be careful portions are really big. We ordered the Chuleton for 3 only and still was a lot (instead of 4)."
"July 30, 2013",40,"Slightly pricey, but good quality","The restaurant had been recommended to us. It didn't disappoint. Quality was good and plenty of staff around to help, Atmosphere was pleasant. Only down side is that it has above average pricing. ""Free sweets"" are a bonus"
"April 8, 2013",40,Great Food in Traditional Atmosphere,"If you like traditional spanish food and don't mind so much about the restaurant's outdated interior, then Asador Donostiarra is definitely the place to be for fantastic food. Tip: No need to order desert.. they overload you with chocolate, biscuits and liquers!"
"December 3, 2012",50,Excellent food and service,Wonderful experience. Was there in a group of 6 and enjoyed every part of it. The starters were delicious as were the main courses. Had the beef that you cook on a hot terracotta plate...delicious! Would recommend and go back any time.
"October 2, 2012",20,Tourist Trap,"Tourist-Trap. “Special Chuleton” was tasteless and chewy. Be aware, this a a very expensive restaurant, we ended paying more than 70€ per person."
"September 23, 2012",30,Good food gone mediocre,"After 15 years of going to this ""used to be great "" restaurant, my favorite dish, chipirones en su tinta,was a big disappointment. The inky sauce was bland to say the least. The service was slow and pretty much ignored our table. Never again ."
"July 12, 2012",30,Touristy,"“Special Chuleton” (beef chop) was average. Very expensive, don’t worth it."
"July 2, 2012",50,Are you a football star? Would like to see one?,"Excellent food. A little pricey, but the place to go if you want to see a football star. This is one of their favourite restaurants in Madrid"
"June 4, 2012",20,Don’t worth the money you pay!,"We ordered the “Chuleton”. The quality of the meat was so-so. Service was poor. Not worth the money you pay, massively overpriced!"
"March 30, 2012",10,"Not worth it, only famous for the names that go there.","Massively overpriced, very limited menu, dated decor and no ambience as there was no one there at peak time on a saturday night."
"March 6, 2010",50,Best meat in Madrid,"delicious food. order the ""chuletón especial"" for 2. staff is nice, they even offer you a ""digestive"" at the end. A little expensive, but it worths every euro."
"January 10, 2019",40,Amazing,"Site with very rich and original food. It is super abundant and is well priced. Very good attention. It cost approximately 16 euros per person, with starter to share and main and drink."
"July 13, 2018",50,Ezciring,Had a super time. Food was onpoint and everyone enjoyed the great eats. Dogs everywhere not to sire about that. We retirned to aet here again. Great pdople to meet. Thansks to daniel for showing is differant recipes.
"July 28, 2017",50,Wowsers!,Foodtruck is superb! From the quality of the food to the wonderful service. It cannot be faulted! The host was welcoming and thoughtful and nothing was too much trouble. Something very different but absolutely fabulous in Madrid!
"January 30, 2017",50,What a burger! !,"Excellent burger... Excellent service.... staff was so helpful and worked so hard to get my order perfect despite a language barrier! Very clean and calm atmosphere, suitable for all ages."
"March 20, 2016",50,Speechless,If you love burgers and your going to Madrid than you surely have to visit FoodTruck. The burgers are so delicious you just wish its never over. The crispy onions in the bun makes it even more delicious. Thank you food truck
"January 17, 2019",50,"The Bermuda Triangle of food: Quality, Quantity and Price.","Giant burgers, delicious and a surprisingly well-adjusted price for them (which means they're not fast-food cheap, but still cheap for the amount and quality of food you get). We almost didn't make it to the desserts because of how full we were. The cheese sticks...More"
"January 10, 2019",40,Amazing,"Site with very rich and original food. It is super abundant and is well priced. Very good attention. It cost approximately 16 euros per person, with starter to share and main and drink."
"July 13, 2018",50,Ezciring,Had a super time. Food was onpoint and everyone enjoyed the great eats. Dogs everywhere not to sire about that. We retirned to aet here again. Great pdople to meet. Thansks to daniel for showing is differant recipes.
"September 23, 2017",50,Fantastic meal,"Had dinner here with our teenage daughters. Waiter (Orla) did not speak much English but was very helpful, polite and attentive. English menu provided (good as our Spanish isn't particularly good). Ordered corn dogs as the girls wanted to try them - very sweet so left most of it and the owner insisted on removing them from the bill - even though we tried to explain they were nice but just too sweet for us. Was really impressed when told he does not believe that people should pay for something they did not enjoy. Husbands pulled pork burger was the best he's ever eaten he said. Daughters macaroni sandwich was devoured (and she's a really picky eater). Our burgers were delicious and cooked well done - some other places the meat was still pink even though we asked for it not to be cooked that way. Wonderful place. Busy with locals picking up orders so obviously got a good reputation. Would definitely go back."
"July 28, 2017",50,Wowsers!,Foodtruck is superb! From the quality of the food to the wonderful service. It cannot be faulted! The host was welcoming and thoughtful and nothing was too much trouble. Something very different but absolutely fabulous in Madrid!
"January 30, 2017",50,What a burger! !,"Excellent burger... Excellent service.... staff was so helpful and worked so hard to get my order perfect despite a language barrier! Very clean and calm atmosphere, suitable for all ages."
"January 15, 2017",50,Best Burgers in Madrid,"Although the place is crowded and sort of small the quality of the Burgers is food is good. Service is slow and portions are big. Don't go for fancy Burgers as you might be disappointed. Burger patties flavor is very good. Overall price is convenient, all tough if you are in a budget drinks, will increase your tab substantially."
"March 20, 2016",50,Speechless,If you love burgers and your going to Madrid than you surely have to visit FoodTruck. The burgers are so delicious you just wish its never over. The crispy onions in the bun makes it even more delicious. Thank you food truck
"December 26, 2015",40,Great brugers,"Went with the family after Christmas, burgers are huge, but don't think it's quality over quantity! The burger patties were cooked exactly how everyone wanted it, the chips were great, and the beer selection was bigger than I thought, with a number of American beers available. Good place to go with friends for a quick bite to eat"
"July 20, 2015",40,Huge burgers!,The burgers here where enormous and very good! Not the best burger I had in Madrid but still very good! I tried the Fanta Strawberry which we dont have in our country. The waiter was not very friendly...we had to google translate all the menu because we dont understand spanish...in other restaurants the waiters offered to translate menus for us when not available in english but not here.
"January 17, 2019",50,"The Bermuda Triangle of food: Quality, Quantity and Price.","Giant burgers, delicious and a surprisingly well-adjusted price for them (which means they're not fast-food cheap, but still cheap for the amount and quality of food you get). We almost didn't make it to the desserts because of how full we were.  The cheese sticks are DELICIOUS (and huge too, of course).  The staff were friendly and helpful beyond duty, and you can tell they love what they do.  Probably the best burger place in Madrid!!"
"January 10, 2019",40,Amazing,"Site with very rich and original food. It is super abundant and is well priced. Very good attention. It cost approximately 16 euros per person, with starter to share and main and drink."
"July 13, 2018",50,Ezciring,Had a super time. Food was onpoint and everyone enjoyed the great eats. Dogs everywhere not to sire about that. We retirned to aet here again. Great pdople to meet. Thansks to daniel for showing is differant recipes.
"September 23, 2017",50,Fantastic meal,"Had dinner here with our teenage daughters. Waiter (Orla) did not speak much English but was very helpful, polite and attentive. English menu provided (good as our Spanish isn't particularly good). Ordered corn dogs as the girls wanted to try them - very sweet so left most of it and the owner insisted on removing them from the bill - even though we tried to explain they were nice but just too sweet for us. Was really impressed when told he does not believe that people should pay for something they did not enjoy. Husbands pulled pork burger was the best he's ever eaten he said. Daughters macaroni sandwich was devoured (and she's a really picky eater). Our burgers were delicious and cooked well done - some other places the meat was still pink even though we asked for it not to be cooked that way. Wonderful place. Busy with locals picking up orders so obviously got a good reputation. Would definitely go back."
"July 28, 2017",50,Wowsers!,Foodtruck is superb! From the quality of the food to the wonderful service. It cannot be faulted! The host was welcoming and thoughtful and nothing was too much trouble. Something very different but absolutely fabulous in Madrid!
"January 30, 2017",50,What a burger! !,"Excellent burger... Excellent service.... staff was so helpful and worked so hard to get my order perfect despite a language barrier! Very clean and calm atmosphere, suitable for all ages."
"January 15, 2017",50,Best Burgers in Madrid,"Although the place is crowded and sort of small the quality of the Burgers is food is good. Service is slow and portions are big. Don't go for fancy Burgers as you might be disappointed. Burger patties flavor is very good. Overall price is convenient, all tough if you are in a budget drinks, will increase your tab substantially."
"March 20, 2016",50,Speechless,If you love burgers and your going to Madrid than you surely have to visit FoodTruck. The burgers are so delicious you just wish its never over. The crispy onions in the bun makes it even more delicious. Thank you food truck
"December 26, 2015",40,Great brugers,"Went with the family after Christmas, burgers are huge, but don't think it's quality over quantity! The burger patties were cooked exactly how everyone wanted it, the chips were great, and the beer selection was bigger than I thought, with a number of American beers available. Good place to go with friends for a quick bite to eat"
"August 23, 2020",50,Best Meat Ever!,"Best Meat Ever! Enjoyed the meat so much.. it was what i asked for, very soft and yummy.. very professional restaurant and would definitely go again!"
"July 22, 2018",50,The best meat restaurant in Madrid,Excellent restaurant serving the best meat in town. Genuinely great experience. Service was first class with seasoned professional waiters. The food even better with the centrepiece being some of the finest cuts of red meats. Thoroughly recommended for foodies!
"November 9, 2017",50,Still my favorite,"This place opened back in the early 80’s, I have been coming ever since then and still can say the quality is maintained. Prices have gone up, but if you like meat, you will love it!!"
"April 30, 2016",50,Love this place!,"A great place for meat lovers ! It's also gluten free and great value for money, will definitely be going back ."
"May 29, 2008",40,The real spanish beef is...,"The real spanish beef is in this house, these guys know how to handle a bull. The best of Madrid steakhouses out of many good ones"
"October 12, 2020",50,THE BEST PLACE FOR ARGENTINIAN BEEF AND EXCELENT SERVICE,"We had lunch at the veranda with an excellent service and food. Please try the ""mollejas"" (sweet breath) with lemon juice!!!! Good selection of wines and drinks."
"July 16, 2020",50,Great atmosphere,"Overall great food and atmosphere. We started off with a small portion of soup, very tasty, then our dinner and after we finished off with some sweet digestives 😊 Great Restaurant!"
"May 9, 2019",50,Extreme quality,This place is well located and beautiful I recommend the meat and chicken but even their fish and pasta is good It’s not cheap But the quality worth it
"March 15, 2019",50,Argentinian food,"High quality Argentinian food. Great ambiance, similar to an American steak house restaurant. Was there with my work colleagues (group of 12). Went for the set menu and was absolutely stuffed by the end of the evening."
"February 7, 2019",50,Best food!,"Amazing food, the stuff is so kind, the food is amazing and the deserts are so delicious is a nice place to have a romantic dinner wirh your wife."
"November 3, 2018",50,Wow,One of the best steak house in madrid I had here and best indian is in very near from bernabau LUMBANI TANDOORI WOW WOW WOW WAT A EXCELLENT SERVICE ( thanx to this 2 restaurante in madrid highly recommended this 2 restaurante
"September 14, 2018",50,Must go,"A must go for both bussiness and pleasure, the food is delicious and I mean really delicious. The atmosphere is relaxed and the staff attentive and polite."
"August 7, 2018",40,Great for steak and not too pricey,"De Maria is a very reliable restaurant when you feel like a steak (with chimichurri), good service and a relaxed atmosphere. It is reasonably priced particularly as they don't charge extra for the cava, olives, gazpacho, bread, mini desserts and petit fours!! I'll be back!!!"
"July 12, 2018",40,Great restautant,I had lunch at 'De Maria' in Hortaleza and the food was great! If you want to share a nice meal with friends or family you should make this restaurant a visit. Nice food and nice service.
"February 15, 2018",40,Very nice place,Nice place We were there for lunch Very nice place you need reservation The portion are nice If the meat were beter then it would’be perfect But for Argentina meat iris good
"December 4, 2017",40,Nice cosy place for good meat,"If only the waitress was a little bit more smiling the place would be great. The meats served are delicious, the portions ok. The wines are excellent and very decent prices. Very cosy and nice athmosphere"
"July 3, 2017",50,"NICE, AND VERY GOOD FOOD","We went there for a special occasion. The service was real good, and the food is EXCELENT. You can go in your car, it has a valet."
"March 31, 2017",50,Delicious,"The service is good, the food is tasty! We visit it every time we go to madrid, the chicken and steaks with the chumichurri sauce are a must try."
"February 13, 2017",50,Just gets better every time,"OK, we go to Madrid pretty frequently and this is one of our ""go to"" spots. The steak is spectacular and the service is excellent. Don't miss it if you have time. Personnally, I like this location better than the others."
"November 26, 2016",50,Almost forgot,To review this place and these guys deserve it. Attentive service and good food combined with ambiance. Lots of nice places to dine nearby but you cannot go wrong here. Close to subway stop too. Go!
"November 15, 2016",50,Great meat and atmosphere,A great meat restaurant off plaza castilla. My husband said the pasta was very good and my empanadilla very tasty. The meat was divine with a really nice charcoaled taste. You must go there!
"April 8, 2016",30,"Great meat, avoid everything else",The meat was exceptional. It really was. The Appetizers and the dessert were both lackluster. I would only order the entree's at this restaurant.
"April 16, 2015",40,Both elegant and relaxed,If you want to share a nice meal with friends or family you should make this restaurant a visit. Nice food and nice service.
"March 15, 2015",40,Meeting Meat,"When I'm in Madrid I have a dinner in this restaurant to eat meat, if possible. The ambient is modern-classic, the staff is professional, the food quality is high. The price is aligned."
"July 2, 2014",50,Excellent Food - Excellent Service,"Great variety of Entrees, Main Dishes and Deserts and Wines. Genuine Argentinian Meat! Very friendly service. Valet parking service available. Met all expectations!"
"April 2, 2013",50,Best meal in years,"We had a group dinner and everything was perfect. It was an all inclusive meal with starters , main course and dessert and the food was 5 star. I did not know meat like this exist in Europe and only tasted this quality in Argentina."
"May 26, 2012",50,Excellent,Prompt and efficient service with an outstanding menu selection. Very affordable and a welcome break from the extreme heat of the day.
"November 28, 2011",40,excellent meat,"This is an argentinian-like restaurant in Madrid. Best meat in town, particularly the ""lomo alto fileteado"". To be ordered with ""patatas soufflé"", a must. A bit expensive but affordable. Perhaps a little noisy. Need reservation, particualrly on week-ends."
"October 23, 2011",50,What a surprise!,Looks like a bar from the street. Great modern decor met us as we walked in off the street on Sunday afternoon. Very good food especially grilled meats and chorizo from open grill at the bar. Service good. All for €35 a head.
"March 17, 2010",50,For carnivores!,"In my last visit to madrid I went to this restaurant, the meat is just fantastic, I had the best argentine steak ever!!!!!The restaurant is very beatiful and the service very kind! If you love meat, this is your place!"
"January 5, 2010",40,Great steak!,I had dinner at 'De Maria' in Hortaleza and the food was great! I had spicy sausages and a steak for 2 to share plus a bottle of wine... I am definitely going back to this restaurant next time I go to Madrid!!!
"September 26, 2008",40,Celebrities spotted,A bit pricey but very good meat and profesional service. Book in advance!! Good resturant to spot some celebrities as you can deduce after the photos displayed. One of the Real Madrid favourites.
"April 18, 2008",40,"An outstnading ""argie"" if you want a good steak and feel like you are in Argentina. Great service but not...","An outstnading ""argie"" if you want a good steak and feel like you are in Argentina. Great service but not cheap."
"April 12, 2008",10,when your fangs itch for...,when your fangs itch for an argentian meat quicky
"April 1, 2008",30,good but expensive for what it is,good but expensive for what it is
"March 12, 2008",40,good meat,good meat
"December 17, 2007",40,Good quality and well priced considering you'll be sitting next to Raul or Beckham :),Good quality and well priced considering you'll be sitting next to Raul or Beckham :)
"September 26, 2008",40,Celebrities spotted,A bit pricey but very good meat and profesional service. Book in advance!! Good resturant to spot some celebrities as you can deduce after the photos displayed. One of the Real Madrid favourites.
"June 30, 2008",40,A meal to remember,"We went to Le Maria for a supper during a business trip to Madrid. It was very, very good food. They do not have English menus or many waiters that know English, so ordering was pretty difficult. But the food was amazing. It's a small...More"
"April 18, 2008",40,"An outstnading ""argie"" if you want a good steak and feel like you are in Argentina. Great service but not...","An outstnading ""argie"" if you want a good steak and feel like you are in Argentina. Great service but not cheap."
"April 12, 2008",10,when your fangs itch for...,when your fangs itch for an argentian meat quicky
"April 1, 2008",30,good but expensive for what it is,good but expensive for what it is
"March 12, 2008",40,good meat,good meat
"December 17, 2007",40,Good quality and well priced considering you'll be sitting next to Raul or Beckham :),Good quality and well priced considering you'll be sitting next to Raul or Beckham :)
"September 26, 2008",40,Celebrities spotted,A bit pricey but very good meat and profesional service. Book in advance!! Good resturant to spot some celebrities as you can deduce after the photos displayed. One of the Real Madrid favourites.
"June 30, 2008",40,A meal to remember,"We went to Le Maria for a supper during a business trip to Madrid. It was very, very good food. They do not have English menus or many waiters that know English, so ordering was pretty difficult. But the food was amazing.  It's a small place, but very stylish. We made reservations at 9pm, when the restaurant opened for supper, and by about 10-10:30 the place was packed. You are supposed to see lots of celebrities there but we didn't (except for the ones on their memory wall).  We had a starter of baked cheese, it was very good. On the house they also brought out fried shrimp and Chorizo. The Chorizo, Argentina sausage, was by far the best. For the main course we had two different cuts of Argentina beef and one fish. (The fish was the last one on the fish section--I can't remember the name). My fish was moist and very tasty. There was an orange colored sauce under which was very smooth, not fruity. They also brought us some potato chips, but not your ordinary chips, these looked like mini pillows, fried. They were very addictive!!  For desert, we ordered the doulche (something like that), which was vanilla ice cream on top of a cookie covered in chocolate. On the plate was a vanilla pudding with strips of chocolate over top. One of the best deserts I've ever had. They also brought us on the house warm apple pie with vanilla ice cream and these sherbet shooters. The shooters were the best probably.  Total for the food we ordered (one starter, 3 meals, 1 dessert, 2 waters, 1 beer, 1 glass of wine) our total was 135 Euros. A meal to remember!!"
"April 18, 2008",40,"An outstnading ""argie"" if you want a good steak and feel like you are in Argentina. Great service but not...","An outstnading ""argie"" if you want a good steak and feel like you are in Argentina. Great service but not cheap."
"April 12, 2008",10,when your fangs itch for...,when your fangs itch for an argentian meat quicky
"April 1, 2008",30,good but expensive for what it is,good but expensive for what it is
"March 12, 2008",40,good meat,good meat
"December 17, 2007",40,Good quality and well priced considering you'll be sitting next to Raul or Beckham :),Good quality and well priced considering you'll be sitting next to Raul or Beckham :)
"September 26, 2008",40,Celebrities spotted,A bit pricey but very good meat and profesional service. Book in advance!! Good resturant to spot some celebrities as you can deduce after the photos displayed. One of the Real Madrid favourites.
