"August 12, 2010",50,Best steak ever,"Everything was absolutely fantastic from appetizer to dessert. The service was impeccable-first class. The steak was so tender I could cut it with a fork. Pricey, but worth it for every delicous mouthful."
"April 28, 2010",50,A Real Old-Style Steak Powerhouse Restaurant.,"Wonderful meat. Old fashioned, wood-panelled, slightly dark very traditional meat lovers temple! Great cocktails as well. You can eat other things here but go for the steaks! Old fashioned servers too.... Just what a steak place should be... Reasonably dressy although not required."
"March 24, 2009",50,"Oh boy, it's so good! I'm drooling just thinking about the steak that I had.","Oh boy, it's so good! I'm drooling just thinking about the steak that I had."
"January 21, 2009",40,"Love Harris' because I love good, dry, aged beef. Seared, seasoned well - but... Then there is the crowd... Makes it so...","Love Harris' because I love good, dry, aged beef. Seared, seasoned well - but... Then there is the crowd... Makes it so less fun. Go on off hours like we do where your server can treat you like the star that you are!!!!"
"December 31, 2008",30,"Food was good, but they...","Food was good, but they got my order wrong. Not what you expect for the price."
"November 7, 2008",40,Kobe ribeye was excellent.,Kobe ribeye was excellent.
"October 30, 2008",40,Can't beat it for red meat,Can't beat it for red meat
"August 2, 2008",40,"Old school steak house, portions are huge!","Old school steak house, portions are huge!"
"July 21, 2008",50,The best,The best
"June 9, 2008",30,Old school!,Old school!
"May 25, 2008",30,Would like to return since we got sick on our honeymoon and had to leave early.,Would like to return since we got sick on our honeymoon and had to leave early.
"May 23, 2008",50,The filet mignon melts in your mouth.,The filet mignon melts in your mouth.
"May 19, 2008",50,Great steak and service...,Great steak and service. Had the ribeye and loved it.
"April 30, 2008",50,great steak!,great steak!
"April 29, 2008",50,Best Steak any where in...,Best Steak any where in the world. But eat in the bar.
"April 25, 2008",30,Click to add a comment,Click to add a comment
"April 19, 2008",40,This was a tough one... Bobo's is also outstanding and I love the Au Poive at Izzy's... But Harris' Steak Dianne is...,This was a tough one... Bobo's is also outstanding and I love the Au Poive at Izzy's... But Harris' Steak Dianne is puuurfect
"April 14, 2008",40,Great food and excellent...,Great food and excellent service!
"March 23, 2008",40,Excellent thats it ! great food and service,Excellent thats it ! great food and service
"March 18, 2008",40,STEAK!!!,STEAK!!!
"February 5, 2008",40,I recomend the porterhouse cut.,I recomend the porterhouse cut.
"January 30, 2008",40,Steak!!!,Steak!!!
"January 23, 2008",40,Favorite steak house in...,Favorite steak house in SF
"January 22, 2008",40,great steak house,great steak house
"January 11, 2008",50,Love this place!,Love this place!
"December 29, 2007",20,Not the City's best steakhouse but another choice at least.,Not the City's best steakhouse but another choice at least.
"December 16, 2007",40,"vanilla bean creme bulee, hmm...","vanilla bean creme bulee, hmm..."
"December 12, 2007",50,Went for a Birthday back...,"Went for a Birthday back in 01, can't remember what I had but the food was excellent!"
"November 26, 2007",40,Suhr's X-Mas Eve dinner...,Suhr's X-Mas Eve dinner every year
"November 21, 2007",50,My favorite place to get...,My favorite place to get a steak in the city!
"November 21, 2007",40,Best steak I've ever had...,"Best steak I've ever had in a restaurant. Would say 5 stars, but it's pricey--very high end. The atmosphere is great though--you could imagine the Rat Pack sitting in a booth in the back smoking cigars."
"November 17, 2007",20,"Good steak, not much else to say","Good steak, not much else to say"
"November 14, 2007",40,pricey and high-end. i...,"pricey and high-end. i liked the steaks but wasn't blown away by them. considering the price, i should have been. good but not great."
"November 21, 2007",50,My favorite place to get...,My favorite place to get a steak in the city!
"November 21, 2007",40,Best steak I've ever had...,"Best steak I've ever had in a restaurant. Would say 5 stars, but it's pricey--very high end. The atmosphere is great though--you could imagine the Rat Pack sitting in a booth in the back smoking cigars."
"November 17, 2007",20,"Good steak, not much else to say","Good steak, not much else to say"
"November 14, 2007",40,pricey and high-end. i...,"pricey and high-end. i liked the steaks but wasn't blown away by them. considering the price, i should have been. good but not great."
"April 20, 2007",50,Great Steak - Old school classy,"I read some of the reviews and was surprised at some of the less satisfied patrons. I took my wife and daughter here for wife's B-day. She loves steak and I had seen this place before, decided to give it a try. First of all...More"
"April 1, 2007",20,Not as good as Outback,"I ate at Harris' on 3/31/07 and probably won't ever go back. This is the third time I've eaten there and in each case I was charged about $43 for a fillet that was not anywhere near as good as Outback Steakhouse which charges about $20. The fillets I've gotten at Harris' were only about an inch thick and had noticable grissle. Outback's fillets are always perfect cuts of meat. Harris' simply are not worth what you pay for them in my opinion. The decor of Harris' is beautiful. Very upscale, very masculine. Everything a great steakhouse needs to be...except the steaks. Really disappointing."
"June 8, 2006",30,Good Steakhouse,Coming from NYC I guess I expect a bit more from a Steakhouse. Not that I have any really negative to say about Harris'. I enjoyed my meal and left with a smile. I just feel that when I spend $200 for dinner for 2 it should blow me away. I had the NY Strip she had the Filet. Both were very good and the potato was excellent.  I was a little disappointed in my special appetizer which was the Dungeness Crab Cocktail. I guess I didnt expect shredded crab. I loved the Martini barrel!  Good restaurant - but not worth going out of your way for. Service was excellent though!
"January 20, 2005",20,Bad Service Ruined a Good Dinner,"The steak was great. The caesar salads were the best ever. The service really was snobby, however. Our waitress failed to offer any sauces (oh my!!, just kidding, but she didn't offer, just one example). We tried to order dessert at the meal's end, but instead she plopped down the check and walked abruptly away. No ""Thank you..."" No ""Anything else?"" The meal was very expensive ($120 after wine, for two). We know this is San Francisco.. but even still.. a little bit of common courtesy would be nice. I wrote the manager later and he responded, pleading with us to come back. Frankly, although the food was great, there are too many restaurants in that area, and much cheaper @ that.. to waste our time returning to Harris'. Nice decor, terrible, impersonal service, great food. Steaks everywhere are either great, or okay. We therefore don't think it would be too difficult to get a good steak elsewhere in the area. Harris' rides on its reputation. Also, we could hear booming car stereo speakers as cars drove by the restaurant, outside (and we weren't by the window, either). Nice place, though, overall. We were a bit offended by the service, as this was supposed to have been an anniversary dinner (and the restaurant knew this). We've had friendlier service at Applebee's. No joke. Comparing Harris' to a place like Fifth Street would be like comparing Shakespeare to a comic book (Harris'). Oh yes, I asked for a refill on a drink, and never got one.. that was quite hilarious. The same girl waited on a table adjacent to ours.. we watched that couple wait, wait, and just look disappointed. We share a ""knowing glance"" at each other, silently saying, ""yes, the service here SUCKS and SUCKS BAD..."" Pretty hilarious. Again, $120--before tip-- to be treated like sh_t."
"November 8, 2004",50,best steak dinner ever,"At the advice of our hotel concierge, we made a reservation at Harris' for our 20th anniversary dinner. The cheese spread that accompanied the bread basket was tasty so we requested and were happiliy supplied with more. The butternut squash soup, a special that evening, was out of this world. I would have licked the bowl if it wasn't such a fancy place. The main attraction, the steaks, were perfectly cooked and delicious. It was the best steak my husband & I ever had. Service was professional and courteous. Seating was comfortable in a large booth. The only surprise was the $7 valet parking fee."
"November 21, 2007",50,My favorite place to get...,My favorite place to get a steak in the city!
"November 21, 2007",40,Best steak I've ever had...,"Best steak I've ever had in a restaurant. Would say 5 stars, but it's pricey--very high end. The atmosphere is great though--you could imagine the Rat Pack sitting in a booth in the back smoking cigars."
"November 17, 2007",20,"Good steak, not much else to say","Good steak, not much else to say"
"November 14, 2007",40,pricey and high-end. i...,"pricey and high-end. i liked the steaks but wasn't blown away by them. considering the price, i should have been. good but not great."
"April 20, 2007",50,Great Steak - Old school classy,"I read some of the reviews and was surprised at some of the less satisfied patrons. I took my wife and daughter here for wife's B-day. She loves steak and I had seen this place before, decided to give it a try.  First of all people must understand, the best west coast steak is probably a 6 out of 10 compared to mid west steak houses. I have eaten at Morton's in Chicago and Mortons in Los Angeles and Las Vegas, the Chicago steak is twice as good hands down. Same with Shula's and others. I found Harris's rib eye to be VERY tasty, cooked perfectly, juicy and flavorful. Just as good as a Chicago steak.  The building is nicely decorated. It's old school high class motif. leather booths, high ceilings, large paintings.  The parking valet was professional and friendly. The hostess was prompt and friendly. The wait staff was very professional. The bus staff was equally as professional. The manager stopped by our table to check on us.  This restaurant measured up and did their job by the numbers. If I were a food critic I would have to rate it very high. I am not a professional critic, I'm just an average guy with a steak loving family who appreciates a fancy restaurant every now and then. We love San Francisco and our dinner at Harris's will forever be a pleasurable memorable experience. I highly recommend it to others. It is one of the best west coast steaks I have ever had."
"April 1, 2007",20,Not as good as Outback,"I ate at Harris' on 3/31/07 and probably won't ever go back. This is the third time I've eaten there and in each case I was charged about $43 for a fillet that was not anywhere near as good as Outback Steakhouse which charges about $20. The fillets I've gotten at Harris' were only about an inch thick and had noticable grissle. Outback's fillets are always perfect cuts of meat. Harris' simply are not worth what you pay for them in my opinion. The decor of Harris' is beautiful. Very upscale, very masculine. Everything a great steakhouse needs to be...except the steaks. Really disappointing."
"June 8, 2006",30,Good Steakhouse,Coming from NYC I guess I expect a bit more from a Steakhouse. Not that I have any really negative to say about Harris'. I enjoyed my meal and left with a smile. I just feel that when I spend $200 for dinner for 2 it should blow me away. I had the NY Strip she had the Filet. Both were very good and the potato was excellent.  I was a little disappointed in my special appetizer which was the Dungeness Crab Cocktail. I guess I didnt expect shredded crab. I loved the Martini barrel!  Good restaurant - but not worth going out of your way for. Service was excellent though!
"January 20, 2005",20,Bad Service Ruined a Good Dinner,"The steak was great. The caesar salads were the best ever. The service really was snobby, however. Our waitress failed to offer any sauces (oh my!!, just kidding, but she didn't offer, just one example). We tried to order dessert at the meal's end, but instead she plopped down the check and walked abruptly away. No ""Thank you..."" No ""Anything else?"" The meal was very expensive ($120 after wine, for two). We know this is San Francisco.. but even still.. a little bit of common courtesy would be nice. I wrote the manager later and he responded, pleading with us to come back. Frankly, although the food was great, there are too many restaurants in that area, and much cheaper @ that.. to waste our time returning to Harris'. Nice decor, terrible, impersonal service, great food. Steaks everywhere are either great, or okay. We therefore don't think it would be too difficult to get a good steak elsewhere in the area. Harris' rides on its reputation. Also, we could hear booming car stereo speakers as cars drove by the restaurant, outside (and we weren't by the window, either). Nice place, though, overall. We were a bit offended by the service, as this was supposed to have been an anniversary dinner (and the restaurant knew this). We've had friendlier service at Applebee's. No joke. Comparing Harris' to a place like Fifth Street would be like comparing Shakespeare to a comic book (Harris'). Oh yes, I asked for a refill on a drink, and never got one.. that was quite hilarious. The same girl waited on a table adjacent to ours.. we watched that couple wait, wait, and just look disappointed. We share a ""knowing glance"" at each other, silently saying, ""yes, the service here SUCKS and SUCKS BAD..."" Pretty hilarious. Again, $120--before tip-- to be treated like sh_t."
"November 8, 2004",50,best steak dinner ever,"At the advice of our hotel concierge, we made a reservation at Harris' for our 20th anniversary dinner. The cheese spread that accompanied the bread basket was tasty so we requested and were happiliy supplied with more. The butternut squash soup, a special that evening, was out of this world. I would have licked the bowl if it wasn't such a fancy place. The main attraction, the steaks, were perfectly cooked and delicious. It was the best steak my husband & I ever had. Service was professional and courteous. Seating was comfortable in a large booth. The only surprise was the $7 valet parking fee."
