"July 13, 2016",50,Just simply AWESOME!,"It is usually hard to give out five stars for anything, let alone someplace that can be a bit expensive and where you may not even expect value. However, The House of Prime Rib not only blew away every expectation that I had, but I happily paid the bill because this just was one of the best restaurants I have ever eaten at. Mind you I have been at some of the best steakhouses in New York, Chicago, had prime rib at the Original Lawry's in Beverly Hills, great meat when I lived in Texas, but The House of Prime Rib tops them all!  I say it is the best I have ever had as everything was fantastic! I went with my wife, daughter and cousins and just had a blast! My wife and daughter love prime rib and really do know what is good and is not. I knew we had a great meal when my wife made sure to let me know how good it really was.  I have to say everything started on the right foot when The House of Prime Rib allowed me to expand our reservation from 3 people to 7 just 24 hours before we arrived. My cousin found out that we were going there and made arrangements to bring his family from an hour away to join us! He had always wanted to go, so off we went!  Now mind you, this is not a cheap place, but when we finished I had to let the desk know that the meal I had was not only one of the best I (WE) had ever had, but I had no problem paying the $150 bill for the three of us since it was such value. Yes, value at a fancy, high end place! Oh, and with out all the snootiness you sometimes find at these places. Quite the opposite as everyone was super nice, accommodating and had one of the widest ranges of clientele that I have seen.  As for the food.... Everything was just wonderful! Our server and her assistants were terrific, very helpful when ordering, and always explained what was being served or answered any question we had. I was a bit taken aback when we received our salad as it was huge!  The prime rib was to die for! Wow, you could nearly use a fork to cut it since it was so tender. The creamed spinach had some kind of spice that put a bite on it, but it was really great none-the-less. If you like baked potatoes, go here! Dang the thing was huge! Interestingly enough, one of my cousins kids does not eat meat, but she was taken care of really well also as they had a beautiful King salmon for her. Her family was sharing it and it was just as good as everything else!  Bottom line is that this was a great place, albeit on the high side, but well worth it! Just make sure to make reservations! Can't wait to get back to San Francisco just to go back to dinner here!"
"July 12, 2016",50,Amazing Prime Rib!!!,"Ok...so obviously, you have to like prime rib if you're going to eat here. And if you do...this will be up there with the best you've ever had! It's super old school and the wait is long, but worth it...we grabbed a drink in the lounge area while we waited and wound up sitting at the bar, which I personally prefer. The drinks were great, the service was great and the food was even better! I can't say it enough...GO EAT HERE!!"
"July 4, 2016",50,"OF COURSE, WORLD CLASS PRIME BEEF, NEXT TIME, GIVE ME A LITTLE MORE LEISURE","Obviously, prime is their beef. The Henry VIII cut guarantees that if you still need more beef, they will continue to slice beef for you till you pass out, so if your favorite grandchild plays rt tackle for Stanford, this is his dish. Their sides are excellent, espec the creamed spinach, baked potato is enormous No need to upgrade to a larger cut of prime rib and the regular cut is fine:P I did a bit of an upgrade at the suggestion of the waiter(+ $3.00) for an item where they thin slice three pieces of prime rib, his suggestion being that some folks find the flavor of the thin cut is better than that of the full cut: after the meal, I agreed and recommend this alternative. My only criticism is that I felt we were ever so gently rushed, especially when we ordered our cocktails we asked for time before the salad course(included in the price of the dinner) was served: we were only half way through our cocktails when the salad was served, but of course I suppose this is a restaurant where one eats and does not dine: though they are not lacking in business, for me, this will be my first and last time at the restaurant, and they can defend their policy by pointing to the crowds at the door when the place opened its door that night."
"June 30, 2016",40,Make Sure You're Hungry!,"This was our second time we went to The House of Prime Rib. Like our previous visits, the meal tasted great. The menu isn't extensive but this made it easier for us to choose. I had the city cut prime rib dinner, while my boyfriend had the English cut. Both of our meals tasted great. When we ordered, I thought that the meal just came with a baked potato, which can be cooked other ways, and a choice of one of two vegetables. The meal also comes with sourdough bread to start, salad before the main, and freshly made Yorkshire pudding with the prime rib. As with many of the customers, we ended up taking the leftovers home. I also enjoyed the seasoning so much, I bought two bottles to take home! The ambiance is louder than usual and my only complaint is we felt slightly rushed throughout the beginning of the meal. Otherwise, the price was very good for the amount of food that we got. The restaurant is out of the way from most hotels, but it's easily accessible from the cable car on California street and just a short walk from the stop."
"June 30, 2016",40,Devine Prime Rib!,This is a very busy very loud place! It's actually quite well planned out as there are several foods that come with the prime rib You just choose your cut of meat and you get all the sides. Seems to be a fair price for what you get. It was a fun evening and fairly priced.
"June 27, 2016",40,"A wait, delicious food and no lingering",Either call ahead or be prepared for about 45-60 min wait. The food is delicious with huge portions and moderately priced. If you enjoy a lovely grilled piece of prime rib... Stop! Look no further... It's here.
"June 27, 2016",50,Great ribs,"Typically not a fan of such restaurants as I find their meat pretty bland. However, they offer the Kings Sear, which they seat both sides of the prime rib, marinated with salt and pepper.  The taste is pretty incredible and you don't have to pay an arm and a leg for it.  Definitely a must go to joint in SF"
"June 25, 2016",50,I will dream about this dinner for a long time...,"I can tell you that you will unequivocally never, ever, have a better slice of prime rib (FYI- don't be afraid to order ""rare""). Everything about this spectacularly hedonistic experience was superb. The service and ambiance is classic and excellent. However, the star, by far is the food. From the meat, to the generously portioned sides, to the desserts, everything was delicious. I was so pleasantly surprised at how good everything was. Even with the huge portions, I was enjoying everything so much that I finished everything. I hope to return MANY times in the future!"
"June 21, 2016",50,Intense food experience!,"This was the high light of my San Fran eating experience. The meat selection is outstanding, and the quality is superb. I highly recommend treating yourself to this spot."
"June 1, 2016",50,Meat lovers destination!,"Excellent food, reasonable price! You can get any cut of prime rib from a petite cut to the King Henry cut with bone. Salad, bake potato and side dish is included. Excellent value!"
"May 29, 2016",50,So much food,"texas size food over here! great experience, wonderful food, large servings. its pricey but worth it!"
"May 19, 2016",50,Great steaks!,"The steaks are juicy and tender, and amazingly we can ask for more for free! The only drawback is it is too crowded at times."
"May 17, 2016",50,Return visit just as enjoyable,"This place has a limited menu and focusses on, as the name suggests, prime rib. But boy do they do it well. The beef is cooked as requested and is very tender and tasty. Really enjoyed the meal and it is decent value too."
"May 13, 2016",50,"Perfect, just do it.","Love it. Start with a gin martini and salad. Don't fill up on the bread. Get the King cut, baked potato, creamed spinach, and a big cabernet. Go with a date or a big group, it works for any occasion."
"April 30, 2016",50,Consistently good!,I have been to this restaurant a few times and the food and service has always been consitently good. This is not mind blowingly good but its definitely great food when you're feeling carnivorous in San Francisco.
"April 25, 2016",50,Snazzy spot,"Slip the maître d a few bucks to get a seat if you aren't on the list. Food was delicious, service was excellent - one of my favorites in San Fran."
"April 18, 2016",30,"nice place , food less nice","very very loud place , i wont go there for a date food was very very average , the steak are looking awesome but taste not too good"
"March 23, 2016",30,Noise ambient...,Get ear plugs with you . You'll need that. The acoustic of ambience is very bad. You can hear all noise around your table!!!
"March 16, 2016",50,Best steak in SF,"We were extremely satisfied with our visit here. Service matched up to the quality of the food. Portions were big for us but it was so nice we finished the lot and worried about the over indulgence after! Highly recommend to anybody, for any occasion."
"March 15, 2016",50,Great Food!,"Big, Delicious and succulent Prime Rib, the salad and the bread were good too and the ambiance was enjoyable."
"March 15, 2016",50,An institution,"This place is a must for meat lovers coming through SF. Its great. I promise. Went here for dinner with friends, and we all left stuffed and satisfied. Also, the lemon drop drink is delicious."
"March 4, 2016",50,Amazing,"I've had good prime rib before but nothing compared to this one. Everything was perfect, including the cheesecake I had for dessert. Yes, it's rather pricey, but unforgettable."
"February 4, 2016",50,Could not eat the whole thing,"A great old steakhouse not in the Midwest. Best prime rib ever..if you love prime rib this is the place to go. Went with my daughter , her boyfriend and hubby. Had great food and service. Will go back again."
"January 27, 2016",50,You see the name,The name says it all. Prime rib to die for. I eat here all the time and will continue to do so as long as they have the best prime rib.
"January 23, 2016",50,OMG...I love this place!,"Best prime rib eve! Great salad as well! If you love prime rib there is none better then the House of Prime Rib. Tough to get a reservation, but they do take walking, but go early and enjoy!"
"January 7, 2016",30,2nd.time..still...just.a.slam.joint,in.you.go..heres.your.meat.thanks..get.out...realy..just.a.factory.good.meat..nothing.to.scream.on..just.a.factory
"December 15, 2015",50,The best prime rib,Long established and still standing for good reason! It truly has the best prime rib and excellent service. You will need to reserve about a month in advance.
"December 13, 2015",50,Great Holiday Dinner with Friends,"It's a tradition of mine to come here every December with friends. The food is fantastic, service is great, and the atmosphere is warm and spirited. We will be back next year."
"December 3, 2015",40,Staple of San Francisco,The House of Prime Rib is a long time staple of San Francisco. Their steaks are excellent. You will not be disappointed.
"November 16, 2015",50,Top Notch,"Couldn't wait to take our friends here, and the HOPR did not disappoint. Our 3rd time here and expectations were once again exceeded. They are the most consistent restaurant ever."
"November 12, 2015",50,When you only do ONE thing you better do it Right ~ this place does it!,You must get a reservation to eat here. If you have someone in your group who does not eat Beef ~ they can order a Veggie plate. One of the best Prime Rib dinners I have had.
"October 21, 2015",30,business dinner,"Well the food was okay, but a very special type of preperation of the meat. But great place and a experince."
"October 18, 2015",50,Excellent as always,I went there after a long time. It was good as always. Some things never change. I reccomend it with no hesitation.
"October 18, 2015",50,Anniversary Dinner,My husband and I ate here during our first visit to San Francisco in celebration of our anniversary. The food and service were excellent. I recommend splurging on this restaurant at least once.
"September 30, 2015",50,did not disappoint!,The BEST prime rib!!! temperature was perfect. you did not need a knife to cut through the tender steak. we went for a birthday celebration dinner and everyone was very helpful to make it a memorable experience.
"September 29, 2015",50,A perfect place for Dad's birthday,"Went there for a special occasion with the entire family and had a wonderful time. The prime rib is delicious, the sides are very good and the cocktails are the best!"
"September 27, 2015",50,Better than Lowry's,"Could not believe the quality of food with such a moderate price! Order the spinach in garlic and oil instead of the creamed spinach!! Amazing!! Service, quality and quantity. They truly outdid themselves. Great bar, too."
"September 20, 2015",50,The Best Prime Rib in the West,A definite must go for hardcore prime rib connoisseurs. Zeppelin transported and cut to perfection in plate of au jus than never runs out. Advance reservations is a must if you want to eat at a decent time due to its popularity.
"September 19, 2015",50,still one of the best prime ribs to be had.,"Came in on a early dinner at 5:30, hard to reserve, but worth it, the ribs was perfect. and today i got a peice with a large cab on it. envirment was engergetic and the prime ribs is just so nice!"
"September 16, 2015",50,Excellent,This restaurant serves one thing and does it right. You must love prime rib but it could be the best prime rib you have ever had! Service is excellent. Loved everything from start to finish.
"September 9, 2015",50,Don't miss.....worth a trip...just to eat here,"From the initial contact with the truly professional waiters, to the sequenced progression of the house speciality.....everything done to true perfection. Having eaten all over the world this is special restaurant."
"September 9, 2015",50,Incredible Prime Rib!,"Atmosphere, food, and wait staff are all top notch! Prime rib was incredible. Bread, salad, spinach and bake potato delicious! Waiter was very knowledgeable and presentation of food was terrific. Yorkshire pudding that came with the meal was also delicious!! Highly recommend."
"September 1, 2015",50,Best Prime Rib Ever,Anthony Bourdain was right. House of Prime Rib is the best. Retro sans kitsch environment. Best quality meat you could hope for. They do one thing and they do it right. Sides are fabulous.
"August 29, 2015",30,Don't Wate Your Time,"Crowded, loud, and unnecessarily spicy spinach. The meat is good, specially if you like juice on it."
"August 19, 2015",50,Amazing,The best steak ever. We ordered well done king steak for two of course and it was a lot but really really good. Of course is expensive but worth it. They don't have sangria :( I love this place :)
"August 15, 2015",50,Best Place to go for Prime Rib,I have been going here for many years and it never disappoints. The Prime Rib is great. Service is great. Nothing at all to complain about
"August 9, 2015",50,Was and still is GREAT!,Visited my old home in SF after 40 years away. House of Prime rib was just as wonderful as the old days. Fabulous food and service.
"July 14, 2015",40,prime rib restaurant,excellent if you love prime rib. not much more to eat. Very crowded and noisey. The service was prompt and very good. Many extra's included in the price
"July 12, 2015",50,Traditional excellence!,"From the well prepared (and large) cocktails, to the salad prepared table side, to the beyond-delicious prime rib, to the friendly and efficient wait staff, this place exudes excellence and tradition! A must-do when in SF."
"July 11, 2015",50,Solid,"Had a great experience here with my husband, daughter (5 at the time) and in-laws. The food was great, and service was excellent. The waitress was so good to my daughter that my daughter talked about her for the rest of the trip. Great experience!"
"July 7, 2015",40,Noisy but delicious,"Food was expensive but really delicious. Would have given it five stars but it was so noisy and crowded, I was practically sitting with the next table."
"July 7, 2015",50,Great Food Great Staff,"Prime Rib here is really great, glad I waited to eat at 10 pm. Even then it was still crowded. It was a very happy and lively atmosphere. I highly recommend calling ahead and get a reservation. A bit cramp crowded."
"July 3, 2015",50,Quality,"Just the best prime rib you will ever taste. Service is excellent too. If you are a vegetarian steer well clear, however if you like your meat melt in the mouth then book up !!"
"June 15, 2015",50,Holy prime rib,Absolutely amazing prime rib. You have a choice of 4 cuts and then baked or mashed potato. That's all you have to make for decisions and you will be satisfied. Definitely worth the price tag.
"June 11, 2015",40,If you love Prime Rib....,If you love Prime Rib.. then this is a must place to visit when you are in the City. It a decadent old resturant that serves a great portion of prime rib with the usual side dishes. typical of a great prime rib establishment...
"June 2, 2015",50,Prime Rib or Prime Rib,We thoroughly enjoyed the preparation and flourish involved in selecting the cuts and the creation of the salad. It was the best creamed spinach ever as well.
"May 31, 2015",40,Lawry's West Coast,"If you're a Lawry's fan, you'll find this place fits that mold. Our meal was great, and they were very accomodating about our separate check needs."
"May 20, 2015",50,"Meat, its what's on!","Great Prime Rib Dinner. Its can get loud and if you dont have a reservation, the wait can be long; but, if Its meat that you want; this is the place."
"May 19, 2015",40,Great Feed.,"This is an experience in itself. My husband and I were recommended to try this restaurant and, if you're a carnivore, it does't disappoint. Well worth a visit if you're in San Francisco. A note of warning - the serves are HUGE (for us Australians)."
"April 21, 2015",50,Prime ribs house,"Very lucky that I live close by to this restaurant, spending our special occasion or just to make tummy great the best ."
"March 26, 2015",50,Best prime rib dinner,"Perfectly cooked for varying tastes. Medium rare for US guests, medium to well for UK! Good service. Booking essential. Would be fine dining with better dress code."
"March 17, 2015",50,Fantastic food. Best prime rib I've ever had.,"Best prime rib I've ever had. Every side dish is wonderful too. Great staff. Old-time feel. The place is pretty noisy, but that kind of adds to the fun."
"March 7, 2015",50,awesome,I never had prime rib until I ate at The House of Prime Rib. Thanks to them I fell in love with prime rib. Amazing.
"January 31, 2015",40,First meal in SF,Our expectations were high given it's ratings Service was fantastic Food whilst great quality was not for everyone but can't fault the size of helpings!! If you are looking for expansive menu then probably not for you
"January 26, 2015",40,A Must go to!,"Step back in time here, great food, carving stations, excellent prime rib and sides. Although Yorkshire pudding is well touted, I guess its an acquired taste. Very well known and popular place!"
"January 13, 2015",50,Worth the wait,"HoPR offers amazing prime rib, great sides, and great drinks. Service is friendly, and the ""all-in"" pricing is a bargain. We had a 90-minute wait for a table on a Tuesday--fortunately Gina the bartender and Aaron the waiter made the time fly."
"January 2, 2015",20,Disappointing,I had read the reviews and was all set for a big night at the House of Prime a Rib in San Francisco. The place was packed and we felt rushed by the waiter.
"December 10, 2014",40,Nice Old Restaurant,"A little late with this review. Nice old restaurant with good food. The service was really good too! So much food, I think everyone had enough for lunch the next day!"
