"February 16, 2016",50,Great Dinner,We wanted a nice dinner for our last night in San Francisco and was referred to Harris'. The food and service were fantastic.
"February 11, 2016",40,Great Steaks and......,"Old fashioned steak house. Had a great cocktail to start. Excellent steaks, friendly staff. Veggies cocked to the point. Crisp chips. All really cool backhround music. One thing botherrd me slightly... A strange smell in the room. May be time to change carpets?!?!"
"February 6, 2016",50,Private dining with excellent customer service,"We had a group of nine or so and had a nice time with good food, wine & service. This is an old school kind of place, for sure. The live music was just getting started as we finished up our meal. It was nice."
"January 11, 2016",50,Awesome,The best steak meal I have ever had - and I am from New Zealand - land of the cow and sheep. Fantastic sommelier and service outstanding. My husband went again the next night too and again was not disappointed. Cant wait to return
"December 30, 2015",50,25th Wedding anniversary trip to SF,"Recommended to us by Hilton hotel at Union Square. This is an awesome restaurant. Great food, atmosphere and service. First class all the way!!"
"December 15, 2015",40,A great dinner night,"We visited Harris steakhouse 27 November with a reservation,perfect atmosfere and nice live music.we tried the soup of the day it was excellent,and Harris steak very good the service was very good,we tried a red wine from napa valley,very good."
"November 30, 2015",30,Good overall!,"We went to try the prime rib which was very, very tasty. Other menu items looked good as well. The restaurant is a classic looking, old world. The favorite part of the meal was the Baked Alaska for dessert. Now that was a show stopper."
"November 22, 2015",50,Wonderful dining experience,"We loved the elegant, dark, stately ambiance and the booth seating. Service was quite good. Martinis were prepared as requested. Steaks were excellent."
"November 14, 2015",50,Another great Steakhouse in San Francisco,Harris's steakhouse is very much like Morton's. Both delicious and with all the side that you would expect. They do take reservations which I highly recommend. On the pricey side but well worth it.
"November 6, 2015",30,Solid overall but disappointed in steak flavoring (or lack thereof),"As the title suggests my family and I enjoyed our visit overall but the steak was so bland. The texture was great, they were cooked to the right temperature, but lacked seasoning and flavor."
"October 26, 2015",40,Good food and ambience.,"Had a good time here, the food was good and also the service. The Harris steak was good and was the way I wanted, also the lamb chops were good too."
"October 25, 2015",50,Dinner,"The place is really classy. Food was great, the soup was delicious and the steak was amazing. Service was excellent, friendly and professional. Keep it up."
"October 25, 2015",50,Excellent steak in rather formal setting,Rather formal and 'stiff' setting but the steaks are truely excellent! Nice wine menu with good choice of American wines. Staff very friendly and helpful. Maybe a luttle overpriced but definitely worth a visit..
"October 19, 2015",40,Great Steakhouse,"Have visit this classic steakhouse, every time we are in San Francisco. And we have never been disapointed."
"October 17, 2015",40,Recommended!!,Typical american Steakhouse! Nice and class enviroment. Good menu a la carte. Excellent list of wines from all over the world. Personally i choose fresh oyster and Pepper steak. Excellent!
"October 14, 2015",40,Great steak!,"Best service we have had in a long time. Excellent steak, loved the sides (potatoes excellent) - good salads and wine selections and suggestions from staff were spot on. Not cheap - but worth it for a special night out."
"October 9, 2015",50,Beautiful food and ambiance,"Fantastic appetizers and awesome steak. We sat in the Library so had privacy but also enjoyed the live jazz - which was excellent. Cocktails, wine and service also top notch. Not cheap but well worth it for a special meal. Thanks Harris'...really enjoyed it!"
"September 20, 2015",50,Best Steaks in SF,Everytime we visit SF we eat here. Always make a reservation and have dinner. Seems like a lot of the staff have been there a long time. Very good service always and they cook the steaks perfect.
"August 30, 2015",50,Very good steak and excellent wine list,"Very nice steak - but not the best I've tasted. Attentive, friendly service with very tasty bread to start. Great wine list. I like that the steak entrees come with veg and choice of potato - so many steak houses charge extras for this."
"August 27, 2015",50,the wine list and jonathan knew his wine.,from start to finish this was a perfect date night out. the dry aged beef is displayed in the window and the booth seating was very romantic and well furnished.
"August 24, 2015",40,No restaurant for old sissies,"Go for the american farmed Wagyu, rare, and you'll be happy. Perhaps not always the epitome in refinement when it comes to the sides but that's not why one went in the first place."
"July 21, 2015",50,pricey but yummy,Great steakhouse with excellent service and a price tag that matches. Nice atmosphere with live jazz music in the bar. Great place to eat before going to see the ballet or symphony. Parking was the only problem.
"July 8, 2015",50,Great steakhouse,"Had dinner with a work colleague based on a recommendation from the concierge from the St Francis. Was not disappointed. Great service, amazing steak and wonderful cocktails. Would definitely go back."
"June 19, 2015",40,Great steak!,"Have been every time when we are in San Fran. Good steak and nice service. A little bit dated interieur, but who cares if the food is great!"
"June 6, 2015",50,Simply Great,We booked on line and were greeted professionally when we arrived at this swanky upmarket eatery in San Francisco. What a delight. Superb service and sensational food. Great atmosphere - more like a Gentleman's Club - couldn't fault the entire evening.
"June 4, 2015",50,Great place,We had reservations and were seated quickly. The wait staff was attentive and quick. The steaks and fish were cooked perfectly. I had the Steak Diane and the sauce were superb. I am looking to return soon. A very elegant steak house.
"April 20, 2015",50,Perfect for meat-lovers!!!,This is a great restaurant! The food was really good and my whole family enjoyed it a lot. The cuts were perfect and the sides delicious!! Too full for desert ….but what can I say? No complaints here……:)
"April 12, 2015",50,At the bar...appetizers and good music,We were not that hungry so we visited the bar at Harris'....had appetizers and a couple of good drinks and enjoyed the ambience.
"March 27, 2015",50,Upscale restaurant,"Excellent steakhouse in San Francisco. Good for a special occasion, since it is on the expensive side. Service was very good along with the food."
"March 18, 2015",40,Great Steak,This is a great place for steak and a glass of cabernet. The food here is stellar and the service is good. Great place to go for steak!
"February 24, 2015",50,The BEST steak and martini in San Francisco!,The BEST steak house ever! This place is old school and in a good way. Enjoyed a fantastic dinner of the Harris Steak and Harris Martini served with all the style and class you would expect. Cannot wait to go back! Absolutely delicious!
"January 14, 2015",50,Expensive,Arrived at resturant it was December arrived at reception was not the most welcoming reception seated the service from the wait staff were like the reception staff not friendly at all the food fantastic the stakes were great the decor was first class
"January 3, 2015",40,I love this place,"I love this place, fantastic steak and always worth a visit. Very good atmosphere and friendly staff. Not the cheapest but you get what you pay for."
"December 8, 2014",50,Good combination! Martini and steak,Visited several times and satisfied without fail. Good food and drink!
"December 8, 2014",50,"Quite simply, stunning!","Wonderful meat. Excellent service. Killer cocktails. Classy ambience. Top class in every way. Yes, it was pricey but we knew that and, compared to other restaurants, delivered much greater value. One of my two best ever steak restaurants."
"November 17, 2014",50,Great steak,"The 2nd time we have eaten here, and as before fantastic all round, great steaks, wine and service at a reasonable (not cheap) price"
"October 13, 2014",50,Must eat at,"Our dinner at Harris' was more than delicious, the service was excellent and the food was absolutely delicious and the atmosphere was excellent. We would recommend this restaurant to any one who is visiting San Francisco. John and Linda LaSalle, Ontario Canada"
"October 8, 2014",40,Top Notch Steakhouse,"I had dinner at Harris' on October 6th and it was very enjoyable. The restaurant decor is a bit dated but the steaks, service and wine are very good. I would give the steaks a rating of 8 out of 10."
"September 19, 2014",40,One of the Best,Everyone in the family enjoyed their food and so am I . Worth trying. Hard to find a parking space at night.
"September 6, 2014",30,"Ok, but not worth the hype",The food was just...good. Wine selection way overpriced. I get the same bottle elsewhere at restaurants for much much less. The lobster was overlooked. At $99 for the entree it should have been spot on.
"August 5, 2014",40,good steak,good steak. good waiters. good deserts. bit pricey. was better a couple of years before. overall nice atmosphere
"August 5, 2014",50,The best steakhouse in SF. Classic atmosphere and a high level service.,Had good prepared steak. Extensive wine list. Very good service and a classical atmosphere! It was a good choice during our trip in San Francisco. It is highly recommended !
"August 1, 2014",50,Nest place in sfo,It was a very good place in sfo an one of the best steak houses ever! thank you. Tje bar after that was also perfect! See you again
"July 10, 2014",40,Delicious,The flemignon and T bone steak was great. It was delicious ever I ate until today.Also the place is so cool.
"June 15, 2014",50,Amazing Food,"The filet mignon we had was amazing, cocktails and wine and the service was great! Good athmosphere with the band playing inf the bar area..."
"June 3, 2014",50,Harris' - Most memorable dining experience!,"Had an amazing dinner with family while visiting San Francisco. Everything was perfect....ambiance, service, and the steaks were the best I have ever tasted. It is well worth the visit to Harris'!"
"May 29, 2014",50,Excellent steak for a price,"We had a dinner in May at Harris'. That was one of the best steak I have ever had. Service, ambiance was excellent. I would definitely recommend Harris if you crave for a great steak..."
"April 30, 2014",40,Classy,Harris' Steakhouse is like visiting a different time. But in a good way.the food was delicious. The staff was perfect. This is a place that remembers how to treat a customer the way a customer should be treated. Pure Class.
"April 15, 2014",40,Nice Porterhouse,"We shared a delicious Porterhouse steak cooked perfectly as ordered, sauteed onions and tender baked potato rounded out our meal. Everything was very tasty and all the waitstaff were top notch. This is a beutiful restaurant and great choice for a romantic celebration"
"March 11, 2014",50,Best steak ever!!!!,"Definitely worth the price. Best steak I've ever had....and I'm from the Midwest!!!!! Tender, cooked perfectly, juicy....just awesome. Great place for any special occasion. I will definitely go back!"
"March 8, 2014",30,Disappointed,"Went for birthday celebration..based on recommendation of a friend but I was disappointed in the quality of the food, presentation and service."
"March 8, 2014",50,WOW!!,Amazing food service and wine list!! This is a great place not as trendy as some other spots. Ambiance perfect! Table was ready when we arrived... Perfect! Can't wait to go back.
"January 23, 2014",40,Good place for a special event,"Nice atmosphere with good service, but not the best steaks I've had. They were ""okay,"" but tasted a bit greasy. We had a great not, but be prepared to pay top dollar."
"January 21, 2014",50,Amazing steak and great service,"Steak, service and ambience were all amazing. Both my partners and myself steaks were cooked to perfection and tasted great. Our waiter was very helpful and efficient. The setting and whole feel of the restaurant was very cozy. And all round great dining experience."
"January 4, 2014",50,Best New York Strip Ever,"Great dining experience plus the best steak I've ever had. Additionally, bartender makes a great manhattan."
"November 15, 2013",40,Good Steaks but a bit of a stuffy atmosphere,"As a family we felt that the atmosphere was rather formal and stuffy. However, steaks were good as was the service and great selection of wines. Perhaps we were a bit jet lagged!"
"November 12, 2013",30,I liked it but thought the steak would be better,"Visited with friends they said this would be the best steak i had ever eaten,,,,, they were very very wrong it does not even compare to british steak,, sorry USA but it doesnt."
"November 10, 2013",30,"Lobster was great, but steak below average","My wife loved the lobster, but my Harris steak was tough and below average. The sides were good and service was good so I rated as average."
"November 5, 2013",40,"good steak, great service, great dessert","venue/decor like many steakhouses is traditional in nature and pretty dated. service is formal but excellent, steaks were good without being exceptional though dessert was very good - especially the butterscotch cheesecake - which was to die for. quite expensive, but worth a visit"
"October 29, 2013",50,Great Steaks,"This is always a great place for good conversation, great drinks, and first class steaks. It has an ""Old Time San Francisco"" feel."
"October 14, 2013",50,Best steakhouse,"No detail is left unattended at this beautiful restaurant. If the gorgeous rooms are not enough, the steak is the best I've ever had. I've eaten at a lot of steakhouses and Harris' continues to be the benchmark that all others are judged by."
"October 12, 2013",50,Excellent steak!!,This steakhouse was absolutely amazing! The atmosphere was wonderful and the service was fantastic. Not to mention how great the food was.
"October 4, 2013",50,"Beautiful, delicious, worth the money.","Very beautiful meals. Great service. Beautiful atmosphere. Nicest steak we've ever eaten. They have a dress code, so dress appropriately. Expensive but worth every cent."
"September 16, 2013",40,Good food dimly lit,"Very good steak spoilt by uncomfortable seats and very dim lighting, had to use phone flash to read menu"
"September 10, 2013",40,VERY GOOD,"This was great, no doubt. Great food, great atmosphere, good service. Have to admit, Bobo's beat it though."
"July 12, 2013",50,Top notch restaurant,"This is the best steak restaurant we have ever been to. Shirt & tie sort of place. Quite pricey but worth every penny. The food was melt in the mouth, wine Devine and service top class. We were treated with respect and like VIPs"
"July 7, 2013",50,Excellent food and atmosphere,I went to this restaurant with my wife and we both loved the place it is romantic with live jazz music the food is excellent as well as the service I would recommend this place to anyone
"July 3, 2013",50,T Bone,"Always a great steak, also the spinach salad is a winner, very good wine list, even the half bottles are great and the nice by the glass. Only the choice of potatoes is small"
"June 27, 2013",50,Best steak in town,Excellent service and very friendly servicee. Got good size portion....and wine selection is excellent as well. A must place to eat if you are in town
"May 19, 2013",40,Great dinner!,An established classic steakhouse in San Francisco. Great dinner. I had the New York Steak and a Lobster Bisque before that. Manhattan wasn't quite the way I usually have it but was still good. Service was very attentive. I would go back in the future.
"May 3, 2013",50,exellent,"We are very pleased with the visit of the restaurant - delicious food, good service and atmosphere, clean and nice, recommend to all"
"April 8, 2013",40,Great experience,"My husband, the meat and potatoes king declared this the Best Porterhouse He Has Ever Eaten. The service was great, the scalloped potatoes were perfect, the crab cocktail superb. Good service, beautiful atmosphere but not stuffy or pretentious. We really enjoyed our meal."
"March 11, 2013",50,excellent,"Very romantic, dark setting, juice steak, wonderful service, reservation great. Made out of state. Absolutely beautiful for couples,ate here on my wedding night, very good food too!"
"February 15, 2013",50,Better than most,"Great food with excellent service. Start with a drink at the great bar and work into one of the best steaks you will have. All dinners done perfect, choice of sides also great. One of the better local steakhouses you will find in any city."
"January 24, 2013",50,Fine dry aged prime steaks in a very upscale old style San francisco restaurant.,"Great ambiance, great service, great food, great coctktails but the bill for two was $198 without the tip.."
"November 6, 2012",50,Great steak and Jazz,"Had the Harris cut bone in steak, while listening to Jazz, doesn't get any better while in San Francisco"
"October 16, 2012",50,Always great steaks,"I love eating at this upscale steak house. Plan to spend 50-75.00 per person for dinner here. But, well worth it. ."
"October 15, 2012",50,So very well done!,Had the pleasure of dining here for a private party this past Friday night in their library room. Everything was done superb! Service to food were off the charts wonderful!
"August 30, 2012",50,Best Steak Ever,"My wife and I ate the best steaks we have ever tasted at Harris'. I had a Pepper Steak and she a Diane. Pricey, sure, but service was superb; the wine list excellent and the experience one we will never forget."
"August 8, 2012",40,Very good steakhouse,Ive had a better steak but the spinach and potato were great. Cocktails were good and the steak tartar was the best I've ever had.
"June 24, 2012",50,What an institution.......,"We felt like part of San Francisco's history, Great place to people watch. Make sure you are in a booth in the main room. Fantastic steak, but you have to love meat as its everywhere !"
"September 13, 2012",50,Delicious,"Harris steakhouse is a bit of a ride away from the wharf, but well worth the taxicab ride over. Everything we had was delicious. from the appetizers to the salads to the main course. Staff was very nice and very helpful with the menu. They...More"
"September 10, 2012",50,dinner,"LOVED IT! We had great service, steak and wine! I would go back in a heart beat. I wish I didn't eat so much so I could have enjoyed a drink at the bar to listen to the live music but you couls hear it in the dining room too."
"August 30, 2012",50,Best Steak Ever,"My wife and I ate the best steaks we have ever tasted at Harris'. I had a Pepper Steak and she a Diane. Pricey, sure, but service was superb; the wine list excellent and the experience one we will never forget."
"August 21, 2012",30,Average for a steakhouse,"The atmosphere was very traditional steakhouse except in the middle of the restaurant there were two huge houseplants separating the room. Our waiter was never outright rude, but he definitely had an undeserved air of superiority. I got a Caesar salad which tasted fishy, so my boyfriend switched with me and I ate the spinach salad. Nothing mind-blowing. For our mains, we both got the filet and a baked potato, and shared the Baked Alaska for dessert. The Baked Alaska was the best part of the meal besides the wine. The steak was nothing to write home about.  I wanted to try a local steakhouse while visiting the area, but I prefer Ruth’s Chris for the price and overall experience."
"August 8, 2012",40,Very good steakhouse,Ive had a better steak but the spinach and potato were great. Cocktails were good and the steak tartar was the best I've ever had.
"August 6, 2012",50,Classic Steakhouse!,"My husband and I traveled to San Fran for our honeymoon and treated ourselves to Harris Steakhouse. Harris is a classic steakhouse.... great decor with vintage looking leather booths and elegant finishings. Fantastic steaks! My husband had a Kobe steak there and I had the Filet. We started with, for him a Manhattan, and, for me, champagne. The remainder of each drink that wouldn't fit in our glasses was put into a little glass decanter and then put into a mini wine barrel filled with ice. It was really cute! Our waiter was great as well... service was excellent.  Highly, recommend."
"July 31, 2012",50,Lovely old style steakhouse with meat everywhere,"My boyfriend wanted a good steak on his last evening in San Fran so we came here after doing a bit of research. Harris was a great choice! We had a lot of fun looking at the different cuts of meat displayed in the butcher disk and also the meats lined up towards the street. The portions here are huge! We shared an iceberg wedge salad for starters, and although they didn't have the traditional variety on the menu our server fixed us up with a delicious variant: iceberg with bacon and blue cheese with a balsamic vinaigrette. It was absolutely delicious. For mains we shared a Porterhouse steak and as we don't eat potatoes our waiter suggested substituting with creamed spinache. Everything was perfect. The steak was cooked to perfection (medium rare) and was more than enough to share. Vegetables were crisp and the spinache was lovely. All in all it was a great evening with really good wine and drinks, a friendly and helpful waitstaff and as an added bonus we sat near a fun couple who we had a bit of a conversation with as well."
"July 15, 2012",50,Great Steak,"This is one of the top two or three steakhouses I've been to. We were seated in the ""casual"" area, but the atmosphere and service were as good as the main dining room. The steaks are out of this world. My wife and niece both had the Steak Diane and loved it (and my niece is not a steak eater). I had the bone-in New York strip. It was delicious. I would have gnawed the meat off the bone if I would have been at home. My nephew had the porterhouse and left less that I did. The potato of the day was au gratin potato and it was the best au gratin I've had in a long time. If you like steak, make it a point to eat here when you are in San Francisco."
"June 28, 2012",50,"Handsome place, fabulous steak","This is a classy restaurant that accepts casual dress. Tables are well spaced and the staff are most helpful. The steaks were excellent; I had the filet mignon, about 2 and a half inches of perfection, and my wife had the porterhouse, a huge slab of steak perfectly cooked. The steaks come with crunchy garden vegetables and a potato of your choice. Appetizers include the usual salads but I had a creamy parsely soup that was so good. Noise level was low. Wines are heavy California but many others as well . Prices are in all categories."
"June 24, 2012",50,What an institution.......,"We felt like part of San Francisco's history, Great place to people watch. Make sure you are in a booth in the main room. Fantastic steak, but you have to love meat as its everywhere !"
"June 8, 2012",40,Classy SF Steak House,"If you don't mind the high price, ask for the Kobe beef! Most likely the best steak house in San Francisco."
"May 28, 2012",40,Great food,We walked over because we couldn't get a seat at the House of Prime Ribs. It's a quiter restaurant but the food was just as good
"May 25, 2012",50,Never disappoints,"Expensive, yes. Worth it, most certainly? The food and service was outstanding, even on a busy day like Mothers Day."
"May 14, 2012",50,awesome steaks,"The restaraunt has a 50/60's atmosphere about it. Get lounge area with a jazz band. Dinner was very good, great wine list and very attentive service. Would go again and reservation are highly recommended."
"April 24, 2012",50,Amazing!,"Perfect Steak, as Good as Bobo's! Worth the high price..."
"February 7, 2012",30,Overpriced,Nice setting - cosy bar/lounge - great dining room - very comfortable - good design - friendly service - first course was great - but the meat was overcooked (while we asked for medium rare) and tasteless - much overpricedU
"February 1, 2012",50,YUM!,Pricey but deeeelicious. Great steakhouse. Amazing wine list.
"January 28, 2012",50,Excellent,"Probably one of the best steaks I've ever eaten. Recommend the onion soup, and the fillet with pepper sauce and dauphinoise potatoes - divine!"
"January 23, 2012",50,Best Steak in SF,old school steak house great steaks and cocktails not to be missed.
"December 11, 2011",30,An Average high End Steakhouse,"The food quality and service were average for a high end steakhouse. I'd eaten at the House of Prime a couple of months before. My date and I both agreed that the House of Prime had a nicer decor, better service, and better quality food."
"September 26, 2011",30,Eh!,San Francisco is not a steak city. Harris' is supposed to be its best restaurant for steak. We've tried it a couple of times and found it always just blah.
"March 27, 2011",50,Very good,"Very good meal,very good service. what else can i say"
"March 16, 2011",30,Overpriced and overrated,overpriced for the price. The lobster was delicious but the ribeye steak was not as good as other steakhouses at this price.
"October 20, 2010",50,delicious,"great service; quiet setting, filet mignon had BONE which is not offered at other restaurants and was cooked just right."
