"February 20, 2019",50,Excellent brisket,"Excellent brisket and burgers. Nice, friendly staff - everything was very-very good! Will come back later for sure"
"February 17, 2019",40,Brilliant,From the moment we stepped through the door the welcome and service were excellent. I had a steak and my wife had the duck. Both were extremely tasty and well cooked. Will definitely visit again.
"February 17, 2019",50,Amazing food,"I would definitely recommend this place and will be going back. Reasonably priced, very friendly and amazing food. The beef is melt in your mouth good and the service was great."
"February 8, 2019",50,Beef heaven,Man...its awesome. It is a must see category good food gorgeous waiters and waitresses .enjoy the meat there couse you wont find better
"January 30, 2019",50,Beef Heaven by Tuning,Large party celebrating friends 60th birthday.Excellent service and food outstanding.Superb evening out.
"January 27, 2019",50,22 guests for a 60th birthday,Everyone had lovely meals. Food was excellent. staff were very attentive and very helpful. Even organised taxis home for us all. Thoroughly recommend.
"January 23, 2019",40,Try the ribs!,"Excellent food and friendly service. I had the beef ribs and they were delicious! My girlfriend had the brisket, which was also super tender and tasty."
"January 18, 2019",40,Good food and service,"Polite and helpfull staff. Good food and decent prices 👍🏻 I had a steak, wife had burger and both left very happy!"
"January 4, 2019",50,AWESOME Burgers,Best Burger I have eaten in a long time. Great attentive service. Not sure I would try a steak at £30 (£GBP) as that seems expensive. One of the few places that actually take a booking !!
"December 30, 2018",50,The kitchen....,The food is amazing. We one of the best services. Thanks to our waiter Robert!!!. Best serve we got!!
"December 30, 2018",50,Perfect Service Briliant Meal,"We were here with my friends yesturday, the atmospher it's prity good, the waiter(Robert) made us some great sugestions about our meal. Thank you so much your kindness Robert we definitly come back."
"December 14, 2018",50,Great service - Great beef!,Thank you Misi and the other guys for your great service! Loved your food! We ordered simple dishes but it had great taste. Beef was very tender. Quality meals.
"December 11, 2018",40,Great beef,Food was great. Service was very good. Athmosphere was fine. Everything worked perfectly. Go there if you want good meat!
"December 7, 2018",50,so much food,very good food! outstanding service. Robert was a fantastic waiter and helpt us with are maps besides serving the food with a smile.
"December 2, 2018",50,Nice food!,"The service and food at beef heaven was amazing! If you like meat, it is a very good place to go to."
"November 29, 2018",50,Dinner,"Great restaurant, excellent food. Special thanks to Tukarcs Adam for the service! We will be back soon!"
"November 28, 2018",50,Perfect experience,The entire experience was excellent. And food and service was sublime. We were in Budapest for three nights and this was by far the best restaurant we visited.
"November 27, 2018",40,Very good food,My husband and I visited for dinner. I had a steak and he tried the pork neck. The food was very good and the staff were friendly.
"November 25, 2018",40,"Very good food, excellent Service","The atmosphere and vibe within the restaurant is good and lively and the food is very good, and the service is excellent."
"November 20, 2018",50,"Nice and friendly staff, excellent food!","Everything was fantastic, would recommend. Good value/price compared to the quality. Wasn't too busy during lunchtime."
"November 15, 2018",50,Great food and great service,"Really enjoyed our meal here during out stay in Budapest. Friendly, lively, generous portions and very welcoming. Would recommend."
"November 14, 2018",30,Just Ok,"The restaurant is nice if you are looking to eat meat in Budapest, the service was good. I consider it is a bit expensive in the relation quality- price."
"November 5, 2018",50,Everything was amazing!,Thank you so much for an amazing evening. We were a group of friends from Switzerland. We enjoyed our stay at Beef Heaven! Everyone was so kind ans the Food here was amazing and we would definitely come again!
"November 2, 2018",20,Disapointed,"We came here because the opinions were good. Ok the service is very good but for a meat specialist restaurant, the meat is overcooked and very expensive. Nevertheless the goulash is very good!"
"October 20, 2018",50,Great service,"Amazing food and beverages served fast and tasted delightful. Especially great service from Robert, who served us with a smile and helpful explenations. Would love to come back here again!"
"October 17, 2018",50,Excellent restaurant!,"I went there with my family two times in four days. The service was very good! We really liked the food and win. If i can give you an advice, take the Argentina Ribeye (250 gram). Definitely going back to this restaurant!"
"October 8, 2018",50,Beef lovers must !,Love the place. Service was very accommodating as I enquired about an offer that was not featured in the menu. Balazs made a recommendation and it turned out perfect. Picanha is a rare cut in Europe.
"October 7, 2018",40,yummi dinner in Budapest,"nice location, friendly and helpful staff, cosy atmosphere. the burgers were huge and really tasty!!"
"October 6, 2018",50,Awesome food! Amazing service!,We celebrated a birthday party to my partner and we received treats on the house. We received a respectful and polite service.Thanks for a great experience!
"October 6, 2018",50,Beefy,"We had a big party of 18 and the service, food and drink was excellent. Next time i’m in Budapest i’ll be visiting again."
"October 3, 2018",50,Best Steak in Budapest,"Beautiful restaurant, amazing stuff, spectacular food! I mean wow! Everything was so unbelievably great! Words cannot describe how an amazing dinner we had! Thank you so much once again! I will definetly be back! This place is a must if you are in Budapest!"
"October 1, 2018",50,Beef heaven,Best mest ever and service is perfect so just go there We had the best time here in the restaurant top service
"September 29, 2018",50,Very good food and excellent service,"Both service and the food was very good. Price is normal (20-30eu) for steak. I would recommend this place for all people, families but also groups of friends."
"September 28, 2018",40,Good place for burgers,"Great burgers and beer, and excellent service provided by Robert. We recommend the beef heaven burger."
"September 28, 2018",50,Great service! Ask for Zsombor !,Great service! It’s a great ambience restaurant with good food. The waiter is ultra attentive and passionately cares about his customers. Thank you for switching my plate!
"September 23, 2018",50,Just great,This was an absolutely unforgettable evening with a personal and professional service and an absolutely perfect meet! You cannot miss that! Thanks for all!
"September 21, 2018",50,A must for meat lovers!,"Stopped in for a meal after a busy day at the office. What a treat! Craft beers, great service and one of the best burgers I’ve ever had. Will definitely be back on my next trip!"
"September 20, 2018",50,The meat heaven,"Perfect for all meatlovers. Service was on top. The meat was perfect. Nice place, we’ll be back!!!!!"
"September 20, 2018",50,Great for the meatlovers,"Great beer, astounding service and fantastic food! If you’re looking for a place with great mest this is the place to be"
"September 20, 2018",50,Best food,"Must visit. Wonderful food. Immaculate service. If You're hungry, you should go there. Great location. Not crowded, and very polite staff."
"September 20, 2018",50,Dining,"Beef heaven, seven eleven. Great outdoor area and great burgers!! You must eat here. The meat is good"
"September 20, 2018",50,Mr.,Topps! Jättebra. Superb. Nice. Good good and drinks. Staff very friendly and with a feeling for service
"September 20, 2018",50,Perfect,Great staff! And the food Was supberb. I like it and Robert was a great waiter. Ask for him! Will comeback back
"September 19, 2018",50,Exelent food perfect for meat lovers,"We had great food top quality, friendly and top service they even spoke a littlebit german. The beef heaven burger is fantastic! The price is good and totally worth but they haven‘t vegetarian food accept the desserts but they are flexible."
"September 18, 2018",50,Great service,The food was delicious and plentiful. We had the Beef Heaven Smoked & Steak & Tál. We had exceptional and friendly service from Misi!
"September 17, 2018",50,Perfect date,"Lovely scenery, food was incredible, staff were extremely friendly and welcoming. Robert served us and he was a breath of fresh air and very polite, top service, highly recommend."
"September 15, 2018",50,The best smoker brisket,Professional serviceExcellent food qualityFriendly and modern interior designUnique menuGood location
"September 14, 2018",50,Great food,I tried the hamburger which was good. The service was also good restaurant is in good location with nice atmosphere
"September 12, 2018",50,Best steak,"Best steak I've had in along time, great quiet atmosphere, amazing service really recommended. A little fancy but not to expensive."
"September 11, 2018",50,Amazing Service! Great food!,Ròbert gave us the best service in Budapest and the food was amazing. We had the pork ribs and the cheese burger. Both were excellent! Make sure you check this place out!
"September 9, 2018",50,Best Customer Service in Budapest,"We went for dinner, sat outside on the beautiful patio. Food was amazing and service was the best we had in this City so far! Robert was very polite, helpful and his suggestions were on point!"
"September 8, 2018",50,Excellent service & food,Robert was an excellent host. The food was amazing. The meat is excellent quality. Would definitely come back.
"September 8, 2018",50,Awesome meat,We had dinner with a group of 7 people and ordered mostly burger. The burger were really amazing and prepared with much love to detail and the meat was definitely tasty. Our stuff guy Joli was nice too and made our evening even better.
"September 6, 2018",50,Good burgers and beef !,"Good burgers and beef ! The service was really nice, thank you Adam ! Really recommended for Budapest."
"September 1, 2018",50,Steak,The beef is absolute fantastic as for the service it was impeccable. A special thanks to Misi he is a fantastic waiter. We will be back tomorrow 👌🏻😋
"August 26, 2018",50,Great Steak,Great dinner out with friends. Good atmosphere and good food. Well thought through menu. Great hosting from Robert! In the Top 10 steaks I have eaten!
"August 24, 2018",50,Good food,Adam måste the night. Great service and Good. Maybe to much food 😎 we do recomend this place. Greatings from Sweden
"August 21, 2018",50,"Great steaks, great service","Great steaks ! It’s funny that you can watch how your meal is prepared trough the screens above the terrace. Robert was a great host, really kind. A"
"August 15, 2018",50,Great food,"The restorant is graet, the food was wanerfull, we took gulash soup, it was the best, i ever taeste, my children took, burger, all of us was very enjoy."
"August 15, 2018",50,Real beef haven,We went on a date and ate two burgers! They were more than just delicious!😍 plus the waiter (misi) was super friendly! I wasn’t allowed to eat sugar that time and so they prepared my lemonade without! 👍🏻Really enjoyed the stay and the food!
"August 15, 2018",50,Excellent experience,This is THE place for the best Burgers and meat experience. Waiters are very kind and helpful. My girlfriend had some special dietary requirements and that was no problem for them. Go here if you’re into burgers that you’ll never forget.
"August 15, 2018",50,Truly heavenly beef,"Fantastic brisket and burger. Great service, charming place, good beer selection. Pricey but quality justified."
"August 14, 2018",50,Very nice,"I went with my boyfriend to beefheaven in Budapest and it was very nice. Also the service was very good. Especially Robert was very friendly! When we are back, we will definitly eat there again."
"August 12, 2018",50,Heavenly bef,I like! Adam has the best meat! Best tbone steak in the country. Afterwards afterburner with palinka was much appreciated👍🏻👌🏻
"August 6, 2018",40,Huge burgers,Big portions. Tasty burgers but something was missing for it to be superb! We can definitely recommend! Nice staff!
"August 4, 2018",50,Awesome food!!,Really nice place. We were just passing by and we saw it and just went there. Great burgers. Friendly staff! Totally recommend it!!
"August 3, 2018",50,Excellent,It was amazing. The staff was very helpful and friendly. The burgers was great and the atmosphere was very relaxing
"August 2, 2018",50,Perfect food,"Everyone's food was fantastic, the staff is really nice and helpful, and overall, it's a unique experience in Budapest"
"July 31, 2018",30,Very good food but also very overpriced,"We had a very good dinner consisting in two beers, two main dishes (meat), and one bottle of red wine (the less expensive in the menu) and it cost us 100€. To our mind it was not worth that much. Service was excellent."
"July 30, 2018",40,Excellent meal,"We booked this restaurant for the Sunday evening after the formula one race. Food was excellent the tenderloin was very good and excellent burgers. Service was friendly and Robert looked after us and he was very attentive. Nice setting, clean place, would highly recommend 🍔🥩🍻"
"July 26, 2018",50,Very tasty and a lot!,Very good service and the food were terrific. Spend a lovely evening with family on the terrass along the walkng street.
"July 26, 2018",50,Holy Cow! It’s Amazing.,Food was sublime - my wife and I had the signature burger. We’re going back for another tomorrow. Waiter Robert was extremely helpful and made our experience all the more pleasant. I suggest you pay them a visit - these people know their stuff.
"July 20, 2018",50,Great,"The food was amazing, and we were lucky that our kelner was in good mood and gave us many good tips of what to drink to the food. Probably going back again before leaving Budapest."
"July 17, 2018",50,Great!,"We had a romantic lunch here. The food is excellent, the beer selection is huge and well choosen, the service is perfect. It was my husbands birthday, and he even got a present from the owner."
"July 17, 2018",50,Business dinner,"Excellent food and service, big sortiment of drinks. The waiter can recommend good choice, and can change the dishes as we want"
"July 17, 2018",40,Very good,"Was a very good restaurant, good service, very tasty food and resonable prices, l definitely recommend this restaurant in Budapest!"
"July 17, 2018",50,Best steak I ever ate!,"I haven't eaten a lot of steaks, but this one was the best! Pricy on the vine cart, but definitely worth it! I can only recommend!"
"July 17, 2018",50,Amazing,"I enjoyed my meal in this restaurant, delightful food and very nice staff. Róbert was extremely welcoming and helpful in explaining parts of the delicious meals and made our dinner even better!"
"July 12, 2018",50,Underrated meat restaurant,Great food and great atmosphere. If you are looking for a quality meat restaurant with decent prices then this is the place for you. Highly recommended :D
"July 11, 2018",50,Excellent,Good food with good service. This restaurant is in a good easy to find location. The staff were attentive but not intrusive. The food was excellent and plentiful
"July 11, 2018",50,The best beef reastaurant in Budapest,The food was amazing as well as the atmosfere. If you find yourself in Budapest you should defently go to this place.
"July 10, 2018",50,Amazing,"Went with a stag group in Budapest. Incredible food, all agreed best steak we’d ever had. Very impressed and will be back whenever I visit again."
"July 10, 2018",50,Best meat we ate so far.,"The food is delicious. Wenn ordered 2 big plates for 4 people with various meats, potatoes, burgers and more on it. It was delicious! The Service is great and the location with their glassroom in the Front Looks beauiful!"
"July 10, 2018",50,Same quality and hospitality as the Little brother Tuning bar :),"We've visited here for a BBQ night, the food was so delicious it made me cry and the waiters were also really friendly. Place,food,employees -» 10/10 Beside Tuning bar my favourite place."
"July 10, 2018",50,Very good,"Very good food, not just the meat. We ate a kind of ramen / lamen soup for starters. I had meat which was excellent but I don't recall exactly what - I think it was pork ribs. Wife had fish also good."
"July 10, 2018",50,A must in Budapest,The best burguers that you can eat in Budapest. The craft beer is also a must if you visit Beef Tuning.
"July 5, 2018",50,Great Steaks,Great steaks good location and great service. Watching the steaks being cooked on large screen TV was novel.
"July 5, 2018",50,Very very very good,"We were there in September 2017 for dinner with colleagues and it was fantastic, food, service, beverages, simply everything!"
"July 4, 2018",50,Totally recommened,Wonderful place in the heart of the city. Staff is professional with good sense of humor. They worked fast and always gave us a full attention. And the Foods are brilliant. Rockefeller Burger is my favourite.
"July 3, 2018",50,Dinner,"Excellent quality of the food (burgers, stew), very friendly people, nice atmosphere. We'll come back every time we visit Budapest."
"July 1, 2018",50,Fantastic burger,Loved the burgers and gnocchi too. Absolutely delicious. Thanks for the kid friendly service Robert. We'll be back next visit to Budapest.
"June 20, 2018",50,Fantastic meal,"Great meal, great staff, great atmosphere, great beers, what else you need when you have also a great group of friends?"
"June 20, 2018",50,Great burgers,Probably one of the best burgers I have had in my life. Great staff and atmosphere. Also great craft beers.
"June 17, 2018",50,Great food and services,"It is situated in an excellent location. The food is tasty, and the staff very kind. I warmly recommend it"
"June 1, 2018",50,Amazing restaurant - meatlover’s heaven,"If you love meat, great service, outstanding design, nice location do not miss this restaurant. Steaks are the best in town. Waiers are professional, give amazing details regarding your food."
"May 27, 2018",50,Budapest,Delicious food and professional staff makes this place perfect for dinner. Value for money restaurant.
"May 26, 2018",50,If I were a cow I'd want to end up here.,"If I were a cow I'd want to end up here. Amazing food, amazing staff, super friendly and very knowledgeable. By FAR the single best place in Budapest for meat related dishes. Their brisket is simply amazing."
"May 21, 2018",50,Love this place,"Awesome food, nice and friendly staff. Defiantly a place you need to visit during your stay in Budapest"
"May 19, 2018",50,Amazing meat!,One of the best steaks I had in Budapest! Absolutely fabulous! Location is amazing and the whole atmosphere was fantastic! Thanks for the incredible experience!
"May 19, 2018",40,Meat,Dropped in without reservation while we were in Budapest for New Year. Ordered mixed platter so tried different things and it was all good.
"May 15, 2018",50,"Super burgers, super service!","Fantastic restaurant in a cozy street. Delicious burgers, very friendly and quick service here, great location."
"May 1, 2018",50,A great restaurant in central Budapest,"We had a great time eating in this great restaurant located in a nice place and served a great dinner. The food was excellent, we ate hamburger and steak and both were excellent . A great place to eat in Budapest"
"April 26, 2018",40,Very good,"I saw this place on trip advisor and wanted to check how is it. So we ordered two burgers, must say one of best burgers that I eat. Staff was very good and polite. Restaurant inside is very very nice we really like it."
"April 20, 2018",50,Fourth time,"Been here four times, sometimes with company sometimes solo, still as great as it was the other times, I like this place a lot and will be back for more, I can thoroughly recommend the ""pit box"""
"April 2, 2018",50,Delicious beef!,We went in Easter Sunday and it was super busy. Thankfully we rang ahead to reserve. The cuts of beef are aged onsite and it’s super tasty. Highly recommend!
"April 1, 2018",40,Great visit,"The food was fantastic but if you get a steak they’re quite small for what you pay, it’s still delicious though, just not use to such small portions."
"March 31, 2018",50,Best resturant in Hungary,"Went here with an empty stomace, came out filled up on beef and beverage. Great staff and food, everyone is called Roberth."
"March 30, 2018",40,Nice Beer and Wine,Very good food. Nice waitors. Nice atmosphere. Nearby City center. Prices were ok. Warm food. Didnt wait long.
"March 30, 2018",50,Great meat and burger place,"We had the cattle ribs and a burger, everything tasted fantastic, would definitely recommend this place."
"March 28, 2018",50,The best T-bone ever,"The best T-bone ever in my life. Evrything elese was perfect, friendly and high profressional staff..."
"March 26, 2018",50,Amazing !,"Recommended! Food was great, food portions extremely big for my belly, nice atmosphere inside the restaurant and the best thing ever! Finally in Budapest we found a restaurant with excellent service. They know how to treat to their clients! 5 stars from me !"
"March 24, 2018",50,😋😋😋,Best burger in town!!!! Very Nice service and Nice wine! But the burgers here you will love! Thanks for a nice dinner!
"March 11, 2018",50,AMAZING!,"My friends and I found this little gem on TA actually and decided to pay a visit when we went for our city break, we were most definitely NOT disappointed. The service was great and the BURGERS WERE FANTASTIC! A must try!"
"March 7, 2018",50,Wonderful evening for couple,"Magical place to eat tasty burgers accompanied with delicious BBQ ribs & stuff. Thank you guys, Cheers from Latvia"
"February 28, 2018",50,Amazing food - huge portions,"Watch out for the chips/crisps translation error! But, they were amazing! HUGE portions and amazing staff :) overall, brilliant! (Pricey for budapest, but not if you were anywhere else)"
"February 26, 2018",50,Worth a visit!!,Thoroughly enjoyed! We booked this table before visiting Budapest as we had heard good things. Can say we wasn’t disappointed and would definitely recommend!
"February 24, 2018",50,For Burger Lover is a must,"Best handcrafted burger in town of course there is competion Tuning Bar & Burger 😜bit really it’s very tasty,best bet!"
"February 15, 2018",50,Great burger & friendly service,Excellent signature burger (beefheaven) and local draft beer. Only downside that their wifi didn't work
"February 8, 2018",50,Delicious food Great service,"Food was very good, great selection of craft beers and excellent service. Many thanks to Robert and the rest of the team."
"February 8, 2018",50,Early dinner,"Amazing and professional service, great food, nice drinks and overall really nice place. Next time will try steak."
"February 7, 2018",40,Realllyyy good food,We enjoyed our meal! Very friendly service and a cozy moooooooo(d). Definitly recommendable! Free shot of their homemade liquer at the end of our meal
"February 2, 2018",50,Greatest brisket of all time hand down,The name matches the food because for that hour i was eating the brisket it felt like i was in heaven.
"January 30, 2018",50,AMAZING!,The burgers at this restaurant are incredible. Robert (our waiter) was so attentive and would recommend to anybody. We also had cocktails which were delicious. If you are stuck for dinner in Budapest Go to Beef Heaven!
"January 29, 2018",50,Fantastic food and Service,I came on a date here with my significant other and the food was absolutely fantastic (brisket and fried rice) at a very reasonable price and the service was also flawless with a lovely waiter and staff. 10/10
"January 29, 2018",50,"Great service, excellent food quality","Atmosphere beautiful and relax, good advices for food selection. Gulas soup was an interpretation of the recipe with the beef served as a steak almost. Overall, good value for money, service 10% included in the invoice from the very beginning"
"January 27, 2018",50,Best burger ever,Really enjoyed this visit - Nice staff and truly the best burger I have ever had. Cocktails are small so remember to order a lot 😊
"January 23, 2018",50,Fantastic,Food was absolutely marvellous! Especially the steak! Good quality meat and very tasty. Staffs are very professional and the restaurant’s atmosphere is wonderful.
"January 23, 2018",50,Very nice,I had burger which was clearly homemade from the scratch. The beef patty was left pink inside as the angus beef should be. Big portions and lovely atmosphere. Service was kind and very helpful.
"January 23, 2018",40,Night with friends,The environment and the service was amazing. But the most amazing thing though was the food. Nice location in the center of Budapest
"January 19, 2018",50,Value for price,"We had a great baby shower party at this place which was really nice! Stuff was great, burgers were too and a top of that nice hand crafted beers and numerous palinkas as gift from house!!"
"January 18, 2018",40,Beautiful,"First meal out in Budapest and it was amazing! The beef was just amazing, melt in the mouth. We had the pit box and heaven burger they were both amazing. Would definately return"
