"February 29, 2020",50,Working dinner at Conference,We ate here in the evening and the view over the Bay Bridge was stunning. The food is great quality and there is a lot of it. You will not leave here hungry that’s for sure.
"January 7, 2020",50,A good classic steak house,"Really good, steak tartar was amazing, also the prime rib and the filet was very good. The place is nice, and has a beautiful view to the bridge. Service was very good."
"December 21, 2019",50,"Great Food, Great Service, Unbelivable Location","This restaurant is excellent. I've been here several times, in the bar, on the patio, and in the dining room. Never disappointing!"
"December 11, 2019",50,Remarkable food and impeccable service,Steaks and grills were superb. Service was impeccable. I would not mind going back to it next time we visit SF. Place has a relaxed atmosphere. The views of the Bay Bridge from the restaurant was just fantastic too.
"October 22, 2019",50,Magnificent,"Had a great time with the family. Will definitely do it again whenever possible. Location, view, service, staff were all fantastic..!!! Thank you..!!!"
"October 11, 2019",40,Great but a tad pricey and touristy,Spectacular location overlooking Bay Bridge. Stroll the bay front. Great terrace - grab it if not too cold. Solid steakhouse menu. Sister restaurant WaterBar is also buzzing next door. Short pleasant walk from downtown.
"September 19, 2019",50,Lovely Location,"It’s really nice in the night... under the Bay bridge the view so great... great food , service at the bar was exceptional... place is really good to host a business dinner.."
"July 28, 2019",50,Great food and views,We were recommended to go here for dinner to see the lights on the Bay Bridge. Was not disappointed at all. We sat out on the balcony and had a wonderful evening. Recommend you book to ensure a table though.
"July 13, 2019",50,Beautiful views and delicious food!,We enjoyed a great group dinner here. A clear night so beautiful views of the bridge and lots of people walking by on the path. Delicious steak and potatoes! Lemon risotto was way too lemony. Loved the chocolate ice box cake. Great wine selections.
"July 3, 2019",40,Lovely Setting,Scallops were delicious. Personally did not care for the vegetables as they were either too spicy (broccoli) or too bland (green beans) the steak I am told was as delicious.
"May 26, 2019",50,Epic it is,"Epic it is, I've try the T Bone with Lobster, at the bar and it was really really tasty.The view if you seat close to the window is also great but the overall restaurant is very pleasant."
"May 21, 2019",50,Awesome venue and food choices,"We had a wonderful dinner at EPIC - and it was EPIC. Loved the location, the water view was wonderful. Steak and apps were perfect and delicious."
"February 23, 2019",50,Mouthwatering experience,Epic certainly lived up to its name! All of the food was amazingly delicious - and the view of the bridge really set the atmosphere. The service was also too notch. I’d highly recommend!
"February 12, 2019",50,Impossible Burger,The meatless Impossible Burger (the newer recipe) is served here. It’s a delicious alternative to beef patties and a great option for those who want to avoid meat.
"March 28, 2019",40,Steak and fresh seafood,Five for dinner at 6:30pm and the place was already very busy. It is well organized and operated and everything went smoothly with no sense of being rushed or hurried. The seafood indulgence platter was fantastic and the grilled octopus was the best I’ve ever...More
"March 17, 2019",50,"The perfect view, and the food is good!","Typically when you have an awesome view, the restaurant is average. This is not the case! First, I would highly recommend you allow some extra time pre or post dinner to walk along the Embarcadero. The lights of the city are truly amazing! Then step into a lively restaurant which has traditional steak house wines, drinks and menu. The dishes are all done very well, and don’t disappoint. They try and get creative w an apple salad, which is a fun twist. The atmosphere both inside and out make this a special evening."
"March 17, 2019",40,Dinner for the mothers,"I'll start with great flavor and tender cuts. Great flavor. The prices are high, but it's a high end restaurant. Good size cuts and you do not leave hungry. The fritto misto wasnt the greatest I've had. Little to dry. The sides available had good flavor and portion size is enough for two or more. Wine and cocktail selection is good. I only gave a four rating due to appetizer not being up to par for price."
"March 10, 2019",30,"Overpriced, not great steaks","The positive things with the restaurant is the outside terrace and the great view on the Bay Bridge and the Baywalk. The steaks were hard to cut, with a lot of fat. No real greens apart from sprouts. We ordered mushrooms, which were quite overcooked. Still looking for the best Steakhouse in San Francisco."
"March 10, 2019",40,Solid dinner as part of a conference,Had the short ribs and they were very good. Knocked a star as the risotto starter wasn't the greatest... basically cheese and risotto. The dessert was pretty good as well but a very different version of an apple pie. The service was excellent and attentive and the views were simply unapproachable beneath the bridge... stellar views.
"March 8, 2019",50,Great food - wonderful location,"Went for lunch Las week. The food was terrific, a Expensive but the steak was perfection. Everything we has was marvelous including top notched service. It’s well situated in the Embarcadero with a great view of the bay bridge. Come for the food and stay to dine. It’s wonderful."
"February 23, 2019",50,Mouthwatering experience,Epic certainly lived up to its name! All of the food was amazingly delicious - and the view of the bridge really set the atmosphere. The service was also too notch. I’d highly recommend!
"February 12, 2019",50,Impossible Burger,The meatless Impossible Burger (the newer recipe) is served here. It’s a delicious alternative to beef patties and a great option for those who want to avoid meat.
"February 7, 2019",50,AMAZING,Had dinner here 2 weeks ago while in town for a convention and it was amazing. The food was beyond excellent and the service was unmatched. I've eaten in many many steakhouses around the country and this is top 3. If ever back in San Fran will 100% eat here again!
"February 5, 2019",50,As Good As I Remembered,"Often times we go to a restaurant and have a terrific meal and rave about it. Then, in our enthusiasm we go back only to be disappointed as it not being quite what we remembered. That is not the case with Epic Steak. We recently returned and it was every bit as good as in our previous visit. This time we ordered Rack of Lamb along with the Julia Child potatoes (a must order). The rack was cooked to perfection and, since we were splitting the order, delivered each of us our own plate rather than our having to do it ourselves. Great ambiance, service, and food. What more could you ask for?"
"February 2, 2019",30,Not the best,This place was just OK. We were a party of three and one meal was sent back and the others were marginal at best. The view is the best part but be prepared for lots of large parties and a very loud experience.
"December 28, 2018",50,2nd visit in 2 years.....still excelent,"Great food, great view, great service. Perfectly cooked steak. Wonderful sides. All in all a great experience and meal. Definitely worth going to."
"December 28, 2018",50,Best steak I've ever had & a fantastic waiter,"Phenomenal ambience - special but unpretentious, super-friendly staff, and the most delectable Brussels Sprouts I've ever had :D"
"November 8, 2018",40,Great steak,"Great steak and view of the Bay Bridge. Malbec wine delicious. Bar staff friendly. Calamari pretty average, but overall definitely worth a visit if you can afford it."
"October 27, 2018",50,OUTSTANDING,"We sat on the patio with a superb view of the Bay Bridge, sunset was glorious. My salmon was absolute perfection. Perfect flavors, presentation. My hubby’s fish was excellent. The Brussels sprouts are insane!!!! Would HIGHLY recommend."
"October 23, 2018",40,Great steak,Visited again last night - if you want great steak and great napa wine this the place to go. Great views of illuminated bay bridge and highest quality ingredients - have been several times since it opened 10 years ago
"October 7, 2018",40,"Epic Food, Epic View, good wine, Epic Prices","The food is very good, but sit on the terrace and enjoy the spectacular view of the bay bridge and the lighting display. The service is very good, wines are good but be prepared to pay high prices for the view."
"October 4, 2018",40,Great view of the SF Bay Bridge,Very nice angus beef burger with all the trimmings. Fries with bernaise sauce. AND a brownie!! Close to SFFD fire boat station.
"October 4, 2018",50,Excellent Steak,The restaurant has a great view of the bay bridge which is lit up at night. The quality of the steak was excellent the best I have ever had while the service quality added to the overall evening.
"October 3, 2018",50,Great food and great view!,The view of the San Francisco Bay and the Bay Bridge were just the beginning of a perfect dinner. The service was impeccable and the food and wine were delicious. My Prime Rib was cooked to perfection.
"September 20, 2018",50,Classy atmosphere with wonderful food and service!,this s a stop for us each time we are in San Fran! great steaks and seafood-and the service is excellent! we will be back again and again!
"September 12, 2018",40,"Good food, good service!","I really like the setting next to the Bay Bridge and the interior is nice and makes it feel a bit luxurious. Oysters and meat are good, but not outstanding. Overall a nice place to go to."
"September 12, 2018",40,Joint birthday celebration,On the basis of the food this would be a 5 but it is pretty expensive so I accounted for this Steaks beautifully cooked and goes well with one of the various seafood based starters Wine list is extensive and some very pricey bottles
"September 10, 2018",50,Consistent Excellence,"Consistently excellent. Epic is a go-to for special occasions and a splurge dinner. Steak is always perfectly prepared, love the design-it-yourself salad, and the wine list is to die for! Service was impeccable. It's spendy, but worth every penny!"
"August 20, 2018",50,"Holy awesome views, Batman!","This is where I had my first meal in San Francisco. Great start! Tasty good, super awesome staff (especially Jenn)! I’m sorry I didn’t get a chance to return. Next time I’m in the city, I’ll stop by again."
"August 4, 2018",50,Incredible View with Great food,"Brunch was memorable sitting outside...the view of the bridge is breathtaking. Food was very, very fresh and beautifully presented."
"June 7, 2018",50,The view of the Bay Bridge at night adds to the restaurant ambience,"The food was great. The location and scenery is amazing. We sat right next the huge fireplace. The temperature in SF, right on the bay tends to drop at night. The fireplace kept us warm."
"June 5, 2018",50,"Anniversary Dinner on vacation, Epic did not disappoint!","We chose this restaurant for our anniversary dinner during our vacation to San Francisco. It was highly recommended, and lived up to the accolades for us! Great wine selection, and amazing food. Hope to be back soon!"
"May 28, 2018",40,Great Place to grab a late night drink and view the Bay Bridge,When in San Francisco stop by for an Epic view of the Bay Bridge. Such a beautiful setting and the lights of the bridge are nice at night. We didn't ear there so only can attest to location for an evening cocktail or two.
"April 27, 2018",30,"Good good, wonderful view, Service below average","We enjoyed a good dinner with really nice views of the bridge tonight. While quality of the food is good, the Service is just Not good and below other top restaurants we visited in SF."
"March 4, 2018",50,Club managers dinner,Group of 11 and the food and service were excellent. Certainly not inexpensive as you can expect 100 + person without liquor. The view is absolutely spectacular.
"January 31, 2018",30,Great view and Service but not the food,"The view is really nice for an special occasion, but my steak was burned the mojito tasteless and the sides extremely small with not a verity of selection (no mash potatoes in steakhouse)"
"January 30, 2018",50,Just perfect,Magnificent steak perfectly cooked as requested. Great views of the bridge and bay. Wonderful staff who were attentive but not overbearing. Perfect night.
"January 21, 2018",50,Great view and superb service,Perfect setting for a table of ten. We could enjoy the food and the discussion all of this with a really perfect service. And not to forget the view. Much better than expected for a steak house.
"December 28, 2017",50,Hand down! VERRY GOOD!,Truly an amazing restaurant! Even the appetizer ceaser salad is amazing! The steaks where cooked exactly like we wanted it. The julia’s child potatoes is a must try! The view is stunning
"December 21, 2017",50,Great upstairs bar and atmosphere,This was such a great place. I was visiting from Texas and went for happy our but ended up staying for dinner. They have an amazing champagne happy hour! Definitely recommend
"November 25, 2017",40,Great meat and service,"Great location by the Bay Bridge, great meats but they cannot cook it really ""medium rare"" the french way it seems. Good side dishes. Service was professional and efficient."
"October 15, 2017",30,"Ordered hamburger well done, came medium","And it had a little ‘sign’ on a wooden stick that said medium. Slow service. Just my experience in an ‘upscale’ restaurant, sorry. Nice location though."
"October 8, 2017",40,Good drinks but amazing view!,We planned on eating here but the lunch menu did not look as good as the dinner menu. We sat at the outdoor bar and had a cocktail enjoying the view. Good drinks at a reasonable price.
"October 6, 2017",50,One of the best steakhouse in San Francisco,One of the best steakhouse in San Francisco. Had the Tuscan Porterhouse and was delicious. Great bar on 1st floor for drinks before dining.
"October 5, 2017",50,Cocktail Party on Patio,Attended networking event at this steakhouse. Beautiful location with views of bay and bridge. Atmosphere was bustling with open kitchen and active bar area. Appetizers we excellent. Will definetly go back for dinner next time im in tow
"October 3, 2017",50,Beautiful location...,Lovely place to go for Dinner... Great food & Drinks...Service was extraordinarily... outside open seating was really good..
"September 27, 2017",50,Really cool venue for company event!,"I had the good luck of attending an event arranged by our business partner. Super place, right by the Bay Bridge. Super cool venue, terrace and food/service! Highly recommended!"
"September 4, 2017",50,"Great food, great service, amazing view","Super address for meat and wines. Great menu, service friendly. Terrasse is perfect over bay bridge. Just great restaurant!"
"August 27, 2017",40,Happy days,"Went here the day after Waterbar, so had the great location and views of the bat and the bridge Enjoyed our meal and service was great but it is pricey as it's specialist steaks, although steaks were still excellent"
"August 8, 2017",30,Nice food but very expensive,We tried the stakes and the duck. Very good food but its too expensive here. Best suitiable for business dinners.
"August 4, 2017",40,Great interior and service with good food,"This restaurant is overlooking the Bay Bridge and has a great ambiance. Service is great and food is good, but not fantastic. Steaks are good, but bearnaise a bit runny and spetzel floating in oil. But overall I would recommend this restaurant."
"July 31, 2017",30,"Top location, excellent staff, ok food","The restaurant is a gem and the view spectacular. All waiters very attentive and very friendly. The food was ok, quality of meat exceptional, but not well prepared - very salty, otherwise not much flavor. Heavenly desert though."
"July 23, 2017",50,"A ""Wow"" experience!!",We were just blown away by this restaurant! Picturesque view overlooking the bay bridge! Everything was perfection including the food! Expensive place but worth all the money!! A unforgettable experience!
"July 20, 2017",30,"A steak house, nothing more","this is good steakhouse but nothing else, nothing special. The waterfront view ist not very special and food quality could be better. I had a salad (disapointing), Steak (ok) and some vegetables. The steak house is expensive."
"July 17, 2017",50,Favorite Restaurant in the City,"Amazing food, amazing view and fantastic service. They are always so nice & it's such a treat to dine there! Food is definitely worth the price. The filet mignon is my favorite!"
"July 15, 2017",50,Great service and awsome view of the bay bridge,"I have to say this restaurant is a bit pricey, however, the food, service and view are spectacular. Went for a birthday dinner so it was a special occasion"
"June 28, 2017",50,Awesome Steakhouse and Atmosphere,"While in San Francisco for work, my clients insisted on eating at Epic Steakhouse knowing I love to hit steak houses all over the country. This lived up to the hype. Everything was perfect. I can't wait to go back."
"June 20, 2017",50,Amazing food with amazing views,"A friend recommended this place for a client dinner. The views of the Oakland Bridge are ""epic."" The service was on point. Everyone enjoyed the food and wine selection. A must do in SFO."
"May 18, 2017",40,High end place with good view,"Steaks are expensive, but very tasty. Not the best, but very tasty. Service felt genuine and friendly, cocktails were okay. A nice meal in all"
"May 16, 2017",30,Expensive steak,The restaurant has a nice vibe with beautiful views of the Bay Bridge. However the steaks were very expensive and came out not looking overly appetising. They did however taste pretty good!
"May 2, 2017",50,This was recommended by Hotel and it did not disappoint....,"Excellent location with view of San Francisco Bridge, quite beautiful at night. The service was top notch. Food way better than even excellent."
"April 10, 2017",40,"Beautiful restaurant, beautiful view, good food","We went as a large group (20ish). The view of the Bay Bridge is gorgeous. As a large group, we had a choice of steak or fish. Both entrees were good. The chocolate dessert was phenomenal."
"March 26, 2017",50,Really Good Bar and Fine Restaurant,A beautiful view of the bay bridge with fine lights at night. The bar is upstairs with an outdoor balcony. It was intimate. Bar food was good albeit a bit scarce. Downstairs steakhouse served good steak and fish dishes. Nice wine selection including French Wines.
"March 16, 2017",50,"Beautiful Vie, Excellent Service",A must visit while in San Francisco. Great food. Excellent service. Fantastic view. Something for everyone.
"March 4, 2017",50,Stunning views of the Bay Bridge (and excellent food),"This is a special occasion restaurant featuring great views of the Bay Bridge. The food is relaxed but quite excellent and with an impressive wine list including wine by the glass selections. Can highly recommend the Black Cod, and views from the upstairs patio area"
"March 1, 2017",50,"Great food, adn wonderful view",Came for a meeting and tried all sorts of new food. None of it disappointed. Wonderful view of the Bay Bridge at night just added to the atmosphere. Wonderful experience.
"February 17, 2017",50,Delicious steaks,I went to this steakhouse twice this week for two receptions. Food and view were outstanding. Staff are very nice.
"February 5, 2017",40,Just the Bar,"Very nice and cozy place to pop in on a rainy evening. Great value for Happy Hour... 5 bucks for certain drinks..wine, mixed and beer selection. Wait staff was excellent."
"February 1, 2017",40,Recent Dinner,"Very attentive service, good presentation, food tasty, very pricy. Beautiful room, tables not crowded together"
"February 1, 2017",50,Beautiful location and food,I had a few hours tomspare in San Francisco between flights. It was worth the uber down to the bay and back. Steaks were cooked to perfection and idea were delicious. The staff are attentive and friendly.
"January 21, 2017",50,Amazing view and delicious dinner,It's located in the bay. You have an amazing view in a very good environment. Food was delicious. We had to wait a little bit even we had a reservation but it was in a bar which also is vey nice. Service was very good
"January 17, 2017",50,OMG,"wow, great dinner, petite filet was more than enough. The ceasar salad is very very good and we had a caramel cheesecake that we are still thinking about. Hard to beat the view, amazing wine list too"
"January 7, 2017",50,Excelent!,"One of the greatest ever! The view of Bay Bridge is amazing, the food was awesome, ordered the New York and I loved it!"
"November 26, 2016",40,Wonderful!,Definitely going back....beautifully set out with view over the Bay bridge and the food was stunning...Pan fried scallops to start and a bone-in strip for mains...both beautifully prepared and plated. Very nice wine list and excellent service. Looking forward to going back! Great job team
"November 23, 2016",50,"Fabulous view, excellent food and good service",This restaurant sits right on the Bay with fabulous vistas of the Bay bridge and waterfront. The interior of the restaurant is historic and has a story dating back to the big fires in SF. The food and drinks were outstanding. We'll go again.
"November 10, 2016",40,Can't beat the view,"Had a work event. Steak was huge, tasty and well cooked. Walnut pie superb. Hard to fault the experience."
"November 10, 2016",20,Very poor quality for the price,"The food was ok, but the prices make you expect excellent food and above average service. Prices are about 30% above the normal SF prices for the quality you get. The service wasn't above average either."
"October 26, 2016",50,Great steak and view,"Excellent view of Bay Bridge along with great food! Service spot on and very attentive throughout the meal. Sides enough to share. Only suggestion is to increase topping amounts. A bit skimpy on the mushrooms and bearnaise sauce. Otherwise, outstanding!"
"October 17, 2016",50,Good food and service,We had a reservation on Saturday night at 7:30pm. They sat us on time and the food was great and the service too. There is a great view of the Bay Bridge all lite up at night.
"October 15, 2016",50,"Great view, service and food",Perfect place for business or private dinner. Great view and nice atmosphere. Welcoming service Great choice of steaks and top quality Prices are high
"October 12, 2016",50,"Beautiful food, beautiful view!","Come for the food and service, stay for the view. I think we had a bit of everything. The wine list is outstanding. Dessert was incredible. one of our favorites in the city for sure."
"October 6, 2016",40,Great Bridge Views,"Had a business dinner this week and the views of the Oakland Bay Bridge at night is beautiful. The restaurant gets a bit noisy which can be distracting if you want to have an important business discussion. Service was fair, Steaks were cooked to order."
"October 5, 2016",40,"Good Food, Great View","This is a combination of a very good steakhouse at a great location. Everyone in our party greatly enjoyed the food, although it was pricey. But the view and location can't be beat!"
"September 26, 2016",50,Totally worth it!,"We celebrated my husbands birthday in this restaurant. To begin with, it has an amazing view, and as a plus the customer service by everyone is great. The food was delicious, though a little expensive, but totally worth it. I highly recommend this restaurant."
"September 12, 2016",50,Great location,"View is great, especially at night time. Food and service was top notch. Highly recommend. Easy to get to and right on the water."
"August 29, 2016",20,Bad surprise,Restaurant absolutely not adapted for children under 3 years old. Food not value for money at all: very expensive and not so good. Service not excellent.
"August 27, 2016",40,Waterfront seating at dinner and good steaks,"We came for the steaks and we got these in a great setting, served by friendly servers, good recommendations and were very satisfied."
"August 23, 2016",40,Great Lunch,"Had a great meal here, although I did think the menu was some what limited during lunch. The food was very tasty and the staff were great and very attentive. Lovely to sit outside when the sun shines. A very pleasant experience."
"August 19, 2016",50,Epic,Very good service and view of oakland bridge Very good wine menu Excelent steak Nice people are visiting this restaurant
"August 15, 2016",50,Great View. Great Happy Hour.,$5 Champagne by the Bay can't be beat. Excellent oysters. Good Steak Tartar. Great Service. This is THE place to be on a nice day.
"August 10, 2016",50,amazing steak,Pricey but the best steak you will ever taste. my son actually fell asleep and they didn't make a fuss the rest of us ate and drank and had a great dinner.
"August 4, 2016",50,Worth the money .... For one time,Very expensive but honestly the best T bone steak I have ever had. The view of the bridge the best in town. Good service. As usual with these places a bit noisy.
"August 2, 2016",40,"great steak, great views","Epic is a great restaurant with beautiful views near the Bay Bridge. There is a good vibe there and a good crowd. I was solo, so I ate at the upstairs bar, which was very comfortable. Food was excellent."
