"March 22, 2015",40,"March 21, 2015","We bounced downstairs into the bar area and received immediate service. Caught the game on their large screen, had the filet Oscar style, very good wine by the glass selection. Go here $$$$"
"March 11, 2015",50,Wonderful,If you are a steak lover this is your spot. Excellent service and great food. Later gets a little loud
"February 12, 2015",40,Classic and expensive,An iconic steakhouse with a reputation and prices to match. Absolutely nothing to fault except the bill but for that price I have eaten in michelin starred restaurants
"February 10, 2015",40,Great service good Food!!,2nd time eating at a Morton's Steakhouse and our server (Ruben) was amazing he was very friendly and helpful. The food was very good and we will be back!!!
"February 5, 2015",50,Bar menu - perfect choice,"Try the filet mignon trio....great experience, great service, delicious food. I recommend it....the best bar menu so far!!"
"January 27, 2015",40,Chain perfection,I normally try and go to local steakhouses when I travel but this is the most consistently great steakhouse I have found. Service and food excellent. Keep up the good work.
"January 27, 2015",50,"Mortons, what else is there to say!","Within walking distance of all the Union Square hotels. As usual, the food and service are second to none. Mortons always delivers a great meal!"
"January 17, 2015",50,Fantastic steaks,"If you are in for a really good steak, this is your place. The filet mignon is phenomenal and the side orders great. Prices are high, but you really get what you pay for!"
"January 12, 2015",50,Excellent steaks...great service,When the steaks were brought to our table we made our choice...I then asked the waitress if I could request the chef to make my with a special method... they talked it over and consequently made the best steak I've ever had...except for my own.
"December 23, 2014",40,Anniversary Dinner,"We have eaten at quite a few Morton's this was the darkest of any I have ever been to. The service was perfect, food perfect. Atmosphere was a little crazy and tight squeeze around the tables."
"December 14, 2014",50,Wonderful experience,I walked in and saw steps!! Was worried because I am mobility impaired. But they have a lift that brings you up the five steps to the dining level. Food great. Sides are large and can be shared by three or even four people.
"December 13, 2014",50,Excellent steaks and burgers,"Morton's has fantastic steaks and burgers, but the menu is spendy. If you want outstanding food and are okay with spending for a great meal, stop in. We love this place, because of the great food and friendly staff."
"December 5, 2014",40,Nice pre-theatre drink,"Headed here for a quick drink before the theatre next door, lovely decor, friendly and efficient staff, would love to head back for dinner."
"November 12, 2014",50,What can I say ... The best steak.,I had a craving for a steak ... Although it was a little pricey it was well worth it. Perfectly cooked and delicious sides. The atmosphere was elegant and service was prompt and efficient. Would love to come back again.
"November 11, 2014",40,Great Steak,"Food was fantastic but was a little pricey. My husband and I shared a tomato and blue cheese appetizer, a 16oz ribeye, and a side of brussel sprouts. A drink each and our bill was $105. Service was amazing"
"October 22, 2014",30,TOO EXPENSIVE!!!,"So...$55 for an 8oz fillet mignon. Add Jacket potato, add bread, add two beers...$96! one person! yeh...i felt mugged. You can get a steak for less thats just as good."
"October 20, 2014",50,Very satisfying,"A very nice dinner with my wife on our honeymoon, shared a steak because they are so big. A good couple of wine glasses and your done for the night..."
"October 15, 2014",50,Excelent steak in classy restaurent,"Mortons is one of the best steakhouses I have visited. The waiters have good knowledge. My steak was a perfect ""medium-rare"", as I ordered. A bit expensive."
"October 7, 2014",40,Delicious food.,"Loved how this was right next door to our hotel, and even when it was too busy to sit in, they did room service! Yum."
"October 3, 2014",50,It's a Morton's,"Pricey but great bar and the best steaks around. It's a Morton's, what more is there to say. Practically next door to the excellent Inn at Union Square and easy to access by cab, cable car or T."
"September 27, 2014",40,TYPICAL MORTON'S STEAK - VERY GOOD,We were able to get a table on a walk in basis and the restaurant was very crowded. The service was good and the steaks didn't disappoint in true Morton's style. The wine list was very comprehensive.
"September 6, 2014",50,Best stake in SFO,"I wanted to have a good steak and I just loved this place. If you are looking for stake, just go to this place. Prices are acording to this level of restaurants."
"September 3, 2014",30,Good steakhouse but why waiters so fast ?,"The choice of steaks is good and very good their quality. As too often happens, waiters are too fast in changing dishes and bringing the check."
"September 1, 2014",50,Perfect steak,Perfect steak restaurant wiht interesting meal and good selection of wine. Location near Union square
"July 26, 2014",40,Excellent steak,"Great food, maybe a bit overpriced, but actually one of the best steaks I've eaten. Probably not a good choice for vegetarians"
"July 24, 2014",50,Excellent evening at Morton's,"Great service, great food, great atmosphere. Gave us special attention due to a special occasion. Very pleasant time."
"July 23, 2014",50,Great place for relax and a great filet!,Great place in San Francisco...only once because it is expensive ...everything so great---warm bread...filet and wine what else?
"July 13, 2014",40,Consistently good steaks,Always great steaks and service. Not what I would call a real special restaurant and certainly not inexpensive but I can always count on a great great steak.
"July 7, 2014",50,Delicious,"This was one of the nicest restaurants we went too on our honeymoon. The food, wine, service was amazing - all of it! We had no booking but they found us a table straight away with no wait. HIGH RECOMMEND"
"July 7, 2014",50,One of the best steak meals!,"It's Morton's, it's expensive, it's ala carte and it's very good. Dinner for 4 of us was not cheap but was very likely one of the best steak dinners we've ever had. Won't do it often, but will absolutely do it again."
"July 6, 2014",50,Thank you.,"We went to Morton's on the 4th, our 42nd wedding anniversary. Great meal, great service. Thanks for making our anniversary special."
"June 26, 2014",40,Pricey but worth it,"We wanted a steakhouse and Morton's fills the bill. It was a block away from our hotel. Very attentive service, selections were expensive but everything was very good."
"June 22, 2014",50,very nice steak house,Excellent steak house in a good location. Was able to walk in with no reservation. Great service and good prices.
"June 16, 2014",40,Amazing atmosphere and meat,Oh my gosh the porterhouse was amazing the meat was cooked perfect a bit pricy but for the atmosphere and food it is worth doing every so often.
"May 12, 2014",50,Always a pleasure,Consistent and good. As long as the new owner doesn't homogenize it and take away what truly makes Morton's I will always come back. Kudos to the guys in the bar for great service and knowledge and pride in their work.
"May 5, 2014",50,Great food Great service,It was fantastic anniversary dinner. We mention anniversary to the very friendly bartenders. They really took care of us from start to finish. The meal was exquisite and the staff was 5 Star all of the way. Thank you Morton's staff for a fantastic evening
"May 2, 2014",50,Great Experience,We had a great experience at Mortons. The service was outstanding from the greeting at the front desk desk right through. Our waiter was very knowledgeable as the menu and wine list is very extensive. This is a lovely restaurant.
"April 20, 2014",30,Great food. Disappointing service for the price.,The food was delicious. But the prices were more expensive than we expected. And the service from our waiter didn't measure up to the price.
"April 14, 2014",50,Steak to die for,Amazing steak best I've ever had. Service great but don't go if you are on a budget as we only had main courses and 2 beers each and it was over $178!!!!!!
"March 20, 2014",50,Great happy hour,"Staff was very professional and friendly. The bar noise level was low, the wine was good, and the steak was excellent as always!"
"March 14, 2014",30,"Overpriced, underwhelming","Food was good, but not superb as one would expect given the price of the check. We won't be eating at this chain again."
"February 28, 2014",30,Obviously great steak but...,"We were a large group so it probably drove down the overall experience, but I expected both better taste of the steak and more effort on the sides. Portions are huge (do not take starters). Nothing special, which is disappointing for this price."
"February 21, 2014",50,Good steak!,"The service was excellent, lots of food choices, large wine list. The prices are a little high but the food was really good!"
"February 16, 2014",50,Great service at the bar!,My wife and I stayed at the hotel next door. We made a few passes through the restaurant. We sat at the bar and enjoyed a few cocktails and appetizers. If you are near Union Square it is a must do!
"January 27, 2014",50,Very good food!we t,"Went without reservations, they accomodated us immediately and the service was superb! We were 6 people and had an array of different food, from pasta to sea food and meat and everything was very nice. Will definetly go back and highly recommend it!"
"January 26, 2014",50,Excellent!,"It is a nice restaurant, a little bit too dark but a part from that the ambiance was nice, the service was good and the food as well."
"January 11, 2014",40,Morton: as Morton.,"The steak is of sure one of the best steak of the US. Morton is a chain of restaurant, but i could say that the service was good and also the food."
"December 30, 2013",50,American Steakhouse,Our friends from Italy arrived for the holidays and we wanted them to experience a fabulous steak dinner with wonderful California Wines. Morton's far surpassed our expectations! Our waiter was exceptional. Our reservations were set our table ready it was just fabulous.
"December 17, 2013",40,Aged Manhattan,Had the hudson corn whiskey aged manhattan - they age the drink in-house in barrels that make it super mellow and really delicious.
"December 13, 2013",20,SLOW!,"They told us the wait was 20 minutes, after 30, we sat in the bar. they didn't get us for an hour, we had already ordered. Steaks came out way over cooked. sad!"
"November 17, 2013",40,Morton's ; always a pleasure !,"Great ambiance, perfect staff and friendly a s well combined with high quality delicious meat. Combined with a extensive wine list; what else could you ask for ( except the price . . )"
"November 9, 2013",40,Excellent steak and more,"We got a treat with a friend at this great steakhouse. Not only was the steak very good, but also starters, sides, dessert and wine recommendation"
"November 4, 2013",40,Great restaurant,"The steak was amazing! Great ambience, lots of choice on the food and wine menu and great service. There is very little not to like about this, very centrally located, restaurant. I would definitely go back if I did not live so far away!!!"
"November 1, 2013",40,"Great location, great food","Lovely meal in here on our first night in San Fran. Extensive menus, wine list and the food did not disappoint. Steak was cooked to perfection and the crab cakes were delicious. Attentive service, despite the restaurant being busy."
"October 30, 2013",50,Delicious food!,"Had a truly great experience here, the restaurant was packed but not in a way that hinders your experience. The service was excellent and the steaks were superb, we had an excellent meal with a perfect experience!"
"October 29, 2013",40,Medtronic meeting,Typical Morton's quality but I will admit that the filet steak appetizer meat was better than the steak at dinner. The service was very good.
"October 24, 2013",50,All about Happy Hour.,"Great happy hour menu! Be careful though, the food is cheap and the drinks are regular price so after a couple of drinks it gets expensive, fast."
"October 22, 2013",50,Great food and great service,"Morton's is famous for steaks and delivered on that reputation. The staff were really on the ball and even though it was busy, the service was excellent."
"October 9, 2013",50,Best Steak in Town!,"Dedicated Service, nice atmosphere, delicious Steaks and creative Sides. Morton in SF is despite the high prices definitely worth a visit!"
"September 29, 2013",50,Always delicious,"We eat here almost every time we go to San Fran. Whether it's drinks and appetizers or a steak dinner Morton's never disappoints. It is always packed, yet the service is impeccable"
"September 26, 2013",20,Give it a pass,"Outrageously expensive, cold food, indifferent service, but a nice waitress and good dessert. I'll never go to another Morton's anywhere."
"September 18, 2013",40,Best steak,"Amazing steaks! Everyone at our table had a different cut and they were all wonderful. Great location, the bar is a fun place to have drinks and appetizers while people watching off union square"
"September 17, 2013",50,"The best steaks & atmosphere, was thoroughly enjoyed!!","My husband & I really enjoyed the steak, cooked to perfection re our wishes, the atmosphere & service at this fantastic restaurant! Our son had been here earlier this year & recommended it to us when staying in SF. We weren't disappointed!"
"September 12, 2013",50,Excellent food but $418 including tip is a bit much.,The waiter was very helpful and friendly. The food was excellent but $13 for a baked potato. one bottle of wine and a bottle of beer for four people. Maybe I'm just out of my league.
"August 27, 2013",50,Excellent but expensive!!,"Managed to get a table at Mortons without booking, although booking strongly recommended ! The food and wine were superb but really quite expensive as you would expect for a restaurant in this location."
"August 20, 2013",50,Superb,Outstanding steaks and service. $500 for 4 of us so not cheap! But everything cooked to perfection using finest ingredients.
"August 14, 2013",50,A treat,After walking to coit tower and all along the sea front we needed a treat. Best steak ever. Cooked to perfection. The service was super. $200 for 2 steaks and sides and 4 wines but well worth it.
"July 4, 2013",30,"overpriced,ok steak but have had much better",old and dark. ok but not great would never go there again. spinach was horrible. drinks very weak although nicely presented .service good
"July 3, 2013",40,Quick dinner,"After arriving from europe I had a quick dinner at the Union Square location. Always good steaks, I like the parmesan fries. The wine by the glass list is not a winner, service was good this time."
"July 2, 2013",50,A known,We have dined in several Morton's in different cities over the years including the original in Chicago. This restaurant provides the food quality and service we expected; we had a great evening.
"June 24, 2013",50,Steaks and more in San Francisco,Fiorst time at this Morton's. Not disappointed. Great service and the food was good as always. Expensive and not someplace that you drop in. But if you are looking for a great meal definitely put morton's on the list.
"June 24, 2013",20,Burned steak !,You would think a steak house would know how to cook the inside of a steak without buring the outside!
"June 24, 2013",20,Burned steak !,"I can't figure out how you can burn the outside of a steak, and the inside is beet red with blood! Worst steak I ever had in my entire life! Stay away from this clip joint !"
"June 6, 2013",50,Great food,"Wonderful steak meal --delicious salad, great hash-brown pancake-type potatoes. Good service. (steakhouse expensive)"
"May 22, 2013",40,Excellent,"Excelnt steak (i took the poter house). Nice desert. Excellen service as well. Four people eating 1 bottle of wine, 2 double scotchs about 350 usd."
"May 14, 2013",50,An amazing place to enjoy an incredible meal,We loved everything about this place because it is a pure delight and the food is incredible and everybody is nice to talk with.
"May 13, 2013",30,Great lunch,"Service was great, they really tried to take care of their customers..our waiter was so funny, it was a pleasant surprise."
"May 4, 2013",30,Nice,Nice restaurant with excellent service. Very freindly would visit again. A little pricey but the food was great :)
"April 27, 2013",50,Consistant Morton's High Quality,"In SFO for business and my companion suggested dinner at Morton's, always a good choice, in my limited expereince. We were not disappointed. Excellent service. The food and wine were wonderful. All up to the expected high standards of their locations around the country."
"April 23, 2013",40,Food after theatre,Went to eat after the theatre. Good move as food in the lounge was at happy hour prices. Had tuna tacos and they were excellent. Good fries too. Pleasant service.
"April 23, 2013",50,Wonderful!,"It was our 35th wedding anniversary and they sure took care of us! Decorations on the table (a great table also), complimentary dessert and the food was fabulous (as Morton's usually is!) I had never been to San Francisco before (live in San Diego)...wonderful trip!"
"April 22, 2013",50,Anniversary Dinner,Staff treated us like royalty and even personalized our menus to help make our night more special. Would highly recommend Morton's for any occasion or just for dinner out. Service is awesome and the food is delicious
"April 8, 2013",50,Wonderful food an a great location,"Wonderful bar, food and atmosphere. Around the corner from the Sir Francis Drake hotel. You cannot go wrong with this food."
"March 28, 2013",40,great meat,"If you like a huge chunk of meat, cooked in excellent fashion, come here. Food was excellent, service attentive. Prices were pretty darned high. I thoroughly enjoyed it!"
"March 24, 2013",30,Good service,The steak was ok but priced too high for the quality. However the service was excellent. Wine selection was great and the atmosphere was good.
"March 23, 2013",10,Not impressed,"Overpriced and Corporate. As far as chain restaurants go, I suppose it is on of the better ones. I would rather get a Steak in the Marina District."
"March 22, 2013",40,We Enjoyed our Visit!,"We ordered salmon and chicken, which we know you're not supposed to do at a steakhouse. :) But they were delicious! Our waitress was friendly and courteous, made us feel very welcome. We would definitely visit this restaurant again!"
"March 7, 2013",30,Good place for drinks...food medicore,Good place for drinks...food medicore. They serve a good steak and drinks are drinks are generous but isn't that what you expect from a steak restaurant? Nothing outstanding.
"March 5, 2013",50,A Great Steak!,We found this restaurant because we took a tour that picked up out front. We had a wonderful experience at Morton's. The wait staff was so professional. A must do!
"March 2, 2013",50,Perfect night! They took great care of us,I let them know that we were celebrating my husbands birthday and completion of Cal Bar! They had special menus for us that said congratulations Eric and Happy 55th birthday!!!
"February 28, 2013",40,A great steak!,"Had a lovely meal, great steak though expensive. Can't say I have had a poor steak in the US though!"
"February 25, 2013",30,Very expensive steak,"The steak is excellent and very expensive and all of the sides are fairly ordinary. A steak lovers delight, but otherwise, there are better alternatives."
"January 28, 2013",30,very expensive and the steaks are ok but no wow factor,good steaks at a very expensive price and frankly not worth the price they charge for dinner. Too many good places which charge half what Mortons does.
"January 28, 2013",50,Best place ever!,"The food is amazinggggg! This is the best restaurant I have ever visited, even though the restaurant doesn't look that nice from the outside, it is a different world on the inside!"
"January 16, 2013",40,True to the brand,Morton's is a good steak place. One of the things that I like best is the consistency of the food. It's a little pricey but no more than other steakhouses you could choose.
"December 11, 2012",40,Very good steakhouse,"We were served by a friendly, professional staff. Food was expensive, but it was definitely a cut above the usual. One of our party had a salad, which looked quite uninspiring, but if you come to Morton's you should probably be having steak..."
"December 9, 2012",40,Proper steakhouse,"Good, chunky, tasty steaks. Good atmosphere, although best to book. Wine list is OK but could be expanded. Service was good and efficient, and food was appreciated by everyone."
"November 22, 2012",50,Superb,Everything was fantastic. I ordered a drink i didn't care for and it was quickly taken care of and a new drink that I loved was brought out. Our food was all fabulous and the ambiance was great as well.
"November 17, 2012",20,"Ok, but overpriced","I fully agree with herzoke's review. Nothing special for the food, but very high prices. Atmosphere not really cozy, very loud. A glass of average red wine for 16 USD is just rip-off."
"November 16, 2012",40,great steak,Had the steak and lobster special for $50 and it was awesome. Not a fan of how you have to order sides separately.
"November 10, 2012",50,"The ""Blued"" 8 oz. Filet was Incredible!","The Morton' on Post in San Fran is fantastic. Not only was the food delicious, the staff was wonderful making it a wonderful dining experience."
"November 8, 2012",50,Great Food and Service,"This place was wonderfull, great staff and entertainment. We arrived early and the barman advised that we wait 10 minutes and then our food would be approx $20 ( between the 2 of us) cheaper - Recommend"
"November 5, 2012",50,traditionally good,"You can't go wrong with Morton's Steak House. Traditionally they have the knack for making the best steak in the industry. The service is top knotch, the people are friendly, the food is fantastic.."
"October 31, 2012",50,Amazing Dinner Experience,"The most amazing rib eye steak my husband has ever had. I had the sea bass which was amazing as well. The staff is friendly, the wine was great!! The bread and butter is to die for"
"October 29, 2012",50,Surf and Turf Dinner,Excellent special during our evening was the Surf and Turf entree.Both were superior. Ambience was one to remember supported by superb service.
"October 10, 2012",50,Best Place for Visiting Family,"Great place to take meat and potatoes visitors. Food is good, service is great, and wine list is outstanding."
"October 8, 2012",10,Plenty of other places to eat,$150 for a main course for 2 and two glasses of wine. Service was mediocre. There are far better places to eat and you should choose them.
"October 2, 2012",50,Chain restaurant but outstanding,Service here was impeccable. The food was Mortons and excellent. Great location just across the street. Didn't have to bother with cab or trolley for a great meal.
"October 1, 2012",50,Honeymoon night out!,"The food was incredible, the service impeccable. We got a seat without a reservation with little wait. Our waitress, Erica was both knowledgeable and personable. The menu is family style and price was right on line with similar dining establishments."
"October 20, 2012",50,A great place for food,"On entering we were greeted warmly and given the choice of either the dining room or bar to eat, we chose the dining room. The wait staff were very friendly and helpfull even pointing out the starters were huge and informed us the kitchen would...More"
"October 15, 2012",10,So much for service!,"We arrived cold, tired and hungry. The staff were snooty, looking down upon us and smarmly suggesting that we book next time. The place was not busy and there will not be a next time! We contemplated walking out, but decided to stay. With hindsight, wish we had gone elsewhere. All through the meal we were made to feel unwelcome and unwanted....staff were chatting to themselves and sneering at other customers. You have been warned!"
"October 10, 2012",50,Best Place for Visiting Family,"Great place to take meat and potatoes visitors. Food is good, service is great, and wine list is outstanding."
"October 9, 2012",50,The best Mac and Cheese EVER!!,We visited Mortons on the last night of our three night stay in San Francisco and it was great! We had a short wait for a table at the bustling bar and then we were seated at our table. Learning from previous mistakes o portion sizes in the USA we went straight for the main course. We both had the 6oz Fillet Mignon and I had the chopped spinach salad with bacon dressing and my partner had the mac and cheese. Only a short wait for the food and when it came it was great the steak was cooked perfectly and the salad was awesome but the mac and cheese was the star of the show. This is a great restaurant and well worth a visit if you are in San Fran.
"October 8, 2012",10,Plenty of other places to eat,$150 for a main course for 2 and two glasses of wine. Service was mediocre. There are far better places to eat and you should choose them.
