"September 13, 2020",50,3084sapd,The service and steaks were amazing. The location across the street from Rockefeller Center is beautiful. The waitress did a wonderful job in answering our questions. This is a must visit location when in NYC-Manhattan.
"April 1, 2020",50,Amazing! Everything we had,"Amazing! Everything we had here was so good! The steak, seafood, cocktails, you name it. The service was excellent, the view was fantastic, and within walking distance of our broadway show and lodging. Definitely recommend!"
"March 7, 2020",50,Wow,"Amazing food, amazing service, great place visited here for 14th Feb for wifes birthday. Will be back"
"February 27, 2020",50,"Amazing food, amazing service","Amazing food, amazing service and really friendly staff. A really nice place to eat if you don’t mind spending a bit more money for quality. Make a reservation though as it was very busy (that did not affect the service at all)."
"February 25, 2020",50,The best,Best steakhouse in Manhattan regardless of Price Amazing Steaks Amazing Service Amazing views of the city. and best Lemom cake ever
"February 20, 2020",50,Beautiful lunch,"Had a very tasty meal here with business colleagues but it would also be a great location for social events as well. Loved the steak medallions. Dessert was AMAZING, enough to share because portions are supersized. We had lemon cake and butter cake. Yum!!!"
"February 20, 2020",50,great evening with a great view of the city,"we loved our dinner and our sommelier . Joshus picked out the best bottle of wine we ever had. The only negative is we felt it was cramp, too many tables and we felt we were in the walk way ."
"February 16, 2020",30,WORST HOSTESS IN THE WORLD,The manager should fire all the runs receiving hostess . Very rude arrogant girls . I invited a friend to the restaurant and We were received like a pice of Sh.
"February 12, 2020",50,Excellent steak,One of the best steaks I’ve ever had. Meal was excellent. Server was pushy to up sell no doubt thinking of the tips but when the prices were so expensive there was no need to up sell. Would revisit though.
"February 11, 2020",50,Excellent steaks,Attention to patron's requests and phenomenal service. Food is prepared beautifully. The waiters are very knowledgeable as to which beverages complements the meal.
"January 25, 2020",50,Fantastic,"We had dinner with friends. We had a great waiter, David. We saw their amazing wine cellar. My fillet was Fantastic. I will definitely return on my next trip to New York City."
"February 20, 2020",50,great evening with a great view of the city,"we loved our dinner and our sommelier . Joshus picked out the best bottle of wine we ever had. The only negative is we felt it was cramp, too many tables and we felt we were in the walk way ."
"February 16, 2020",30,WORST HOSTESS IN THE WORLD,The manager should fire all the runs receiving hostess . Very rude arrogant girls . I invited a friend to the restaurant and We were received like a pice of Sh.
"February 13, 2020",10,Horrible,"Went out to celebrate with my wife and friends and couldn’t believe this place.... My wife’s lamb was tuff and just not cooked right,another friend’s stake was also not cooked correctly..the service was pretty much non existent and the fact that I’m paying good money...More"
"February 12, 2020",50,Excellent steak,One of the best steaks I’ve ever had. Meal was excellent. Server was pushy to up sell no doubt thinking of the tips but when the prices were so expensive there was no need to up sell. Would revisit though.
"February 11, 2020",50,Excellent steaks,Attention to patron's requests and phenomenal service. Food is prepared beautifully. The waiters are very knowledgeable as to which beverages complements the meal.
"February 8, 2020",20,Subpar...,"Simple and Slique REVISION – @del.friscos review  This steakhouse was suggested and because I had never been, I was excited to go. Our server Josh (the 2nd server named Josh in two days) was very nice, attentive and explained the menu and the specials to us in detail. The bread and drinks came quickly, the bread, I give a 4 out of 10. In a steakhouse I was expecting superior bread, but instead received a large sesame seeded roll, that had no real texture or taste. The drink (a blood orange Manhattan), was very tasty. We asked our server some basic questions about some menu items and I was surprised at some of the answers. When asked if we could have a few items (crab cakes, and crab fried rice) prepared without butter we were told it would not be possible, that is how the meal comes. I was confused and did not understand the reasoning. We are in a restaurant where I assume chefs are preparing my meal, why is it butter could not be replaced with EVOO? So of course, I immediately “assumed” (and I could be wrong), some menu items are prepackaged/pre-made, and reheated for the customer. I could not come to any other conclusion as to why something as simple as “butter” could not be replaced with EVOO. When our meal came out, it was so disjointed. Some items were right, but others were wrong, so when we mentioned it, the manager came over and grabbed the incorrect items, leaving us with the “correct” items (instead of taking it all away and bringing us a HOT correct meal all at once) which means a portion of our meal would be hot and the other portion cool at best. The food was subpar, period! The location is in the big business district of Manhattan, so I can see people bringing clients here for lunch and young adults coming here with someone they are seemingly interested in, all in an attempt to impress with the high priced/overpriced menu choices. The manager did come over and rectify this situation nicely, as well as apologized profusely for our dining experience. I give this place a 5 out of 10. #simpleand_slique"
"February 6, 2020",50,"If you like your steak, then","If you like your steak, then make sure you check this place out... I have tried a good few steak restaurants an some very high recommended like gauchos, hawk Moore’s And stk... I would quite easily say the fillet here is out of this world and full of flavour I really could not explain how nice it was. If you have ever heard of the expression ‘FOOD PORN’ then this is the closest I think I have come to it .... the lamb chops are also very tasty but would recommend the steak."
"January 25, 2020",50,Fantastic,"We had dinner with friends. We had a great waiter, David. We saw their amazing wine cellar. My fillet was Fantastic. I will definitely return on my next trip to New York City."
"January 20, 2020",20,Avoid the tomahawk,Have been coming to the nyc location for years always have had a good experience until last night it was our anniversary decided to splurge and order the tomahawk for $140 and I can’t stress how disappointed I was it was dry and had no taste at all should have just stayed with the ribeye I’m not one to complain so I didn’t mention it to the waiter but take my advice and do not order the tomahawk unless you like dry tasteless cut
"January 19, 2020",30,Amazing steak but why such a rude server...,"One of the better steaks that I have had, but the experience ruined by the most condescending server I have encountered. All food was good, although quite overpriced, was with business and a table of 12 so we were paying a considerable amount, would love the potential experience with the condescending server...not what you expect with a $3k bill!!!"
"January 12, 2020",50,Top Notch,"Went for our anniversary. Staff are really top notch, they don't miss a beat. Naturally the food is incredible and the entire experience is worth it. If your in Manhattan make this part of your trip, you will be glad."
"January 10, 2020",50,Great steak house and the atmosphere was amazing,We went to Del Frisco’s this week to celebrate my birthday. The food was superb and cooked perfectly. They even gave me a large dessert which was amazing. They sure made my birthday special. I will be back!
"December 29, 2019",40,A quality experience,"Just a short walk from Times Square, Del Frisco's is a classy, high end dining. Very good food. Professional service."
"December 23, 2019",10,Rip off!,Had a horrible meal there. Everyone’s steaks came out rare and had to go back. Then of course it’s burnt when you get it back. Never again. There are way too many good restaurants in NYC to ever go here!
"December 11, 2019",10,Poor quality steak,"Happened to get a bad cut of meat last night at Del Frisco, New York City. Steak was very chewy and lacked flavor."
"December 6, 2019",50,Very good choice!!,"Service was very good! Calimari appetizer was very good. Filet was excellent, great flavor! Highly recommend."
"December 1, 2019",50,Wonderfull experience,"Nice atmosphere, varied menu and very tasty food. We like it and will be back for sure. I recommend reservation in advance."
"November 29, 2019",40,Great for Business ...,"I had a business meeting at Del Frisco's; this is the perfect place; staff is discrete, the able are apart from each other, and gives you some room and privacy; the food is really good; Fresh and quality ingredients; nicely presented."
"November 20, 2019",50,Just an excellent restaurant.,"Just an excellent restaurant. The food, the service and atmosphere. It was pretty loud, didn’t expect that, but 5 star all the way. Steak, fish and Brussels sprouts!"
"November 13, 2019",50,Great Steak House / People watching restaurant,Reasonable great food at a reasonable price in NY. Take my word and bring your friends. They have a pre-theater menu at a reasonable price. Try it once and you will return. Make restaurant.
"November 6, 2019",50,Fantastic!!,"What an incredible experience!! it was one of my all time favorite meals. Service, Atmosphere, and Food were all top notch."
"November 4, 2019",50,Outstanding Steakhouse in Midtown Manhattan,"Attended a bachelor party dinner for a college friend. Everything was great... whiskey selection, wines, steaks (obviously), sides. Service was also terrific - they can’t do enough for you. It’s expensive, as expected, but you get your money’s worth. Strongly recommend it."
"October 31, 2019",50,"Great food, service","I always stop here whenever I am in NYC. The food, service is always excellent. The VIP drink is one of my favorites. They have a great menu."
"October 22, 2019",50,Stop over after delayed flight.,"Fantastic dinner, service everything!!! Best steak the onion rings and creamed spinach to die for. Only downside was my stomach was to small heheheeheh"
"October 14, 2019",40,Great steak,Really one of the best steaks in town. Always good service and I am basing that on about 6 visits. Big spot for those using the corporate credit card and always crowded. But always worth it.
"October 11, 2019",50,Best Steak in NYC,"This restaurant has it all from wonderful service, delicious food and nice atmosphere. The Filet melts in your mouth and the Mac n cheese is so good. Save room for the lemon cake, it’s huge. Can’t wait to go back."
"October 8, 2019",50,Dinner,Fabulous. This is the place for a great dinner period. The staff is wonderful. Drinks terrific. Food excellent. Please visit. You will not be sorry. It doesn’t get any better. We have drinks and dinner at least once a month at this restaurant. Xo. Joe&Anthony
"October 4, 2019",50,Great food and Wine!!,"My wife each had Filet Mignon and they were cooked perfectly! Our waiter, Chris, was great and the wine sommelier gave us an excellent wine choice. This was our third Del Frisco's we have dined at and they are the best!"
"September 29, 2019",50,Birthday celebration made perfect,"Our group of 5 girls out to celebrate a weekend together and one of ours 50th really enjoyed all that this restaurant had to offer. Bustling efficient friendly service, great menu, nice touches including personally signed birthday card and birthday cake treat."
"September 24, 2019",50,Wow,Dimitri is the bomb. He blew us away with his superior service steak of course crab cakes of course and lobster bisque of course
"September 19, 2019",40,My Favorite restaurant in New York,"Love this restaurant. My wife and I frequent this place a few times a year. It's a bit pricey, but it's well worth it. The Staff is phenomenal and the food is to die for. A must visit if you like steak."
"September 5, 2019",50,Great place with good food and service,"Great restaurant offering a big beautiful dining room or terrace. People are nice and helpful, the VIP pineapple cocktail was sumptuous and for lunch the Lobster Cobb Salad is excellent. Desserts are huge and delicious!"
"August 28, 2019",50,Great value,"Great steaks, cooked to perfection 16oz bone on fillet is superb Overall great value and excellent choice of wines too. Service was top notch f Recomend for a classy evening"
"July 19, 2019",50,Nice,I went during lunch time. Atmosphere very elegant. Food was nice and service outstanding. Certainly I´ll return next at NYC.
"July 12, 2019",50,Father's Day,This restaurant was absolutely awesome! Food and Staff. It was busy but our waiter took good care of us!
"July 9, 2019",40,Top notch steak house,"High quality steak house with excellent selection of meat and fish, tasty starters and an extensive wine list. Professional service, however we experienced a little too long waiting time between the dishes.... note: its a busy place so book well in advance"
"July 9, 2019",50,Fine steak good lunch value,This high end steakhouse has great lunch specials for NYC. Try the business lunch complete with starter and main item. The salads and medallions are tasty.
"July 5, 2019",50,Marriot,"Great restaurant I tried steak and onion rings ,macaroni cheese it’s good good dishes and good waiters"
"July 2, 2019",50,"Del Frisco's, enough said!","Great view of the NYC block, best steaks as always, great service and drinks were great. Carrillo's to end the night tops it off."
"June 16, 2019",50,Amazing,Had lunch here. The server was outstanding. She helped us choose and was on point. The crab cake is the best I have ever had. Also the short rib stroganoff - amazing.
"June 15, 2019",50,Great place,Lots of gluten free options! They even brought a loaf of GF bread to the table for me! Great service with beautiful views!
"June 15, 2019",50,Great Steak and experience!,Absolutely great steak and side dishes (though pricey). The service was great even though the place is always packed!
"June 1, 2019",10,not go on summer and weekends,"Waited an hour for a table, had reservation! Service very slow, the garcom simply disappeared after telling the special options of the day! I waited 30 minutes for him to come back and write the orders! I'm waiting for the wine...."
"May 31, 2019",50,Super Steak lunch,Sarah took good care of us as we asked to split a steak and yummy lobster macaroni & cheese for lunch. So delicious & nice wine selection. I would definitely recommend DelFriscos ...even better for dinner😃
"May 28, 2019",50,Great Steakhouse,"Had a birthday dinner here last night with my wife and son and it was fantastic. Our waiter James was great and the steaks were done perfectly. Del Friscos is not cheap, but worth the money. We will be back again!"
"May 21, 2019",50,Superb Steak and So Much More!,"This place is always known for their great steaks and meat, but the fish and seafood are excellent as well!"
"May 15, 2019",40,"Great food, great service but very crowded","Place is filled with people with corporate expense accounts. If your looking for a place for an intimate dinner this is not the place. The food, service was great. Get the double eagle, and the butter cake for dessert."
"May 15, 2019",50,Amazing,"Great service, great steak. Make sure every time I get to NY fro London I go here for dinner. Service was amazing too, expensive but you def get what you pay for"
"May 7, 2019",50,Great Steak in Downtown Manhattan,"Met a colleague at Del Frisco's, the selection of steaks was fantastic and the trio filet, one topped with Gorgonzola, one covered with a scallop, and one topped with crab was a great variety of excellent filets. Don't miss the bread pudding for dessert."
"May 1, 2019",40,"A dinner with my son, grandson and son-in-law","Great place with great service and a chance for my grandson to meet Justin Tuck. The calamari was excellent as was the filet. Quite a long wait, but apparently a lot of other people felt the food and atmosphere were pretty special too."
"April 29, 2019",50,Always a great experience,"Another great meal at Del Frisco's! They have a wonderful menu, great food, drinks and dessert. The food, service is always top notch."
"April 28, 2019",50,Fabulous Restaurant!,"The food, service, and atmosphere was fabulous - despite being a steak restaurant, I'm a vegetarian but I had the lobster and it was excellent. Try the known cake dessert...its to die for!"
"April 27, 2019",40,Lovely Food,"Returned after 11 years, and had another good meal. Food was fantastic, but pricey! Service was good. It’s very busy/lively, so bear that in mind."
"April 17, 2019",50,Best fancy steakhouse,"Checks all boxes for a classic NYC steakhouse. Good seafood, excellent steaks, a well made wine list and great cocktails. It is rather a fancy place so dress up and make sure u have reservations."
"April 14, 2019",40,Customer Service and the Environment.,The food is really good and it is a good place to go and have a good time with family and friends. I highly recommend it when you want to have a tasty cuisine experience.
"April 7, 2019",50,Night out,Loved it. The long bone rib eye steak waygue beef was worth the money. Loved the lobster mac. Service was great. Ask for kasz.
"March 27, 2019",50,Still the best to me...,"Full package of NY business casual atmosphere, great food and service! What a wine list and endless possibilities to find what you want for that special evening... Congrats for such an impressive run of perfect meals! Will be back..."
"March 13, 2019",40,Popular,"Party of four on a busy, noisy Saturday night. The prices are high, but the quality is there. Service was top-notch. Several grades of prime beef. Sides are large enough to share among several diners. House wine was excellent."
"March 4, 2019",50,Pre-Matinee Meal With Kids,"Excellent in every way. Service, food, decor. Erik was incredibly accommodating with a food allergy in our party, and with our theater schedule. 5+ stars, really. Would recommend and/or revisit, even with (literally!) thousands of dining options in NYC."
"March 3, 2019",40,Would Revisit,"They provide a similar experience to the high end steakhouses I’ve dined in before. Delicious and creative cocktail menu, fantastic seafood tower and although I regret to have passed on having steak I enjoyed my entree. Service was friendly and attentive. Overall, a lovely time."
"February 24, 2019",50,Del Frisco's never disappoints in any city,"No matter where I am in the county, if there's a Del Frisco's, it's always excellent!! This location is no exception. Premium service and outstanding everything!! One of my faovirte places to treat myself..."
"February 22, 2019",50,They do it right,Kudos to Felix and his staff. I have been eating here since it opened almost 20 years ago. Our waiter Kenny went above and beyond. No wonder he earned his FEED pin. And they know how to pour a martini with blue cheese stuffed olives.
"February 12, 2019",50,Excellent Steak,Great choice of meat cuts served in a smart restaurant with a bouncing atmosphere. Good wine choice - only grumble is all the side dishes are extra and overpriced. Very good service on a busy night on 1st January.....2019
"February 4, 2019",50,Been here a few times,"The restaurant is fantastic! Great menu for those that do and don't want to eat steak, with an extensive wine menu as well. Easy to get to, valet and get in for drinks, meetings, etc..."
"February 1, 2019",50,Dry-aged perfection,"Del Frisco’s does not disappoint. Your pockets have to be deep, but the seafood tower to start and the 45 day dry-aged ribeye were melt in your mouth perfection. The atmosphere, food, wine list, and service are second to none. Will be back again!"
"January 31, 2019",50,One of the best NYC Steakhouses,My wife and I celebrated our anniversary at Del Frisco's. The staff was very attentive and Sylvia was an excellent server. The dishes are worth every dollar.
"January 26, 2019",40,Great vibe,"The steaks are good and service friendly , I don’t think it’s a top steak house in the city but they accomplish something special with decor , the buzz and with the location that makes you Want to come back again and again"
"January 17, 2019",50,Best Steakhouse in New York,Been there a couple of times. Last visit had a 22oz Porterhouse with a selection of sides. Food was excellent and service top notch. Would highly recommend.
"January 15, 2019",50,Fantastic as always,Once again this restaurant and staff have far exceeded our expectations! Food was fantastic and service was excellent! Makes our trip to NewYork always special
"January 15, 2019",30,Good service. Food eh.,Food wasn't bad by any stretch but nothing memorable either. Nothing that would compel me to go back. I much prefer the Old Homestead if I'm down that way. Okay for a quick drink and an appetizer or two.
"January 14, 2019",50,Best Dinner Experience.,We were celebrating our anniversary when we chose this restaurant. They gave us an amazing table. The service was excellent and the food was Incredible! Highly recommend!!
"December 22, 2018",50,Never disappoints,"I am a repeat offender at DelFrisco. Never been disappointed, food is great, drinks are delish and so I always come back."
"December 17, 2018",40,"Good place, crowded","Nice place for drinks, lots of different crowd, mostly people from around the place (it is in the center of New York)."
"December 12, 2018",50,Always an excellent dining experience,"Food, drinks, service; always amazing. Whenever I am in NYC, I always stop at Del Frisco's. Their drink, wine selection is great and their menu is wonderful."
"December 11, 2018",40,"Mmmmmm, mouth-watering","Simply delicious. Great steak, cooked to perfection. Get the filet on the bone. My only niggle would be the service which was very hit and miss, good at times, but very very slow at times."
"December 10, 2018",50,The most excellent steak house,"We was greeted with a smile, shown to the cocktail bar and as our table was running slightly late, we had a drink on the waiter. The services was fantastic. The food was to die for, absolute great all around."
"December 1, 2018",50,Ahhhhh....mazing!,Food was fantastic. Wine was great. Service (Chris) superb. Would definitely go back. Try the wedge salad and lobster mashed potatoes and of course your steak of choice.
"November 17, 2018",50,Best Steak Ever,We wanted to enjoy a steak dinner before our broadway show and Del Frisco's definitely did not disappoint. The ribeye was awesome. We had great service from the hostess to our server. I will be returning for sure.
"November 16, 2018",50,Fantastic evening,What a wonderful experience! Service knocked it out of the park and the food was fantastic! Lemon cake is a must. I ate way too much!
"November 14, 2018",50,amazin experience,We been there in october and were pampered by the service. Honest and professional service. Amazing food. And very respectful stuff.
"November 10, 2018",50,Great steaks,"We really like this restaurant for steaks and great side dishes. We love the porterhouse, my strip and the ribeye and a great surprise is that also their espresso is very good, enjoy!"
"October 10, 2018",50,Steak,"Best steak, nice place and nice side dishes. A bit too expensive if you like to have the best meat but it s worth it."
"October 10, 2018",50,The Best Steakhouse in NYC,Everything and I mean EVERYTHING is GOOD! The server was mega friendly and fluent with everything on the menu. GO! Please GO❤️!
"October 3, 2018",50,Our first time,We went for lunch ..... Great staff and service.... Steak salad was large and delicious . Husband had steak sandwich and loved it .... Would definitely go back
"September 22, 2018",50,The most amazing meet !!!!,Absolutely the best beef we eaten in nyc! With lobster max&cheese and potatoes with truffle. Fantastic service !!! 10/10!!!!
"September 18, 2018",50,Wonderful food and service,I came for an event and was happy with both the food and service. The flavors were great! I loved the mashed potatoes with the filet. Great ambiance too.
"September 11, 2018",40,Dinner after a show.,Location is fabulous for the theatre. The service was amazing and so enjoyable. The steak was great and the creamed corn was the best thing on the menu.
"September 7, 2018",50,Every dish was delicious!,"I ordered the lobster bisque, beef medallions, mac & cheese w lobster, and sorbet for dessert. The staff was welcoming and very attentive. Loved the atmosphere and the food, would definitely recommend this place!"
"September 2, 2018",50,10/10! Amazing,"Fiest time dining at the restaurant and it was an excellent experience. Highly recommend the steak and lobster mac and cheese. Beautiful ambiance, great staff, and beautiful view!"
"August 27, 2018",50,Relaxing Dinner,This place is wonderful. Everything was delicious. The service is impeccable. Ambiance was very nice. Truly amazing night.
"August 27, 2018",50,Excellent,"Spontaneous family dinner at this restaurant. From arrival to departure a very nice experience. Reservation via open table worked perfectly, we got a nice room upstairs, service was very friendly and the steaks were excellent! Will be back, highly recommended!"
