"August 9, 2020",50,Top Drawer. Always,Been here 150 times. Honest. Over 30 years. Service and food is always consistent. Fine cocktails and wine. Excellent service. Moved away but always visit them
"March 21, 2020",50,Delicious English cut prime rib!,"This was by far the best prime rib I’ve ever had! Be sure to make reservations well in advance, this place is crazy busy."
"March 1, 2020",30,"Good, not great prime rib!","Good, not great prime rib! Definite tourist attraction. Over priced, and average meat. Other chain steak houses have equal or better quality for half the price."
"January 28, 2020",50,Yum with great service,"Referred by our friends to try their great prime rib! So good, great environment , amazing service. They carve the prime rib right in front of you served table side. Nice touch. Overall a great experience I would totally come back"
"January 10, 2020",50,"Classic,l!","Classic, old school prime rib joint. Basic menu prime rib, salad choice of potato and Yorkshire pudding. Get the king cut and have it seared. Waiter was great. Prime rib was excellent. When I was finished they offered me another piece. Lol. Loved it."
"December 19, 2019",50,Great night,Celebrated our anniversary here. The food and service were excellent and they did everything possible to make it a special night.
"November 21, 2019",50,Truly stunning!,"We went for our 10th wedding anniversary. The atmosphere is superb and the place is absolutely rammed. The food is sensational and we recommend the prime rib, larger the better 😁 You would be insane if you don't visit on any visits to San Francisco!"
"October 5, 2019",50,"Very Good, Great Service","The prime rib was very good, but the rest of the meal was excellent. Our server, Mitra, was delightful and very attentive! My shout out for the creamed spinach - it was A-MA-ZING."
"September 11, 2019",50,Great place for dinner,This it's a great place to go for dinner really good portion of meat everything included on the price salad cream of spinach mashed potatoes o baked potatoes
"August 18, 2019",40,All time favorite,"We have been going to House of Prime Rib for decades. Excellent value, although through the years, it can be very hard to get reservations. Is noisy and very hard to have an intimate dinner. Love the salad and the cart."
"August 16, 2019",50,Best Prime Rib,The service is excellent! Food is delicious!!! Everything I wanted plus more!! The drinks were good and the food and service is amazing!!!
"August 13, 2019",50,House of Prime Rib - steaks,"Delicious prime rib celebration with family of 10. Wonderful, attentive waiter. Just what I hoped for."
"July 7, 2019",50,The Best of the Best!,"We are Asians, small appetite but the staff happily allowed sharing and made us feel so welcome. Steak was full of flavour, very tender, price very affordable, environment though very busy was cosy and there were happy faces all round."
"July 3, 2019",50,Prime Rib!,"What can I say: If love prime rib like we do, this place is fantastic! But, if you go, be sure everyone wants that, or they will be out of luck!"
"July 2, 2019",40,Great food!,"Prime Rib was amazing and the service stellar. It is very loud inside of the restaurant due to it's popularity. We all commented we wish we didn't feel rushed to eat and get out. Otherwise, I highly recommend this restaurant"
"June 20, 2019",10,Do not go here they trick you with 3 hour wait,You arrive they tell you it’s 1–1.1/2 hours and really it’s 3 hours Service is so rude and they are deceptive about the queues The are booked 5-9.30pm Then you wait and wait and wait and then you ar seated 9.45
"June 9, 2019",50,outstanding restaurant,"I am sold!!!! I am coming back next visit. Great prime rib like I remember from years gone by. Yorkshire pudding, tender meat, mashed potato and gravy were amazing. I loved the salad, and bread. Our waitress and help were excellent."
"June 3, 2019",10,Cannot hold a reservation :(,"Reserved a table, arrived 10 min early, waited for 45 minutes to be seated... did not yet get a chance to rate the food. Do not get the “Old fashioned” or the Martini. They are terrible :("
"April 8, 2019",50,The highest quality and the best Prime Rib I’ve ever had in my life! Salad and side dishes couldn’t have been better. Th,The highest quality and the best Prime Rib I’ve ever had in my life! Salad and side dishes couldn’t have been better. The best service!!!!!!!!!!!!!!!!!
"April 2, 2019",50,Kelly knows best,Don’t mess around with anything but the thickest cut of prime rib. Ask for the tobacco horseradish. Spinach and baked potato are my favorite Fantasy Cake for desert Kelly is a great waitress and really takes care of her guests.
"March 28, 2019",30,Celebrating,"This is a traditional restaurant in San Francisco. We always recommend it to friends and family, but our last time dinner the prime rib house cut and the end cut petite was not us expected. Very tough."
"March 21, 2019",50,SO SO SO SO AMAZING - Must Visit,It has been a while since I found an amazing restaurant that knows prime rib. You can't do better than House of Prime Rib and the whole atmosphere goes right along with the food.
"March 4, 2019",50,OMG,Best Prime Rib...I had the gigantic portion...the Martini’s are amazing also...not a fan of creamed anything but the dinner was amazing! Get a rez bcuz you may not eat or be waiting for hours if you don’t. Worth it tho!!
"February 20, 2019",40,My review,I was here for dinner tonight with my sister and brother-in-law. I’m not a huge Prime Rib fan so I had their Chilean Sea Bass. It was delicious!
"February 5, 2019",50,Lifetime Destination,I have been eating at House of Prime Rib for years and always look forward to this place every time I travel to San Francisco. This is an old school quaint essential San Francisco establishment. The service is impeccable and the food is wonderful.
"February 1, 2019",40,Sorry guys.. I just don’t get it,I’m sure this could done a whole lot better.. Perhaps it was just an off day for me but I wasn’t feeling everyone else’s experience here.. the beef at Huntsman in Dunchurch is far better... Sorry again but won’t give it a second try
"January 6, 2019",50,Excellent service and food,Sat at the bar and received fast and friendly service. Prime rib is excellent and comes with plentiful sides. Great overall experience.
"December 12, 2018",40,Really good,We had an amazing dinner in that place. Everything was great. The service was really friendly and the meal was lovely!
"December 11, 2018",40,Dated but delicious,"You walk in the you feel like you just went back to 1955. The drinks are ok, I had a watered down Manhatten. The food is great and the so is the staff. It's expensive but you will walk out of there VERY ful"
"November 5, 2018",50,Prime beef lover!!,"This is absolutely the best prime beef I have ever tasted. It a a complete ceremony around prime beef, and they really know how to do so. Love this place."
"October 15, 2018",50,Super efficient,A great place for a prime rib dinner. If you’re on your own - eat at the bar. Very good service. Suggest going for +1 on your ‘how do you like that cooked’ as my medium came out quite rare. All good.
"October 7, 2018",30,More style over substance,The meat here is very good and you get very big portions but I have had better. We were served quickly despite the place being so busy that there was a 2 hour wait to eat at the bar.
"September 16, 2018",50,Excelent quality meat and service,Very good restaurant. The meat is incredible. Almost imposible to eat everything. The bread is fantastic. Also very good service.
"September 15, 2018",40,"good, tasty.","if you want to taste a good steak, this would be one of good choices. But a problem is you should make a reservation at least before a month you visit there"
"September 10, 2018",40,Wow,To much to big wow proper nice steak place this a little pricey but you come off street thinking its dead and its buzzing great place for special occasion
"September 4, 2018",30,Hopper .....,Having dined here a number of times and this last time was the last. Portions are smaller and the plates they are served on are smaller while the price climbs. Not worth the effort.
"August 27, 2018",50,Classic Steak House - Perfection!,"When you plan to go to a high-end steakhouse, this is what you expect. The service, the food, the simple menu. We were very impressed with this establishment. I can't wait for the next special occasion!"
"August 18, 2018",50,Fantastic Ribs,"We had dinner here on Aug 11, we had to wait almost an hour but I can say that it deserves it. I had the house classical cut and was delicious and generous."
"August 14, 2018",40,Beef lovers ream,"Very good meal, somewhat expensive. They even offered me a second slic of beef after i had finished..reservations highly suggested. We arrived without one but they seated us in about 45 minutes"
"August 4, 2018",40,All about meat,"A great place, outstanding meat, juicy and super delicious. A huge waiting list because the house is very famous. Service good a bit overdone...too busy The only bad point: it is so loud!"
"July 23, 2018",40,Fabulous dinner,Four people for a business dinner. The food and service were top notch. It was not conducive for actually conducting business but great for entertaining customers!
"July 14, 2018",40,經典扒房,四分一世紀過去 這餐廳還和我第一次去一模一樣 沒有造作 沒有花臣 就是honest 的一塊 Roast beef 和 攞命油浸似的yorkshire pudding 依然故我的巨大人portion 𠲖！連價格都差不多！ what a pleasant surprise
"June 30, 2018",50,If you love steak! This is the place!,"It is very good, but my advice is booking in advance because it is very popular, very difficult for a walk-in! Menu is very simple 5 deferents size of steak and you choose or the sides! Quality is good!"
"June 24, 2018",50,Could be the best meal of my life,"There are no words for how delicious this meal was. The mashed potatoes were creamy, the meat tender and cooked to perfection, the Yorkshire pudding soaked up all the yummy gravy....the inside was lovely and old school. The entire experience was wonderful. Just go!!!!"
"May 24, 2018",50,Enjoyed it,Really enjoyed the food. It was VERY filling so don't be an amateur and eat too much bread at the start. Service was great and the chef was accommodating to a last minute change.
"May 22, 2018",30,Below expectations,"Heard so much about this place, but it was ok and no more. The steak was very tender which is great, but lack of flavor.. also the desserts (crem brule & bread pudding). Not worth the money."
"May 6, 2018",50,Did not disappoint,Obviously this is a well known establishment in San Francisco. My wife saw it on TV one time and we always wanted to go. Finally got a chance this last month. Fantastic food and experience. I would go back.
"March 9, 2018",40,Best roast beef I have tasted,"The best roast beef I have had in a long time and amazing salad that is prepared at your table, excellent mashed potatoes and baked potatoes with amazing fillings. I will be back here again."
"March 7, 2018",40,Great restaurant,The restaurant is wonderful . Tasty is very good. Steaks are delicious and salads are also amazing . I really enjoy it. The staffs are very friendly and nice.
"March 3, 2018",50,#1 Prime Rib in SF,"Expect 2-3+ hours wait if don't have reservations. People willing to wait that long to have Prime Rib, that's all I need to say."
"February 7, 2018",50,Worth it,The old school ambiance and menu work really well here. The food is absolutely amazing. I see why it’s difficult to get a reservation. HOPR: don’t change a thing.
"January 22, 2018",40,I normally don’t like prime rib but,This place was awesome! It was quite the experience and super delicious. It’s a lot of food that you get for your money’s worth.
"December 19, 2017",50,great and classic dinner in the city,"been many times but no since moving to Denver great dinner, service and the whole ball of wax..a SF must go"
"December 13, 2017",50,Still terrific prime rib!,Terrific prime rib perfectly cooked. Good service. Reasonable cost for the area. We'll go back next time we're in the city.
"December 10, 2017",40,A FAVORITE,The food is excellent and the atmosphere is very lush and sophisticated. Somehow the waiter seemed to have added and additional $20 to our bill (on top of what we tipped!) and that has not yet been resolved.
"October 31, 2017",50,Amazing,We visited for a friend’s birthday for a special occasion. It was only a choice of which type of cut of beef you wanted but the wait was worthwhile - an amazing meal with amazing service. Highly recommended for anyone nearby!
"October 15, 2017",10,Worst of the worst,We expected fine dining.What we got was average food with a bunch of kids in t shirts and shorts.Noisy and obnoxious.So glad we didn’t bring quests we would have been so embarrassed.
"September 25, 2017",50,Best Prime Rib Ever! (Not for vegetarians),You definitely need a reservation if you want to eat at a decent time. The prime rib was amazing and I don't even like prime rib! The sour dough bread is also delicious! All the sides are great and highly recommend the horseradish sauce.
"September 17, 2017",50,Fabulous Dining Experience!,"Hands down, THE BEST prime rib! The food and service were impeccable! Go there hungry because the servings are plentiful. And the table-side service was a treat. Definitely on the list for our next trip to SF."
"September 7, 2017",50,House of Prime Rib Review,"Very busy bustling place full of energy that has Great food, Great service. The only negative is that they ran out of red wine glasses last night and we drank a great wine in Chardonnay glasses. The best prime rib I have every had !"
"August 28, 2017",50,"The name says all, but I'll say, ""Its awesome!""","Classy yet relaxing atmosphere, professional and friendly staff, cold drinks...and of course the fabulous PRIME RIB (and other great grub)! My wife and I both enjoyed this, though I may have eaten a bit more than she did. ;) ENJOY!"
"August 23, 2017",50,Birthday,The food was excellent! More important was the customer service. The people were very welcoming and enjoyable. Make reservations is better than dropping in but if you do drop in do it early. Better chance of eating early
"August 14, 2017",40,Beat prime ribs ever,"Don't ever miss prime ribs here if you are meat lover, visiting SF. The queue is worth waiting for, our queue is 1hr waited but eventually only took us 30mins waited. I definitely visit again!!"
"July 18, 2017",50,Desire Prime Rib--Enjoy the best!!,"When my wife and I get that urge for prime rib, we head to House of Prime Rib, the best. The salad, baked potato, and spinach adders top it off. GM Evan Burns does a great job as he done for over 10 years."
"July 12, 2017",50,Fantastic steak meal,"Had a great meal here food was first class and good service , friendly service and the steak was to die for well worth booking"
"July 2, 2017",50,My #1 Stop in San Francisco,House of Prime Rib has the best prime rib anywhere. I compare every prime rib meal and no others measure up. You have to plan ahead and get a reservation but they will take some walk-ins but you need to go early.
"June 8, 2017",50,Fantastic prime rob cooked to perfection!,Had dinner with our daughter and her boyfriend here. The food and service were amazing! Reservations book up quickly so plan ahead!
"May 31, 2017",30,Not worth it...,They squeeze you like sardines! The tables are so packed together that one can hardly walk between them. The quality of the prime rib is just so so. It a very mass production show.
"May 30, 2017",50,Prime rib at its best...,"This Restaurant servers are great,,, ALWAYS lots of customers ... Very good Baked potatoes and cream of Spinach."
"May 29, 2017",40,Come Hungry!,"This restaurant serves various cuts of prime rib with excellent sides. Between the salad, potato, and creamed spinach, you will not walk out hungry! Not a prime rib person, but this was great. Nice atmosphere with top of the line service."
"May 27, 2017",50,Comfort food at its best,"This place is great, I have been here many times. Mainly cos they serve and amazing Roast beef, with a delicious side of baked potatoes. Pure comfort food cooked to perfection."
"April 12, 2017",50,Eat for England!,Fantastic no other words necessary other than the Yorkshire puds! Chef don't open the oven while they're cooking otherwise they go flat like ours! Other than that just brilliant. Worth the trip to SFO.
"April 7, 2017",50,We ate like a famine was coming tomorrow ...,"The absolute best prime rib in town!!! Great people , exceptional service , it's hard to beat that package ! We came here hungry and left stuffed and satisfied!"
"April 4, 2017",50,OMC,.....who could ask for anything more 'ONE MENU CHOICE' its prime rib all the time and I don't mind at all. I can truly say that this was one of my favorite restaurants of all times.
"March 17, 2017",50,Nom Nom Nom,great food large cuts of prime rib with baked potato or mashed. Yorkshire pudding and spinach as sides... almost forgot about the salad!
"March 10, 2017",30,Crowded,"We were very close to the next couple. It was so loud that it was difficult to carry on a conversation. Food was better than average, but not worth the price."
"March 3, 2017",50,Dinner with the family,"Location: Nob Hill Parking: metered, paid street parking Atmosphere: traditional, warm, elegant Staff: incredibly accommodating Menu: limited to a fairly fixed menu Drinks: standard Meal: unbelievable - try it Prices: pricy Visit Again: please! Recommend To Friends: you bet"
"March 2, 2017",30,Loud restaurant with lots of food,"Very loud, touristic restaurant with lots of big tables and long lines. Good meat and sauce but not worth the price. Expensive but dishes are big even for US standards"
"March 1, 2017",50,Wouldn't go home Hungry,A n old standby that still delivers a lot of meat for your dollar. Old time service and tasty sides like creamed spinach
"February 22, 2017",50,Brilliant,Arrived from the UK and this was the first restaurant we eat in top notch food and service and you will not find a better steak anywhere else an absolute must to visit.
"February 13, 2017",50,Great meal!,"An excellent place for Prime Rib. Ate at the bar with 2 other family members. It was worth the wait. Delicious food and great service, once seated."
"February 2, 2017",50,Get reservations for the prime rib of your life!,"I've been to lots of different steakhouses and this rivals them all for the best of the best! Everything you order here is high quality and prepared perfectly! If you have the chance, do not miss it!"
"January 23, 2017",50,My Favorite Restaurant in SF.,"They do Prime Rib right as the name describes. Finish your house cut and get another slice. Accompanied by salad, creamed spinach, bread, sometimes cornbread. For around $50, it's a deal!"
"January 23, 2017",50,One word AMAZING,"Have wanted to try this for a few years but not got around to it before now. Service, surrounding all 5 starts and the food deserves 6 stars !!"
"January 8, 2017",50,Great Service,"The food was amazing, and great service. Definitely recommend this place. The price was good for the great meal you get."
"January 4, 2017",50,Superb,"The service was excellent. The prime rib was cooked to perfection. The dinner comes with salad, cream spinach potatoes, Yorkshire pudding. You will be taking a doggie bag home. You need reservations."
"December 24, 2016",50,Wow,Great Service. Great food. The menu is carnivore's perfection. The service had a personal touch. If you're in this area I recommend it
"November 11, 2016",50,Best prime rib,The House of Prime Rib has the best Prime Rib. Served table side and with all the side dishes. A great piece of San Francisco history.
"November 6, 2016",50,The Best Ever,"I don't normally choose Prime Rib, but this it place to make an exception. The meat is perfect, with all the Au jus you want. It's a once in a lifetime meal."
"October 18, 2016",50,Best prime rib,"This place has one of the prime ribs! Good service, although reservations are hard to get because of their popularity, it is well worth the wait! Love ❤️ this resto!"
"October 9, 2016",50,Wow!,Terrific restaurant for having only one dish but with 3 choices on how to have it cut. Keep your expectations up because flavoursare unique. The only comment I would do is that they don't have wifi.
"October 8, 2016",50,Dinner,"Loved it the food was excellent. The wait time was 2 minutes. I prime rib was tender and juicy, the mashed potato and cream spinach was delicious. Would differently go back"
"October 5, 2016",50,Delicious prime rib,"Great service, prime rib cooked and cut to order, price for prime rib includes sides. Dining experience comfortable and not rushed. Friends highly recommend this restaurant"
"September 27, 2016",50,Super delicious,It was our first time and we were so impressed with the service and the quality and taste of everything specially the Prime Rib. It melts in your mouth. I have never had anything like this. We will definitely come back. Great job!!'
"September 27, 2016",50,Fantastic!,"We had dinner with our family and close friends. The service was excellent and the food absolutely delicious! The prime rib is perfect accompanied by salad, potato, Yorkshire pudding and spinach. I highly recommend dining here. It is an experience not to be missed!"
"September 19, 2016",50,Great food,It has been a few years since I ate and when I did it was very good and I enjoyed the prime rib I would totally recommend this place to anybody
"September 12, 2016",50,Lots of food,To say they feed you is an understatement. Standard meal gives you enough for 2 days for an average size guy. Prime ribs are large and prepped right at your table. Not to mention the nice size portioned sides. Two thumbs up on the meal.
"September 3, 2016",40,Delicious!,Delicious food! It was very loud though and difficult to have conversation. Make a reservation and bring your appetite. We will eat here again!
"August 22, 2016",40,Ribs as they should be,"Perfect meat, tender and juicy. You must order medium or well done, if you don't want to eat it very red. The side orders are very yummy. The mashed potatoes are delicious."
"August 22, 2016",40,Still the best prime rib,"Even after all these years, their roast beef is still roasted and cut to perfection, exactly to what you requested. The side dishes are large and well prepared. You always come away very satisfied and too full, and happy with the bill."
"August 4, 2016",50,Awesome dining experience!!!,"This is how prime rib should be served! Prepared in rock salt and served tableside! Portions are generous, servers are attentive! It's all in the presentation! You'll certainly enjoy this absolutely phenomenal dining experience!"
"July 28, 2016",50,Best. Prime. Rib. Anywhere.,"You have never had prime rib like this. Cut off the whole rib table side, it is the juiciest you ever ate. The spinach, corn, and salad are all included. Great value for a great meal."
"July 26, 2016",40,Old School Delight,"Excellent service and great prime rib. Simple menu is welcomed, you know you are having prime rib. I enjoyed the salad made at your table."
"July 16, 2016",50,The only place for Prime Rib,"Best Prime Rib place in the Bay Area, maybe even in the USA. Always superb in taste and tenderness. Outstanding and friendly service."
"June 27, 2016",40,"A wait, delicious food and no lingering",Either call ahead or be prepared for about 45-60 min wait. The food is delicious with huge portions and moderately priced. If you enjoy a lovely grilled piece of prime rib... Stop! Look no further... It's here.
"June 21, 2016",50,Intense food experience!,"This was the high light of my San Fran eating experience. The meat selection is outstanding, and the quality is superb. I highly recommend treating yourself to this spot."
"July 14, 2016",50,Best restaurant we have been - fantastic prime rib,"Didn't really know what to expect but the reviews were so good thought we'd try. Absolutely awesome. Specialise in the prime rib and do it brilliantly! A bit pricey but worth every penny. Great staff, a bit of theatricals when making up the salad at...More"
