"March 15, 2020",50,Absolutely amazing!,Absolutely amazing! We had high expectations and was not let down! Beautiful food both meat and vegetarian! Amazing waitress (Vivi). Could not recommend more! Just be careful of the Scorpion chilli sauce if you’re brave enough to try it 😂
"March 14, 2020",50,Great steak and wine :),Great cuts of steak and super local wine thanks to @Vivi and @Geri with special spicy sauces that rock your world
"March 12, 2020",40,Enjoyable evening meal,"Went with a friend ,who really enjoyed the meatology burger. My venison meatloaf was also good. We had a waiter called Garai who was very welcoming and helpful with our choices, and gave us good service."
"March 12, 2020",50,Nice food and service,I ordered the classic burger and it was really big! Burger was amazing and my waitress Vivi is really nice!
"March 12, 2020",50,Beautiful steaks and burgers,"Beautiful steaks and burgers , we had rib eye steaks and burgers between the 4 of us and they were all extremely delicious . Outstanding service from Garai and Vivien , very helpful giving advice and knowledge of the area . Would recommend 100%"
"March 10, 2020",50,Great food and great service,Great food and great service especially from Garai. The tastiest steak I have ever had. Would recommend!
"March 9, 2020",50,Amazing!,"Me and my other half both had the cheeseburger. Let me tell you know it was bloody great! The staff were so friendly and the baconaise was SO good! Definitely visit here if you are in the area, you will not regret it!"
"March 9, 2020",50,Good fast food in Budapest,Excellent attention from Charlie. Very good food and good price. I recommend Hungarian breakfast. Nice place!
"March 8, 2020",50,Absolutely brilliant food. Best in Budapest.,We came here on the off chance just trying different resturants and have to say hands down the best steak here. Our waiter Garai was very polite and explained each dish perfectly
"March 7, 2020",50,This place was amazing even for us American Steak eaters.,Our server Ben was simply the best and the Ribeye was by far one of the best I have ever had. Cooked perfect. And affordable if you are used to steak places in America.
"March 6, 2020",50,"This restaurant was amazing,","This restaurant was amazing, great food and amazing service. Ben was our waiter and he was great, very on the ball and very polite. Would definitely come back!"
"March 6, 2020",50,Meatology Budapest,Great service indeed!!! Must try and it feels like heaven: 1. Roast Duck with Maltaise Sauce 2. Homemade Sausage MANGALITSA DEBRECZINER 3. Pork Stake Burger
"March 2, 2020",40,Excellent food in a convenient location,"We stopped here twice the food was so good. the location is ideal, the option excellent and the food was incredible"
"March 1, 2020",50,Best hamburger - great place!,Best hamburger we ate on a LONG time Wonderful meat and great Bun and pickles. Great service by our waiter- Charlie A must visit.
"February 29, 2020",30,Staff friendly and helpful,Staff friendly and helpful we both had burgers large and tasty and Garai was very friendly and helpful and the food was delicious
"February 29, 2020",50,"Excellent food, friendly waiter (Garai)","The duck meat was tender and fresh and the sausage was flavourful. The waiter (Garai) was very friendly and helpful, we enjoyed his service."
"February 29, 2020",50,Lunch at Meatology,The food was delicious and there was great service by Garai which made the experience even better. Ambience is family friendly and overall value for money.
"February 26, 2020",50,Wonderful food and fabulous service,"Fantastic food, the bacon cheese burger is amazing and the accompanying sauce is to die for! Our server Charlie was fantastic and very helpful, would strongly recommend :)"
"February 25, 2020",50,best burger and meat,it was very nice to viait meatology 2. we ordered burgers and stake with green salad. everything was perfect and simply the best. thanks meatology staff for the exeptional service.
"February 25, 2020",50,Amazing steak! Fantastic serving,"Amazing steak! Fantastic serving staff with excellent knowledge of steak both cuts of meat and of origins of cattle. A lovely, lovely place and cannot rate it highly enough. Charlie especially was a life saver with milk after the scorpion chilli sauce."
"February 21, 2020",50,Amazing steak,"The meal me and my partner had was perfect, steak cooked and seasoned perfectly and all the staff were so lovely! Would highly recommend, definitely will be going back!"
"February 20, 2020",50,Meatology Budapest 2.0,"I went to this restaurant with my family and received excellent service from waiter Garai and amazing food, would recommend for any meat lover."
"February 19, 2020",50,Must visit!,"For meat lovers this restaurant is highly recommend! Great staff, good food! Waiter Charlie took very good care of us!"
"February 19, 2020",50,Highly recommend coming here!,"Highly recommend coming here! Had a cheese burger with bacon! Very tender and juicy! Hubby had the pork belly with a side of fries! Delicious! The service was also excellent, friendly and attentive waiter!"
"February 19, 2020",50,Best steak ever,Had a few steaks over the years this one was cooked to perfection we were served by Gorai who recommended what to have great choice . Tried the Rehab Big Sun chilli sauce blew my head off
"February 18, 2020",50,Well worth a visit.,"Thank you for our service tonight. Great service, great staff and fantastic food. Charlie our waiter looked after our every need. Even the music was spot on."
"February 18, 2020",50,Best steak in Budapest!,We had the steak and the bacon cheesburger and it was extremly tasty! The staff is super friendly too!
"February 15, 2020",50,When visiting Budapest you,When visiting Budapest you defiantly have to visit this place especially if you are a meat lover .Excellent food with great service which makes your evening very enjoyable
"February 14, 2020",50,Elliott,Food was amazing and our waiter garai was also really great. Would 100% recommend to anyone to visit this restaurant will definitely be coming back!
"February 12, 2020",50,Yum,"Food was beautiful and our waiter Garai was very friendly. We would definitely eat here again, the duck was beautiful and the burger was fab. A steak we saw on the way out looked incredible. Def a place for meat lovers."
"February 12, 2020",50,Fabulous meal do it!,"Fabulous meal, well worth making the effort for. Great surroundings and really friendly staff. A must visit!"
"February 12, 2020",50,Perfect lunch spot,"Had lunch in both Meatologys whilst we here. Broad menu, great food & service. Clean restaurant & nice atmosphere. Charlie looked after us well! Would recommend. Oh and their homemade chilli sauces are delicious!"
"February 11, 2020",50,Loved it!,"Great experience, delicious food, wonderful plating and friendly service. loved the whole experience. highly recommended, even the vegetarian goat cheese burger was delicious."
"February 10, 2020",50,Scorpion,"Great fun filled experience with delicious food. Vivi is fast, courteous, kind, and a mind reader who recommends the right meals for everyone in the party. If you're brave enough, try the best hot sauce ever. #scorpionsting"
"February 6, 2020",50,SUPERB,Magnificent place. The burgers are tasty and adequate in quantity. The service is friendly and delicate despite the fact that it is not a fancy restaurant.There some things that you can buy there as well.
"February 6, 2020",30,This Maetology is no good.,"This Maetology is no good. No good beer choice. The steaks is no good, comparing other Meatology here is bad choice and quality. 3 point gives for great burger only, it’s really perfect."
"February 5, 2020",50,Breakfast,"We went to the other branch of this restaurant for dinner the night before and when we saw that they did breakfast here we decided to stop. Awesome breakfast, perfectly cooked and very tasty. Staff again friendly and sweet. Highly recommend."
"February 2, 2020",50,Well done place and very tasty,"Our waiter, Garui, was very polite. Recommended with a choice of dishes. The burger and sausages were juicy and unbelievably delicious! I recommend to everyone!"
"February 2, 2020",50,Amazing food,Excellent friendly service Simple great fresh food Excellent value for money. Very clean restaurant and a good selection on drinks.
"February 2, 2020",50,1st Class Experience,"Felt like royalty when we were being waited on by Charlie. Amazing experience, fantastic food and every condiment and food was explained/recommended by our very friendly waiter Charlie. Highly recommend !"
"February 1, 2020",50,Fabulous food,Amazing burgers. Great atmosphere and music. Staff were wonderful so helpful and friendly. Great and really good service. Booking a reservation is a must we seen several people get turned away due to them being full! Definitely recommend for a great burger in Budapest!
"February 1, 2020",50,Amazing Food and Amazing Service,"We ordered 2 Hungarian breakfasts and they were perfect, highly recommend. Our waiter Charlie was a delight and made a highlight of our trip. Highly recommended!"
"January 31, 2020",50,"Great food, great service","Great food at this restaurant, thank you for the excellent service by Gergo and the team! We were here with friends, everyone was really happy, we felt deeply pleased with our dinner!"
"January 31, 2020",50,Perfect service and tasty food,"We chose this place for breakfast and were absolutely satisfied by tasty food, cozy atmosphere and good service from Charlie."
"January 30, 2020",50,"Excellent food, superb service!","Excellent food, superb service! We loved our visit, the choice of food was superb, and the quality of the meals was fantastic. Couple this with a great level of service and it’s a no-brainer - we’d definitely visit again!"
"January 29, 2020",50,"Decent portions, great steak","Decent portions, great steak and pork cheek, amazing! Fries are really good too, comes with the steak"
"January 29, 2020",50,Amazing Food,"Amazing Rib Eye, Pork Cheek and Sausages. All food was perfectly cooked and goes amazingly with the beer. Good Service!!"
"January 29, 2020",50,Excellent food,"Excellent food, staff really kind and fast. The waiter that served us, Garai, was helpful. I reccomand this restaurant for meat lovers!"
"January 27, 2020",50,Perfect,"The Best burger that i have ever tried, thank you to Charlie (the waiter) for the welcome. The fries are so good !"
"January 26, 2020",50,What a little Gem!,"Came here on my last night in Budapest, definitely the best meal of the trip! Nice friendly environment, the food was a good mix of grill and Hungarian classics. Charlie our server was polite and couldn’t do enough for us! Definitely check this one out!"
"January 19, 2020",50,Birthday dinner!,"The loveliest food and the best service! 10/10 customer service and complimentary prosecco and dessert as it was my birthday, would 100% recommend coming here if you’re visiting budapest."
"January 19, 2020",50,Amazing Burgers,"Really liked the Food and the Ambiente, nice Service and good food, in Not hungry anymore think you guys"
"January 19, 2020",50,Amazing lunch !,Amazing food even better service! Our waiter Garai was very attentive and very helpful. We got the sausages and the bacon burger. Absolutely delicious! If in Budapest do take a visit to meatology 2.0
"January 18, 2020",50,Amazing food!,"Came in spontaneously and so glad we did! Brilliant service, food came within 15 minutes on a busy Saturday evening and was amazing and tasty. Would definitely come back for more food and would highly recommend."
"January 14, 2020",50,Dinner with my love and my buddy,Delicious food in the middle of the city and one of the most polite waiters I have ever met. Thank you!
"January 13, 2020",50,Great lunch!,"My wife and I visited Meatology 2.0 for some quick lunch after our flight. We both had the full Hungarian breakfast, it was excellent and very filling. Our waiter was great and service was 10/10. Highly recommended."
"January 13, 2020",50,Very good burger and very,"Very good burger and very helpful and kind service ,great beer, we were very satisfied. We recomend this restaurant."
"January 12, 2020",50,Amazing burgers!!,"Amazing burgers!! We had the biggest burgers and wine for £20! Outstanding quality and Ben, our waiter, was friendly and attentive. Don’t be put off by the almost fast food look of the decor... food is high quality and freshly prepared. Loved it!"
"January 11, 2020",50,Top,Very good food and fast service. Easy to find and also has english menu. Will definitely come again.
"January 10, 2020",50,Great Experience,"Friendly place with a nice atmosphere situated in the heart of the city. Good quality food at budget friendly rate and nice customer service, we had been attended by Garai who was very friendly and professional"
"January 9, 2020",50,Burger craving satisfaction,"I feel like ""Sex Bomb"" was written from my mouth to the ""Meatology Burger"". Our waiter Ben was also really helpful and friendly! Go here for your Burger Craving needs!"
"January 9, 2020",50,Great,Amazing Food and great service! Will definately come back. The staff was smiling and welcoming. I ate one of the best burgers i have eaten
"January 9, 2020",50,"Great food, great service","Staff cared about their food and drinks, eager to help and friendlier than most. Place looks good as well."
"January 8, 2020",50,Nice!,Second time Ive visited Meatology 2.0! The sausages are great! Fair value for great taste! The customer service is very friendly!
"January 7, 2020",50,"Worth it, oh so worth it",Great food and service from Garai. I had the Debrecziner sausage my wife had the pork belly sandwich. Would recommend highly. Gave us a free welcome drink.
"January 6, 2020",10,One of the worst burgers I’ve,One of the worst burgers I’ve ever tasted it was swimming in burger relish the garnish of tomato and lettuce looked like it was days old The taste and smell was awful Please avoid this place at all cost save your money and go elsewhere
"January 4, 2020",50,Superb all round,"A wonderful place, amazing food would recommend the steaks to anyone, melt in your mouth and mazing taste. Our waiter was georg who was attentive and made the evening and all round wonderful one!"
"January 4, 2020",50,Best burgers in the city,I visited this place with my girlfriend and we were both surprised how good these burgers were! We tried many burgers in the past few years and this one was one of the best for sure! 10/10
"January 2, 2020",50,The best meat in Budapest,The best meat in Budapest ! The manager is very nice and the beers are amazing. The service is friendly and there is some Good music.
"January 2, 2020",40,Very tasty burger,"Very tasty burger, fast and very kind staff! Delicious limonades. Only the air conditioner next to our table was a bit annoying."
"December 28, 2019",50,2.0,"The food is more than excellent!! I really recommend to visit this place at least one time in your trip. Also, ask for Charlie the manager, he is a very welcoming guy and treat you like if you were in home!"
"December 28, 2019",50,"Very very good restaurant in the centre of Budapest, delicious breakfast","A very good restaurant in the city centre with delicious Hungarian kitchen, friendly service and good atmosphere. Loved the breakfast menu and the hot chocolate. Many thanks for Bence & Karesz :)"
"December 28, 2019",50,Perfect for brunch,"A perfect place for brunch. No crowd, Hungarian cuisine, lovely service. Big thanks for Bence, Karesz"
"December 28, 2019",40,Great food great service.,Easy and great food to eat with the family. Service was excellent and both of our kids enjoyed. Highly recommend this place.
"December 23, 2019",50,best burger in Budapest,"Just excellent! The burgers, the atmosphere, the service! Garai served us really politely and fully smiley😊!!!"
"December 22, 2019",50,"The foods are delicious, I","The foods are delicious, I order pork steak burger and the meat is so tender. The staff Charlie greeting us super friendly."
"December 21, 2019",50,Great hamburgers in the cetre of the city,"We quickly decided for this restaurant and we had a great service. Hamburgers were great, atmosphere modern, and Gerai (waiter) was most helpful in getting right meal for us. I would recommend everyone interested in good and fast meal in modern environment."
"December 21, 2019",50,Tasty burgers in the centre of Budapest,"Lovely place and atmosphere, very good food and reasonable prices. I had pork belly sandwich which was great. Waiter Charlie is very friendly and proffesional."
"December 21, 2019",50,Great food(burgers) and service in center of Budapest.,"The food was excellent,one of the best burgers I have eaten in my life. The prices are not too high. Service is great(especially the waiter Charlie). If you come here, for sure you won't regret. Excellent!"
"December 21, 2019",50,Great burgers in the centre of Budapest,"Great service(especially the waiter Charlie), food is excellent,prices are not too much, everything is so clean and I would recommend it to everyone."
"December 18, 2019",50,Great Meal and Service,We had a great experience at Meatology Budapest 2.0 and very much enjoyed the excellent burgers and also the great service provided by Gergö. Thank you and will be happy to come back again during our next visit to Budapest!
"December 14, 2019",50,Tasty and friendly service,"very friendly staff, the Hamburger was really tasty, also the french fries and everything else. great choice of beer too. would recommend to anyone"
"December 14, 2019",50,Best burgers!,One of the best burgers I’ve ever had. The service was very kind and the meal was ready very fast. The place is modern but you might have troubles finding the entrance.
"December 14, 2019",50,Amazing food ❤️ best burgers,Amazing food ❤️ best burgers in Budapest. Thanks charlie for best servise. See you soon in our next visit.
"December 12, 2019",50,Best steak in Budapest,"Top quality meats, great hospitality and very good atmosphere! Strongly recommended... Waitresses are very friendly and makes you feel comfortable and wellcomed!"
"December 9, 2019",50,Excellet burger in Budapest,Excellet burger in Budapest we had. I recommend to try Meatology burger or classic burger. Also good beer
"December 9, 2019",50,Best burger,Perfect burger. One of the best. Simon was very kind and helpfull. Also homemade weiss beer was excellent combination.
"December 8, 2019",50,Great food & friendly staff,"The food is perfectly cooked. The burgers and the steaks, 10 out of 10! The staff is very friendly and attentive. Charlie was very nice, told us everything about how they cook."
"December 8, 2019",50,"Perfect burger, very kind staff","Maybe the best burger we've had. Cooked perfectly, all the right ingredients. And the Meatology lager beer, also very good! Their staff is friendly and always there. Charlie took care of us and we thank him for the treat!"
"December 8, 2019",50,Brilliant food,"Visited Meatology 2.0 on a weekend break, having read great reviews about it. It did not disappoint! We were served by Charlie and he was very friendly and helpful. The food was really delicious, we would highly recommend."
"December 6, 2019",40,Christmas break,"Lovely space for lunch, ordered two bean hock soups which came with warm fresh bread, both very tasty. Stout and Weiss beer very nice too and friendly service from Anna."
"December 5, 2019",50,Amazing!,Unassuming digs. Friendly staff. Amazing food. One of the best steaks I've had. The walnut/feta/orange salad was also outstanding. Very satisfied that I took a chance on this place.
"December 5, 2019",50,Lunch!,"Came here for lunch today and I had the Hungarian breakfast, everything was perfect and our server Simon was really nice too!"
"December 4, 2019",50,Excellent service,"The service was excellent, waiters are very helpful and attentive. They give recommendations and help choose from the menu. We tried the meatology burger and bacon & cheeseburger, both are tasty and come with fries and home made sauce."
"December 3, 2019",50,"Great food, nice staff","The staff was helpful especially viv and the food was great, highly recommend if your visiting Budapest to eat here!"
"December 3, 2019",50,Для всех любителей мяса. For,Для всех любителей мяса. For all people who like meat! Charlie - the best waiter! Duck is amazing! Ribeye is awesome!
"November 28, 2019",50,Amazing meal,I had sirloin which was cooked to perfection and delicious. My wife had Pork cheek which was also amazing. The pricing is very fair and I would expect to pay more for such quality.
"November 27, 2019",40,Quality burgers,"Great burgers and good steaks. Laid back atmosphere, a clean restaurant, efficient waiters. A bit pricey, but worth going to."
"November 24, 2019",50,Tasty Snack,"Just popped in for a late snack after skipping dinner, and had the pork sandwich which had amazing Thai flavours, so thanks to Charlie for recommending it and looking after us!"
"November 22, 2019",50,Good burgers in Budapest!,We both had the bacon cheeseburger and it was really good. Lovely service from our waiter Charlie. Highly recommended if you're in Budapest and in a burger mood!
"November 22, 2019",50,Steak and wine,The Hungarian steak on the bone was amazing. The Hungarian wine was amazing. The hot sauce(s) were amazing. The service was amazing. Thank you so much!
"November 21, 2019",50,Excellent Food,"We are from Wyoming America and this is some of the best steak we ever had, Charlie is the best waiter Awesome service"
"November 16, 2019",50,So good!,"So good! Staff lovely, burgers were lush and the beer was good, especially the mango beer. Other half is a burger fan and he said this was one of the best he’d ever had. High praise indeed!"
"November 12, 2019",50,好食,於tripadvisor搵到呢間，見d食物相賣相唔錯，所以試吓。 我叫咗個dry aged 西冷，夠肉味，medium啱啱好！ 我老婆叫咗份Homemade Mangalitsa Debrecziner腸，唔知係乜，試過發現好juicy，正！ 地方乾淨，性價比高。
"November 10, 2019",50,Marvellous juicy steak. Charlie,"Marvellous juicy steak. Charlie very friendly, couldn’t do more to accommodate us! 10/10 would recommend"
"November 10, 2019",50,Great service great food!,"Friendly service, great beer and food. Highly recommended for meat lovers. But also some good stuff for veggies. Highly recommend"
"November 10, 2019",50,Incredibly friendly staff and great food,"we Just had lunch here and I just want to say, go here!!!!!! Our waiter (Charlie) was super professional and had a good sense of humor. The food was just amazing too!!!!"
"November 9, 2019",50,Superb,"Amazing steak, lovely Hungarian house wine. Simon, our waiter, was very attentive, but not intrusive, and I would love to eat here again!"
"November 9, 2019",50,Great find,"Wow great find. 6 of us for a quick supper. 4 meat eaters and 2 vegetarians, quick service by Garoi, All dishes were excellent, nice wine too"
"November 7, 2019",50,Excellent food and service,"The food from this restaurant was out of this world!! Our waiter, Gorai, was very friendly and helpful."
"November 3, 2019",50,Great burgers and friendly staff!,"Simon and staff were very friendly and on hand for any details without being over crowding! Burgers were amazing, with great attention to detail Nice atmosphere!"
"November 3, 2019",50,Great steaks & burgers! Quickly,"Great steaks & burgers! Quickly served, very nice staff, children friendly, found the place by chance but will certainly be back!"
"November 2, 2019",50,Duck to die for!,Popped in after suffering the misery of England losing to SA in the Rugby World Cup Final. Fully cheered me up. The roast duck was as good as I've had. Try the scorpion chilli sauce if you are brave enough
"November 1, 2019",50,"Great steak, great service","we went in this evening and were greeted by zsolt, he recommended some lovely wine, which went great with our amazing ribeye steaks. Thanks for a lovely meal and friendly service."
"November 1, 2019",50,Best burgers in town,"Had a very nice evening with great food, our servant Zsolt took great care of us. Also ask for the spicy sauce, it’s really hot, so use it carefully."
"October 26, 2019",50,Excellent food and service.,Excellent food and service. The steak was delicious and Meatology burger wowwww. Would really recommend it.
"October 23, 2019",50,Great burgers,Food and service were excellent. Charlie was a wonderful host and made sure our dinner experience was amazing!!
"October 19, 2019",50,Excellent!,"I have been there with a friend of mine and I have to tell you, it was one of the best burgers of my life. The staff was super friendly!"
"October 19, 2019",50,Awesome burger in Budapest,Fantastic service (thanks Georg!) and the food was excellent. 10 points for over-the-top hot sauce and pickles!! Quality: top notch!
"October 17, 2019",50,Nice !!! Highly recommend!!,Nice restaurant! Fast serving! Very polite and pro stuff!!! I recommend to try angulus steak ! It was really nice!!!
"October 17, 2019",50,Lunch,Great food and great service from Charlie. I had a bacon cheeseburger which was excellent. Food was very hot when it arrived. My girlfriend had the pork sandwich which she loved.
"October 16, 2019",50,Great food! Cool location!,Food was great! Perfect service from Charlie! Gave me extra hot sauce to try was really good but super spicy! If your looking for a good quick meal in a great location come here! 😊
