"November 29, 2015",40,Great food - Great server(s) ....,"This is my second time to Mr. Porter- I've found the food and the servers to be great. The last time we had Leandro (sp?) as our server he was really great, so attentive, so friendly, nothing was too much trouble and he took his time to give detailed info of the wines always with a smile.  The lighting is good as is the music and the atmosphere.  On both occasions the 'welcome' was not very smooth on check in and leaving the restaurant and seemed unorganized. It is quite pricey as well.  All in all I've enjoyed my experiences."
"November 29, 2015",40,Breakfast was great... Dinner... well...I'll never know....,"I stayed at the W last week…Breakfast in “Mr. Porters” was great experience. Aside from the fantastic view of the city from the 6th floor, the food choices were unique and tasty; served with the upmost professionalism. In addition to my Eggs Benedict, I opted to include the Mediterranean / Middle Eastern breakfast buffet. The buffet included the standard expected omelets, croissants, cheeses and meats, however surpassed expectations with the addition of roasted veggies with feta, and stuffed grape leaves and other delights. Everything I tasted was excellent; I appreciated this departure from the standard breakfast fare.  After having such a positive experience with breakfast; I tried (very last minute) to secure a table or place at the bar for “dinner for one”. Regretfully, the hostess was unable to seat me … at any time, not even at the bar. She explained that although the restaurant was “housed” at the W, it was not directly connected with W, and priority seating could not be accommodated for guests of the hotel… even at the bar.  This was a disappointment at the time….Thankfully I was directed (by a local) to try a nearby establishment “Tales & Sprits”…. a great tiny little restaurant and bar at Lijnbaanssteeg 5, 1012 TE Amsterdam, which turned out to be a great experience!"
"November 27, 2015",40,Overall a good experience,"After been confronted by an unfriendly hostess - all just improved. I sat at the bar. The barman was attentive and made both good food and drink recommendations. Food arrived very quickly, I also overheard a couple requesting for things to slow down a bit. All starters was exceptional. Throughout the meal various of the restaurant staff checked in on me. I received both a great dessert and desert wine recommendation. Looking forward to visit again."
"November 25, 2015",30,very trendy steakhouse in great location,Very nice location near the royal palace totally new and very nice decoration ask for a table near the window not close to the bar as later at night there starts some very nice loud music The stake are very nice and the idea is that you chair them wit your other quests. The idea is nice but the stakes are served on cold plates so they loose their temperature very fast.  They have very nice and friendly personal only the organization good be better  but overall nice to eat and enjoy the trendiness
"November 24, 2015",30,Average,"Guess this is a type of restaurant that a lot of people want to visit. Situated on the topfloor of the new W Hotel. Unfortunately, the expectations were not met. The service was quite arrogant (""they were selected to work there, so they must be great""). Food was decent, but the prices are too high in relation to what is served. With regards to complaints about the loudness of the music ... well that's subjective, but I wouldn't go there for a romantic dinner. Was nice to have been there, but a one time visit for me."
"November 22, 2015",10,Sound and Service,"Beautiful styling and location.  But for people who do not like to talk: the music is too loud to hear each other. And the chef cook thinks he is the king of the show, not you as a guest... Do not ask or expect an extra service you do not get it.. You just pay and leave..."
"November 20, 2015",20,100 Euros/person & awful quality,"Even though the place has a very nice design and very nice views, I certainly would not recommend it for food. Wines were overpriced, the meat was like a shoe without much taste and we felt pushed by the waiters to rush from one dish to the other. The service was not what we expected for a restaurant of this price range. Staff is very trendy, waiters and cooks with nice beards and a fashionable hairdos, but guys, we come here to eat! Worst of everything was the price... 100 euros a person and we left the restaurant with a hole in our stomach. Overall, good place to have a drink with your colleagues, and that's all."
"November 12, 2015",50,"Fantastic view, good food, steep price","Mr. Porter Steakhouse is quite new in Amsterdam and part of the W hotel. The food is great and after dinner the place transforms into a club with lovely cocktails. Prices are steep, but you can have a lot of fun watching the young, the old, the rich and the wannabe's."
"July 27, 2020",50,Very good restaurant,It was a nice location. Our waitress was very friendly and the food was incredibly delicious. I would really recommend it.
"March 8, 2020",50,We arrived late whit no booked,We arrived late whit no booked table. We had shrimps fried photato and beaf loved the food and the serfis was exelent.
"February 25, 2020",30,Nice ambience but slow service,Nice ambience but slow service and steak wasn’t great. Steak tasted under seasoned but cooked to medium rare like I ordered.
"February 5, 2020",50,Best steak ever! Surf & Turf,Best steak ever! Surf & Turf was just melt in the mouth! Definitely a must do if you’re in Amsterdam!!!
"January 19, 2020",50,Hands down the best restaurant in Amsterdam!!!,I have eaten so many different meals from de Nachtwacht and oh my word this is the best food in the world.
"January 8, 2020",50,Highly Recommended,Great meal and great service. Very impressed. Would definitely visit again on next trip to Amsterdam.
"November 30, 2019",40,"4 star service , 5 star food",The service was ok. It is extremely busy so I understand the waiters forgetting to grab a drink. The food is excellent. Ordered the surf and turf and a baked potato. Two of us split the surf and turf. It was very satisfying dinner.
"November 24, 2019",50,"Excellent food, good service!","I didn't make a booking but luckily got seats at the bar. Bar tender was very attentive and service was good. Had steak and spare rib. Rib was a little too salty, but the steak was perfect. Recommended."
"November 20, 2019",50,"Excellent, as always","Great food, excellent staff, very nice facilities. I've been many times and I hope to return many more. The only disappointment would be deciding to dine somewhere else."
"November 18, 2019",40,30th birthday dinner,The service was fast and efficient the waiter was helpful food was good and reasonable for the price. Would recommend to anybody wanting a good steak.
"November 10, 2019",50,SUPERB beef tenderloin..,"The best beef in Amsterdam...very Nice staff, excellent location. Good beer & nice fries. What more could u ask for... The best"
"November 3, 2019",50,50th birthday celebration,"Excellent location, food absolutely exquisite and staff very helpful. Highly recommended. We had the special black Angus I think it was."
"October 11, 2019",50,Great food great service,"Came here in search of a great steak and found it! Service was super friendly and restaurant ambiance was very enjoyable, as it was also in a great location in the city."
"October 7, 2019",50,Great Dutch Grass Fed Beef,The Ribeye Steak of Dutch grass fed beef is tender and juicy. Great place for casual dinner at a moderate price. And try the frogs legs. Highly recommend.
"August 24, 2019",50,Extremely yummy!,"I know everyone will talk about the meat, well, the meat is indeed great. I just want to add I think I had the best baked potato EVER!"
"July 20, 2019",40,Good restaurant,Good restaurant for dinner. Compared to all touristic restaurant in the area is the best!! We had froglegs for starter and spare rivs for main dish! Generally clean. Service was fast!
"June 30, 2019",50,Great Black Angus rib-eye,"Discovered on Friday, I came back on Sunday! The black Angus rib-eye is soo delicious! Great service, Tosca and Alejandra are superstar! Ps: the tall waiter it’s the shame of the restaurant."
"June 27, 2019",50,Delightful dutch casual steakhouse,An authentic and delightful dutch steakhouse. A rarity in such a touristic street. I had a superb black angus ribeye steak. The owner was very attentive and friendly. Beware of those fake steakhouses in Amsterdam!
"June 19, 2019",50,Best Black Angus steak,Really cool restaurant with friendly staff. Great dinner in Amsterdam a really good black angus steak and cheesecake to end this delicious meal
"June 14, 2019",40,Lovely food!,"The food was really nice, I had ribs with a portion of fries and I was so fully I couldn’t finish! I didn’t think the price was bad at all considering it’s a steak restaurant. The customer service was good!"
"May 25, 2019",50,Best steak ever!,"Great experience! We didn’t have reservations but they got us right in! Everything was delicious!!! Modern decor, great view!"
"May 22, 2019",50,Beautiful Steak,What a lovely restaurant by Rembrandt Square which offers a good selection of food at reasonable prices. Steak was like a melting moment and the soup was beautiful. Service was excellent and we could not fault our visit.
"May 4, 2019",50,Lovely bit of meat!,"Arrived with high anticipation and was not disappointed! Great service, even better steak! The meat was cooked to perfection and was more moist than the ladies from the red light district! Will 100% be coming back here on my next visit to Amsterdam!! Bravo!"
"May 1, 2019",50,Excellent!,We ordered meat and they were so good. And staffs were so helpful also. You can trust them. Before you go you have to book
"April 16, 2019",30,Too expensive,"Seriously a quarter of a chicken for 22 euros is too much. It is just a steakhouse, nothing special like you can find hundreds around."
"April 6, 2019",50,Great food,Found this steakhouse and thought the food was fantastic I would recommended the beef satay it was fabulous if you order the Ribs you won’t need a starter as its a big portion
"March 1, 2019",50,Great place!,"Steak was perfect, nice atmosphere, good service! Also, snails in garlic were great! Hardly recommend this restaurant!"
"February 18, 2019",50,Best Ribs in Amsterdam!,Been here this evening to try their ribs... and they are amazing!! All the staff are excellent and really helpful and the meals are very reasonably priced. You get a nice warm welcome and it has a nice atmosphere too. Definitely be back.
"January 22, 2019",50,Great steak,"Great steak, and the bread with garlic butter was so good! Restaurant is in the centre so very easy to get to"
"January 15, 2019",50,Rembrandt's finest (steakhouse),"I should start this off by saying I have been here more than a couple of times. I take all my visitors here! The quality of the food is unreal, service is relatively fast and the staff is friendly. Make sure to reserve your table!"
"January 7, 2019",50,Best steakehouse in the centre of Amsterdam!,This is one of the best steakehouse in Amsterdam. The quality of the meat is very good and everything on the menu is delicious!
"January 4, 2019",40,Excellent Dinner,Nice atmosphere. Great staff speaking excellent English. Good food. Great price. 1x ribs 1 X grilled Salmon 2 soft drinks 55 euros
"December 25, 2018",50,Truly one of the best steakhouses in Amsterdam,Make a reservation and try out yourselves Recommendation: order your fillet steak rare Cooked to perfection you won’t find this anywhere else. At least I didn’t!
"December 10, 2018",50,Like it,The food is very good and especially the pork fillet for me. the atmosphere is also very nice and friendly staff.
"December 5, 2018",40,Great atmosphere,This place offers much more than very delicious food. It has great atmosphere and the service is very good too .
"December 3, 2018",50,Work trip dinner,"Met up with a couple of work buddies n headed over to try their ribs. All I can say is - WOW! It was great. I love ribs, and theirs score high in my charts!"
"November 18, 2018",50,Meat heaven,"I’ve never had a steak this good. Medium absolutely on point!!! I got it with fries but to be honest, the steak is all you need. You wouldn’t need sides :-)"
"October 22, 2018",40,Very Nice Steak House,"The location is very good, the service was very good, the food was excellent from starters to main course, the steak was exactly how I like it, I would definitely recommend it."
"October 21, 2018",20,Raw meat and lousy service,"The place was recommended by the hotel, but what a disappointment. The order was medium, but the meat was rare. The very arrogant head waiter then gave us a hard time for not speaking up."
"October 10, 2018",50,Wow,"Absolutely amazing food. Highly recommended the fillet steak. Staff very courteous and professional, they made it a pleasant environment to dine in. Great location too."
"September 30, 2018",40,Great ribs,"Delicious ribs with bbq sauce. One portion with fries is enough for two women. We were totally full. Inside nothing special but totally recommend for a good grill food. 4,5 stars 😍"
"September 21, 2018",40,Dinner and drinks,Super steaks and trust me half a rack of ribs we enough. Superb baked potatoes. Essspresso Martini to sink a ship great beer all said n done great.
"September 17, 2018",30,Not pleasant,"We wanted to eat dinner there but the tables were dirty, Staff not very hospitable so we went somewhere else. Maybe the food is great, I cannot assess, but the place didn't make good impression."
"August 27, 2018",50,Evening Dinner,Beautiful food. We both had steaks... Medium rare. Well cooked and presented. Nice central location.
"August 27, 2018",50,Another great night at this fabulous restaurant,"Third visit and once again it didn't disappoint. A lovely table for 4 in the window overlooking Rembrantplien. Good wine, beers and food. If you like steak this is the place to book."
"August 23, 2018",50,Dinner,"Really good food one of the best jacket potatoes , and I can say it was the best meal during the trip."
"August 19, 2018",50,Excellent!,The food is SO good. And the service is excellent! Sat outside and got there at 6 pm just before it started getting really busy. Must try the ribs!!
"August 12, 2018",50,Always the same,"Back after four years and delicious as I remembered. Go and taste meat in this restaurant, it is a must to do!"
"August 6, 2018",40,Very tasty and pleasant restaurant,"Being there on a Friday eve, the place was crowded but quite comfortable, food was served within a reasonable time and was delicious. Recommended!"
"August 4, 2018",50,Great steak restaurant in Amsterdam,Visited here whilst in Amsterdam for dinner. Sat at the bar and enjoyed good wine and food. Crab cocktail starter was especially nice. Friendly staff and I’d visit again.
"July 30, 2018",50,Amazing,I came here with my partner and another couple the food was delicious and the staff were friendly and efficient. If you want a great steak or fall of the bone ribs I would highly recommend you eat here.
"July 29, 2018",50,Excellent Entrecote,Very good steakhouse located just next to Rembrandt place. We had a nice all well cooked Dutch Angus Entrecote. Very nice staff.
"July 20, 2018",40,Very good restaurant,I was here with some friends and had an amazing night. Good food and very friendly employees. I am definitely coming back!!
"July 20, 2018",40,Highly recommended,Really good food and even if it was busy the service was still on point and very friendly. Highly recommended!
"June 17, 2018",50,Excellent Food in Amsterdam,We have been there for dinner. Great selection of food and excellent taste. It was so good that we also went there a second and a third time during our one week stay in Amsterdam. The service is excellent as well. Thanks Tosca Sombroek!
"June 15, 2018",50,Longlasting quality,Its my 5 or 6 visit in l The last 5 years. Good as always. I had a fillet. Superb meat. They know how to treat it. Recomended!
"June 9, 2018",30,Ok,"My friend and I came here for a steak, and although the food was nice, the service was incredibly slow. I would come again- but I’d like to see the speed and quality of their service improve."
"June 3, 2018",10,Horrible customer service,Staff on the outside on 03rd of June are very ignorant and not helpful and have a huge attitude problem. It's shame. Do not recommended
"June 2, 2018",50,"Dinner at Nachtwatch, excellent experience!!",The quality of the food and specially of the meat and fish are excellent. The waitresses are very cordial and make suggestions if asked to do so.
"May 20, 2018",30,Hit or Miss,"Half of the steaks ordered were excellent (around the well done point) - The other half very undercooked. Moderate service on a busy nice, nice patio atmosphere."
"May 13, 2018",50,Fond Memories,"I enjoyed very courteous and professional service, and a selection of lamb chops with wonderful sauce that made my night a great experience. I can only recommend De Nachtwacht."
"April 13, 2018",50,Great local steak house,"A good place for night out with friends. Good wine, great menu variety. Food is remarkable though it takes a while to reach the table but you know it is fresh!"
"April 3, 2018",50,Amazing,Spend ages looking around for somewhere good to eat lastnight when we stumbled on this gem! The food is amazing and the staff are extremely friendly! Highly highly recommend!
"March 17, 2018",40,Enjoyable Meal,"Booked online in Amsterdam very easily and it was confirmed by email. Food, service and atmosphere all great. Very busy place and very lovely staff."
"March 8, 2018",50,Mac,Great atmosphere. Not cheap but a memorable experience on Rembrandt Square. Good 70s music. Try the Affigem blonde beer.
"February 27, 2018",20,"Passable meat, would not recommend","Ordered the entrecôte which was way more chewy then supposed to be at 25€. Exchanged for a fillet which they overcooked. Fries tasted a bit off, didn’t like any of the sauces. Due to cold weather also cold inside. Cannot recommend."
"February 10, 2018",50,best meat in Amsterdam,"Everytime that i go to Amsterdam i need to have a dinner here, excellent service, excellent ducth meat coock perfectly. Surf and turf plate is one of my favourite. Dutch black angus absolutely to try. The position is also another plus of this place, Rembrantplein."
"February 8, 2018",40,Steak!,A lovely meal in a lovely atmosphere for my mum's 60th birthday. We all had steak which was beautiful.
"February 3, 2018",40,Good meal,Very good meal we had at this place. Professional service and a warm environment. Good value for the money!
"January 22, 2018",50,Delicious!!!,"Amazing food, ribs were very good!! So much food, it is worth the money! Friendly staff & good location. Would visit again if I’m ever back in Amsterdam."
"January 19, 2018",50,Great food & Great service,"Great food at a beautiful and comfortable restaurant, resonable price and great service. Defenetly recomend this place!"
"January 9, 2018",50,Ribs steak beer wine and atmosphere,"Great ribs, thick fries tasty steaks and a glass of beer or wine and your done. If you’re around just reserve a table and stop by."
"December 16, 2017",50,Best Spare Ribs in Amstedam,"As good as it gets, i’d say. The only con is the portion - it’s huge. We learned the trick some time ago, so now we order the half portion. The ribs are really the best I’ve eaten. I’ll be back!!!"
"December 10, 2017",10,Very bad,We have reservation for table and waiting our table two hours and go out becouse didn’t get!:((( The staff was no frendly.
"December 9, 2017",40,Nice food - speedy service,Wife and I were in for a quick and small meal. We were promptly expedited and ordered escargout and onion soup as both were good.
"December 3, 2017",40,Delicious steak! Treat for us American travelers on Thanksgiving day!,"Enjoyed delicious steaks and cocktails in place of traditional American turkey feast. This place did not disappoint! Friendly wait staff and meals cooked to perfection! In a quaint plaza, enjoy it!!!"
"December 2, 2017",50,Amazing,First time visit. Friendly and helpful staff and amazing steaks. Highly recommended a visit. Definitely will return.
"November 8, 2017",40,Delicious meat !,"Very good Steak house in Amsterdam. The lamb is delicious, Baked potato too. Medium price. I recommend it !"
"October 16, 2017",50,Good steakhouse,Chosen because of online reviews. Did not disappoint. The filet was cooked to perfection. Recommend you make reservations at this very busy restaurant.
"October 14, 2017",20,Evening meal,Stopped here for evening meal. Nice looking bar but food was very average and very costly (70Euro for 2 mains and two beers!). Steak was a bit tough and not cooked to medium more well done.
"October 2, 2017",50,Best Spare Ribs in Amsterdam,I never miss an opportunity to eat in this steakhouse. The babyback ribs are so tender that the meat just falls off the bone. The only con i can think of is that the portion is far too big for a single person. Consider sharing.
"September 30, 2017",50,Excellent value,"Excellent food, service and location. Cannot fault there fillet steak, taste texture and just quality was spot on. A hint of herbs of some sort on the meat from cooking was an unexpected treat."
"September 18, 2017",50,Good food friendly staff,"- very good food, steaks - nice lively atmosphere - nice music - friendly staff - nice view on the square"
"September 9, 2017",40,Very good,I really liked this place. Good food (and big portions) The staff was friendly and helpful : ) I can recommend it
"September 3, 2017",40,Fantastic steak ! Slow service,"Fantastic food, the best steak !!!!! However slow service & waitress forgot a few items & I had to repeat a few things we wanted. Great steak , just be prepared to wait !"
"August 10, 2017",50,Succulent steak,"Right on Rembrandt square so location and atmospere was ideal for people watching and enjoying the square and the amazing weather. Service was good and the steak I ordered was cooked perfectly, was tender, and super flavorful."
"July 23, 2017",50,Best ribs in A'dam,"Visited this place twice because the food was amazing! We had Tbone steak and ribs, both of them made us visit again at the end of stay. Maybe waitress lady should put a better smile on her face :) Thanks!"
"July 18, 2017",40,Horrible meat,We ordered lamb that had a strong taste of goat and satte which was practicly rare inside. Wouldn't recommend at all
"July 14, 2017",50,One of the beat steaks i've eaten!,Fantastic restaurant. Great service. Dutch Ribeye was amazing and wife's Fillet even better. Highly recommended!
"July 8, 2017",50,"Great food, great location",Very popular yet able to accommodate walk ins. The Dutch Mussels were amazing - great bit of spice to them. The fillet steak is well worth the price - succulent and cooked as ordered. Decent wine menu and good coffee!
"July 4, 2017",50,Fillet steak,"Fillet steak was so amazing I bought two in a row...one for dinner, one for dessert. Cooked well, no fat... And great location for people watching."
"July 4, 2017",40,Lovely meal,Reasonably priced restaurant on the busy Rembrandtplein. Good steak with enough fries to share. French onion soup starter was excellent.
"July 1, 2017",50,Perfect T-Bone Steak,"The steak was perfect, the fries perfect and the waiters are cute. Me and my boyfriend really enjoyed! Would defenatly recommend! 😻"
"June 18, 2017",50,Excellent lunch,We dined here on a lazy Saturday afternoon and really enjoyed my lunch . I had mixed grill and my wife had ribs a nd everything was cooked to perfection. I would highly recommended
"June 14, 2017",50,Amazing,"Staff were incredible, food was amazing, and the view of the square just brought it all together. Although it's a bit on the pricey side it was definitely worth it!"
"June 13, 2017",50,De nachtwacht,"Meat was great, staff was friendly, dessert was perfect. Vanilla ice cream with chocolate sauce, it is a must, if you come here."
"May 22, 2017",40,Very good steak,"Nice service and very good steak. We stayed outside with some people. Service was quick, employees frienfly and great food. I tried the fillet steak which was very good. I recommend this steakhouse."
"May 19, 2017",10,"Manager is good, service sucks",Waited for 1.30 with a baby for old meat to be served. A serving girl brought coffee in a broken glass and just spilt it to another glass (didn't make new).
"May 17, 2017",30,Good food,Nice place to have meal. Better to make a reservation in advance. Otherwise you can only choose outdoor seats (and the heater is not really working...)
"May 14, 2017",50,Fantastic,Love this place. Get the ribs. Great ambiance. Good beer . Friendly staff. My wife got steak and she loved it.
"May 11, 2017",50,Ribs,"Best ribs I've ever had , always visit here when I'm at the Dam . The mixed grill is excellent to , cannot recommend this place high enough"
"May 8, 2017",50,Suverän måltid,"Amaizing staff, the food was superb,the mest just melted in my mouth, couldn't ask for more. Just go there and have the finner of your life."
"May 6, 2017",50,Amazing food,The lobster soup with cognac is just a piece of art and a festival for the mouth. Ideal to recovery from cold weather.
"May 4, 2017",50,Jimmy bartolo,Excellent food in all dishes that they have prices are reasonable. Recommended .this is the third visit .
